voto,curul,asambleista
SI,2,ALBORNOZ VINTIMILLA CLAUDIO ESTEBAN
SI,3,SERRANO SALGADO JOSÉ RICARDO
SI,6,ARREGUI RUEDA MARCIA CECILIA
SI,8,BENAVIDES ZAMBRANO ZOILA TERESA
SI,12,BUSTAMANTE MONTEROS RUBÉN ALEJANDRO
SI,13,CABEZAS GUERRERO ELIZABETH ENRIQUETA
SI,16,CAMBALA MONTECE CARLOS ALBERTO
SI,19,TERÁN SARZOSA SEGUNDO FAUSTO
SI,20,CEDEÑO ZAMBRANO JOHANNA ELIZABETH
SI,21,GREFA AVILEZ FLAVIO PATRICIO
SI,24,COROZO AYOVÍ JORGE WILBER
SI,25,CUESTA RÍOS LIUBA ELISA
SI,27,DOUMET CHEDRAUI MICHEL ANDRÉS
SI,31,GARCÍA MARTÍNEZ INGRID VANESSA
SI,34,GARZÓN RICAURTE WILLIAM ANTONIO
SI,35,GAVILÁNEZ CAMACHO FAFO HOLGUÍN
SI,38,LITARDO CAICEDO CÉSAR ERNESTO
SI,40,MARÍN AGUIRRE ANA BELÉN
SI,42,COLAMARCO VERA PINUCCIA MAGALY
SI,46,ORELLANA ROMÁN ROSA GINA
SI,47,BUSTAMANTE GARCÍA JUAN FRANCISCO
SI,48,PEÑA PACHECO XIMENA DEL ROCÍO
SI,49,PLAZA CASTILLO LENIN
SI,52,QUIJIJE DELGADO LUIS RAFAEL
SI,53,QUIÑONEZ OCAMPO JULIO CÉSAR
SI,56,SALAZAR CEDEÑO GUADALUPE DOLORES
SI,57,SALGADO ANDRADE SILVIA BETZABETH
SI,59,YAGUANA ECHEVERRÍA ANDREA ALEXANDRA
SI,65,VERA RODRÍGUEZ CARLOS ALFREDO
SI,66,VILLALVA MIRANDA LIRA DE LA PAZ
SI,71,ANDRADE MUÑOZ WILMA PIEDAD
SI,72,ALMEIDA ALARCÓN KAREM MICHELLE
SI,73,AUQUILLA ORTEGA RAÚL VICENTE
SI,74,ASTUDILLO LOOR LINA GLORIA
SI,75,BURBANO MONTENEGRO FÉLIX FERNANDO
SI,76,ZAMBRANO CASTRO NORALMA ELIZABETH
SI,77,AZUERO RODAS ELISEO ALEXIS
SI,78,CUCALÓN CAMACHO HENRY EDUARDO
SI,79,SERRANO VITERI MERCEDES MARITZA
SI,80,CALLEJAS BARONA FERNANDO
SI,81,CAMPAIN BRAMBILLA RINA ASUNCIÓN
SI,82,CAMPOVERDE ROBLES EMILIO ABSALÓN
SI,83,CARRIÓN MORENO CÉSAR ATAULFO
SI,85,SINMALEZA SÁNCHEZ ÁNGEL RUPERTO
SI,86,YANDÚN POZO CÁSTULO RENÉ
SI,87,HENRÍQUEZ JAIME PATRICIA IVONNE
SI,89,CASTANIER JARAMILLO XAVIER HOMERO
SI,90,CELI SANTOS GUILLERMO ALEJANDRO
SI,92,CRUZ VACA JEANNINE DEL CISNE
SI,93,CUESTA ORELLANA MARÍA DE LOURDES
SI,95,CADENA HUERTAS FRANCISCO JAVIER
SI,96,PEÑA ONTANEDA ELIO GERMÁN
SI,97,CAMPOVERDE GONZÁLEZ RAÚL FREDDY BOLÍVAR
SI,98,
SI,99,OLLAGUE VALAREZO ZOILA PIEDAD
SI,101,DONOSO CHIRIBOGA PATRICIO
SI,102,FLORES VÁSQUEZ FERNANDO PATRICIO
SI,103,VERDEZOTO REINOSO ROSA ISABEL
SI,104,GENDE CALAZACÓN ANGEL MESÍAS
SI,106,ZAMBRANO VERA MARIANO
SI,108,DUCHI GUAMÁN MARÍA ENCARNACIÓN
SI,109,OLIVO PALLO JAIME FERNANDO
SI,111,TAIANO BASANTE VICENTE GIOVANNY
SI,112,NUÑEZ MANSSUR LUIS ANTONIO
SI,114,ALVAREZ TOBAR RODRIGO CÉSAR
SI,115,CUADRO GASTEZZI DEYSI MARIA
SI,116,VERA CALDERÓN SILVIA LORENA
SI,117,MONTAÑO VALENCIA MAE
SI,118,MORENO GUERRERO HENRY FREDY
SI,119,MUÑOZ ALARCÓN HÉCTOR PATRICIO
SI,120,PACHALA POMA LUIS ALBERTO
SI,121,TELLO BENALCÁZAR RAÚL ESTUPIÑAN
SI,123,PEÑAFIEL IZQUIERDO EDDY COLÓN
SI,124,PUANCHIR PAYASHÑA TITO PEDRO
SI,125,ALARCÓN GUILLÍN FREDY OSCAR
SI,126,SOLORZANO SARRIA CESAR FAUSTO
SI,127,ALMEYDA JALIL VICENTE FERNANDO
SI,128,MARÍN LAVAYEN DENNIS GUSTAVO
SI,129,ESTUPIÑÁN ORTIZ BORIS EFRÉN
SI,130,RODRÍGUEZ PÉREZ SORAYA MARIBEL
SI,131,PAREDES TORRES WASHINGTON ARTURO
SI,132,ROMERO LOAYZA FRANCO SEGUNDO
SI,133,SIMBAÑA VILLARREAL ABDÓN MARCELO
SI,134,SUQUILANDA VALDIVIESO BYRON VINICIO
SI,135,VERA MENDOZA TANLLY JANELA
SI,136,VILLAMAR JÁCOME PEDRO FABRICIO
SI,137,YÉPEZ MARTÍNEZ HÉCTOR JOSÉ
ABSTENCION,1,AGUIÑAGA VALLEJO PAOLA MARCELA
ABSTENCION,4,ARIAS FERNÁNDEZ VERÓNICA ELIZABETH
ABSTENCION,5,ARIAS RAMÍREZ ALBERTO JESÚS
ABSTENCION,7,ARTEAGA MUÑOZ KARINA CECILIA
ABSTENCION,9,BERGMANN REYNA CARLOS ALBERTO
ABSTENCION,10,BONILLA SALCEDO VIVIANA
ABSTENCION,11,BUENDÍA HERDOÍZA MARÍA SOLEDAD
ABSTENCION,14,CADENA VÉLEZ KARLA GABRIELA
ABSTENCION,15,CALLE VERZOZI HERMUY
ABSTENCION,17,CÁRDENAS ESPINOZA JUAN JORGE
ABSTENCION,23,CHÁVEZ BAJAÑA KHARLA DEL ROCÍO
ABSTENCION,26,CUESTA SANTANA ESTHER ADELINA
ABSTENCION,28,DURÁN AGUILAR LILIANA ELIZABETH
ABSTENCION,29,ALEAGA SANTOS RONNY XAVIER
ABSTENCION,30,ESPINOSA ANDRADE AUGUSTO XAVIER
ABSTENCION,32,GARCÍA GAIBOR CARMEN MERCEDES
ABSTENCION,33,GARCÍA POZO DIEGO OSWALDO
ABSTENCION,36,GUEVARA VILLACRÉS VERÓNICA MARGARITA
ABSTENCION,37,HOLGUÍN NARANJO MARCELA PRISCILA
ABSTENCION,39,LLORET VALDIVIESO JUAN CRISTÓBAL
ABSTENCION,43,MUÑOZ LÓPEZ CHRISTIAN PABEL
ABSTENCION,44,NARANJO ALVARADO PRISCILA AMAPOLA
ABSTENCION,45,OCHOA MORANTE MANUEL ALFREDO
ABSTENCION,50,POMA HERRERA YOFRE MARTÍN
ABSTENCION,51,PROAÑO CIFUENTES ROBERTH MAURICIO
ABSTENCION,54,RIVADENEIRA BURBANO GABRIELA ALEJANDRA
ABSTENCION,55,RIVADENEIRA BUSTOS CARMEN MERCEDES
ABSTENCION,58,SAMANIEGO MAIGUA FRANKLIN OMAR
ABSTENCION,60,ALEMÁN MARMOL MÓNICA ROCÍO
ABSTENCION,61,SOLIZ CARRIÓN DORIS JOSEFINA
ABSTENCION,62,VALLE PINARGOTE BAIRON LEONARDO
ABSTENCION,63,VELIN CORTÉS JUAN PABLO
ABSTENCION,64,VERA FLORES WENDY VANESSA
ABSTENCION,67,VITERI GUALINGA CARLOS ELOY
ABSTENCION,68,YAR ARAUJO JUAN CARLOS
ABSTENCION,69,GUAMBA DÍAZ NANCY JEANNETH
ABSTENCION,70,LOOR ALCÍVAR LEXI LIDUVINA
ABSTENCION,84,ZAMBRANO CHACHA ALBERTO ALEXANDER
ABSTENCION,88,KRONFLE KOZHAYA HENRY FABIÁN
ABSTENCION,94,ZAMBRANO VALLE EDUARDO MAURICIO
ABSTENCION,105,GÓMEZ ALCÍVAR ROBERTO ANDRÉS
ABSTENCION,110,ROHON HERVAS CÉSAR EDUARDO
ABSTENCION,113,TORRES COBO LUIS ESTEBAN
