curul,asambleista,voto
31,DE LA CRUZ GASPAR ADRIANA MIOSOTI,AUSENTE
41,GUAMAN CASTRO ALEX FRANCISCO,AUSENTE
44,GUEVARA VILLACRES VERONICA MARGARITA,AUSENTE
48,CRUZ SALAZAR FRANCISCA GABRIELA,AUSENTE
65,PEÑA PACHECO XIMENA DEL ROCIO,AUSENTE
72,MEDINA MERA VICTOR CLEMENTE,AUSENTE
81,VILLAO PANCHANA RAUL ELIAS,AUSENTE
84,SANCHEZ ORDOÑEZ MONTGOMERY LUIS,AUSENTE
88,DIAZ COKA MARIA GABRIELA,AUSENTE
91,ORELLANA MARQUINEZ MAGALI MARGOT,AUSENTE
93,TIBAN GUALA LOURDES LICENIA,AUSENTE
107,ARGUELLO TROYA BLANCA AZUCENA,AUSENTE
109,VELIZ BRIONES JOSE FELIX,AUSENTE
124,ZAMBRANO ARTEAGA JOSE RICARDO,AUSENTE
136,SERRANO VALLADARES SAADIN ALFREDO,AUSENTE
1,ABAD VELEZ RAUL,SI
2,ACERO LANCHIMBA ESTHELA LILIANA,SI
3,LANDAZURI OLMEDO LUDIS CLAUDINA,SI
4,MACHUCA MOSCOSO LINDA MARICELA,SI
5,AGUIRRE HIDALGO DORA ANDELA,SI
6,ALBAN TORRES MARIANA DEL ROCIO,SI
7,TORRES CEDEÑO KERLLY ANABEL,SI
8,MUÑOZ VICUÑA MARIANGEL,SI
9,ANDINO REINOSO MAURO EDMUNDO,SI
10,VITERI LOPEZ CHRISTIAN HUMBERTO,SI
11,ARIAS RAMIREZ ALBERTO JESUS,SI
12,ARREGUI RUEDA MARCIA CECILIA,SI
13,BENAVIDES ZAMBRANO ZOILA TERESA,SI
14,BERGMANN REYNA CARLOS ALBERTO,SI
15,BORJA PEREZ GALO,SI
16,RIVADENEIRA BURBANO GABRIELA ALEJANDRA,SI
17,BUSTAMANTE PONCE FERNANDO XAVIER,SI
18,CALDERON SALTOS RICHARD OSWALDO,SI
19,CALLE ANDRADE MARIA AUGUSTA,SI
20,TOALOMBO CHIMBORAZO JOSE SEGUNDO,SI
21,CARRION MARIA JOSE,SI
22,CARVAJAL AGUIRRE MIGUEL ANGEL,SI
23,CASSINELLI CALI JUAN CARLOS,SI
24,CAYAMBE TIPAN FAUSTO HERIBERTO,SI
25,CEDEÑO ZAMBRANO JOHANNA ELIZABETH,SI
26,CHAVEZ CANALES HOLGER EZEQUIEL,SI
27,CHICA AREVALO VINICIO VETHOWEN,SI
28,CORDOVA ENCALADA EDGAR EDUARDO,SI
29,CUESTA RIOS LIUBA ELISA,SI
30,DE LA CRUZ BERNARDO HERMAN ULISES,SI
32,DELGADO CHALA AGUSTIN JAVIER,SI
33,FAJARDO MOSQUERA LETTY VANESSA,SI
34,FALCONI LOQUI EVELYN PAMELA,SI
35,GAGLIARDO LOOR GASTON,SI
36,GALVAN GRACIA MARIA ESPERANZA,SI
37,LARREA VITERI LIDICE VANESSA,SI
38,GARZON RICAURTE WILLIAM ANTONIO,SI
39,GODOY ANDRADE GINA JAKELINE,SI
40,GONZALEZ SERRANO MIRYAM CATARINA,SI
42,GUAMANGATE ANTE LUIS GILBERTO,SI
43,JARAMILLO RODRIGUEZ VICTOR HUGO,SI
45,GUZMAN OCHOA LILIANA MAURA,SI
46,HERNANDEZ ENRIQUEZ VIRGILIO HUMBERTO,SI
47,MOSQUERA YANEZ ISABEL PIEDAD,SI
49,JEREZ PILLA BETTY MARICELA,SI
50,JUEZ JUEZ OMAR JUSEPH,SI
51,ORTIZ GASPAR ESTHER FLAVIA,SI
52,BUENDIA HERDOIZA MARIA SOLEDAD,SI
53,LARRIVA ALVARADO OSCAR OSWALDO,SI
54,LEDESMA ZAMORA OSCAR ALFONSO,SI
55,AGUIÑAGA VALLEJO PAOLA MARCELA,SI
56,MELO GARZON ESTEBAN ANDRES,SI
57,TOBAR NUÑEZ RAUL IGNACIO,SI
58,LUCERO SISA RAFAEL,SI
59,ALVARADO CARRION ROSANA,SI
60,OCLES PADILLA ALEXANDRA,SI
61,PABON CARANQUI PAOLA VERENICE,SI
62,PADRON SAETEROS GLADYS PAULINA,SI
63,BRITO MENDOZA MONICA CRISTINA,SI
64,PEÑA CARRASCO DIANA LUCIA,SI
66,PEÑAFIEL MONTESDEOCA JUANA MARISOL,SI
67,PONCE LEON XIMENA MERCEDES,SI
68,PILLAJO TUQUERES JENNY ELIZABETH,SI
69,FARFAN APONTE RICHARD WILSON,SI
70,RIVERA LOPEZ JOSE GABRIEL,SI
71,RIVERO DOGUER ANGEL ARMANDO,SI
73,VELASTEGUI RAMOS LEONARDO DARIO,SI
75,ARIAS FERNANDEZ VERONICA ELIZABETH,SI
76,RODRIGUEZ DELGADO MARIA VERONICA,SI
77,SAENZ DE VITERI LAUTARO ENRIQUE,SI
78,SALAZAR CEDEÑO GUADALUPE DOLORES,SI
79,ANDRADE VARELA JUPITER GOZOSO DE LA CRUZ,SI
85,MOYA DUQUE HERMAN ANIBAL,SI
86,SERRANO REYES NELSON ALCIDES,SI
87,SOLANO MORENO ALEX FABIAN,SI
94,TERAN SARZOSA SEGUNDO FAUSTO,SI
95,VALAREZO ORDOÑEZ ROCIO DEL CARMEN,SI
96,VALLE PINARGOTE BAIRON LEONARDO,SI
97,VASCONEZ ARTEAGA ANNY MARLLELY,SI
98,VELA CAIZAPANTA ANGEL RAMIRO,SI
99,PACHECO ORDOÑEZ BAYRON EDUARDO,SI
106,VELA CHERONI MARIA SOLEDAD,SI
108,VELASCO ENRIQUEZ CARLOS ALBERTO,SI
110,VERDUGA CEDEÑO MARY,SI
111,VICUÑA MUÑOZ MARIA ALEJANDRA,SI
112,ANDINO ROBALINO ANGELICA MARIA,SI
113,POSSO SALGADO LUIS ANTONIO,SI
121,VILLACRESES PEÑA OCTAVIO XAVIER ENRIQUE,SI
122,VINTIMILLA JARRIN DIEGO ARMANDO,SI
123,VITERI GUALINGA CARLOS ELOY,SI
125,ZAMBRANO CABANILLA EDUARDO ALFONSO,SI
126,VILLON POZO LUIS MARIANO,SI
127,ZAMBRANO CHACHA ALBERTO ALEXANDER,SI
128,ZAPATA MANTILLA JOSE LEONIDAS,SI
129,URIBE LOPEZ FANNY ESTHER,SI
74,AGUILAR TORRES MANUEL RAMIRO,NO
80,BUSTOS CHILIQUINGA ARCADIO,NO
82,YANDUN POZO CASTULO RENE,NO
83,ACACHO GONZALEZ PEPE LUIS,NO
89,FIERRO OVIEDO PACO,NO
100,GUTIERREZ BORBUA FAUSTO GILMAR,NO
101,AUQUILLA ORTEGA RAUL VICENTE,NO
102,CHICAIZA TOAPANTA WILSON ALFONSO,NO
103,DONOSO CHIRIBOGA PATRICIO,NO
104,MONCAYO CEVALLOS JOSE RICARDO,NO
114,AGUINDA TAPUY DIANA YOLANDA,NO
115,MONTAÑO VALENCIA MAE,NO
116,MORETA PANCHEZ MIGUEL ANGEL,NO
117,LLANES SUAREZ HENRY MANUEL,NO
118,SALGADO RIVADENEIRA DIEGO,NO
119,CHICA PAVEL,NO
120,TORRES TORRES LUIS FERNANDO,NO
130,TAPIA LOMBEYDA LUIS FERNANDO,NO
131,CUCALON CAMACHO HENRY EDUARDO,NO
132,REYES HIDALGO CRISTINA EUGENIA,NO
133,TACLE GALARRAGA MOISES FERNANDO,NO
134,ROMERO LOAYZA FRANCO SEGUNDO,NO
135,YELA BURGOS DAYSE INES,NO
137,KRONFLE GOMEZ MARIA CRISTINA,NO
90,GUALAN JAPA MILTON RODRIGO,ABSTENCION
92,UMAJINGA GUAMAN CESAR,ABSTENCION
105,MOREIRA MACIAS GRACE HOLANDA,ABSTENCION
