voto,curul,asambleista
AUSENTE,2,ALBORNOZ VINTIMILLA CLAUDIO ESTEBAN
AUSENTE,5,ARIAS RAMÍREZ ALBERTO JESÚS
AUSENTE,10,BONILLA SALCEDO VIVIANA
AUSENTE,18,CARRIÓN CEVALLOS MARÍA JOSÉ
AUSENTE,19,VALLEJO JARAMILLO NORMA MARLENE
AUSENTE,21,CERDA MIRANDA GABRIELA PAMELA
AUSENTE,25,SUAREZ HUAYAMAVE CARLOS ALBERTO
AUSENTE,26,CUESTA SANTANA ESTHER ADELINA
AUSENTE,28,DURÁN AGUILAR LILIANA ELIZABETH
AUSENTE,35,GAVILÁNEZ CAMACHO FAFO HOLGUÍN
AUSENTE,41,MELO GARZÓN ESTEBAN ANDRÉS
AUSENTE,48,PEÑA PACHECO XIMENA DEL ROCÍO
AUSENTE,53,QUIÑONEZ OCAMPO JULIO CÉSAR
AUSENTE,56,SALAZAR CEDEÑO GUADALUPE DOLORES
AUSENTE,60,ALEMÁN MARMOL MÓNICA ROCÍO
AUSENTE,61,SOLIZ CARRIÓN DORIS JOSEFINA
AUSENTE,63,VELIN CORTÉS JUAN PABLO
AUSENTE,66,VILLALVA MIRANDA LIRA DE LA PAZ
AUSENTE,68,YAR ARAUJO JUAN CARLOS
AUSENTE,69,YUNDA MACHADO JORGE HOMERO
AUSENTE,70,ZAMBRANO ARTEAGA JOSE RICARDO
AUSENTE,74,BERNAL BERNAL ESTEBAN REMIGIO
AUSENTE,84,VEGAY JIPA LUZ AIDA
AUSENTE,86,YANDÚN POZO CÁSTULO RENÉ
AUSENTE,88,KRONFLE KOZHAYA HENRY FABIÁN
AUSENTE,92,CRUZ VACA JEANNINE DEL CISNE
AUSENTE,95,CADENA HUERTAS FRANCISCO JAVIER
AUSENTE,100,CURICHUMBI YUPANQUI PEDRO
AUSENTE,102,FLORES VÁSQUEZ FERNANDO PATRICIO
AUSENTE,103,GALARZA AÑAZCO ANA MERCEDES
AUSENTE,110,ROHON HERVAS CÉSAR EDUARDO
AUSENTE,115,MENDOZA PALMA JOFFRE PATRICIO
AUSENTE,116,MINCHALA MURILLO RÓMULO MARCELO
AUSENTE,127,UGARTE GUZMÁN BLANCA ROSANA
AUSENTE,136,VILLAMAR JÁCOME PEDRO FABRICIO
AUSENTE,137,YÉPEZ MARTÍNEZ HÉCTOR JOSÉ
SI,1,AGUIÑAGA VALLEJO PAOLA MARCELA
SI,3,CEVALLOS GUEVARA LESLIE MARCELA
SI,4,ARIAS FERNÁNDEZ VERÓNICA ELIZABETH
SI,6,ARREGUI RUEDA MARCIA CECILIA
SI,7,ARTEAGA MUÑOZ KARINA CECILIA
SI,8,MARQUEZ LOPEZ JOSE LENIN
SI,9,BERGMANN REYNA CARLOS ALBERTO
SI,11,BUENDÍA HERDOÍZA MARÍA SOLEDAD
SI,12,BUSTAMANTE MONTEROS RUBÉN ALEJANDRO
SI,13,CABEZAS GUERRERO ELIZABETH ENRIQUETA
SI,14,CADENA VÉLEZ KARLA GABRIELA
SI,15,CALLE VERZOZI HERMUY
SI,16,CAMBALA MONTECE CARLOS ALBERTO
SI,17,CÁRDENAS ESPINOZA JUAN JORGE
SI,20,TENORIO VALENCIA CALLETANO
SI,22,CHALÁ CRUZ JOSÉ FRANKLIN
SI,23,CHÁVEZ BAJAÑA KHARLA DEL ROCÍO
SI,24,COROZO AYOVÍ JORGE WILBER
SI,27,DOUMET CHEDRAUI MICHEL ANDRÉS
SI,29,ALEAGA SANTOS RONNY XAVIER
SI,30,ESPINOSA ANDRADE AUGUSTO XAVIER
SI,31,FLOR GIL BRENDA AZUCENA
SI,32,GARCÍA GAIBOR CARMEN MERCEDES
SI,33,GARCÍA POZO DIEGO OSWALDO
SI,34,MORENO CHIRIBOGA AMPARO DIANA
SI,36,GUEVARA VILLACRÉS VERÓNICA MARGARITA
SI,37,HOLGUÍN NARANJO MARCELA PRISCILA
SI,38,LITARDO CAICEDO CÉSAR ERNESTO
SI,39,LLORET VALDIVIESO JUAN CRISTÓBAL
SI,40,MARÍN AGUIRRE ANA BELÉN
SI,42,MENDOZA ARÉVALO DANIEL ISAAC
SI,43,MUÑOZ LÓPEZ CHRISTIAN PABEL
SI,44,NARANJO ALVARADO PRISCILA AMAPOLA
SI,45,OCHOA MORANTE MANUEL ALFREDO
SI,46,ALONSO FERNÁNDEZ FÉLIX FREDY
SI,47,PALACIOS VELÁSQUEZ SONIA LUCRECIA
SI,49,PLAZA CASTILLO LENIN
SI,50,POMA HERRERA YOFRE MARTÍN
SI,51,PROAÑO CIFUENTES ROBERTH MAURICIO
SI,52,QUIJIJE DELGADO LUIS RAFAEL
SI,54,RIVADENEIRA BURBANO GABRIELA ALEJANDRA
SI,55,RIVADENEIRA BUSTOS CARMEN MERCEDES
SI,57,SALGADO ANDRADE SILVIA BETZABETH
SI,58,SAMANIEGO MAIGUA FRANKLIN OMAR
SI,59,SÁNCHEZ REYES MONTGOMERY
SI,62,VALLE PINARGOTE BAIRON LEONARDO
SI,64,VERA FLORES WENDY VANESSA
SI,65,VERA RODRÍGUEZ CARLOS ALFREDO
SI,67,VITERI GUALINGA CARLOS ELOY
SI,71,ANDRADE MUÑOZ WILMA PIEDAD
SI,72,ASÁN WONSANG JOSÉ FRANCISCO
SI,73,AUQUILLA ORTEGA RAÚL VICENTE
SI,75,BURBANO MONTENEGRO FÉLIX FERNANDO
SI,76,ZAMBRANO CASTRO NORALMA ELIZABETH
SI,77,GUEVARA LOZADA FLERIDA YOVANA
SI,78,ORDOÑEZ ZAMBRANO SANDRA DEL ROCÍO
SI,79,AÑAZCO ROMERO DOLORES LETICIA
SI,80,CALLEJAS BARONA FERNANDO
SI,81,CAMPAIN BRAMBILLA RINA ASUNCIÓN
SI,82,CAMPOVERDE ROBLES EMILIO ABSALÓN
SI,83,CARRIÓN MORENO CÉSAR ATAULFO
SI,85,SINMALEZA SÁNCHEZ ÁNGEL RUPERTO
SI,87,HENRÍQUEZ JAIME PATRICIA IVONNE
SI,89,CASTANIER JARAMILLO XAVIER HOMERO
SI,90,CELI SANTOS GUILLERMO ALEJANDRO
SI,91,CRUZ PROAÑO LUDOVICO ISRAEL
SI,93,CUESTA ORELLANA MARÍA DE LOURDES
SI,94,ZAMBRANO VALLE EDUARDO MAURICIO
SI,96,PEÑA ONTANEDA ELIO GERMÁN
SI,97,MONTAÑO GUISAMANO MAYRA MIGDONIA
SI,98,
SI,99,REYES HIDALGO CRISTINA EUGENIA
SI,101,DONOSO CHIRIBOGA PATRICIO
SI,104,GENDE CALAZACÓN ANGEL MESÍAS
SI,105,GÓMEZ ALCÍVAR ROBERTO ANDRÉS
SI,106,MACÍAS ORTEGA WENDY ELENA MARISOL
SI,107,CANDELL SOTO JAIME ENRIQUE JIMMY
SI,108,DUCHI GUAMÁN MARÍA ENCARNACIÓN
SI,109,OLIVO PALLO JAIME FERNANDO
SI,111,TACLE GARCÍA SAMIA
SI,112,TERÁN SALCEDO RAMÓN FORTUNATO
SI,113,TORRES TORRES LUIS FERNANDO
SI,114,LARREÁTEGUI FABARA MARÍA GABRIELA
SI,117,MONTAÑO VALENCIA MAE
SI,118,VARGAS SÁNCHEZ GRETTY LEILA
SI,119,MUÑOZ ALARCÓN HÉCTOR PATRICIO
SI,120,PACHALA POMA LUIS ALBERTO
SI,121,TELLO BENALCÁZAR RAÚL ESTUPIÑAN
SI,122,CUESTA CONCARI MARÍA MERCEDES
SI,123,PEÑAFIEL IZQUIERDO EDDY COLÓN
SI,124,PUANCHIR PAYASHÑA TITO PEDRO
SI,125,ALARCÓN GUILLÍN FREDY OSCAR
SI,126,SOLORZANO SARRIA CESAR FAUSTO
SI,128,VINTIMILLA MOSCOSO PAOLA
SI,129,ZAMBRANO ORTIZ MARÍA ROBERTA
SI,130,PALACIOS MUÑOZ JUAN SEBASTIÁN
SI,131,PAREDES TORRES WASHINGTON ARTURO
SI,132,ROMERO LOAYZA FRANCO SEGUNDO
SI,133,SIMBAÑA VILLARREAL ABDÓN MARCELO
SI,134,SUQUILANDA VALDIVIESO BYRON VINICIO
SI,135,VERA MENDOZA TANLLY JANELA
