voto,curul,asambleista
AUSENTE,8,MUÑOZ VICUÑA MARIANGEL
AUSENTE,19,CALLE ANDRADE MARIA AUGUSTA
AUSENTE,25,CEDEÑO ZAMBRANO JOHANNA ELIZABETH
AUSENTE,26,CHAVEZ CANALES HOLGER EZEQUIEL
AUSENTE,33,PALACIOS CESAR
AUSENTE,37,MENDOZA DANIEL ISAAC
AUSENTE,40,GONZALEZ SERRANO MIRYAM CATARINA
AUSENTE,47,MOSQUERA YANEZ ISABEL PIEDAD
AUSENTE,48,ISSA WAGNER NICOLAS JOSE
AUSENTE,63,BRITO MENDOZA MONICA CRISTINA
AUSENTE,70,JIJON BUENDIA ITALIA LUISA
AUSENTE,77,SAENZ DE VITERI LAUTARO ENRIQUE
AUSENTE,78,SUBIA BARREIRO BOLIVAR STALIN
AUSENTE,79,ANDRADE VARELA JUPITER GOZOSO DE LA CRUZ
AUSENTE,85,MORAN AMALIA
AUSENTE,91,ORELLANA MARQUINEZ MAGALI MARGOT
AUSENTE,100,GUTIERREZ BORBUA FAUSTO GILMAR
AUSENTE,104,MONCAYO CEVALLOS JOSE RICARDO
AUSENTE,109,VELEZ MARLENE MARGARITA
AUSENTE,112,VILEMA FREIRE ANGEL RAMIRO
AUSENTE,114,SOLORZANO SARRIA CESAR FAUSTO
AUSENTE,124,ZAMBRANO ARTEAGA JOSE RICARDO
AUSENTE,126,ZAMBRANO CASTRO NORALMA ELIZABETH
SI,1,ABAD VELEZ RAUL
SI,3,AGUILAR PLACIDO ARMANDO
SI,4,HAGO CELI FRANCISCO WAIKING
SI,5,AGUIRRE HIDALGO DORA ANADELA
SI,6,QUINDIGALLE LICTAPUZON GUILLERMO ORLANDO
SI,7,MONTENEGRO NUÑEZ CHRISTIAN SANTIAGO
SI,9,ANDINO REINOSO MAURO EDMUNDO
SI,10,VITERI LOPEZ CHRISTIAN HUMBERTO
SI,11,RIVAS ALAVA ELIANA LISSET
SI,12,VILLAMAR CASAL JOSE LEONIDAS
SI,13,BENAVIDES ZAMBRANO ZOILA TERESA
SI,14,BERGMANN REYNA CARLOS ALBERTO
SI,15,BORJA PEREZ GALO
SI,16,RIVADENEIRA BURBANO GABRIELA ALEJANDRA
SI,18,CALDERON SALTOS RICHARD OSWALDO
SI,20,CARRILLO BETTY
SI,21,ANRRANGO ZAMBRANO GERARDO ELIAS
SI,22,CARVAJAL AGUIRRE MIGUEL ANGEL
SI,23,BRAVO RAMIREZ MARIA LORENA
SI,24,CONSTANTE NIETO MARIANA DE LAS MERCEDES
SI,27,DELGADO GUTIERREZ ALEXANDRA ISABEL
SI,28,CORDOVA ENCALADA EDGAR EDUARDO
SI,29,CUESTA RIOS LIUBA ELISA
SI,30,DE LA CRUZ BERNARDO HERMAN ULISES
SI,31,DE LA CRUZ GASPAR ADRIANA MIOSOTI
SI,32,DELGADO CHALA AGUSTIN JAVIER
SI,34,FALCONI LOQUI EVELYN PAMELA
SI,35,GAGLIARDO LOOR GASTON
SI,36,DE LA TORRE RAMIREZ PABLO ANTONIO
SI,38,GARZON RICAURTE WILLIAM ANTONIO
SI,39,GODOY ANDRADE GINA JAKELINE
SI,41,GUAMAN CASTRO ALEX FRANCISCO
SI,42,GUAMANGATE ANTE LUIS GILBERTO
SI,43,JARAMILLO RODRIGUEZ VICTOR HUGO
SI,44,GUEVARA VILLACRES VERONICA MARGARITA
SI,45,GUZMAN OCHOA LILIANA MAURA
SI,46,HERNANDEZ ENRIQUEZ VIRGILIO HUMBERTO
SI,49,CARRILLO CRESPO HUGO FERNANDO
SI,50,SILVA MALDONADO SOFIA IRENE
SI,51,BAZURTO ROLDAN NANCIS CELESTE
SI,52,BUENDIA HERDOIZA MARIA SOLEDAD
SI,53,LARRIVA ALVARADO OSCAR OSWALDO
SI,54,LEDESMA ZAMORA OSCAR ALFONSO
SI,55,AGUIÑAGA VALLEJO PAOLA MARCELA
SI,56,MELO GARZON ESTEBAN ANDRES
SI,57,TOBAR NUÑEZ RAUL IGNACIO
SI,58,MUÑOZ AVENDAÑO ROSA ELVIRA
SI,59,ALVARADO CARRION ROSANA
SI,60,OCLES PADILLA ALEXANDRA
SI,61,CAZA TIPANTA HUGO RENE
SI,62,SANANGO AUCACAMA LUIS LORENZO
SI,64,TORRES LARA JOSE EDUARDO
SI,65,PEÑA PACHECO XIMENA DEL ROCIO
SI,66,PEÑAFIEL MONTESDEOCA JUANA MARISOL
SI,67,PONCE LEON XIMENA MERCEDES
SI,68,PILLAJO TUQUERES JENNY ELIZABETH
SI,69,FARFAN APONTE RICHARD WILSON
SI,71,GOMEZ IRMA
SI,72,MEDINA MERA VICTOR CLEMENTE
SI,73,REINOSO LESCANO MARIA ELIZABETH
SI,75,ARIAS FERNANDEZ VERONICA ELIZABETH
SI,76,RODRIGUEZ DELGADO MARIA VERONICA
SI,81,MATIAS APOLINARIO RITA AZUCENA
SI,84,SANCHEZ ORDOÑEZ MONTGOMERY LUIS
SI,86,AGUALSACA GUAMAN JOSE CLEMENTE
SI,87,DAHIK ASTUDILLO REYTA GIOMAR
SI,94,TERAN SARZOSA SEGUNDO FAUSTO
SI,95,VALAREZO ORDOÑEZ ROCIO DEL CARMEN
SI,96,VALLE PINARGOTE BAIRON LEONARDO
SI,97,VASCONEZ ARTEAGA ANNY MARLLELY
SI,106,VELA CHERONI MARIA SOLEDAD
SI,107,ARGUELLO TROYA BLANCA AZUCENA
SI,108,VELASCO ENRIQUEZ CARLOS ALBERTO
SI,110,VERDUGA CEDEÑO MARY
SI,111,VICUÑA MUÑOZ MARIA ALEJANDRA
SI,122,VINTIMILLA JARRIN DIEGO ARMANDO
SI,123,VITERI GUALINGA CARLOS ELOY
SI,125,ZAMBRANO CABANILLA EDUARDO ALFONSO
SI,127,OBANDO MORALES SANTA FELICITA
SI,128,SERRANO SEGURA GRACE MARISOL
NO,88,DIAZ COKA MARIA GABRIELA
NO,99,PACHECO ORDOÑEZ BAYRON EDUARDO
NO,102,CHICAIZA TOAPANTA WILSON ALFONSO
NO,113,POSSO SALGADO LUIS ANTONIO
NO,115,MONTAÑO VALENCIA MAE
NO,129,URIBE LOPEZ FANNY ESTHER
ABSTENCION,2,ACERO LANCHIMBA ESTHELA LILIANA
ABSTENCION,17,BUSTAMANTE PONCE FERNANDO XAVIER
ABSTENCION,74,GUZMAN SEGOVIA JOSE FRANCISCO
ABSTENCION,80,BUSTOS CHILIQUINGA ARCADIO
ABSTENCION,82,LANDAZURI CORDOVA SANDRA SUSANA
ABSTENCION,83,ACACHO GONZALEZ PEPE LUIS
ABSTENCION,89,FIERRO OVIEDO PACO
ABSTENCION,90,GUALAN JAPA MILTON RODRIGO
ABSTENCION,92,UMAJINGA GUAMAN CESAR
ABSTENCION,93,TIBAN GUALA LOURDES LICENIA
ABSTENCION,98,VELA CAIZAPANTA ANGEL RAMIRO
ABSTENCION,101,LUDEÑA SOTOMAYOR CECILIA DEL CISNE
ABSTENCION,103,DONOSO CHIRIBOGA PATRICIO
ABSTENCION,105,MOREIRA MACIAS GRACE HOLANDA
ABSTENCION,116,SIVINTA TAIPE WALTHER OSWALDO
ABSTENCION,117,LLANES SUAREZ HENRY MANUEL
ABSTENCION,118,SALGADO RIVADENEIRA DIEGO
ABSTENCION,119,MEDINA TAMBACO EMILY JESUS
ABSTENCION,120,TORRES TORRES LUIS FERNANDO
ABSTENCION,121,VILLACRESES PEÑA OCTAVIO XAVIER ENRIQUE
ABSTENCION,130,TAPIA LOMBEYDA LUIS FERNANDO
ABSTENCION,131,CUCALON CAMACHO HENRY EDUARDO
ABSTENCION,132,REYES HIDALGO CRISTINA EUGENIA
ABSTENCION,133,TACLE GALARRAGA MOISES FERNANDO
ABSTENCION,134,ROMERO LOAYZA FRANCO SEGUNDO
ABSTENCION,135,TERAN SALCEDO RAMON FORTUNATO
ABSTENCION,136,SERRANO VALLADARES SAADIN ALFREDO
ABSTENCION,137,KRONFLE GOMEZ MARIA CRISTINA
