voto,curul,asambleista
AUSENTE,2,ALBORNOZ VINTIMILLA CLAUDIO ESTEBAN
AUSENTE,3,SERRANO SALGADO JOSÉ RICARDO
AUSENTE,6,YELA ACOSTA WERNER ANTONIO
AUSENTE,9,BERGMANN REYNA CARLOS ALBERTO
AUSENTE,14,CADENA VÉLEZ KARLA GABRIELA
AUSENTE,25,CUESTA RÍOS LIUBA ELISA
AUSENTE,28,DURÁN AGUILAR LILIANA ELIZABETH
AUSENTE,42,MENDOZA ARÉVALO DANIEL ISAAC
AUSENTE,50,POMA HERRERA YOFRE MARTÍN
AUSENTE,60,ALEMÁN MARMOL MÓNICA ROCÍO
AUSENTE,61,SOLIZ CARRIÓN DORIS JOSEFINA
AUSENTE,69,GUAMBA DÍAZ NANCY JEANNETH
AUSENTE,70,ZAMBRANO ARTEAGA JOSE RICARDO
AUSENTE,115,MENDOZA PALMA JOFFRE PATRICIO
AUSENTE,126,SOLORZANO SARRIA CESAR FAUSTO
AUSENTE,136,VILLAMAR JÁCOME PEDRO FABRICIO
SI,1,AGUIÑAGA VALLEJO PAOLA MARCELA
SI,4,ARIAS FERNÁNDEZ VERÓNICA ELIZABETH
SI,5,ARIAS RAMÍREZ ALBERTO JESÚS
SI,7,MONTESDEOCA PALACIOS JOSÉ DANIEL
SI,8,BENAVIDES ZAMBRANO ZOILA TERESA
SI,10,BONILLA SALCEDO VIVIANA
SI,11,BUENDÍA HERDOÍZA MARÍA SOLEDAD
SI,12,HIDALGO JARAMILLO EDITH MARLENE
SI,13,CABEZAS GUERRERO ELIZABETH ENRIQUETA
SI,15,CALLE VERZOZI HERMUY
SI,16,CAMBALA MONTECE CARLOS ALBERTO
SI,17,CÁRDENAS ESPINOZA JUAN JORGE
SI,18,CARRIÓN CEVALLOS MARÍA JOSÉ
SI,19,VALLEJO JARAMILLO NORMA MARLENE
SI,20,TENORIO VALENCIA CALLETANO
SI,21,GREFA AVILEZ FLAVIO PATRICIO
SI,22,CHALÁ CRUZ JOSÉ FRANKLIN
SI,23,TORRES TORRES EURO IGNACIO
SI,24,COROZO AYOVÍ JORGE WILBER
SI,26,CUESTA SANTANA ESTHER ADELINA
SI,27,DOUMET CHEDRAUI MICHEL ANDRÉS
SI,29,ESPÍN REYES EUGENIA SOFÍA
SI,30,ESPINOSA ANDRADE AUGUSTO XAVIER
SI,31,FLOR GIL BRENDA AZUCENA
SI,32,GARCÍA GAIBOR CARMEN MERCEDES
SI,33,GARCÍA POZO DIEGO OSWALDO
SI,34,GARZÓN RICAURTE WILLIAM ANTONIO
SI,35,GAVILÁNEZ CAMACHO FAFO HOLGUÍN
SI,36,GUEVARA VILLACRÉS VERÓNICA MARGARITA
SI,37,HOLGUÍN NARANJO MARCELA PRISCILA
SI,38,LITARDO CAICEDO CÉSAR ERNESTO
SI,39,LLORET VALDIVIESO JUAN CRISTÓBAL
SI,40,MARÍN AGUIRRE ANA BELÉN
SI,41,MELO GARZÓN ESTEBAN ANDRÉS
SI,43,MUÑOZ LÓPEZ CHRISTIAN PABEL
SI,44,NARANJO ALVARADO PRISCILA AMAPOLA
SI,45,OCHOA MORANTE MANUEL ALFREDO
SI,46,ORELLANA ROMÁN ROSA GINA
SI,47,PALACIOS VELÁSQUEZ SONIA LUCRECIA
SI,48,PEÑA PACHECO XIMENA DEL ROCÍO
SI,49,PLAZA CASTILLO LENIN
SI,51,PROAÑO CIFUENTES ROBERTH MAURICIO
SI,52,QUIJIJE DELGADO LUIS RAFAEL
SI,53,QUIÑONEZ OCAMPO JULIO CÉSAR
SI,54,RIVADENEIRA BURBANO GABRIELA ALEJANDRA
SI,55,RIVADENEIRA BUSTOS CARMEN MERCEDES
SI,56,SALAZAR CEDEÑO GUADALUPE DOLORES
SI,57,SALGADO ANDRADE SILVIA BETZABETH
SI,58,SAMANIEGO MAIGUA FRANKLIN OMAR
SI,59,SÁNCHEZ REYES MONTGOMERY
SI,62,VALLE PINARGOTE BAIRON LEONARDO
SI,63,VELIN CORTÉS JUAN PABLO
SI,64,VERA FLORES WENDY VANESSA
SI,65,VERA RODRÍGUEZ CARLOS ALFREDO
SI,66,VILLALVA MIRANDA LIRA DE LA PAZ
SI,67,VITERI GUALINGA CARLOS ELOY
SI,68,YAR ARAUJO JUAN CARLOS
SI,71,ANDRADE MUÑOZ WILMA PIEDAD
SI,72,ASÁN WONSANG JOSÉ FRANCISCO
SI,73,AUQUILLA ORTEGA RAÚL VICENTE
SI,74,BERNAL BERNAL ESTEBAN REMIGIO
SI,75,BURBANO MONTENEGRO FÉLIX FERNANDO
SI,76,ZAMBRANO CASTRO NORALMA ELIZABETH
SI,77,AZUERO RODAS ELISEO ALEXIS
SI,78,CUCALÓN CAMACHO HENRY EDUARDO
SI,79,FALQUEZ BATALLAS PEDRO CARLOS
SI,80,CALLEJAS BARONA FERNANDO
SI,81,CAMPAIN BRAMBILLA RINA ASUNCIÓN
SI,82,ORDOÑEZ QUEZADA ANDREINA SILVANA
SI,83,CARRIÓN MORENO CÉSAR ATAULFO
SI,84,VEGAY JIPA LUZ AIDA
SI,85,SINMALEZA SÁNCHEZ ÁNGEL RUPERTO
SI,86,YANDÚN POZO CÁSTULO RENÉ
SI,87,UGARTE HENRÍQUEZ JOSÉ FERNANDO
SI,88,OLLAGUE VALAREZO ZOILA PIEDAD
SI,89,CASTANIER JARAMILLO XAVIER HOMERO
SI,90,LÓPEZ GÓMEZ DE LA TORRE MARÍA CRISTINA
SI,91,CRUZ PROAÑO LUDOVICO ISRAEL
SI,92,ZÁRATE CASTRO JORGE EDUARDO
SI,93,CUESTA ORELLANA MARÍA DE LOURDES
SI,94,ZAMBRANO VALLE EDUARDO MAURICIO
SI,95,CADENA HUERTAS FRANCISCO JAVIER
SI,96,PEÑA ONTANEDA ELIO GERMÁN
SI,97,MONTAÑO GUISAMANO MAYRA MIGDONIA
SI,98,RODRÍGUEZ CUESTA JORGE IGNACIO
SI,99,LLANES SUAREZ HENRY MANUEL
SI,100,CURICHUMBI YUPANQUI PEDRO
SI,101,DONOSO CHIRIBOGA PATRICIO
SI,102,FLORES VÁSQUEZ FERNANDO PATRICIO
SI,103,GALARZA AÑAZCO ANA MERCEDES
SI,104,GENDE CALAZACÓN ANGEL MESÍAS
SI,105,GÓMEZ ALCÍVAR ROBERTO ANDRÉS
SI,106,ZAMBRANO VERA MARIANO
SI,107,CANDELL SOTO JAIME ENRIQUE JIMMY
SI,108,DUCHI GUAMÁN MARÍA ENCARNACIÓN
SI,109,OLIVO PALLO JAIME FERNANDO
SI,110,ROHON HERVAS CÉSAR EDUARDO
SI,111,TACLE GARCÍA SAMIA
SI,112,TERÁN SALCEDO RAMÓN FORTUNATO
SI,113,TORRES TORRES LUIS FERNANDO
SI,114,LARREÁTEGUI FABARA MARÍA GABRIELA
SI,116,MINCHALA MURILLO RÓMULO MARCELO
SI,117,MONTAÑO VALENCIA MAE
SI,118,MORENO GUERRERO HENRY FREDY
SI,119,MUÑOZ ALARCÓN HÉCTOR PATRICIO
SI,120,PACHALA POMA LUIS ALBERTO
SI,121,TELLO BENALCÁZAR RAÚL ESTUPIÑAN
SI,122,CUESTA CONCARI MARÍA MERCEDES
SI,123,PEÑAFIEL IZQUIERDO EDDY COLÓN
SI,124,PUANCHIR PAYASHÑA TITO PEDRO
SI,125,ALARCÓN GUILLÍN FREDY OSCAR
SI,127,UGARTE GUZMÁN BLANCA ROSANA
SI,128,VINTIMILLA MOSCOSO PAOLA
SI,129,ZAMBRANO ORTIZ MARÍA ROBERTA
SI,130,PALACIOS MUÑOZ JUAN SEBASTIÁN
SI,131,PAREDES TORRES WASHINGTON ARTURO
SI,132,ROMERO LOAYZA FRANCO SEGUNDO
SI,133,SIMBAÑA VILLARREAL ABDÓN MARCELO
SI,134,SUQUILANDA VALDIVIESO BYRON VINICIO
SI,135,VERA MENDOZA TANLLY JANELA
SI,137,PADILLA SIERRA MAGGIE DOLORES
