curul,asambleista,voto
5,AGUIRRE HIDALGO DORA ANDELA,AUSENTE
29,MACIAS GARCIA PEDRO ROBERTO GEOVANNY,AUSENTE
35,MONTIEL ARREAGA ROSAISELA DE LAS MERCEDES,AUSENTE
47,MOSQUERA YANEZ ISABEL PIEDAD,AUSENTE
56,QUIROZ VALLEJO HECTOR HUGO,AUSENTE
68,PILLAJO TUQUERES JENNY ELIZABETH,AUSENTE
71,RIVERO DOGUER ANGEL ARMANDO,AUSENTE
72,MEDINA MERA VICTOR CLEMENTE,AUSENTE
77,SAENZ DE VITERI LAUTARO ENRIQUE,AUSENTE
79,ANDRADE VARELA JUPITER GOZOSO DE LA CRUZ,AUSENTE
92,SALAZAR CHICAIZA ABRAHAN ELIO,AUSENTE
93,TIBAN GUALA LOURDES LICENIA,AUSENTE
105,MOREIRA MACIAS GRACE HOLANDA,AUSENTE
113,POSSO SALGADO LUIS ANTONIO,AUSENTE
118,SALGADO RIVADENEIRA DIEGO,AUSENTE
119,CHICA ARTEAGA GUNTARD PAVEL,AUSENTE
123,VITERI GUALINGA CARLOS ELOY,AUSENTE
124,ZAMBRANO ARTEAGA JOSE RICARDO,AUSENTE
125,ZAMBRANO CABANILLA EDUARDO ALFONSO,AUSENTE
128,SERRANO SEGURA GRACE MARISOL,AUSENTE
129,URIBE LOPEZ FANNY ESTHER,AUSENTE
131,CUCALON CAMACHO HENRY EDUARDO,AUSENTE
132,REYES HIDALGO CRISTINA EUGENIA,AUSENTE
74,AGUILAR TORRES MANUEL RAMIRO,SI
80,BUSTOS CHILIQUINGA ARCADIO,SI
82,YANDUN POZO CASTULO RENE,SI
83,CARDENAS SAQUICELA ULBIO EFREN,SI
87,SOLANO MORENO ALEX FABIAN,SI
88,DIAZ COKA MARIA GABRIELA,SI
89,FIERRO OVIEDO PACO,SI
90,GUALAN JAPA MILTON RODRIGO,SI
91,ORELLANA MARQUINEZ MAGALI MARGOT,SI
99,PACHECO ORDOÑEZ BAYRON EDUARDO,SI
100,GUTIERREZ BORBUA FAUSTO GILMAR,SI
101,AUQUILLA ORTEGA RAUL VICENTE,SI
102,CHICAIZA TOAPANTA WILSON ALFONSO,SI
103,DONOSO CHIRIBOGA PATRICIO,SI
104,MONCAYO CEVALLOS JOSE RICARDO,SI
110,OCHOA MORANTE MANUEL ALFREDO,SI
111,VICUÑA MUÑOZ MARIA ALEJANDRA,SI
112,VILEMA FREIRE ANGEL RAMIRO,SI
114,SOLORZANO SARRIA CESAR FAUSTO,SI
115,MONTAÑO VALENCIA MAE,SI
116,MORETA PANCHEZ MIGUEL ANGEL,SI
117,PAEZ BENALCAZAR ANDRES TARQUINO,SI
120,TORRES TORRES LUIS FERNANDO,SI
130,TAPIA LOMBEYDA LUIS FERNANDO,SI
133,TACLE GALARRAGA MOISES FERNANDO,SI
134,ROMERO LOAYZA FRANCO SEGUNDO,SI
135,TERAN SALCEDO RAMON FORTUNATO,SI
136,VITERI JIMENEZ CYNTHIA,SI
137,KRONFLE GOMEZ MARIA CRISTINA,SI
1,ABAD VELEZ RAUL,NO
2,MORALES POZO LENIN ALBERTO,NO
3,AGUILAR PLACIDO ARMANDO,NO
4,MACHUCA MOSCOSO LINDA MARICELA,NO
6,ALBAN TORRES MARIANA DEL ROCIO,NO
7,MONTENEGRO NUÑEZ CHRISTIAN SANTIAGO,NO
8,MUÑOZ VICUÑA MARIANGEL,NO
9,ANDINO REINOSO MAURO EDMUNDO,NO
10,VITERI LOPEZ CHRISTIAN HUMBERTO,NO
11,ARIAS RAMIREZ ALBERTO JESUS,NO
12,ARREGUI RUEDA MARCIA CECILIA,NO
13,BENAVIDES ZAMBRANO ZOILA TERESA,NO
14,BERGMANN REYNA CARLOS ALBERTO,NO
15,BORJA PEREZ GALO,NO
16,RIVADENEIRA BURBANO GABRIELA ALEJANDRA,NO
17,BUSTAMANTE PONCE FERNANDO XAVIER,NO
18,QUIMBIULCO BEDON LORENA GABRIELA,NO
19,CALLE ANDRADE MARIA AUGUSTA,NO
20,CARRILLO BETTY,NO
21,CARRION MARIA JOSE,NO
22,CAJAS LARA SUSANA VALERIA,NO
23,CASSINELLI CALI JUAN CARLOS,NO
24,CAYAMBE TIPAN FAUSTO HERIBERTO,NO
25,CEDEÑO ZAMBRANO JOHANNA ELIZABETH,NO
26,CHAVEZ CANALES HOLGER EZEQUIEL,NO
27,DELGADO GUTIERREZ ALEXANDRA ISABEL,NO
28,CORDOVA ENCALADA EDGAR EDUARDO,NO
30,DE LA CRUZ BERNARDO HERMAN ULISES,NO
31,DE LA CRUZ GASPAR ADRIANA MIOSOTI,NO
32,PIÑAN CAJAS MARIA ALEGRIA,NO
33,FAJARDO MOSQUERA LETTY VANESSA,NO
34,FALCONI LOQUI EVELYN PAMELA,NO
36,DE LA TORRE RAMIREZ PABLO ANTONIO,NO
37,LARREA VITERI LIDICE VANESSA,NO
38,GARZON RICAURTE WILLIAM ANTONIO,NO
39,MACAS JOSE LUIS,NO
40,GONZALEZ SERRANO MIRYAM CATARINA,NO
41,GUAMAN CASTRO ALEX FRANCISCO,NO
42,GUAMANGATE ANTE LUIS GILBERTO,NO
44,TORRES PINEDA CLINTON ELIUD,NO
45,RODAS MARCA CARLOS EDUARDO,NO
46,GUTIERREZ MOSCOSO MARIA EUGENIA,NO
48,ISSA WAGNER NICOLAS JOSE,NO
49,CARRILLO CRESPO HUGO FERNANDO,NO
50,JUEZ JUEZ OMAR JUSEPH,NO
51,BAZURTO ROLDAN NANCIS CELESTE,NO
52,BUENDIA HERDOIZA MARIA SOLEDAD,NO
53,JAIGUA ALVARADO CELIA MARIA,NO
54,LEDESMA ZAMORA OSCAR ALFONSO,NO
55,AGUIÑAGA VALLEJO PAOLA MARCELA,NO
57,TOBAR NUÑEZ RAUL IGNACIO,NO
58,LUCERO SISA RAFAEL,NO
59,ALVARADO CARRION ROSANA,NO
60,OCLES PADILLA ALEXANDRA,NO
61,PABON CARANQUI PAOLA VERENICE,NO
62,PADRON SAETEROS GLADYS PAULINA,NO
63,BRITO MENDOZA MONICA CRISTINA,NO
64,PEÑA CARRASCO DIANA LUCIA,NO
65,PEÑA PACHECO XIMENA DEL ROCIO,NO
66,PEÑAFIEL MONTESDEOCA JUANA MARISOL,NO
67,PONCE LEON XIMENA MERCEDES,NO
69,FARFAN APONTE RICHARD WILSON,NO
70,RIVERA LOPEZ JOSE GABRIEL,NO
73,REINOSO LESCANO MARIA ELIZABETH,NO
75,ARIAS FERNANDEZ VERONICA ELIZABETH,NO
76,RODRIGUEZ DELGADO MARIA VERONICA,NO
78,SUBIA BARREIRO BOLIVAR STALIN,NO
84,SANCHEZ ORDOÑEZ MONTGOMERY LUIS,NO
85,MOYA DUQUE HERMAN ANIBAL,NO
86,ALEMAN MARMOL MONICA ROCIO,NO
94,CAJAS ARCOS PAOLA DE LOS ANGELES,NO
95,IÑIGUEZ APOLO LENIN MAURICIO,NO
96,MEJIA PLUAS NILDA CECIBEL,NO
97,VASCONEZ ARTEAGA ANNY MARLLELY,NO
98,VELA CAIZAPANTA ANGEL RAMIRO,NO
106,VELA CHERONI MARIA SOLEDAD,NO
107,TUPIZA OBANDO CARLOS ROGELIO,NO
108,VELASCO ENRIQUEZ CARLOS ALBERTO,NO
109,VELIZ BRIONES JOSE FELIX,NO
121,ALEJANDRO MEDINA CRISTINA SORAYA,NO
122,VINTIMILLA JARRIN DIEGO ARMANDO,NO
126,ZAMBRANO CASTRO NORALMA ELIZABETH,NO
127,ZAMBRANO CHACHA ALBERTO ALEXANDER,NO
43,GUDIÑO MENA ZOBEIDA GUISELA,ABSTENCION
81,MATIAS APOLINARIO RITA AZUCENA,ABSTENCION
