asambleista,curul,voto
ARIAS RAMÍREZ ALBERTO JESÚS,5,AUSENTE
ARREGUI RUEDA MARCIA CECILIA,6,AUSENTE
ARTEAGA MUÑOZ KARINA CECILIA,7,AUSENTE
MARQUEZ LOPEZ JOSE LENIN,8,AUSENTE
BERGMANN REYNA CARLOS ALBERTO,9,AUSENTE
CADENA VÉLEZ KARLA GABRIELA,14,AUSENTE
CARRIÓN CEVALLOS MARÍA JOSÉ,18,AUSENTE
CHÁVEZ BAJAÑA KHARLA DEL ROCÍO,23,AUSENTE
CUESTA RÍOS LIUBA ELISA,25,AUSENTE
MELO GARZÓN ESTEBAN ANDRÉS,41,AUSENTE
MENDOZA ARÉVALO DANIEL ISAAC,42,AUSENTE
PEÑA PACHECO XIMENA DEL ROCÍO,48,AUSENTE
QUIJIJE DELGADO LUIS RAFAEL,52,AUSENTE
YAGUANA ECHEVERRÍA ANDREA ALEXANDRA,59,AUSENTE
VERA RODRÍGUEZ CARLOS ALFREDO,65,AUSENTE
LOOR ALCÍVAR LEXI LIDUVINA,70,AUSENTE
BURBANO MONTENEGRO FÉLIX FERNANDO,75,AUSENTE
AZUERO RODAS ELISEO ALEXIS,77,AUSENTE
KRONFLE KOZHAYA HENRY FABIÁN,88,AUSENTE
CRUZ PROAÑO LUDOVICO ISRAEL,91,AUSENTE
DONOSO CHIRIBOGA PATRICIO,101,AUSENTE
GÓMEZ ALCÍVAR ROBERTO ANDRÉS,105,AUSENTE
DUCHI GUAMÁN MARÍA ENCARNACIÓN,108,AUSENTE
SALTOS MOREIRA DIANA GABRIELA,115,AUSENTE
PACHALA POMA LUIS ALBERTO,120,AUSENTE
CUESTA CONCARI MARÍA MERCEDES,122,AUSENTE
PEÑAFIEL IZQUIERDO EDDY COLÓN,123,AUSENTE
CEDEÑO LOOR LENIN PAÚL,135,AUSENTE
AGUIÑAGA VALLEJO PAOLA MARCELA,1,SI
JUCA SALAZAR MERCEDES DEL ROCÍO,2,SI
CEVALLOS GUEVARA LESLIE MARCELA,3,SI
ARIAS FERNÁNDEZ VERÓNICA ELIZABETH,4,SI
BONILLA SALCEDO VIVIANA,10,SI
BUENDÍA HERDOÍZA MARÍA SOLEDAD,11,SI
SERRANO VALLEJO JORGE ERNESTO,13,SI
CALLE VERZOZI HERMUY,15,SI
CÁRDENAS ESPINOZA JUAN JORGE,17,SI
CHALÁ CRUZ JOSÉ FRANKLIN,22,SI
CUESTA SANTANA ESTHER ADELINA,26,SI
DURÁN AGUILAR LILIANA ELIZABETH,28,SI
ALEAGA SANTOS RONNY XAVIER,29,SI
CABEZAS CASTILLO JANETH PAOLA,30,SI
GARCÍA GAIBOR CARMEN MERCEDES,32,SI
GARCÍA POZO DIEGO OSWALDO,33,SI
GUEVARA VILLACRÉS VERÓNICA MARGARITA,36,SI
HOLGUÍN NARANJO MARCELA PRISCILA,37,SI
LLORET VALDIVIESO JUAN CRISTÓBAL,39,SI
MUÑOZ LÓPEZ CHRISTIAN PABEL,43,SI
NARANJO ALVARADO PRISCILA AMAPOLA,44,SI
POMA HERRERA YOFRE MARTÍN,50,SI
PROAÑO CIFUENTES ROBERTH MAURICIO,51,SI
RIVADENEIRA BURBANO GABRIELA ALEJANDRA,54,SI
RIVADENEIRA BUSTOS CARMEN MERCEDES,55,SI
SALGADO ANDRADE SILVIA BETZABETH,57,SI
SAMANIEGO MAIGUA FRANKLIN OMAR,58,SI
ALEMÁN MARMOL MÓNICA ROCÍO,60,SI
SOLIZ CARRIÓN DORIS JOSEFINA,61,SI
VALLE PINARGOTE BAIRON LEONARDO,62,SI
VELIN CORTÉS JUAN PABLO,63,SI
VERA FLORES WENDY VANESSA,64,SI
VILLALVA MIRANDA LIRA DE LA PAZ,66,SI
VITERI GUALINGA CARLOS ELOY,67,SI
GUAMBA DÍAZ NANCY JEANNETH,69,SI
ANDRADE MUÑOZ WILMA PIEDAD,71,SI
ZAMBRANO ALCÍVAR MAGDA XIOMARA,72,SI
AUQUILLA ORTEGA RAÚL VICENTE,73,SI
CUCALÓN CAMACHO HENRY EDUARDO,78,SI
SERRANO VITERI MERCEDES MARITZA,79,SI
CALLEJAS BARONA FERNANDO,80,SI
CAMPAIN BRAMBILLA RINA ASUNCIÓN,81,SI
CAMPOVERDE ROBLES EMILIO ABSALÓN,82,SI
CARRIÓN MORENO CÉSAR ATAULFO,83,SI
SINMALEZA SÁNCHEZ ÁNGEL RUPERTO,85,SI
YANDÚN POZO CÁSTULO RENÉ,86,SI
UGARTE HENRÍQUEZ JOSÉ FERNANDO,87,SI
CASTANIER JARAMILLO XAVIER HOMERO,89,SI
SARZOSA BENAVIDES JUAN CARLOS,92,SI
ZAMBRANO VALLE EDUARDO MAURICIO,94,SI
CADENA HUERTAS FRANCISCO JAVIER,95,SI
PEÑA ONTANEDA ELIO GERMÁN,96,SI
CAMPOVERDE GONZÁLEZ RAÚL FREDDY BOLÍVAR,97,SI
"PASSAILAIGUE MANOSALVAS DALLYANAMARIANELA",98,SI
OLLAGUE VALAREZO ZOILA PIEDAD,99,SI
GENDE CALAZACÓN ANGEL MESÍAS,104,SI
CEDEÑO ZAMBRANO FELISITA MONCERRATE,106,SI
ROHON HERVAS CÉSAR EDUARDO,110,SI
TAIANO BASANTE VICENTE GIOVANNY,111,SI
TERÁN SALCEDO RAMÓN FORTUNATO,112,SI
TORRES COBO LUIS ESTEBAN,113,SI
MONTAÑO VALENCIA MAE,117,SI
MORENO GUERRERO HENRY FREDY,118,SI
TELLO BENALCÁZAR RAÚL ESTUPIÑAN,121,SI
PUANCHIR PAYASHÑA TITO PEDRO,124,SI
ALARCÓN GUILLÍN FREDY OSCAR,125,SI
CALDERÓN JARAMILLO ALDRIN YUBER,127,SI
MARÍN LAVAYEN DENNIS GUSTAVO,128,SI
ESTUPIÑÁN ORTIZ BORIS EFRÉN,129,SI
PAREDES TORRES WASHINGTON ARTURO,131,SI
SIMBAÑA VILLARREAL ABDÓN MARCELO,133,SI
SUQUILANDA VALDIVIESO BYRON VINICIO,134,SI
TERÁN SARZOSA SEGUNDO FAUSTO,19,NO
BUSTAMANTE MONTEROS RUBÉN ALEJANDRO,12,ABSTENCION
CAMBALA MONTECE CARLOS ALBERTO,16,ABSTENCION
CEDEÑO ZAMBRANO JOHANNA ELIZABETH,20,ABSTENCION
CERDA MIRANDA GABRIELA PAMELA,21,ABSTENCION
COROZO AYOVÍ JORGE WILBER,24,ABSTENCION
DOUMET CHEDRAUI MICHEL ANDRÉS,27,ABSTENCION
FLOR GIL BRENDA AZUCENA,31,ABSTENCION
GARZÓN RICAURTE WILLIAM ANTONIO,34,ABSTENCION
GAVILÁNEZ CAMACHO FAFO HOLGUÍN,35,ABSTENCION
LITARDO CAICEDO CÉSAR ERNESTO,38,ABSTENCION
MARÍN AGUIRRE ANA BELÉN,40,ABSTENCION
OCHOA MORANTE MANUEL ALFREDO,45,ABSTENCION
ORELLANA ROMÁN ROSA GINA,46,ABSTENCION
BUSTAMANTE GARCÍA JUAN FRANCISCO,47,ABSTENCION
PLAZA CASTILLO LENIN,49,ABSTENCION
QUIÑONEZ OCAMPO JULIO CÉSAR,53,ABSTENCION
SALAZAR CEDEÑO GUADALUPE DOLORES,56,ABSTENCION
YAR ARAUJO JUAN CARLOS,68,ABSTENCION
ASTUDILLO LOOR LINA GLORIA,74,ABSTENCION
ZAMBRANO CASTRO NORALMA ELIZABETH,76,ABSTENCION
ZAMBRANO CHACHA ALBERTO ALEXANDER,84,ABSTENCION
LÓPEZ GÓMEZ DE LA TORRE MARÍA CRISTINA,90,ABSTENCION
CUESTA ORELLANA MARÍA DE LOURDES,93,ABSTENCION
CURICHUMBI YUPANQUI PEDRO,100,ABSTENCION
FLORES VÁSQUEZ FERNANDO PATRICIO,102,ABSTENCION
VERDEZOTO REINOSO ROSA ISABEL,103,ABSTENCION
CANDELL SOTO JAIME ENRIQUE JIMMY,107,ABSTENCION
OLIVO PALLO JAIME FERNANDO,109,ABSTENCION
ALVAREZ TOBAR RODRIGO CÉSAR,114,ABSTENCION
VERA CALDERÓN SILVIA LORENA,116,ABSTENCION
MUÑOZ ALARCÓN HÉCTOR PATRICIO,119,ABSTENCION
SOLORZANO SARRIA CESAR FAUSTO,126,ABSTENCION
PALACIOS MUÑOZ JUAN SEBASTIÁN,130,ABSTENCION
ARISTEGUIETA LOGROÑO MIRTHA STEPHANIE,132,ABSTENCION
VILLAMAR JÁCOME PEDRO FABRICIO,136,ABSTENCION
YÉPEZ MARTÍNEZ HÉCTOR JOSÉ,137,ABSTENCION
