voto,curul,asambleista
AUSENTE,8,BENAVIDES ZAMBRANO ZOILA TERESA
AUSENTE,13,CABEZAS GUERRERO ELIZABETH ENRIQUETA
AUSENTE,14,CADENA VÉLEZ KARLA GABRIELA
AUSENTE,21,CERDA MIRANDA GABRIELA PAMELA
AUSENTE,22,CHALÁ CRUZ JOSÉ FRANKLIN
AUSENTE,25,CUESTA RÍOS LIUBA ELISA
AUSENTE,26,CUESTA SANTANA ESTHER ADELINA
AUSENTE,31,FLOR GIL BRENDA AZUCENA
AUSENTE,40,MARÍN AGUIRRE ANA BELÉN
AUSENTE,41,MELO GARZÓN ESTEBAN ANDRÉS
AUSENTE,42,MENDOZA ARÉVALO DANIEL ISAAC
AUSENTE,44,NARANJO ALVARADO PRISCILA AMAPOLA
AUSENTE,54,RIVADENEIRA BURBANO GABRIELA ALEJANDRA
AUSENTE,58,SAMANIEGO MAIGUA FRANKLIN OMAR
AUSENTE,59,YAGUANA ECHEVERRÍA ANDREA ALEXANDRA
AUSENTE,61,SOLIZ CARRIÓN DORIS JOSEFINA
AUSENTE,63,VELIN CORTÉS JUAN PABLO
AUSENTE,64,VERA FLORES WENDY VANESSA
AUSENTE,68,YAR ARAUJO JUAN CARLOS
AUSENTE,71,ANDRADE MUÑOZ WILMA PIEDAD
AUSENTE,81,CAMPAIN BRAMBILLA RINA ASUNCIÓN
AUSENTE,86,YANDÚN POZO CÁSTULO RENÉ
AUSENTE,88,KRONFLE KOZHAYA HENRY FABIÁN
AUSENTE,89,CASTANIER JARAMILLO XAVIER HOMERO
AUSENTE,90,CELI SANTOS GUILLERMO ALEJANDRO
AUSENTE,95,CADENA HUERTAS FRANCISCO JAVIER
AUSENTE,97,CAMPOVERDE GONZÁLEZ RAÚL FREDDY BOLÍVAR
AUSENTE,101,DONOSO CHIRIBOGA PATRICIO
AUSENTE,102,FLORES VÁSQUEZ FERNANDO PATRICIO
AUSENTE,103,GALARZA AÑAZCO ANA MERCEDES
AUSENTE,105,GÓMEZ ALCÍVAR ROBERTO ANDRÉS
AUSENTE,112,TERÁN SALCEDO RAMÓN FORTUNATO
AUSENTE,122,CUESTA CONCARI MARÍA MERCEDES
AUSENTE,127,ALMEYDA JALIL VICENTE FERNANDO
AUSENTE,129,ESTUPIÑÁN ORTIZ BORIS EFRÉN
AUSENTE,131,PAREDES TORRES WASHINGTON ARTURO
AUSENTE,133,SIMBAÑA VILLARREAL ABDÓN MARCELO
AUSENTE,135,VERA MENDOZA TANLLY JANELA
AUSENTE,136,VILLAMAR JÁCOME PEDRO FABRICIO
SI,1,AGUIÑAGA VALLEJO PAOLA MARCELA
SI,4,ARIAS FERNÁNDEZ VERÓNICA ELIZABETH
SI,9,BERGMANN REYNA CARLOS ALBERTO
SI,10,BONILLA SALCEDO VIVIANA
SI,11,BUENDÍA HERDOÍZA MARÍA SOLEDAD
SI,15,CALLE VERZOZI HERMUY
SI,17,CÁRDENAS ESPINOZA JUAN JORGE
SI,28,DURÁN AGUILAR LILIANA ELIZABETH
SI,29,ALEAGA SANTOS RONNY XAVIER
SI,30,ESPINOSA ANDRADE AUGUSTO XAVIER
SI,32,GARCÍA GAIBOR CARMEN MERCEDES
SI,33,GARCÍA POZO DIEGO OSWALDO
SI,36,GUEVARA VILLACRÉS VERÓNICA MARGARITA
SI,37,HOLGUÍN NARANJO MARCELA PRISCILA
SI,39,LLORET VALDIVIESO JUAN CRISTÓBAL
SI,43,MUÑOZ LÓPEZ CHRISTIAN PABEL
SI,50,POMA HERRERA YOFRE MARTÍN
SI,51,PROAÑO CIFUENTES ROBERTH MAURICIO
SI,55,RIVADENEIRA BUSTOS CARMEN MERCEDES
SI,60,ALEMÁN MARMOL MÓNICA ROCÍO
SI,62,VALLE PINARGOTE BAIRON LEONARDO
SI,66,VILLALVA MIRANDA LIRA DE LA PAZ
SI,67,VITERI GUALINGA CARLOS ELOY
SI,69,GUAMBA DÍAZ NANCY JEANNETH
SI,70,LOOR ALCÍVAR LEXI LIDUVINA
SI,77,AZUERO RODAS ELISEO ALEXIS
SI,85,SINMALEZA SÁNCHEZ ÁNGEL RUPERTO
SI,91,CRUZ PROAÑO LUDOVICO ISRAEL
SI,94,ZAMBRANO VALLE EDUARDO MAURICIO
SI,96,SUQUILANDA LIMA CARMEN MARGARITA
SI,100,CURICHUMBI YUPANQUI PEDRO
SI,104,GENDE CALAZACÓN ANGEL MESÍAS
SI,106,CEDEÑO ZAMBRANO FELISITA MONCERRATE
SI,107,CANDELL SOTO JAIME ENRIQUE JIMMY
SI,108,DUCHI GUAMÁN MARÍA ENCARNACIÓN
SI,109,OLIVO PALLO JAIME FERNANDO
SI,115,CARBO AGUIRRE JONATHAN ALEXI
SI,116,VERA CALDERÓN SILVIA LORENA
SI,117,MONTAÑO VALENCIA MAE
SI,118,VARGAS SÁNCHEZ GRETTY LEILA
SI,120,PACHALA POMA LUIS ALBERTO
SI,121,TELLO BENALCÁZAR RAÚL ESTUPIÑAN
SI,123,PEÑAFIEL IZQUIERDO EDDY COLÓN
SI,124,PUANCHIR PAYASHÑA TITO PEDRO
SI,125,ALARCÓN GUILLÍN FREDY OSCAR
SI,126,SOLORZANO SARRIA CESAR FAUSTO
SI,132,ROMERO LOAYZA FRANCO SEGUNDO
SI,134,SUQUILANDA VALDIVIESO BYRON VINICIO
ABSTENCION,2,ALBORNOZ VINTIMILLA CLAUDIO ESTEBAN
ABSTENCION,3,SERRANO SALGADO JOSÉ RICARDO
ABSTENCION,5,ARIAS RAMÍREZ ALBERTO JESÚS
ABSTENCION,6,ARREGUI RUEDA MARCIA CECILIA
ABSTENCION,7,ARTEAGA MUÑOZ KARINA CECILIA
ABSTENCION,12,BUSTAMANTE MONTEROS RUBÉN ALEJANDRO
ABSTENCION,16,CAMBALA MONTECE CARLOS ALBERTO
ABSTENCION,18,CARRIÓN CEVALLOS MARÍA JOSÉ
ABSTENCION,19,TERAN SARZOSA SEGUNDO FAUSTO
ABSTENCION,20,TENORIO VALENCIA CALLETANO
ABSTENCION,23,CHÁVEZ BAJAÑA KHARLA DEL ROCÍO
ABSTENCION,24,COROZO AYOVÍ JORGE WILBER
ABSTENCION,27,DOUMET CHEDRAUI MICHEL ANDRÉS
ABSTENCION,34,GARZÓN RICAURTE WILLIAM ANTONIO
ABSTENCION,35,GAVILÁNEZ CAMACHO FAFO HOLGUÍN
ABSTENCION,38,LITARDO CAICEDO CÉSAR ERNESTO
ABSTENCION,45,OCHOA MORANTE MANUEL ALFREDO
ABSTENCION,46,ORELLANA ROMÁN ROSA GINA
ABSTENCION,47,BUSTAMANTE GARCÍA JUAN FRANCISCO
ABSTENCION,48,PEÑA PACHECO XIMENA DEL ROCÍO
ABSTENCION,49,PLAZA CASTILLO LENIN
ABSTENCION,52,QUIJIJE DELGADO LUIS RAFAEL
ABSTENCION,53,QUIÑONEZ OCAMPO JULIO CÉSAR
ABSTENCION,56,SALAZAR CEDEÑO GUADALUPE DOLORES
ABSTENCION,57,SALGADO ANDRADE SILVIA BETZABETH
ABSTENCION,65,VERA RODRÍGUEZ CARLOS ALFREDO
ABSTENCION,72,ZAMBRANO ALCÍVAR MAGDA XIOMARA
ABSTENCION,73,AUQUILLA ORTEGA RAÚL VICENTE
ABSTENCION,74,ASTUDILLO LOOR LINA GLORIA
ABSTENCION,75,BURBANO MONTENEGRO FÉLIX FERNANDO
ABSTENCION,76,ZAMBRANO CASTRO NORALMA ELIZABETH
ABSTENCION,78,CUCALÓN CAMACHO HENRY EDUARDO
ABSTENCION,79,SERRANO VITERI MERCEDES MARITZA
ABSTENCION,80,CALLEJAS BARONA FERNANDO
ABSTENCION,82,CAMPOVERDE ROBLES EMILIO ABSALÓN
ABSTENCION,83,CARRIÓN MORENO CÉSAR ATAULFO
ABSTENCION,84,ZAMBRANO CHACHA ALBERTO ALEXANDER
ABSTENCION,87,HENRÍQUEZ JAIME PATRICIA IVONNE
ABSTENCION,92,CRUZ VACA JEANNINE DEL CISNE
ABSTENCION,93,MEDINA RAMÍREZ JOSÉ ALFREDO
ABSTENCION,98,CALDERÓN CHANCAY DORIS DAISY
ABSTENCION,99,LLANES SUAREZ HENRY MANUEL
ABSTENCION,110,ROHON HERVAS CÉSAR EDUARDO
ABSTENCION,111,TACLE GARCÍA SAMIA
ABSTENCION,113,TORRES COBO LUIS ESTEBAN
ABSTENCION,114,LARREÁTEGUI FABARA MARÍA GABRIELA
ABSTENCION,119,MUÑOZ ALARCÓN HÉCTOR PATRICIO
ABSTENCION,128,MARÍN LAVAYEN DENNIS GUSTAVO
ABSTENCION,130,PALACIOS MUÑOZ JUAN SEBASTIÁN
ABSTENCION,137,YÉPEZ MARTÍNEZ HÉCTOR JOSÉ
