35,asambleista,curul,total ausente,voto
,AGUIÑAGA VALLEJO PAOLA MARCELA,1,,AUSENTE
,CEVALLOS GUEVARA LESLIE MARCELA,3,,AUSENTE
,MARQUEZ LOPEZ JOSE LENIN,8,,AUSENTE
,MORENO INTRIAGO MARIA LUISA,9,,AUSENTE
,BONILLA SALCEDO VIVIANA,10,,AUSENTE
,BUENDÍA HERDOÍZA MARÍA SOLEDAD,11,,AUSENTE
,DELGADO ORLANDO CÉSAR ANTONIO,14,,AUSENTE
,CALLE VERZOZI HERMUY,15,,AUSENTE
,DURÁN AGUILAR LILIANA ELIZABETH,28,,AUSENTE
,FLOR GIL BRENDA AZUCENA,31,,AUSENTE
,MARÍN AGUIRRE ANA BELÉN,40,,AUSENTE
,PALACIOS VELÁSQUEZ SONIA LUCRECIA,47,,AUSENTE
,PROAÑO CIFUENTES ROBERTH MAURICIO,51,,AUSENTE
,RODRÍGUEZ CEDEÑO ROSA ELENA,53,,AUSENTE
,RIVADENEIRA BURBANO GABRIELA ALEJANDRA,54,,AUSENTE
,RIVADENEIRA BUSTOS CARMEN MERCEDES,55,,AUSENTE
,SALAZAR CEDEÑO GUADALUPE DOLORES,56,,AUSENTE
,SAMANIEGO MAIGUA FRANKLIN OMAR,58,,AUSENTE
,YAGUANA ECHEVERRÍA ANDREA ALEXANDRA,59,,AUSENTE
,YAR ARAUJO JUAN CARLOS,68,,AUSENTE
,GUAMBA DÍAZ NANCY JEANNETH,69,,AUSENTE
,ZAMBRANO ARTEAGA JOSE RICARDO,70,,AUSENTE
,AUQUILLA ORTEGA RAÚL VICENTE,73,,AUSENTE
,ZAMBRANO CHACHA ALBERTO ALEXANDER,84,,AUSENTE
,JARAMILLO ZURITA PAOLA MICHAEL,88,,AUSENTE
,CRUZ VACA JEANNINE DEL CISNE,92,,AUSENTE
,CURICHUMBI YUPANQUI PEDRO,100,,AUSENTE
,MOLINA CELI KARLA ELIZABETH,105,,AUSENTE
,MACÍAS ORTEGA WENDY ELENA MARISOL,106,,AUSENTE
,TACLE GARCÍA SAMIA,111,,AUSENTE
,CUADRO GASTEZZI DEYSI MARIA,115,,AUSENTE
,VERA CALDERÓN SILVIA LORENA,116,,AUSENTE
,CUESTA CONCARI MARÍA MERCEDES,122,,AUSENTE
,UGARTE GUZMÁN BLANCA ROSANA,127,,AUSENTE
,ROMERO LOAYZA FRANCO SEGUNDO,132,,AUSENTE
,ARIAS FERNÁNDEZ VERÓNICA ELIZABETH,4,,SI
,HIDALGO JARAMILLO EDITH MARLENE,12,,SI
,CÁRDENAS ESPINOZA JUAN JORGE,17,,SI
,TERAN SARZOSA SEGUNDO FAUSTO,19,,SI
,CHALÁ CRUZ JOSÉ FRANKLIN,22,,SI
,CUESTA SANTANA ESTHER ADELINA,26,,SI
,ALEAGA SANTOS RONNY XAVIER,29,,SI
,ESPINOSA ANDRADE AUGUSTO XAVIER,30,,SI
,GARCÍA GAIBOR CARMEN MERCEDES,32,,SI
,GARCÍA POZO DIEGO OSWALDO,33,,SI
,GUEVARA VILLACRÉS VERÓNICA MARGARITA,36,,SI
,HOLGUÍN NARANJO MARCELA PRISCILA,37,,SI
,LLORET VALDIVIESO JUAN CRISTÓBAL,39,,SI
,MELO GARZÓN ESTEBAN ANDRÉS,41,,SI
,MUÑOZ LÓPEZ CHRISTIAN PABEL,43,,SI
,NARANJO ALVARADO PRISCILA AMAPOLA,44,,SI
,POMA HERRERA YOFRE MARTÍN,50,,SI
,MOLINA ONOFA LUIS FERNANDO,60,,SI
,SOLIZ CARRIÓN DORIS JOSEFINA,61,,SI
,VALLE PINARGOTE BAIRON LEONARDO,62,,SI
,VELIN CORTÉS JUAN PABLO,63,,SI
,VERA FLORES WENDY VANESSA,64,,SI
,VILLALVA MIRANDA LIRA DE LA PAZ,66,,SI
,VITERI GUALINGA CARLOS ELOY,67,,SI
,ANDRADE MUÑOZ WILMA PIEDAD,71,,SI
,ASÁN WONSANG JOSÉ FRANCISCO,72,,SI
,BERNAL BERNAL ESTEBAN REMIGIO,74,,SI
,BURBANO MONTENEGRO FÉLIX FERNANDO,75,,SI
,AZUERO RODAS ELISEO ALEXIS,77,,SI
,ORDOÑEZ ZAMBRANO SANDRA DEL ROCÍO,78,,SI
,FALQUEZ BATALLAS PEDRO CARLOS,79,,SI
,CALLEJAS BARONA FERNANDO,80,,SI
,VACA QUIÑONEZ SONIA MARÍA,81,,SI
,CAMPOVERDE ROBLES EMILIO ABSALÓN,82,,SI
,CARRIÓN MORENO CÉSAR ATAULFO,83,,SI
,SINMALEZA SÁNCHEZ ÁNGEL RUPERTO,85,,SI
,YANDÚN POZO CÁSTULO RENÉ,86,,SI
,HENRÍQUEZ JAIME PATRICIA IVONNE,87,,SI
,CASTANIER JARAMILLO XAVIER HOMERO,89,,SI
,CELI SANTOS GUILLERMO ALEJANDRO,90,,SI
,YUNGA NAULA SEGUNDO JULIÁN,91,,SI
,CUESTA ORELLANA MARÍA DE LOURDES,93,,SI
,ZAMBRANO VALLE EDUARDO MAURICIO,94,,SI
,CADENA HUERTAS FRANCISCO JAVIER,95,,SI
,PEÑA ONTANEDA ELIO GERMÁN,96,,SI
,MONTAÑO GUISAMANO MAYRA MIGDONIA,97,,SI
,,98,,SI
,REYES HIDALGO CRISTINA EUGENIA,99,,SI
,DONOSO CHIRIBOGA PATRICIO,101,,SI
,FLORES VÁSQUEZ FERNANDO PATRICIO,102,,SI
,GALARZA AÑAZCO ANA MERCEDES,103,,SI
,GENDE CALAZACÓN ANGEL MESÍAS,104,,SI
,CANDELL SOTO JAIME ENRIQUE JIMMY,107,,SI
,DUCHI GUAMÁN MARÍA ENCARNACIÓN,108,,SI
,OLIVO PALLO JAIME FERNANDO,109,,SI
,ROHON HERVAS CÉSAR EDUARDO,110,,SI
,NUÑEZ MANSSUR LUIS ANTONIO,112,,SI
,TORRES TORRES LUIS FERNANDO,113,,SI
,LARREÁTEGUI FABARA MARÍA GABRIELA,114,,SI
,MONTAÑO VALENCIA MAE,117,,SI
,MORENO GUERRERO HENRY FREDY,118,,SI
,MUÑOZ ALARCÓN HÉCTOR PATRICIO,119,,SI
,PACHALA POMA LUIS ALBERTO,120,,SI
,TELLO BENALCÁZAR RAÚL ESTUPIÑAN,121,,SI
,PEÑAFIEL IZQUIERDO EDDY COLÓN,123,,SI
,PUANCHIR PAYASHÑA TITO PEDRO,124,,SI
,ALARCÓN GUILLÍN FREDY OSCAR,125,,SI
,SOLORZANO SARRIA CESAR FAUSTO,126,,SI
,MARÍN LAVAYEN DENNIS GUSTAVO,128,,SI
,ZAMBRANO ORTIZ MARÍA ROBERTA,129,,SI
,PALACIOS MUÑOZ JUAN SEBASTIÁN,130,,SI
,PAREDES TORRES WASHINGTON ARTURO,131,,SI
,SIMBAÑA VILLARREAL ABDÓN MARCELO,133,,SI
,SUQUILANDA VALDIVIESO BYRON VINICIO,134,,SI
,VERA MENDOZA TANLLY JANELA,135,,SI
,VILLAMAR JÁCOME PEDRO FABRICIO,136,,SI
,YÉPEZ MARTÍNEZ HÉCTOR JOSÉ,137,,SI
,GREFA AVILEZ FLAVIO PATRICIO,21,,BLANCO
,ALBORNOZ VINTIMILLA CLAUDIO ESTEBAN,2,,ABSTENCION
,ARIAS RAMÍREZ ALBERTO JESÚS,5,,ABSTENCION
,SALINAS OCHOA CAMILO AURELIO,6,,ABSTENCION
,ARTEAGA MUÑOZ KARINA CECILIA,7,,ABSTENCION
,CABEZAS GUERRERO ELIZABETH ENRIQUETA,13,,ABSTENCION
,CAMBALA MONTECE CARLOS ALBERTO,16,,ABSTENCION
,CARRIÓN CEVALLOS MARÍA JOSÉ,18,,ABSTENCION
,TENORIO VALENCIA CALLETANO,20,,ABSTENCION
,TORRES TORRES EURO IGNACIO,23,,ABSTENCION
,COROZO AYOVÍ JORGE WILBER,24,,ABSTENCION
,CUESTA RÍOS LIUBA ELISA,25,,ABSTENCION
,DOUMET CHEDRAUI MICHEL ANDRÉS,27,,ABSTENCION
,GARZÓN RICAURTE WILLIAM ANTONIO,34,,ABSTENCION
,FUENTES NARANJO PAULINA DEL CARMEN,35,,ABSTENCION
,LITARDO CAICEDO CÉSAR ERNESTO,38,,ABSTENCION
,MENDOZA ARÉVALO DANIEL ISAAC,42,,ABSTENCION
,ORDOÑEZ JARAMILLO DIANA MARINA,45,,ABSTENCION
,ORELLANA ROMÁN ROSA GINA,46,,ABSTENCION
,PEÑA PACHECO XIMENA DEL ROCÍO,48,,ABSTENCION
,PLAZA CASTILLO LENIN,49,,ABSTENCION
,QUIJIJE DELGADO LUIS RAFAEL,52,,ABSTENCION
,SALGADO ANDRADE SILVIA BETZABETH,57,,ABSTENCION
,VERA RODRÍGUEZ CARLOS ALFREDO,65,,ABSTENCION
,ZAMBRANO CASTRO NORALMA ELIZABETH,76,,ABSTENCION
