voto,curul,asambleista
SI,2,JUCA SALAZAR MERCEDES DEL ROCÍO
SI,3,CEVALLOS GUEVARA LESLIE MARCELA
SI,5,ARIAS RAMÍREZ ALBERTO JESÚS
SI,6,SALINAS OCHOA CAMILO AURELIO
SI,7,ARTEAGA MUÑOZ KARINA CECILIA
SI,8,BENAVIDES ZAMBRANO ZOILA TERESA
SI,9,BERGMANN REYNA CARLOS ALBERTO
SI,10,BONILLA SALCEDO VIVIANA
SI,12,BUSTAMANTE MONTEROS RUBÉN ALEJANDRO
SI,13,CABEZAS GUERRERO ELIZABETH ENRIQUETA
SI,16,CAMBALA MONTECE CARLOS ALBERTO
SI,18,CARRIÓN CEVALLOS MARÍA JOSÉ
SI,20,TENORIO VALENCIA CALLETANO
SI,23,CHÁVEZ BAJAÑA KHARLA DEL ROCÍO
SI,24,COROZO AYOVÍ JORGE WILBER
SI,25,CUESTA RÍOS LIUBA ELISA
SI,31,FLOR GIL BRENDA AZUCENA
SI,34,GARZÓN RICAURTE WILLIAM ANTONIO
SI,35,GAVILÁNEZ CAMACHO FAFO HOLGUÍN
SI,38,LITARDO CAICEDO CÉSAR ERNESTO
SI,42,MENDOZA ARÉVALO DANIEL ISAAC
SI,45,OCHOA MORANTE MANUEL ALFREDO
SI,46,ORELLANA ROMÁN ROSA GINA
SI,47,PALACIOS VELÁSQUEZ SONIA LUCRECIA
SI,48,PEÑA PACHECO XIMENA DEL ROCÍO
SI,49,PLAZA CASTILLO LENIN
SI,52,QUIJIJE DELGADO LUIS RAFAEL
SI,53,QUIÑONEZ OCAMPO JULIO CÉSAR
SI,56,SALAZAR CEDEÑO GUADALUPE DOLORES
SI,57,MONCAYO ESPINOSA JOSÉ FRANCISCO
SI,65,VERA RODRÍGUEZ CARLOS ALFREDO
SI,68,YAR ARAUJO JUAN CARLOS
SI,69,YUNDA MACHADO JORGE HOMERO
SI,71,ANDRADE MUÑOZ WILMA PIEDAD
SI,72,ZAMBRANO ALCÍVAR MAGDA XIOMARA
SI,73,AUQUILLA ORTEGA RAÚL VICENTE
SI,74,BERNAL BERNAL ESTEBAN REMIGIO
SI,75,BURBANO MONTENEGRO FÉLIX FERNANDO
SI,76,ZAMBRANO CASTRO NORALMA ELIZABETH
SI,77,AZUERO RODAS ELISEO ALEXIS
SI,78,CUCALÓN CAMACHO HENRY EDUARDO
SI,79,FALQUEZ BATALLAS PEDRO CARLOS
SI,80,CALLEJAS BARONA FERNANDO
SI,81,CAMPAIN BRAMBILLA RINA ASUNCIÓN
SI,82,CAMPOVERDE ROBLES EMILIO ABSALÓN
SI,83,CARRIÓN MORENO CÉSAR ATAULFO
SI,84,ZAMBRANO CHACHA ALBERTO ALEXANDER
SI,85,SINMALEZA SÁNCHEZ ÁNGEL RUPERTO
SI,86,YANDÚN POZO CÁSTULO RENÉ
SI,87,HENRÍQUEZ JAIME PATRICIA IVONNE
SI,88,OLLAGUE VALAREZO ZOILA PIEDAD
SI,89,CASTANIER JARAMILLO XAVIER HOMERO
SI,90,CELI SANTOS GUILLERMO ALEJANDRO
SI,91,CRUZ PROAÑO LUDOVICO ISRAEL
SI,92,CRUZ VACA JEANNINE DEL CISNE
SI,93,CUESTA ORELLANA MARÍA DE LOURDES
SI,95,CADENA HUERTAS FRANCISCO JAVIER
SI,97,MONTAÑO GUISAMANO MAYRA MIGDONIA
SI,98,MUENTES ALVARADO PABLO ANDRES
SI,99,REYES HIDALGO CRISTINA EUGENIA
SI,100,CURICHUMBI YUPANQUI PEDRO
SI,101,DONOSO CHIRIBOGA PATRICIO
SI,102,FLORES VÁSQUEZ FERNANDO PATRICIO
SI,103,GALARZA AÑAZCO ANA MERCEDES
SI,104,GENDE CALAZACÓN ANGEL MESÍAS
SI,105,GÓMEZ ALCÍVAR ROBERTO ANDRÉS
SI,106,ZAMBRANO VERA MARIANO
SI,107,CANDELL SOTO JAIME ENRIQUE JIMMY
SI,109,OLIVO PALLO JAIME FERNANDO
SI,110,ROHON HERVAS CÉSAR EDUARDO
SI,111,TAIANO BASANTE VICENTE GIOVANNY
SI,112,TERÁN SALCEDO RAMÓN FORTUNATO
SI,113,TORRES TORRES LUIS FERNANDO
SI,114,LARREÁTEGUI FABARA MARÍA GABRIELA
SI,115,MENDOZA PALMA JOFFRE PATRICIO
SI,116,MINCHALA MURILLO RÓMULO MARCELO
SI,117,MONTAÑO VALENCIA MAE
SI,119,MUÑOZ ALARCÓN HÉCTOR PATRICIO
SI,120,PACHALA POMA LUIS ALBERTO
SI,122,CUESTA CONCARI MARÍA MERCEDES
SI,123,PEÑAFIEL IZQUIERDO EDDY COLÓN
SI,124,PUANCHIR PAYASHÑA TITO PEDRO
SI,125,ALARCÓN GUILLÍN FREDY OSCAR
SI,126,SOLORZANO SARRIA CESAR FAUSTO
SI,127,UGARTE GUZMÁN BLANCA ROSANA
SI,128,VINTIMILLA MOSCOSO PAOLA
SI,129,ZAMBRANO ORTIZ MARÍA ROBERTA
SI,130,PALACIOS MUÑOZ JUAN SEBASTIÁN
SI,132,ROMERO LOAYZA FRANCO SEGUNDO
SI,133,SIMBAÑA VILLARREAL ABDÓN MARCELO
SI,134,SUQUILANDA VALDIVIESO BYRON VINICIO
SI,135,VERA MENDOZA TANLLY JANELA
SI,136,VILLAMAR JÁCOME PEDRO FABRICIO
SI,137,YÉPEZ MARTÍNEZ HÉCTOR JOSÉ
NO,4,ARIAS FERNÁNDEZ VERÓNICA ELIZABETH
NO,11,BUENDÍA HERDOÍZA MARÍA SOLEDAD
NO,15,CALLE VERZOZI HERMUY
NO,17,CÁRDENAS ESPINOZA JUAN JORGE
NO,22,CHALÁ CRUZ JOSÉ FRANKLIN
NO,26,CUESTA SANTANA ESTHER ADELINA
NO,28,DURÁN AGUILAR LILIANA ELIZABETH
NO,30,ESPINOSA ANDRADE AUGUSTO XAVIER
NO,32,GARCÍA GAIBOR CARMEN MERCEDES
NO,33,GARCÍA POZO DIEGO OSWALDO
NO,36,GUEVARA VILLACRÉS VERÓNICA MARGARITA
NO,37,HOLGUÍN NARANJO MARCELA PRISCILA
NO,39,LLORET VALDIVIESO JUAN CRISTÓBAL
NO,41,MELO GARZÓN ESTEBAN ANDRÉS
NO,43,MUÑOZ LÓPEZ CHRISTIAN PABEL
NO,44,NARANJO ALVARADO PRISCILA AMAPOLA
NO,50,POMA HERRERA YOFRE MARTÍN
NO,51,PROAÑO CIFUENTES ROBERTH MAURICIO
NO,54,RIVADENEIRA BURBANO GABRIELA ALEJANDRA
NO,55,RIVADENEIRA BUSTOS CARMEN MERCEDES
NO,58,SAMANIEGO MAIGUA FRANKLIN OMAR
NO,60,MOLINA ONOFA LUIS FERNANDO
NO,61,SOLIZ CARRIÓN DORIS JOSEFINA
NO,62,TENEZACA LOPEZ MABEL MICHELL
NO,66,VILLALVA MIRANDA LIRA DE LA PAZ
NO,67,VITERI GUALINGA CARLOS ELOY
NO,94,ZAMBRANO VALLE EDUARDO MAURICIO
ABSTENCION,19,TERAN SARZOSA SEGUNDO FAUSTO
ABSTENCION,21,GREFA AVILEZ FLAVIO PATRICIO
ABSTENCION,63,VELIN CORTÉS JUAN PABLO
ABSTENCION,96,PEÑA ONTANEDA ELIO GERMÁN
ABSTENCION,108,DUCHI GUAMÁN MARÍA ENCARNACIÓN
ABSTENCION,118,MORENO GUERRERO HENRY FREDY
ABSTENCION,121,TELLO BENALCÁZAR RAÚL ESTUPIÑAN
