asambleista,curul,voto
AGUILAR PLACIDO ARMANDO,3,AUSENTE
MACHUCA MOSCOSO LINDA MARICELA,4,AUSENTE
ARREGUI RUEDA MARCIA CECILIA,12,AUSENTE
JAIGUA ALVARADO CELIA MARIA,53,AUSENTE
AGUIÑAGA VALLEJO PAOLA MARCELA,55,AUSENTE
ALMEIDA MANOSALVAS MARIA DEL PILAR,57,AUSENTE
ALVARADO CARRION ROSANA,59,AUSENTE
SANANGO AUCACAMA LUIS LORENZO,62,AUSENTE
RIVERO DOGUER ANGEL ARMANDO,71,AUSENTE
MEDINA MERA VICTOR CLEMENTE,72,AUSENTE
QUEZADA CARRION ANDREA MARIBEL,90,AUSENTE
PACHECO ORDOÑEZ BAYRON EDUARDO,99,AUSENTE
SOLORZANO MANUEL ANTONIO,106,AUSENTE
SOLORZANO SARRIA CESAR FAUSTO,114,AUSENTE
MEDINA TAMBACO EMILY JESUS,119,AUSENTE
ZAMBRANO CABANILLA EDUARDO ALFONSO,125,AUSENTE
REYES HIDALGO CRISTINA EUGENIA,132,AUSENTE
ABAD VELEZ RAUL,1,SI
MORALES POZO LENIN ALBERTO,2,SI
ORTIZ LARA LEONARDO,5,SI
ALBAN TORRES MARIANA DEL ROCIO,6,SI
MONTENEGRO NUÑEZ CHRISTIAN SANTIAGO,7,SI
MUÑOZ VICUÑA MARIANGEL,8,SI
ANDINO REINOSO MAURO EDMUNDO,9,SI
VITERI LOPEZ CHRISTIAN HUMBERTO,10,SI
ARIAS RAMIREZ ALBERTO JESUS,11,SI
BENAVIDES ZAMBRANO ZOILA TERESA,13,SI
BERGMANN REYNA CARLOS ALBERTO,14,SI
BORJA PEREZ GALO,15,SI
RIVADENEIRA BURBANO GABRIELA ALEJANDRA,16,SI
PAREDES BENAVIDES LIDIA VICTORIA,17,SI
CALDERON SALTOS RICHARD OSWALDO,18,SI
CALLE ANDRADE MARIA AUGUSTA,19,SI
CARRILLO BETTY,20,SI
CARRION MARIA JOSE,21,SI
CARVAJAL AGUIRRE MIGUEL ANGEL,22,SI
CASSINELLI CALI JUAN CARLOS,23,SI
CAYAMBE TIPAN FAUSTO HERIBERTO,24,SI
CEDEÑO ZAMBRANO JOHANNA ELIZABETH,25,SI
CHAVEZ CANALES HOLGER EZEQUIEL,26,SI
CHICA AREVALO VINICIO VETHOWEN,27,SI
CORDOVA ENCALADA EDGAR EDUARDO,28,SI
CUESTA RIOS LIUBA ELISA,29,SI
DE LA CRUZ BERNARDO HERMAN ULISES,30,SI
DE LA CRUZ GASPAR ADRIANA MIOSOTI,31,SI
DELGADO CHALA AGUSTIN JAVIER,32,SI
FAJARDO MOSQUERA LETTY VANESSA,33,SI
FALCONI LOQUI EVELYN PAMELA,34,SI
GAGLIARDO LOOR GASTON,35,SI
DE LA TORRE RAMIREZ PABLO ANTONIO,36,SI
LARREA VITERI LIDICE VANESSA,37,SI
GARZON RICAURTE WILLIAM ANTONIO,38,SI
GODOY ANDRADE GINA JAKELINE,39,SI
GONZALEZ SERRANO MIRYAM CATARINA,40,SI
GUAMAN CASTRO ALEX FRANCISCO,41,SI
GUAMANGATE ANTE LUIS GILBERTO,42,SI
JARAMILLO RODRIGUEZ VICTOR HUGO,43,SI
GUEVARA VILLACRES VERONICA MARGARITA,44,SI
GUZMAN OCHOA LILIANA MAURA,45,SI
HERNANDEZ ENRIQUEZ VIRGILIO HUMBERTO,46,SI
MOSQUERA YANEZ ISABEL PIEDAD,47,SI
ISSA WAGNER NICOLAS JOSE,48,SI
CARRILLO CRESPO HUGO FERNANDO,49,SI
JUEZ JUEZ OMAR JUSEPH,50,SI
ORTIZ GASPAR ESTHER FLAVIA,51,SI
BUENDIA HERDOIZA MARIA SOLEDAD,52,SI
LEDESMA ZAMORA OSCAR ALFONSO,54,SI
MELO GARZON ESTEBAN ANDRES,56,SI
MUÑOZ AVENDAÑO ROSA ELVIRA,58,SI
OCLES PADILLA ALEXANDRA,60,SI
CAZA TIPANTA HUGO RENE,61,SI
BRITO MENDOZA MONICA CRISTINA,63,SI
TORRES LARA JOSE EDUARDO,64,SI
PEÑA PACHECO XIMENA DEL ROCIO,65,SI
QUINCHIGUANGO GISELA,66,SI
PONCE LEON XIMENA MERCEDES,67,SI
PROAÑO CIFUENTES ROBERTH MAURICIO,68,SI
FARFAN APONTE RICHARD WILSON,69,SI
RIVERA LOPEZ JOSE GABRIEL,70,SI
REINOSO LESCANO MARIA ELIZABETH,73,SI
ARIAS FERNANDEZ VERONICA ELIZABETH,75,SI
RODRIGUEZ DELGADO MARIA VERONICA,76,SI
SAENZ DE VITERI LAUTARO ENRIQUE,77,SI
SUBIA BARREIRO BOLIVAR STALIN,78,SI
MATIAS APOLINARIO RITA AZUCENA,81,SI
SANCHEZ ORDOÑEZ MONTGOMERY LUIS,84,SI
MOYA DUQUE HERMAN ANIBAL,85,SI
ALEMAN MARMOL MONICA ROCIO,86,SI
SOLANO MORENO ALEX FABIAN,87,SI
TERAN SARZOSA SEGUNDO FAUSTO,94,SI
VALAREZO ORDOÑEZ ROCIO DEL CARMEN,95,SI
MEJIA PLUAS NILDA CECIBEL,96,SI
VASCONEZ ARTEAGA ANNY MARLLELY,97,SI
VELA CAIZAPANTA ANGEL RAMIRO,98,SI
ARGUELLO TROYA BLANCA AZUCENA,107,SI
VELASCO ENRIQUEZ CARLOS ALBERTO,108,SI
VELEZ MARLENE MARGARITA,109,SI
VERDUGA CEDEÑO MARY,110,SI
VICUÑA MUÑOZ MARIA ALEJANDRA,111,SI
VILLACRESES PEÑA OCTAVIO XAVIER ENRIQUE,121,SI
VINTIMILLA JARRIN DIEGO ARMANDO,122,SI
VITERI GUALINGA CARLOS ELOY,123,SI
ZAMBRANO ARTEAGA JOSE RICARDO,124,SI
ZAMBRANO CASTRO NORALMA ELIZABETH,126,SI
OBANDO MORALES SANTA FELICITA,127,SI
SERRANO SEGURA GRACE MARISOL,128,SI
AGUILAR TORRES MANUEL RAMIRO,74,NO
ANDRADE VARELA JUPITER GOZOSO DE LA CRUZ,79,NO
CASTRO AJILA GLADYS LUCIA,80,NO
YANDUN POZO CASTULO RENE,82,NO
ACACHO GONZALEZ PEPE LUIS,83,NO
DIAZ COKA MARIA GABRIELA,88,NO
FIERRO OVIEDO PACO,89,NO
ORELLANA MARQUINEZ MAGALI MARGOT,91,NO
UMAJINGA GUAMAN CESAR,92,NO
TIBAN GUALA LOURDES LICENIA,93,NO
GUTIERREZ BORBUA FAUSTO GILMAR,100,NO
AUQUILLA ORTEGA RAUL VICENTE,101,NO
CHICAIZA TOAPANTA WILSON ALFONSO,102,NO
DONOSO CHIRIBOGA PATRICIO,103,NO
MONCAYO CEVALLOS JOSE RICARDO,104,NO
AGUIRRE RODRIGUEZ FRANCISCO XAVIER,105,NO
POSSO SALGADO LUIS ANTONIO,113,NO
MONTAÑO VALENCIA MAE,115,NO
MORETA PANCHEZ MIGUEL ANGEL,116,NO
PAEZ BENALCAZAR ANDRES TARQUINO,117,NO
SALGADO RIVADENEIRA DIEGO,118,NO
TORRES TORRES LUIS FERNANDO,120,NO
URIBE LOPEZ FANNY ESTHER,129,NO
TAPIA LOMBEYDA LUIS FERNANDO,130,NO
CUCALON CAMACHO HENRY EDUARDO,131,NO
TACLE GALARRAGA MOISES FERNANDO,133,NO
ROMERO LOAYZA FRANCO SEGUNDO,134,NO
TERAN SALCEDO RAMON FORTUNATO,135,NO
VITERI JIMENEZ CYNTHIA,136,NO
KRONFLE GOMEZ MARIA CRISTINA,137,NO
ANDINO ROBALINO ANGELICA MARIA,112,ABSTENCION
