curul,asambleista,voto
4,HAGO CELI FRANCISCO WAIKING,AUSENTE
8,MUÑOZ VICUÑA MARIANGEL,AUSENTE
16,SOLORZANO AVILES FRANCISCO MARCELO,AUSENTE
19,CALLE ANDRADE MARIA AUGUSTA,AUSENTE
21,CARRION MARIA JOSE,AUSENTE
22,CAJAS LARA SUSANA VALERIA,AUSENTE
23,BRAVO RAMIREZ MARIA LORENA,AUSENTE
25,OLAYA LIDER,AUSENTE
31,DE LA CRUZ GASPAR ADRIANA MIOSOTI,AUSENTE
37,MENDOZA DANIEL ISAAC,AUSENTE
39,GODOY ANDRADE GINA JAKELINE,AUSENTE
40,GONZALEZ SERRANO MIRYAM CATARINA,AUSENTE
44,TORRES PINEDA CLINTON ELIUD,AUSENTE
47,MOSQUERA YANEZ ISABEL PIEDAD,AUSENTE
48,ISSA WAGNER NICOLAS JOSE,AUSENTE
63,MACAS JOSE LUIS,AUSENTE
65,ASTUDILLO BANEGAS HERNAN VINICIO,AUSENTE
69,FARFAN APONTE RICHARD WILSON,AUSENTE
72,AGUALSACA GUAMAN JOSE CLEMENTE,AUSENTE
73,REINOSO LESCANO MARIA ELIZABETH,AUSENTE
74,GUZMAN SEGOVIA JOSE FRANCISCO,AUSENTE
75,ARIAS FERNANDEZ VERONICA ELIZABETH,AUSENTE
83,ACACHO GONZALEZ PEPE LUIS,AUSENTE
84,SANCHEZ ORDOÑEZ MONTGOMERY LUIS,AUSENTE
86,MORAN AMALIA,AUSENTE
87,DAHIK ASTUDILLO REYTA GIOMAR,AUSENTE
88,DIAZ COKA MARIA GABRIELA,AUSENTE
100,GUTIERREZ BORBUA FAUSTO GILMAR,AUSENTE
101,LUDEÑA SOTOMAYOR CECILIA DEL CISNE,AUSENTE
114,SOLORZANO SARRIA CESAR FAUSTO,AUSENTE
118,SALGADO RIVADENEIRA DIEGO,AUSENTE
124,ZAMBRANO ARTEAGA JOSE RICARDO,AUSENTE
125,ZAMBRANO CABANILLA EDUARDO ALFONSO,AUSENTE
126,VILLON POZO LUIS MARIANO,AUSENTE
127,ZAMBRANO CHACHA ALBERTO ALEXANDER,AUSENTE
133,TACLE GALARRAGA MOISES FERNANDO,AUSENTE
134,ROMERO LOAYZA FRANCO SEGUNDO,AUSENTE
137,KRONFLE GOMEZ MARIA CRISTINA,AUSENTE
1,ABAD VELEZ RAUL,SI
2,ACERO LANCHIMBA ESTHELA LILIANA,SI
3,AGUILAR PLACIDO ARMANDO,SI
5,AGUIRRE HIDALGO DORA ANADELA,SI
6,ALBAN TORRES MARIANA DEL ROCIO,SI
7,MONTENEGRO NUÑEZ CHRISTIAN SANTIAGO,SI
9,ANDINO REINOSO MAURO EDMUNDO,SI
10,VITERI LOPEZ CHRISTIAN HUMBERTO,SI
11,RIVAS ALAVA ELIANA LISSET,SI
12,ARREGUI RUEDA MARCIA CECILIA,SI
13,BENAVIDES ZAMBRANO ZOILA TERESA,SI
14,MORENO INTRIAGO MARIA LUISA,SI
15,BORJA PEREZ GALO,SI
18,QUIMBIULCO BEDON LORENA GABRIELA,SI
20,CARRILLO BETTY,SI
24,CONSTANTE NIETO MARIANA DE LAS MERCEDES,SI
26,CHAVEZ CANALES HOLGER EZEQUIEL,SI
27,CHICA AREVALO VINICIO VETHOWEN,SI
28,CORDOVA ENCALADA EDGAR EDUARDO,SI
29,MACIAS GARCIA PEDRO ROBERTO GEOVANNY,SI
30,DE LA CRUZ BERNARDO HERMAN ULISES,SI
32,DELGADO CHALA AGUSTIN JAVIER,SI
33,FAJARDO MOSQUERA LETTY VANESSA,SI
34,FALCONI LOQUI EVELYN PAMELA,SI
35,GAGLIARDO LOOR GASTON,SI
36,BAZURTO ROLDAN NANCIS CELESTE,SI
38,CALAZACON AGUAVIL MARIA ALBERTINA,SI
41,GUAMAN CASTRO ALEX FRANCISCO,SI
42,BOMBON LOPEZ BLANCA CECILIA,SI
43,JARAMILLO RODRIGUEZ VICTOR HUGO,SI
45,RODAS MARCA CARLOS EDUARDO,SI
46,HERNANDEZ ENRIQUEZ VIRGILIO HUMBERTO,SI
49,CARRILLO CRESPO HUGO FERNANDO,SI
50,SILVA MALDONADO SOFIA IRENE,SI
51,ORTIZ GASPAR ESTHER FLAVIA,SI
52,REYES MACHUCA EFREN RODRIGO,SI
53,LARRIVA ALVARADO OSCAR OSWALDO,SI
54,LEDESMA ZAMORA OSCAR ALFONSO,SI
55,LOOR CEVALLOS JORGE SEBASTIAN,SI
56,MORENO CHIRIBOGA AMPARO DIANA,SI
57,TOBAR NUÑEZ RAUL IGNACIO,SI
58,MUÑOZ AVENDAÑO ROSA ELVIRA,SI
59,ALVARADO CARRION ROSANA,SI
60,OCLES PADILLA ALEXANDRA,SI
61,CAZA TIPANTA HUGO RENE,SI
62,SANANGO AUCACAMA LUIS LORENZO,SI
64,TORRES LARA JOSE EDUARDO,SI
66,PEÑAFIEL MONTESDEOCA JUANA MARISOL,SI
67,PONCE LEON XIMENA MERCEDES,SI
68,PILLAJO TUQUERES JENNY ELIZABETH,SI
70,JIJON BUENDIA ITALIA LUISA,SI
71,GOMEZ IRMA,SI
76,RODRIGUEZ DELGADO MARIA VERONICA,SI
77,GARCIA PLUAS BEATRIZ CANDELARIA,SI
78,SUBIA BARREIRO BOLIVAR STALIN,SI
79,ANDRADE SOLORZANO LUIS ALBERTO,SI
80,BUSTOS CHILIQUINGA ARCADIO,SI
81,MATIAS APOLINARIO RITA AZUCENA,SI
85,MOYA DUQUE HERMAN ANIBAL,SI
94,TERAN SARZOSA SEGUNDO FAUSTO,SI
95,VALAREZO ORDOÑEZ ROCIO DEL CARMEN,SI
96,MEJIA PLUAS NILDA CECIBEL,SI
97,VASCONEZ ARTEAGA ANNY MARLLELY,SI
98,INTRIAGO MACIAS CARMEN ELENA,SI
99,PACHECO ORDOÑEZ BAYRON EDUARDO,SI
105,AGUIRRE RODRIGUEZ FRANCISCO XAVIER,SI
106,VELA CHERONI MARIA SOLEDAD,SI
107,ARGUELLO TROYA BLANCA AZUCENA,SI
108,VELASCO ENRIQUEZ CARLOS ALBERTO,SI
109,VELIZ BRIONES JOSE FELIX,SI
110,VERDUGA CEDEÑO MARY,SI
111,VICUÑA MUÑOZ MARIA ALEJANDRA,SI
112,VILEMA FREIRE ANGEL RAMIRO,SI
113,SOTO MONTALVO ALICIA MAGDALENA,SI
121,ALEJANDRO MEDINA CRISTINA SORAYA,SI
122,PONCE RUBIO ELVIA AZUCENA,SI
123,COELLO JARAMILLO DIANA ANGELINA,SI
128,SERRANO SEGURA GRACE MARISOL,SI
129,URIBE LOPEZ FANNY ESTHER,SI
17,BUSTAMANTE PONCE FERNANDO XAVIER,ABSTENCION
82,LANDAZURI CORDOVA SANDRA SUSANA,ABSTENCION
89,FIERRO OVIEDO PACO,ABSTENCION
90,GUALAN JAPA MILTON RODRIGO,ABSTENCION
91,ORELLANA MARQUINEZ MAGALI MARGOT,ABSTENCION
92,UMAJINGA GUAMAN CESAR,ABSTENCION
93,TIBAN GUALA LOURDES LICENIA,ABSTENCION
102,CHICAIZA TOAPANTA WILSON ALFONSO,ABSTENCION
103,DONOSO CHIRIBOGA PATRICIO,ABSTENCION
104,MONCAYO CEVALLOS JOSE RICARDO,ABSTENCION
115,MONTAÑO VALENCIA MAE,ABSTENCION
116,MORETA PANCHEZ MIGUEL ANGEL,ABSTENCION
117,LLANES SUAREZ HENRY MANUEL,ABSTENCION
119,CHICA ARTEAGA GUNTARD PAVEL,ABSTENCION
120,TORRES COBO LUIS ESTEBAN,ABSTENCION
130,MERA RODRIGUEZ MARIA PAULINA,ABSTENCION
131,POVEDA SALTOS YENNY MARIA,ABSTENCION
132,REYES HIDALGO CRISTINA EUGENIA,ABSTENCION
135,YELA BURGOS DAYSE INES,ABSTENCION
136,OÑATE LOMBEIDA WIMPER BOLIVAR,ABSTENCION
