curul,asambleista,voto
10,VITERI LOPEZ CHRISTIAN HUMBERTO,AUSENTE
12,ARREGUI RUEDA MARCIA CECILIA,AUSENTE
14,BERGMANN REYNA CARLOS ALBERTO,AUSENTE
15,BORJA PEREZ GALO,AUSENTE
21,CARRION MARIA JOSE,AUSENTE
26,SALAZAR PAUCAR MARGOD ELISAVED,AUSENTE
30,DE LA CRUZ BERNARDO HERMAN ULISES,AUSENTE
31,DE LA CRUZ GASPAR ADRIANA MIOSOTI,AUSENTE
32,DELGADO CHALA AGUSTIN JAVIER,AUSENTE
33,FAJARDO MOSQUERA LETTY VANESSA,AUSENTE
39,GODOY ANDRADE GINA JAKELINE,AUSENTE
40,GONZALEZ SERRANO MIRYAM CATARINA,AUSENTE
41,GUAMAN CASTRO ALEX FRANCISCO,AUSENTE
48,CRUZ SALAZAR FRANCISCA GABRIELA,AUSENTE
50,JUEZ JUEZ OMAR JUSEPH,AUSENTE
53,JAIGUA ALVARADO CELIA MARIA,AUSENTE
55,AGUIÑAGA VALLEJO PAOLA MARCELA,AUSENTE
61,PABON CARANQUI PAOLA VERENICE,AUSENTE
65,PEÑA PACHECO XIMENA DEL ROCIO,AUSENTE
68,PROAÑO CIFUENTES ROBERTH MAURICIO,AUSENTE
69,FARFAN APONTE RICHARD WILSON,AUSENTE
71,RIVERO DOGUER ANGEL ARMANDO,AUSENTE
72,MEDINA MERA VICTOR CLEMENTE,AUSENTE
75,ARIAS FERNANDEZ VERONICA ELIZABETH,AUSENTE
76,RODRIGUEZ DELGADO MARIA VERONICA,AUSENTE
77,SAENZ DE VITERI LAUTARO ENRIQUE,AUSENTE
78,SALAZAR CEDEÑO GUADALUPE DOLORES,AUSENTE
80,BUSTOS CHILIQUINGA ARCADIO,AUSENTE
81,VILLAO PANCHANA RAUL ELIAS,AUSENTE
84,SANCHEZ ORDOÑEZ MONTGOMERY LUIS,AUSENTE
85,MOYA DUQUE HERMAN ANIBAL,AUSENTE
87,SOLANO MORENO ALEX FABIAN,AUSENTE
88,DIAZ COKA MARIA GABRIELA,AUSENTE
93,TIBAN GUALA LOURDES LICENIA,AUSENTE
95,VALAREZO ORDOÑEZ ROCIO DEL CARMEN,AUSENTE
104,MONCAYO CEVALLOS JOSE RICARDO,AUSENTE
105,MOREIRA MACIAS GRACE HOLANDA,AUSENTE
107,ARGUELLO TROYA BLANCA AZUCENA,AUSENTE
109,VELIZ BRIONES JOSE FELIX,AUSENTE
126,VILLON POZO LUIS MARIANO,AUSENTE
127,ZAMBRANO CHACHA ALBERTO ALEXANDER,AUSENTE
128,ZAPATA MANTILLA JOSE LEONIDAS,AUSENTE
129,URIBE LOPEZ FANNY ESTHER,AUSENTE
132,REYES HIDALGO CRISTINA EUGENIA,AUSENTE
54,LEDESMA ZAMORA OSCAR ALFONSO,SI
74,AGUILAR TORRES MANUEL RAMIRO,SI
82,YANDUN POZO CASTULO RENE,SI
83,ACACHO GONZALEZ PEPE LUIS,SI
89,FIERRO OVIEDO PACO,SI
90,GUALAN JAPA MILTON RODRIGO,SI
91,YANZA MANUEL,SI
92,UMAJINGA GUAMAN CESAR,SI
100,ALBAN GALLO MARINA ELIZABETH,SI
101,AUQUILLA ORTEGA RAUL VICENTE,SI
102,CHICAIZA TOAPANTA WILSON ALFONSO,SI
103,DONOSO CHIRIBOGA PATRICIO,SI
114,AGUINDA TAPUY DIANA YOLANDA,SI
115,MONTAÑO VALENCIA MAE,SI
116,MORETA PANCHEZ MIGUEL ANGEL,SI
117,LLANES SUAREZ HENRY MANUEL,SI
118,SALGADO RIVADENEIRA DIEGO,SI
119,CHICA ARTEAGA GUNTARD PAVEL,SI
120,TORRES TORRES LUIS FERNANDO,SI
130,MERA RODRIGUEZ MARIA PAULINA,SI
131,CUCALON CAMACHO HENRY EDUARDO,SI
133,TACLE GALARRAGA MOISES FERNANDO,SI
134,ROMERO LOAYZA FRANCO SEGUNDO,SI
135,YELA BURGOS DAYSE INES,SI
136,VITERI JIMENEZ CYNTHIA,SI
137,KRONFLE GOMEZ MARIA CRISTINA,SI
1,ABAD VELEZ RAUL,NO
2,ACERO LANCHIMBA ESTHELA LILIANA,NO
3,ALMEIDA MANOSALVAS MARIA DEL PILAR,NO
4,MACHUCA MOSCOSO LINDA MARICELA,NO
5,AGUIRRE HIDALGO DORA ANDELA,NO
6,ALBAN TORRES MARIANA DEL ROCIO,NO
7,TORRES CEDEÑO KERLLY ANABEL,NO
8,MUÑOZ VICUÑA MARIANGEL,NO
9,ANDINO REINOSO MAURO EDMUNDO,NO
11,ARIAS RAMIREZ ALBERTO JESUS,NO
13,BENAVIDES ZAMBRANO ZOILA TERESA,NO
16,RIVADENEIRA BURBANO GABRIELA ALEJANDRA,NO
17,PAREDES BENAVIDES LIDIA VICTORIA,NO
18,QUIMBIULCO BEDON LORENA GABRIELA,NO
19,CALLE ANDRADE MARIA AUGUSTA,NO
20,TOALOMBO CHIMBORAZO JOSE SEGUNDO,NO
22,CAJAS LARA SUSANA VALERIA,NO
23,CASSINELLI CALI JUAN CARLOS,NO
24,CAYAMBE TIPAN FAUSTO HERIBERTO,NO
25,OLAYA LIDER,NO
27,CHICA AREVALO VINICIO VETHOWEN,NO
28,DAVILA RAMIREZ BELGICA ELIZABETH,NO
29,CUESTA RIOS LIUBA ELISA,NO
34,FALCONI LOQUI EVELYN PAMELA,NO
35,GAGLIARDO LOOR GASTON,NO
36,GALVAN GRACIA MARIA ESPERANZA,NO
37,LARREA VITERI LIDICE VANESSA,NO
38,GARZON RICAURTE WILLIAM ANTONIO,NO
42,GUAMANGATE ANTE LUIS GILBERTO,NO
43,GUDIÑO MENA ZOBEIDA GUISELA,NO
44,GUEVARA VILLACRES VERONICA MARGARITA,NO
45,GUZMAN OCHOA LILIANA MAURA,NO
46,HERNANDEZ ENRIQUEZ VIRGILIO HUMBERTO,NO
47,MOSQUERA YANEZ ISABEL PIEDAD,NO
49,JEREZ PILLA BETTY MARICELA,NO
51,ORTIZ GASPAR ESTHER FLAVIA,NO
52,BUENDIA HERDOIZA MARIA SOLEDAD,NO
56,MELO GARZON ESTEBAN ANDRES,NO
57,TOBAR NUÑEZ RAUL IGNACIO,NO
58,LUCERO SISA RAFAEL,NO
59,ALVARADO CARRION ROSANA,NO
60,OCLES PADILLA ALEXANDRA,NO
62,PADRON SAETEROS GLADYS PAULINA,NO
63,BRITO MENDOZA MONICA CRISTINA,NO
64,PEÑA CARRASCO DIANA LUCIA,NO
66,PEÑAFIEL MONTESDEOCA JUANA MARISOL,NO
67,PONCE LEON XIMENA MERCEDES,NO
70,RIVERA LOPEZ JOSE GABRIEL,NO
73,VELASTEGUI RAMOS LEONARDO DARIO,NO
79,ANDRADE VARELA JUPITER GOZOSO DE LA CRUZ,NO
86,SERRANO REYES NELSON ALCIDES,NO
94,TERAN SARZOSA SEGUNDO FAUSTO,NO
96,VALLE PINARGOTE BAIRON LEONARDO,NO
97,COLLAGUAZO RODRIGO,NO
98,VELA CAIZAPANTA ANGEL RAMIRO,NO
99,PACHECO ORDOÑEZ BAYRON EDUARDO,NO
106,VELA CHERONI MARIA SOLEDAD,NO
108,CHAMORRO HIDALGO YOLANDA JOSEFINA,NO
110,VERDUGA CEDEÑO MARY,NO
111,VICUÑA MUÑOZ MARIA ALEJANDRA,NO
112,ANDINO ROBALINO ANGELICA MARIA,NO
121,VILLACRESES PEÑA OCTAVIO XAVIER ENRIQUE,NO
122,VINTIMILLA JARRIN DIEGO ARMANDO,NO
123,VITERI GUALINGA CARLOS ELOY,NO
124,ZAMBRANO ARTEAGA JOSE RICARDO,NO
125,ZAMBRANO CABANILLA EDUARDO ALFONSO,NO
113,POSSO SALGADO LUIS ANTONIO,ABSTENCION
