voto,curul,asambleista
AUSENTE,7,ARTEAGA MUÑOZ KARINA CECILIA
AUSENTE,13,CABEZAS GUERRERO ELIZABETH ENRIQUETA
AUSENTE,21,CERDA MIRANDA GABRIELA PAMELA
AUSENTE,25,CUESTA RÍOS LIUBA ELISA
AUSENTE,26,CUESTA SANTANA ESTHER ADELINA
AUSENTE,41,MELO GARZÓN ESTEBAN ANDRÉS
AUSENTE,47,BUSTAMANTE GARCÍA JUAN FRANCISCO
AUSENTE,71,ANDRADE MUÑOZ WILMA PIEDAD
AUSENTE,85,SINMALEZA SÁNCHEZ ÁNGEL RUPERTO
AUSENTE,104,GENDE CALAZACÓN ANGEL MESÍAS
AUSENTE,107,CANDELL SOTO JAIME ENRIQUE JIMMY
AUSENTE,108,DUCHI GUAMÁN MARÍA ENCARNACIÓN
AUSENTE,109,OLIVO PALLO JAIME FERNANDO
AUSENTE,122,CUESTA CONCARI MARÍA MERCEDES
AUSENTE,123,PEÑAFIEL IZQUIERDO EDDY COLÓN
AUSENTE,124,PUANCHIR PAYASHÑA TITO PEDRO
AUSENTE,126,SOLORZANO SARRIA CESAR FAUSTO
AUSENTE,133,SIMBAÑA VILLARREAL ABDÓN MARCELO
SI,64,VERA FLORES WENDY VANESSA
SI,74,ASTUDILLO LOOR LINA GLORIA
SI,80,CALLEJAS BARONA FERNANDO
SI,81,CAMPAIN BRAMBILLA RINA ASUNCIÓN
SI,82,CAMPOVERDE ROBLES EMILIO ABSALÓN
SI,83,CARRIÓN MORENO CÉSAR ATAULFO
SI,89,CASTANIER JARAMILLO XAVIER HOMERO
SI,91,CRUZ PROAÑO LUDOVICO ISRAEL
SI,92,CRUZ VACA JEANNINE DEL CISNE
SI,96,SUQUILANDA LIMA CARMEN MARGARITA
SI,100,CURICHUMBI YUPANQUI PEDRO
SI,101,DONOSO CHIRIBOGA PATRICIO
SI,102,FLORES VÁSQUEZ FERNANDO PATRICIO
SI,103,GALARZA AÑAZCO ANA MERCEDES
SI,105,GÓMEZ ALCÍVAR ROBERTO ANDRÉS
SI,115,CARBO AGUIRRE JONATHAN ALEXI
SI,116,VERA CALDERÓN SILVIA LORENA
SI,120,PACHALA POMA LUIS ALBERTO
SI,125,ALARCÓN GUILLÍN FREDY OSCAR
SI,131,PAREDES TORRES WASHINGTON ARTURO
SI,134,SUQUILANDA VALDIVIESO BYRON VINICIO
SI,135,CEDEÑO LOOR LENIN PAÚL
SI,136,VILLAMAR JÁCOME PEDRO FABRICIO
SI,137,YÉPEZ MARTÍNEZ HÉCTOR JOSÉ
NO,1,AGUIÑAGA VALLEJO PAOLA MARCELA
NO,2,ALBORNOZ VINTIMILLA CLAUDIO ESTEBAN
NO,3,SERRANO SALGADO JOSÉ RICARDO
NO,4,ARIAS FERNÁNDEZ VERÓNICA ELIZABETH
NO,5,ARIAS RAMÍREZ ALBERTO JESÚS
NO,6,ARREGUI RUEDA MARCIA CECILIA
NO,8,BENAVIDES ZAMBRANO ZOILA TERESA
NO,11,BUENDÍA HERDOÍZA MARÍA SOLEDAD
NO,12,BUSTAMANTE MONTEROS RUBÉN ALEJANDRO
NO,14,CADENA VÉLEZ KARLA GABRIELA
NO,15,CALLE VERZOZI HERMUY
NO,16,CAMBALA MONTECE CARLOS ALBERTO
NO,17,CÁRDENAS ESPINOZA JUAN JORGE
NO,18,CARRIÓN CEVALLOS MARÍA JOSÉ
NO,19,TERAN SARZOSA SEGUNDO FAUSTO
NO,20,TENORIO VALENCIA CALLETANO
NO,22,CHALÁ CRUZ JOSÉ FRANKLIN
NO,23,CHÁVEZ BAJAÑA KHARLA DEL ROCÍO
NO,24,COROZO AYOVÍ JORGE WILBER
NO,27,DOUMET CHEDRAUI MICHEL ANDRÉS
NO,28,DURÁN AGUILAR LILIANA ELIZABETH
NO,29,ALEAGA SANTOS RONNY XAVIER
NO,30,ESPINOSA ANDRADE AUGUSTO XAVIER
NO,31,FLOR GIL BRENDA AZUCENA
NO,32,GARCÍA GAIBOR CARMEN MERCEDES
NO,33,GARCÍA POZO DIEGO OSWALDO
NO,34,GARZÓN RICAURTE WILLIAM ANTONIO
NO,35,GAVILÁNEZ CAMACHO FAFO HOLGUÍN
NO,36,GUEVARA VILLACRÉS VERÓNICA MARGARITA
NO,37,HOLGUÍN NARANJO MARCELA PRISCILA
NO,39,LLORET VALDIVIESO JUAN CRISTÓBAL
NO,40,MARÍN AGUIRRE ANA BELÉN
NO,42,MENDOZA ARÉVALO DANIEL ISAAC
NO,43,MUÑOZ LÓPEZ CHRISTIAN PABEL
NO,44,NARANJO ALVARADO PRISCILA AMAPOLA
NO,45,OCHOA MORANTE MANUEL ALFREDO
NO,46,ALONSO FERNÁNDEZ FÉLIX FREDY
NO,48,PEÑA PACHECO XIMENA DEL ROCÍO
NO,49,PLAZA CASTILLO LENIN
NO,50,POMA HERRERA YOFRE MARTÍN
NO,51,PROAÑO CIFUENTES ROBERTH MAURICIO
NO,52,QUIJIJE DELGADO LUIS RAFAEL
NO,53,QUIÑONEZ OCAMPO JULIO CÉSAR
NO,54,RIVADENEIRA BURBANO GABRIELA ALEJANDRA
NO,55,RIVADENEIRA BUSTOS CARMEN MERCEDES
NO,56,SALAZAR CEDEÑO GUADALUPE DOLORES
NO,57,SALGADO ANDRADE SILVIA BETZABETH
NO,58,SAMANIEGO MAIGUA FRANKLIN OMAR
NO,59,YAGUANA ECHEVERRÍA ANDREA ALEXANDRA
NO,60,ALEMÁN MARMOL MÓNICA ROCÍO
NO,61,SOLIZ CARRIÓN DORIS JOSEFINA
NO,62,VALLE PINARGOTE BAIRON LEONARDO
NO,63,VELIN CORTÉS JUAN PABLO
NO,65,VERA RODRÍGUEZ CARLOS ALFREDO
NO,66,VILLALVA MIRANDA LIRA DE LA PAZ
NO,67,VITERI GUALINGA CARLOS ELOY
NO,68,YAR ARAUJO JUAN CARLOS
NO,69,GUAMBA DÍAZ NANCY JEANNETH
NO,70,LOOR ALCÍVAR LEXI LIDUVINA
NO,72,ZAMBRANO ALCÍVAR MAGDA XIOMARA
NO,73,AUQUILLA ORTEGA RAÚL VICENTE
NO,75,BURBANO MONTENEGRO FÉLIX FERNANDO
NO,76,ZAMBRANO CASTRO NORALMA ELIZABETH
NO,77,GUEVARA LOZADA FLERIDA YOVANA
NO,78,CUCALÓN CAMACHO HENRY EDUARDO
NO,79,SERRANO VITERI MERCEDES MARITZA
NO,84,VEGAY JIPA LUZ AIDA
NO,86,YANDÚN POZO CÁSTULO RENÉ
NO,87,HENRÍQUEZ JAIME PATRICIA IVONNE
NO,88,KRONFLE KOZHAYA HENRY FABIÁN
NO,90,CELI SANTOS GUILLERMO ALEJANDRO
NO,94,ZAMBRANO VALLE EDUARDO MAURICIO
NO,95,CADENA HUERTAS FRANCISCO JAVIER
NO,97,CAMPOVERDE GONZÁLEZ RAÚL FREDDY BOLÍVAR
NO,98,CALDERÓN CHANCAY DORIS DAISY
NO,99,LLANES SUAREZ HENRY MANUEL
NO,106,CEDEÑO ZAMBRANO FELISITA MONCERRATE
NO,110,ROHON HERVAS CÉSAR EDUARDO
NO,111,TAIANO BASANTE VICENTE GIOVANNY
NO,112,MENDOZA MACÍAS MANUEL VIRGILIO
NO,113,TORRES COBO LUIS ESTEBAN
NO,114,LARREÁTEGUI FABARA MARÍA GABRIELA
NO,118,MORENO GUERRERO HENRY FREDY
NO,119,MUÑOZ ALARCÓN HÉCTOR PATRICIO
NO,127,ALMEYDA JALIL VICENTE FERNANDO
NO,128,MARÍN LAVAYEN DENNIS GUSTAVO
NO,129,ESTUPIÑÁN ORTIZ BORIS EFRÉN
NO,130,PALACIOS MUÑOZ JUAN SEBASTIÁN
ABSTENCION,9,BERGMANN REYNA CARLOS ALBERTO
ABSTENCION,10,BONILLA SALCEDO VIVIANA
ABSTENCION,38,LITARDO CAICEDO CÉSAR ERNESTO
ABSTENCION,93,CUESTA ORELLANA MARÍA DE LOURDES
ABSTENCION,117,MONTAÑO VALENCIA MAE
ABSTENCION,121,TELLO BENALCÁZAR RAÚL ESTUPIÑAN
ABSTENCION,132,ROMERO LOAYZA FRANCO SEGUNDO
