curul,asambleista,voto
4,MACHUCA MOSCOSO LINDA MARICELA,AUSENTE
6,QUINDIGALLE LICTAPUZON GUILLERMO ORLANDO,AUSENTE
26,CHAVEZ CANALES HOLGER EZEQUIEL,AUSENTE
64,PEÑA CARRASCO DIANA LUCIA,AUSENTE
72,MEDINA MERA VICTOR CLEMENTE,AUSENTE
76,RODRIGUEZ DELGADO MARIA VERONICA,AUSENTE
77,SAENZ DE VITERI LAUTARO ENRIQUE,AUSENTE
119,MEDINA TAMBACO EMILY JESUS,AUSENTE
122,VINTIMILLA JARRIN DIEGO ARMANDO,AUSENTE
128,SERRANO SEGURA GRACE MARISOL,AUSENTE
130,TAPIA LOMBEYDA LUIS FERNANDO,AUSENTE
1,ABAD VELEZ RAUL,SI
2,ACERO LANCHIMBA ESTHELA LILIANA,SI
3,AGUILAR PLACIDO ARMANDO,SI
5,AGUIRRE HIDALGO DORA ANDELA,SI
7,TORRES CEDEÑO KERLLY ANABEL,SI
8,MUÑOZ VICUÑA MARIANGEL,SI
9,ANDINO REINOSO MAURO EDMUNDO,SI
10,VITERI LOPEZ CHRISTIAN HUMBERTO,SI
11,RIVAS ALAVA ELIANA LISSET,SI
12,ARREGUI RUEDA MARCIA CECILIA,SI
13,BENAVIDES ZAMBRANO ZOILA TERESA,SI
14,BERGMANN REYNA CARLOS ALBERTO,SI
15,BORJA PEREZ GALO,SI
16,RIVADENEIRA BURBANO GABRIELA ALEJANDRA,SI
17,BUSTAMANTE PONCE FERNANDO XAVIER,SI
18,CALDERON SALTOS RICHARD OSWALDO,SI
19,CALLE ANDRADE MARIA AUGUSTA,SI
20,CARRILLO BETTY,SI
21,CARRION MARIA JOSE,SI
22,CARVAJAL AGUIRRE MIGUEL ANGEL,SI
23,CASSINELLI CALI JUAN CARLOS,SI
24,CAYAMBE TIPAN FAUSTO HERIBERTO,SI
25,CEDEÑO ZAMBRANO JOHANNA ELIZABETH,SI
27,CHICA AREVALO VINICIO VETHOWEN,SI
28,CORDOVA ENCALADA EDGAR EDUARDO,SI
29,CUESTA RIOS LIUBA ELISA,SI
30,DE LA CRUZ BERNARDO HERMAN ULISES,SI
31,DE LA CRUZ GASPAR ADRIANA MIOSOTI,SI
32,DELGADO CHALA AGUSTIN JAVIER,SI
33,FAJARDO MOSQUERA LETTY VANESSA,SI
34,FALCONI LOQUI EVELYN PAMELA,SI
35,MONTIEL ARREAGA ROSAISELA DE LAS MERCEDES,SI
36,GALVAN GRACIA MARIA ESPERANZA,SI
37,LARREA VITERI LIDICE VANESSA,SI
38,GARZON RICAURTE WILLIAM ANTONIO,SI
39,SANCHEZ PERALTA EDUARDO JOSE,SI
40,GONZALEZ SERRANO MIRYAM CATARINA,SI
41,GUAMAN CASTRO ALEX FRANCISCO,SI
42,GUAMANGATE ANTE LUIS GILBERTO,SI
43,GUDIÑO MENA ZOBEIDA GUISELA,SI
44,GUEVARA VILLACRES VERONICA MARGARITA,SI
45,GUZMAN OCHOA LILIANA MAURA,SI
46,HERNANDEZ ENRIQUEZ VIRGILIO HUMBERTO,SI
47,MOSQUERA YANEZ ISABEL PIEDAD,SI
48,ISSA WAGNER NICOLAS JOSE,SI
49,JEREZ PILLA BETTY MARICELA,SI
50,JUEZ JUEZ OMAR JUSEPH,SI
51,ORTIZ GASPAR ESTHER FLAVIA,SI
52,BUENDIA HERDOIZA MARIA SOLEDAD,SI
53,LARRIVA ALVARADO OSCAR OSWALDO,SI
54,LEDESMA ZAMORA OSCAR ALFONSO,SI
55,AGUIÑAGA VALLEJO PAOLA MARCELA,SI
56,MELO GARZON ESTEBAN ANDRES,SI
57,TOBAR NUÑEZ RAUL IGNACIO,SI
58,MUÑOZ AVENDAÑO ROSA ELVIRA,SI
59,ALVARADO CARRION ROSANA,SI
60,OCLES PADILLA ALEXANDRA,SI
61,PABON CARANQUI PAOLA VERENICE,SI
62,PADRON SAETEROS GLADYS PAULINA,SI
63,PATIÑO AROCA RAUL LEONARDO,SI
65,PEÑA PACHECO XIMENA DEL ROCIO,SI
66,QUINCHIGUANGO GISELA,SI
67,PONCE LEON XIMENA MERCEDES,SI
68,PROAÑO CIFUENTES ROBERTH MAURICIO,SI
69,FARFAN APONTE RICHARD WILSON,SI
70,RIVERA LOPEZ JOSE GABRIEL,SI
71,RIVERO DOGUER ANGEL ARMANDO,SI
73,REINOSO LESCANO MARIA ELIZABETH,SI
74,AGUILAR TORRES MANUEL RAMIRO,SI
75,ARIAS FERNANDEZ VERONICA ELIZABETH,SI
78,SALAZAR CEDEÑO GUADALUPE DOLORES,SI
79,ANDRADE VARELA JUPITER GOZOSO DE LA CRUZ,SI
81,VILLAO PANCHANA RAUL ELIAS,SI
82,YANDUN POZO CASTULO RENE,SI
84,SANCHEZ ORDOÑEZ MONTGOMERY LUIS,SI
85,MOYA DUQUE HERMAN ANIBAL,SI
86,ALEMAN MARMOL MONICA ROCIO,SI
87,SOLANO MORENO ALEX FABIAN,SI
88,DIAZ COKA MARIA GABRIELA,SI
94,TERAN SARZOSA SEGUNDO FAUSTO,SI
95,VALAREZO ORDOÑEZ ROCIO DEL CARMEN,SI
96,VALLE PINARGOTE BAIRON LEONARDO,SI
97,VASCONEZ ARTEAGA ANNY MARLLELY,SI
98,VELA CAIZAPANTA ANGEL RAMIRO,SI
99,PACHECO ORDOÑEZ BAYRON EDUARDO,SI
106,VELA CHERONI MARIA SOLEDAD,SI
107,ARGUELLO TROYA BLANCA AZUCENA,SI
108,VELASCO ENRIQUEZ CARLOS ALBERTO,SI
109,VELIZ BRIONES JOSE FELIX,SI
110,VERDUGA CEDEÑO MARY,SI
111,VICUÑA MUÑOZ MARIA ALEJANDRA,SI
112,VILEMA FREIRE ANGEL RAMIRO,SI
113,POSSO SALGADO LUIS ANTONIO,SI
121,VILLACRESES PEÑA OCTAVIO XAVIER ENRIQUE,SI
123,VITERI GUALINGA CARLOS ELOY,SI
124,ZAMBRANO ARTEAGA JOSE RICARDO,SI
125,ZAMBRANO CABANILLA EDUARDO ALFONSO,SI
126,VILLON POZO LUIS MARIANO,SI
127,ZAMBRANO CHACHA ALBERTO ALEXANDER,SI
129,URIBE LOPEZ FANNY ESTHER,SI
115,MONTAÑO VALENCIA MAE,NO
80,BUSTOS CHILIQUINGA ARCADIO,ABSTENCION
83,ACACHO GONZALEZ PEPE LUIS,ABSTENCION
89,FIERRO OVIEDO PACO,ABSTENCION
90,JIMENEZ CABRERA JOSE CLEVER,ABSTENCION
91,GAIBOR ROMERO CARLOS MARTIN,ABSTENCION
92,UMAGINGA GUAMAN CESAR,ABSTENCION
93,TIBAN GUALA LOURDES LICENIA,ABSTENCION
100,GUTIERREZ BORBUA FAUSTO GILMAR,ABSTENCION
101,AUQUILLA ORTEGA RAUL VICENTE,ABSTENCION
102,CHICAIZA TOAPANTA WILSON ALFONSO,ABSTENCION
103,DONOSO CHIRIBOGA PATRICIO,ABSTENCION
104,MONCAYO CEVALLOS JOSE RICARDO,ABSTENCION
105,BUCARAM PULLEY ABDALA JAIME,ABSTENCION
114,SOLORZANO SARRIA CESAR FAUSTO,ABSTENCION
116,MORETA PANCHEZ MIGUEL ANGEL,ABSTENCION
117,PAEZ BENALCAZAR ANDRES TARQUINO,ABSTENCION
118,SALGADO RIVADENEIRA DIEGO,ABSTENCION
120,TORRES TORRES LUIS FERNANDO,ABSTENCION
131,CUCALON CAMACHO HENRY EDUARDO,ABSTENCION
132,REYES HIDALGO CRISTINA EUGENIA,ABSTENCION
133,TACLE GALARRAGA MOISES FERNANDO,ABSTENCION
134,ROMERO LOAYZA FRANCO SEGUNDO,ABSTENCION
135,TERAN SALCEDO RAMON FORTUNATO,ABSTENCION
136,VITERI JIMENEZ CYNTHIA,ABSTENCION
137,KRONFLE GOMEZ MARIA CRISTINA,ABSTENCION
