curul,asambleista,voto
2,MORALES POZO LENIN ALBERTO,AUSENTE
4,HAGO CELI FRANCISCO WAIKING,AUSENTE
6,ALBAN TORRES MARIANA DEL ROCIO,AUSENTE
7,TORRES CEDEÑO KERLLY ANABEL,AUSENTE
9,ANDINO REINOSO MAURO EDMUNDO,AUSENTE
11,RIVAS ALAVA ELIANA LISSET,AUSENTE
12,ARREGUI RUEDA MARCIA CECILIA,AUSENTE
22,CARVAJAL AGUIRRE MIGUEL ANGEL,AUSENTE
23,CASSINELLI CALI JUAN CARLOS,AUSENTE
29,CUESTA RIOS LIUBA ELISA,AUSENTE
33,FAJARDO MOSQUERA LETTY VANESSA,AUSENTE
42,GUAMANGATE ANTE LUIS GILBERTO,AUSENTE
43,GUDIÑO MENA ZOBEIDA GUISELA,AUSENTE
48,ISSA WAGNER NICOLAS JOSE,AUSENTE
51,ORTIZ GASPAR ESTHER FLAVIA,AUSENTE
67,PONCE LEON XIMENA MERCEDES,AUSENTE
68,PROAÑO CIFUENTES ROBERTH MAURICIO,AUSENTE
72,MEDINA MERA VICTOR CLEMENTE,AUSENTE
77,SAENZ DE VITERI LAUTARO ENRIQUE,AUSENTE
79,ANDRADE VARELA JUPITER GOZOSO DE LA CRUZ,AUSENTE
84,SANCHEZ ORDOÑEZ MONTGOMERY LUIS,AUSENTE
86,SERRANO REYES NELSON ALCIDES,AUSENTE
87,DAHIK ASTUDILLO REYTA GIOMAR,AUSENTE
90,JIMENEZ CABRERA JOSE CLEVER,AUSENTE
92,UMAGINGA GUAMAN CESAR,AUSENTE
98,VELA CAIZAPANTA ANGEL RAMIRO,AUSENTE
99,PACHECO ORDOÑEZ BAYRON EDUARDO,AUSENTE
104,MONCAYO CEVALLOS JOSE RICARDO,AUSENTE
105,BUCARAM PULLEY ABDALA JAIME,AUSENTE
107,ARGUELLO TROYA BLANCA AZUCENA,AUSENTE
108,VELASCO ENRIQUEZ CARLOS ALBERTO,AUSENTE
109,VELEZ MARLENE MARGARITA,AUSENTE
111,VICUÑA MUÑOZ MARIA ALEJANDRA,AUSENTE
112,VILEMA FREIRE ANGEL RAMIRO,AUSENTE
116,MORETA PANCHEZ MIGUEL ANGEL,AUSENTE
117,PAEZ BENALCAZAR ANDRES TARQUINO,AUSENTE
118,SALGADO RIVADENEIRA DIEGO,AUSENTE
121,ALEJANDRO MEDINA CRISTINA SORAYA,AUSENTE
124,ZAMBRANO ARTEAGA JOSE RICARDO,AUSENTE
131,CUCALON CAMACHO HENRY EDUARDO,AUSENTE
132,REYES HIDALGO CRISTINA EUGENIA,AUSENTE
137,KRONFLE GOMEZ MARIA CRISTINA,AUSENTE
1,ABAD VELEZ RAUL,SI
3,AGUILAR PLACIDO ARMANDO,SI
5,ORTIZ LARA LEONARDO,SI
8,ORDOÑEZ ALMEIDA FAUSTO EFRAIN,SI
10,VITERI LOPEZ CHRISTIAN HUMBERTO,SI
13,MARQUEZ LOPEZ JOSE LENIN,SI
14,BERGMANN REYNA CARLOS ALBERTO,SI
15,BORJA PEREZ GALO,SI
16,RIVADENEIRA BURBANO GABRIELA ALEJANDRA,SI
17,BUSTAMANTE PONCE FERNANDO XAVIER,SI
18,CALDERON SALTOS RICHARD OSWALDO,SI
19,CASANOVA CEPEDA XAVIER IVAN,SI
20,TOALOMBO CHIMBORAZO JOSE SEGUNDO,SI
21,ANRRANGO ZAMBRANO GERARDO ELIAS,SI
24,CAYAMBE TIPAN FAUSTO HERIBERTO,SI
25,CEDEÑO ZAMBRANO JOHANNA ELIZABETH,SI
26,CHAVEZ CANALES HOLGER EZEQUIEL,SI
27,CHICA AREVALO VINICIO VETHOWEN,SI
28,CORDOVA ENCALADA EDGAR EDUARDO,SI
30,DE LA CRUZ BERNARDO HERMAN ULISES,SI
31,DE LA CRUZ GASPAR ADRIANA MIOSOTI,SI
32,DELGADO CHALA AGUSTIN JAVIER,SI
34,FALCONI LOQUI EVELYN PAMELA,SI
35,GAGLIARDO LOOR GASTON,SI
36,GALVAN GRACIA MARIA ESPERANZA,SI
37,LARREA VITERI LIDICE VANESSA,SI
38,GARZON RICAURTE WILLIAM ANTONIO,SI
39,SANCHEZ PERALTA EDUARDO JOSE,SI
40,GRANDA NIXON ARLIG,SI
41,GUAMAN CASTRO ALEX FRANCISCO,SI
44,GUEVARA VILLACRES VERONICA MARGARITA,SI
45,GUZMAN OCHOA LILIANA MAURA,SI
46,HERNANDEZ ENRIQUEZ VIRGILIO HUMBERTO,SI
47,MOSQUERA YANEZ ISABEL PIEDAD,SI
49,CARRILLO CRESPO HUGO FERNANDO,SI
50,SILVA MALDONADO SOFIA IRENE,SI
52,BUENDIA HERDOIZA MARIA SOLEDAD,SI
53,LARRIVA ALVARADO OSCAR OSWALDO,SI
54,LEDESMA ZAMORA OSCAR ALFONSO,SI
55,AGUIÑAGA VALLEJO PAOLA MARCELA,SI
56,MELO GARZON ESTEBAN ANDRES,SI
57,TOBAR NUÑEZ RAUL IGNACIO,SI
58,MUÑOZ AVENDAÑO ROSA ELVIRA,SI
59,ALVARADO CARRION ROSANA,SI
60,OCLES PADILLA ALEXANDRA,SI
61,CAZA TIPANTA HUGO RENE,SI
62,PADRON SAETEROS GLADYS PAULINA,SI
63,BRITO MENDOZA MONICA CRISTINA,SI
64,PEÑA CARRASCO DIANA LUCIA,SI
65,PEÑA PACHECO XIMENA DEL ROCIO,SI
66,QUINCHIGUANGO GISELA,SI
69,FARES GUAILLAS MARIA SEBASTIANA,SI
70,RIVERA LOPEZ JOSE GABRIEL,SI
71,RIVERO DOGUER ANGEL ARMANDO,SI
73,VELASTEGUI RAMOS LEONARDO DARIO,SI
74,AGUILAR TORRES MANUEL RAMIRO,SI
75,ARIAS FERNANDEZ VERONICA ELIZABETH,SI
76,RODRIGUEZ DELGADO MARIA VERONICA,SI
78,SALAZAR CEDEÑO GUADALUPE DOLORES,SI
81,VILLAO PANCHANA RAUL ELIAS,SI
82,YANDUN POZO CASTULO RENE,SI
83,ACACHO GONZALEZ PEPE LUIS,SI
85,MOYA DUQUE HERMAN ANIBAL,SI
88,DIAZ COKA MARIA GABRIELA,SI
94,TERAN SARZOSA SEGUNDO FAUSTO,SI
95,VALAREZO ORDOÑEZ ROCIO DEL CARMEN,SI
96,VALLE PINARGOTE BAIRON LEONARDO,SI
97,VASCONEZ ARTEAGA ANNY MARLLELY,SI
101,AUQUILLA ORTEGA RAUL VICENTE,SI
102,CHICAIZA TOAPANTA WILSON ALFONSO,SI
103,DONOSO CHIRIBOGA PATRICIO,SI
106,VELA CHERONI MARIA SOLEDAD,SI
110,VERDUGA CEDEÑO MARY,SI
113,POSSO SALGADO LUIS ANTONIO,SI
120,TORRES TORRES LUIS FERNANDO,SI
122,VINTIMILLA JARRIN DIEGO ARMANDO,SI
123,VITERI GUALINGA CARLOS ELOY,SI
125,ZAMBRANO CABANILLA EDUARDO ALFONSO,SI
126,ZAMBRANO CASTRO NORALMA ELIZABETH,SI
127,ZAMBRANO CHACHA ALBERTO ALEXANDER,SI
128,SERRANO SEGURA GRACE MARISOL,SI
129,URIBE LOPEZ FANNY ESTHER,SI
133,TACLE GALARRAGA MOISES FERNANDO,SI
134,ROMERO LOAYZA FRANCO SEGUNDO,SI
135,TERAN SALCEDO RAMON FORTUNATO,SI
136,VITERI JIMENEZ CYNTHIA,SI
80,BUSTOS CHILIQUINGA ARCADIO,ABSTENCION
89,FIERRO OVIEDO PACO,ABSTENCION
91,ORELLANA MARQUINEZ MAGALI MARGOT,ABSTENCION
93,TIBAN GUALA LOURDES LICENIA,ABSTENCION
100,GUTIERREZ BORBUA FAUSTO GILMAR,ABSTENCION
114,SOLORZANO SARRIA CESAR FAUSTO,ABSTENCION
115,MONTAÑO VALENCIA MAE,ABSTENCION
119,PUYOL CORTEZ JORGE LUIS,ABSTENCION
130,TAPIA LOMBEYDA LUIS FERNANDO,ABSTENCION
