voto,curul,asambleista
AUSENTE,14,CADENA VÉLEZ KARLA GABRIELA
AUSENTE,21,CERDA MIRANDA GABRIELA PAMELA
AUSENTE,24,COROZO AYOVÍ JORGE WILBER
AUSENTE,33,GARCÍA POZO DIEGO OSWALDO
AUSENTE,64,VERA FLORES WENDY VANESSA
AUSENTE,81,CAMPAIN BRAMBILLA RINA ASUNCIÓN
AUSENTE,92,CRUZ VACA JEANNINE DEL CISNE
AUSENTE,111,TACLE GARCÍA SAMIA
AUSENTE,126,BOHÓRQUEZ PANTOJA VALERIA DEL CARMEN
AUSENTE,134,SUQUILANDA VALDIVIESO BYRON VINICIO
SI,1,AGUIÑAGA VALLEJO PAOLA MARCELA
SI,2,ALBORNOZ VINTIMILLA CLAUDIO ESTEBAN
SI,3,SERRANO SALGADO JOSÉ RICARDO
SI,4,ARIAS FERNÁNDEZ VERÓNICA ELIZABETH
SI,5,ARIAS RAMÍREZ ALBERTO JESÚS
SI,6,YELA ACOSTA WERNER ANTONIO
SI,7,MONTESDEOCA PALACIOS JOSÉ DANIEL
SI,8,BENAVIDES ZAMBRANO ZOILA TERESA
SI,9,BERGMANN REYNA CARLOS ALBERTO
SI,10,COLLAGUAZO RODRIGO
SI,11,BUENDÍA HERDOÍZA MARÍA SOLEDAD
SI,12,BUSTAMANTE MONTEROS RUBÉN ALEJANDRO
SI,13,CABEZAS GUERRERO ELIZABETH ENRIQUETA
SI,15,CALLE VERZOZI HERMUY
SI,16,CAMBALA MONTECE CARLOS ALBERTO
SI,17,CÁRDENAS ESPINOZA JUAN JORGE
SI,18,EGAS LEDESMA JOSÉ ANTONIO
SI,19,VALLEJO JARAMILLO NORMA MARLENE
SI,20,CEDEÑO ZAMBRANO JOHANNA ELIZABETH
SI,22,CHALÁ CRUZ JOSÉ FRANKLIN
SI,23,TORRES TORRES EURO IGNACIO
SI,25,CUESTA RÍOS LIUBA ELISA
SI,26,CUESTA SANTANA ESTHER ADELINA
SI,27,DOUMET CHEDRAUI MICHEL ANDRÉS
SI,28,DURÁN AGUILAR LILIANA ELIZABETH
SI,29,ESPÍN REYES EUGENIA SOFÍA
SI,30,ESPINOSA ANDRADE AUGUSTO XAVIER
SI,31,FLOR GIL BRENDA AZUCENA
SI,32,GARCÍA GAIBOR CARMEN MERCEDES
SI,34,GARZÓN RICAURTE WILLIAM ANTONIO
SI,35,GAVILÁNEZ CAMACHO FAFO HOLGUÍN
SI,36,GUEVARA VILLACRÉS VERÓNICA MARGARITA
SI,37,HOLGUÍN NARANJO MARCELA PRISCILA
SI,38,LITARDO CAICEDO CÉSAR ERNESTO
SI,39,LLORET VALDIVIESO JUAN CRISTÓBAL
SI,40,MARÍN AGUIRRE ANA BELÉN
SI,41,MELO GARZÓN ESTEBAN ANDRÉS
SI,42,COLAMARCO VERA PINUCCIA MAGALY
SI,43,MUÑOZ LÓPEZ CHRISTIAN PABEL
SI,44,NARANJO ALVARADO PRISCILA AMAPOLA
SI,45,OCHOA MORANTE MANUEL ALFREDO
SI,46,ORELLANA ROMÁN ROSA GINA
SI,47,PALACIOS VELÁSQUEZ SONIA LUCRECIA
SI,48,PEÑA PACHECO XIMENA DEL ROCÍO
SI,49,PLAZA CASTILLO LENIN
SI,50,ANDRADE VILLAPRADO NELLY LISSETH
SI,51,PROAÑO CIFUENTES ROBERTH MAURICIO
SI,52,QUIJIJE DELGADO LUIS RAFAEL
SI,53,QUIÑONEZ OCAMPO JULIO CÉSAR
SI,54,AGUALSACA GUAMAN JOSE CLEMENTE
SI,55,COROZO VALENCIA WILMER JORVELIS
SI,56,SALAZAR CEDEÑO GUADALUPE DOLORES
SI,57,SALGADO ANDRADE SILVIA BETZABETH
SI,58,SAMANIEGO MAIGUA FRANKLIN OMAR
SI,59,SÁNCHEZ REYES MONTGOMERY
SI,60,MOLINA ONOFA LUIS FERNANDO
SI,61,SOLIZ CARRIÓN DORIS JOSEFINA
SI,62,TENEZACA LOPEZ MABEL MICHELL
SI,63,VELIN CORTÉS JUAN PABLO
SI,65,VERA RODRÍGUEZ CARLOS ALFREDO
SI,66,VILLALVA MIRANDA LIRA DE LA PAZ
SI,67,VITERI GUALINGA CARLOS ELOY
SI,68,YAR ARAUJO JUAN CARLOS
SI,69,YUNDA MACHADO JORGE HOMERO
SI,70,ZAMBRANO ARTEAGA JOSE RICARDO
SI,76,ZAMBRANO CASTRO NORALMA ELIZABETH
SI,84,ZAMBRANO CHACHA ALBERTO ALEXANDER
SI,94,ZAMBRANO VALLE EDUARDO MAURICIO
SI,106,ZAMBRANO VERA MARIANO
SI,125,ALARCÓN GUILLÍN FREDY OSCAR
SI,132,ROMERO LOAYZA FRANCO SEGUNDO
NO,72,ASÁN WONSANG JOSÉ FRANCISCO
NO,78,CUCALÓN CAMACHO HENRY EDUARDO
NO,79,SERRANO VITERI MERCEDES MARITZA
NO,80,CALLEJAS BARONA FERNANDO
NO,83,CARRIÓN MORENO CÉSAR ATAULFO
NO,87,UGARTE HENRÍQUEZ JOSÉ FERNANDO
NO,88,KRONFLE KOZHAYA HENRY FABIÁN
NO,89,CASTANIER JARAMILLO XAVIER HOMERO
NO,93,CUESTA ORELLANA MARÍA DE LOURDES
NO,95,CADENA HUERTAS FRANCISCO JAVIER
NO,97,MONTAÑO GUISAMANO MAYRA MIGDONIA
NO,98,MUENTES ALVARADO PABLO ANDRES
NO,99,REYES HIDALGO CRISTINA EUGENIA
NO,100,CURICHUMBI YUPANQUI PEDRO
NO,101,DONOSO CHIRIBOGA PATRICIO
NO,103,GALARZA AÑAZCO ANA MERCEDES
NO,105,GÓMEZ ALCÍVAR ROBERTO ANDRÉS
NO,108,DUCHI GUAMÁN MARÍA ENCARNACIÓN
NO,110,ROHON HERVAS CÉSAR EDUARDO
NO,112,GARCÍA ESPINEL KERLY BEATRIZ
NO,113,TORRES TORRES LUIS FERNANDO
NO,115,CARBO AGUIRRE JONATHAN ALEXI
NO,116,MINCHALA MURILLO RÓMULO MARCELO
NO,117,MONTAÑO VALENCIA MAE
NO,118,MORENO GUERRERO HENRY FREDY
NO,120,PACHALA POMA LUIS ALBERTO
NO,127,UGARTE GUZMÁN BLANCA ROSANA
NO,128,VINTIMILLA MOSCOSO PAOLA
NO,129,ZAMBRANO ORTIZ MARÍA ROBERTA
NO,133,SIMBAÑA VILLARREAL ABDÓN MARCELO
NO,135,VERA MENDOZA TANLLY JANELA
NO,136,VILLAMAR JÁCOME PEDRO FABRICIO
BLANCO,77,AZUERO RODAS ELISEO ALEXIS
BLANCO,86,JÁTIVA MARTÍNEZ BLANCA RUTH
BLANCO,91,CRUZ PROAÑO LUDOVICO ISRAEL
BLANCO,107,CANDELL SOTO JAIME ENRIQUE JIMMY
BLANCO,121,TELLO BENALCÁZAR RAÚL ESTUPIÑAN
BLANCO,122,CUESTA CONCARI MARÍA MERCEDES
BLANCO,124,PUANCHIR PAYASHÑA TITO PEDRO
ABSTENCION,71,PESANTEZ SALTO DIANA ELIZABETH
ABSTENCION,73,AUQUILLA ORTEGA RAÚL VICENTE
ABSTENCION,74,ASTUDILLO LOOR LINA GLORIA
ABSTENCION,75,BURBANO MONTENEGRO FÉLIX FERNANDO
ABSTENCION,82,CAMPOVERDE ROBLES EMILIO ABSALÓN
ABSTENCION,85,SINMALEZA SÁNCHEZ ÁNGEL RUPERTO
ABSTENCION,90,CELI SANTOS GUILLERMO ALEJANDRO
ABSTENCION,96,PEÑA ONTANEDA ELIO GERMÁN
ABSTENCION,102,FLORES VÁSQUEZ FERNANDO PATRICIO
ABSTENCION,104,GENDE CALAZACÓN ANGEL MESÍAS
ABSTENCION,109,OLIVO PALLO JAIME FERNANDO
ABSTENCION,114,LARREÁTEGUI FABARA MARÍA GABRIELA
ABSTENCION,119,MUÑOZ ALARCÓN HÉCTOR PATRICIO
ABSTENCION,123,PEÑAFIEL IZQUIERDO EDDY COLÓN
ABSTENCION,130,PALACIOS MUÑOZ JUAN SEBASTIÁN
ABSTENCION,131,PAREDES TORRES WASHINGTON ARTURO
ABSTENCION,137,YÉPEZ MARTÍNEZ HÉCTOR JOSÉ
