curul,asambleista,voto
1,AGUIÑAGA VALLEJO PAOLA MARCELA,AUSENTE
2,JUCA SALAZAR MERCEDES DEL ROCÍO,AUSENTE
4,ARIAS FERNÁNDEZ VERÓNICA ELIZABETH,AUSENTE
6,SALINAS OCHOA CAMILO AURELIO,AUSENTE
7,ARTEAGA MUÑOZ KARINA CECILIA,AUSENTE
9,BERGMANN REYNA CARLOS ALBERTO,AUSENTE
10,BONILLA SALCEDO VIVIANA,AUSENTE
13,CABEZAS GUERRERO ELIZABETH ENRIQUETA,AUSENTE
15,CALLE VERZOZI HERMUY,AUSENTE
18,CARRIÓN CEVALLOS MARÍA JOSÉ,AUSENTE
25,CUESTA RÍOS LIUBA ELISA,AUSENTE
26,CUESTA SANTANA ESTHER ADELINA,AUSENTE
28,DURÁN AGUILAR LILIANA ELIZABETH,AUSENTE
29,ESPÍN REYES EUGENIA SOFÍA,AUSENTE
32,GARCÍA GAIBOR CARMEN MERCEDES,AUSENTE
36,GUEVARA VILLACRÉS VERÓNICA MARGARITA,AUSENTE
37,HOLGUÍN NARANJO MARCELA PRISCILA,AUSENTE
38,LITARDO CAICEDO CÉSAR ERNESTO,AUSENTE
41,MELO GARZÓN ESTEBAN ANDRÉS,AUSENTE
43,MUÑOZ LÓPEZ CHRISTIAN PABEL,AUSENTE
50,POMA HERRERA YOFRE MARTÍN,AUSENTE
54,RIVADENEIRA BURBANO GABRIELA ALEJANDRA,AUSENTE
58,SAMANIEGO MAIGUA FRANKLIN OMAR,AUSENTE
59,SÁNCHEZ REYES MONTGOMERY,AUSENTE
61,PEÑA BERNAL JOAQUÍN ANTONIO,AUSENTE
63,MALDONADO VERA MABEL MARCELA,AUSENTE
64,VERA FLORES WENDY VANESSA,AUSENTE
69,YUNDA MACHADO JORGE HOMERO,AUSENTE
70,LOOR ALCÍVAR LEXI LIDUVINA,AUSENTE
72,ASÁN WONSANG JOSÉ FRANCISCO,AUSENTE
73,AUQUILLA ORTEGA RAÚL VICENTE,AUSENTE
84,VEGAY JIPA LUZ AIDA,AUSENTE
89,CASTANIER JARAMILLO XAVIER HOMERO,AUSENTE
90,CELI SANTOS GUILLERMO ALEJANDRO,AUSENTE
92,CRUZ VACA JEANNINE DEL CISNE,AUSENTE
93,CUESTA ORELLANA MARÍA DE LOURDES,AUSENTE
99,REYES HIDALGO CRISTINA EUGENIA,AUSENTE
100,CURICHUMBI YUPANQUI PEDRO,AUSENTE
102,FLORES VÁSQUEZ FERNANDO PATRICIO,AUSENTE
103,GALARZA AÑAZCO ANA MERCEDES,AUSENTE
105,GÓMEZ ALCÍVAR ROBERTO ANDRÉS,AUSENTE
106,ZAMBRANO VERA MARIANO,AUSENTE
109,OLIVO PALLO JAIME FERNANDO,AUSENTE
111,TACLE GARCÍA SAMIA,AUSENTE
126,SOLORZANO SARRIA CESAR FAUSTO,AUSENTE
132,ROMERO LOAYZA FRANCO SEGUNDO,AUSENTE
134,SUQUILANDA VALDIVIESO BYRON VINICIO,AUSENTE
136,VILLAMAR JÁCOME PEDRO FABRICIO,AUSENTE
3,CEVALLOS GUEVARA LESLIE MARCELA,SI
5,ARIAS RAMÍREZ ALBERTO JESÚS,SI
8,BENAVIDES ZAMBRANO ZOILA TERESA,SI
11,BUENDÍA HERDOÍZA MARÍA SOLEDAD,SI
12,HIDALGO JARAMILLO EDITH MARLENE,SI
14,CADENA VÉLEZ KARLA GABRIELA,SI
16,CAMBALA MONTECE CARLOS ALBERTO,SI
17,CÁRDENAS ESPINOZA JUAN JORGE,SI
19,VALLEJO JARAMILLO NORMA MARLENE,SI
20,CEDEÑO ZAMBRANO JOHANNA ELIZABETH,SI
21,CERDA MIRANDA GABRIELA PAMELA,SI
22,CHALÁ CRUZ JOSÉ FRANKLIN,SI
23,CHÁVEZ BAJAÑA KHARLA DEL ROCÍO,SI
24,COROZO AYOVÍ JORGE WILBER,SI
27,DOUMET CHEDRAUI MICHEL ANDRÉS,SI
30,ESPINOSA ANDRADE AUGUSTO XAVIER,SI
31,FLOR GIL BRENDA AZUCENA,SI
33,GARCÍA POZO DIEGO OSWALDO,SI
34,GARZÓN RICAURTE WILLIAM ANTONIO,SI
35,GAVILÁNEZ CAMACHO FAFO HOLGUÍN,SI
39,LLORET VALDIVIESO JUAN CRISTÓBAL,SI
40,MARÍN AGUIRRE ANA BELÉN,SI
42,COLAMARCO VERA PINUCCIA MAGALY,SI
44,NARANJO ALVARADO PRISCILA AMAPOLA,SI
45,OCHOA MORANTE MANUEL ALFREDO,SI
46,ORELLANA ROMÁN ROSA GINA,SI
47,YELA ACOSTA WERNER ANTONIO,SI
48,PEÑA PACHECO XIMENA DEL ROCÍO,SI
49,PLAZA CASTILLO LENIN,SI
51,PROAÑO CIFUENTES ROBERTH MAURICIO,SI
52,QUIJIJE DELGADO LUIS RAFAEL,SI
53,RODRÍGUEZ CEDEÑO ROSA ELENA,SI
55,RIVADENEIRA BUSTOS CARMEN MERCEDES,SI
56,PARRA VILLACIS JONATHAN EMANUEL,SI
57,SALGADO ANDRADE SILVIA BETZABETH,SI
60,ALEMÁN MARMOL MÓNICA ROCÍO,SI
62,VALLE PINARGOTE BAIRON LEONARDO,SI
65,VERA RODRÍGUEZ CARLOS ALFREDO,SI
66,VILLALVA MIRANDA LIRA DE LA PAZ,SI
67,VITERI GUALINGA CARLOS ELOY,SI
68,YAR ARAUJO JUAN CARLOS,SI
71,ANDRADE MUÑOZ WILMA PIEDAD,SI
74,BERNAL BERNAL ESTEBAN REMIGIO,SI
75,BURBANO MONTENEGRO FÉLIX FERNANDO,SI
76,PALACIOS ALEJANDRO CESAR GUSTAVO,SI
77,AZUERO RODAS ELISEO ALEXIS,SI
78,CUCALÓN CAMACHO HENRY EDUARDO,SI
79,FALQUEZ BATALLAS PEDRO CARLOS,SI
80,CALLEJAS BARONA FERNANDO,SI
81,GALLARDO CHEME CARLOS DAVID,SI
82,CAMPOVERDE ROBLES EMILIO ABSALÓN,SI
83,CARRIÓN MORENO CÉSAR ATAULFO,SI
85,GONZÁLEZ VÁSCONEZ TERESITA XIMENA,SI
86,YANDÚN POZO CÁSTULO RENÉ,SI
87,UGARTE HENRÍQUEZ JOSÉ FERNANDO,SI
88,OLLAGUE VALAREZO ZOILA PIEDAD,SI
91,CRUZ PROAÑO LUDOVICO ISRAEL,SI
94,ZAMBRANO VALLE EDUARDO MAURICIO,SI
95,PASPUEL GARCÍA REBECA SILVANA,SI
96,PEÑA ONTANEDA ELIO GERMÁN,SI
97,MONTAÑO GUISAMANO MAYRA MIGDONIA,SI
98,"PASSAILAIGUE MANOSALVAS DALLYANAMARIANELA",SI
101,DONOSO CHIRIBOGA PATRICIO,SI
104,GENDE CALAZACÓN ANGEL MESÍAS,SI
107,CANDELL SOTO JAIME ENRIQUE JIMMY,SI
108,DUCHI GUAMÁN MARÍA ENCARNACIÓN,SI
110,ROHON HERVAS CÉSAR EDUARDO,SI
112,TERÁN SALCEDO RAMÓN FORTUNATO,SI
113,TORRES TORRES LUIS FERNANDO,SI
114,LARREÁTEGUI FABARA MARÍA GABRIELA,SI
115,CARBO AGUIRRE JONATHAN ALEXI,SI
116,MINCHALA MURILLO RÓMULO MARCELO,SI
117,MONTAÑO VALENCIA MAE,SI
118,MORENO GUERRERO HENRY FREDY,SI
119,MUÑOZ ALARCÓN HÉCTOR PATRICIO,SI
120,PACHALA POMA LUIS ALBERTO,SI
121,TELLO BENALCÁZAR RAÚL ESTUPIÑAN,SI
122,CUESTA CONCARI MARÍA MERCEDES,SI
123,BUSTAMANTE BRICEÑO YONY ESPERANZA,SI
124,PUANCHIR PAYASHÑA TITO PEDRO,SI
125,ALARCÓN GUILLÍN FREDY OSCAR,SI
127,CALDERÓN JARAMILLO ALDRIN YUBER,SI
128,VINTIMILLA MOSCOSO PAOLA,SI
129,ZAMBRANO ORTIZ MARÍA ROBERTA,SI
130,PALACIOS MUÑOZ JUAN SEBASTIÁN,SI
131,PAREDES TORRES WASHINGTON ARTURO,SI
133,SIMBAÑA VILLARREAL ABDÓN MARCELO,SI
135,VERA MENDOZA TANLLY JANELA,SI
137,PADILLA SIERRA MAGGIE DOLORES,SI
