curul,asambleista,voto
7,MONTENEGRO NUÑEZ CHRISTIAN SANTIAGO,AUSENTE
9,ANDINO REINOSO MAURO EDMUNDO,AUSENTE
10,VITERI LOPEZ CHRISTIAN HUMBERTO,AUSENTE
11,RIVAS ALAVA ELIANA LISSET,AUSENTE
14,BERGMANN REYNA CARLOS ALBERTO,AUSENTE
22,CARVAJAL AGUIRRE MIGUEL ANGEL,AUSENTE
23,CASSINELLI CALI JUAN CARLOS,AUSENTE
25,CEDEÑO ZAMBRANO JOHANNA ELIZABETH,AUSENTE
29,CUESTA RIOS LIUBA ELISA,AUSENTE
37,LARREA VITERI LIDICE VANESSA,AUSENTE
39,GODOY ANDRADE GINA JAKELINE,AUSENTE
40,GONZALEZ SERRANO MIRYAM CATARINA,AUSENTE
43,GUDIÑO MENA ZOBEIDA GUISELA,AUSENTE
48,ISSA WAGNER NICOLAS JOSE,AUSENTE
55,AGUIÑAGA VALLEJO PAOLA MARCELA,AUSENTE
60,OCLES PADILLA ALEXANDRA,AUSENTE
69,FARFAN APONTE RICHARD WILSON,AUSENTE
72,MEDINA MERA VICTOR CLEMENTE,AUSENTE
74,AGUILAR TORRES MANUEL RAMIRO,AUSENTE
75,ARIAS FERNANDEZ VERONICA ELIZABETH,AUSENTE
77,SAENZ DE VITERI LAUTARO ENRIQUE,AUSENTE
78,SALAZAR CEDEÑO GUADALUPE DOLORES,AUSENTE
79,ANDRADE VARELA JUPITER GOZOSO DE LA CRUZ,AUSENTE
84,SANCHEZ ORDOÑEZ MONTGOMERY LUIS,AUSENTE
87,SOLANO MORENO ALEX FABIAN,AUSENTE
88,DIAZ COKA MARIA GABRIELA,AUSENTE
90,GUALAN JAPA MILTON RODRIGO,AUSENTE
99,PACHECO ORDOÑEZ BAYRON EDUARDO,AUSENTE
103,DONOSO CHIRIBOGA PATRICIO,AUSENTE
104,MONCAYO CEVALLOS JOSE RICARDO,AUSENTE
109,VELIZ BRIONES JOSE FELIX,AUSENTE
110,VERDUGA CEDEÑO MARY,AUSENTE
112,VILEMA FREIRE ANGEL RAMIRO,AUSENTE
113,POSSO SALGADO LUIS ANTONIO,AUSENTE
114,SOLORZANO SARRIA CESAR FAUSTO,AUSENTE
115,MONTAÑO VALENCIA MAE,AUSENTE
118,SALGADO RIVADENEIRA DIEGO,AUSENTE
119,MEDINA TAMBACO EMILY JESUS,AUSENTE
125,ZAMBRANO CABANILLA EDUARDO ALFONSO,AUSENTE
128,ZAPATA MANTILLA JOSE LEONIDAS,AUSENTE
129,URIBE LOPEZ FANNY ESTHER,AUSENTE
130,MERA RODRIGUEZ MARIA PAULINA,AUSENTE
132,REYES HIDALGO CRISTINA EUGENIA,AUSENTE
135,TERAN SALCEDO RAMON FORTUNATO,AUSENTE
1,ABAD VELEZ RAUL,SI
2,ACERO LANCHIMBA ESTHELA LILIANA,SI
3,AGUILAR PLACIDO ARMANDO,SI
4,MACHUCA MOSCOSO LINDA MARICELA,SI
5,AGUIRRE HIDALGO DORA ANDELA,SI
6,ALBAN TORRES MARIANA DEL ROCIO,SI
8,MUÑOZ VICUÑA MARIANGEL,SI
12,ARREGUI RUEDA MARCIA CECILIA,SI
13,BENAVIDES ZAMBRANO ZOILA TERESA,SI
15,BORJA PEREZ GALO,SI
16,RIVADENEIRA BURBANO GABRIELA ALEJANDRA,SI
17,BUSTAMANTE PONCE FERNANDO XAVIER,SI
18,CALDERON SALTOS RICHARD OSWALDO,SI
19,CALLE ANDRADE MARIA AUGUSTA,SI
20,CARRILLO BETTY,SI
21,CARRION MARIA JOSE,SI
24,CAYAMBE TIPAN FAUSTO HERIBERTO,SI
26,SALAZAR PAUCAR MARGOD ELISAVED,SI
27,CHICA AREVALO VINICIO VETHOWEN,SI
28,DAVILA RAMIREZ BELGICA ELIZABETH,SI
30,DE LA CRUZ BERNARDO HERMAN ULISES,SI
31,DE LA CRUZ GASPAR ADRIANA MIOSOTI,SI
32,DELGADO CHALA AGUSTIN JAVIER,SI
33,FAJARDO MOSQUERA LETTY VANESSA,SI
34,FALCONI LOQUI EVELYN PAMELA,SI
35,MONTIEL ARREAGA ROSAISELA DE LAS MERCEDES,SI
36,DE LA TORRE RAMIREZ PABLO ANTONIO,SI
38,GARZON RICAURTE WILLIAM ANTONIO,SI
41,GUAMAN CASTRO ALEX FRANCISCO,SI
42,GUAMANGATE ANTE LUIS GILBERTO,SI
44,GUEVARA VILLACRES VERONICA MARGARITA,SI
45,GUZMAN OCHOA LILIANA MAURA,SI
46,HERNANDEZ ENRIQUEZ VIRGILIO HUMBERTO,SI
47,MOSQUERA YANEZ ISABEL PIEDAD,SI
49,JEREZ PILLA BETTY MARICELA,SI
50,SILVA MALDONADO SOFIA IRENE,SI
51,ORTIZ GASPAR ESTHER FLAVIA,SI
52,BUENDIA HERDOIZA MARIA SOLEDAD,SI
53,LARRIVA ALVARADO OSCAR OSWALDO,SI
54,LEDESMA ZAMORA OSCAR ALFONSO,SI
56,MORENO CHIRIBOGA AMPARO DIANA,SI
57,TOBAR NUÑEZ RAUL IGNACIO,SI
58,MUÑOZ AVENDAÑO ROSA ELVIRA,SI
59,ALVARADO CARRION ROSANA,SI
61,CAZA TIPANTA HUGO RENE,SI
62,PADRON SAETEROS GLADYS PAULINA,SI
63,BRITO MENDOZA MONICA CRISTINA,SI
64,PEÑA CARRASCO DIANA LUCIA,SI
65,PEÑA PACHECO XIMENA DEL ROCIO,SI
66,PEÑAFIEL MONTESDEOCA JUANA MARISOL,SI
67,PONCE LEON XIMENA MERCEDES,SI
68,PROAÑO CIFUENTES ROBERTH MAURICIO,SI
70,RIVERA LOPEZ JOSE GABRIEL,SI
71,RIVERO DOGUER ANGEL ARMANDO,SI
73,VELASTEGUI RAMOS LEONARDO DARIO,SI
76,RODRIGUEZ DELGADO MARIA VERONICA,SI
81,MATIAS APOLINARIO RITA AZUCENA,SI
85,MOYA DUQUE HERMAN ANIBAL,SI
86,ALEMAN MARMOL MONICA ROCIO,SI
94,TERAN SARZOSA SEGUNDO FAUSTO,SI
95,VALAREZO ORDOÑEZ ROCIO DEL CARMEN,SI
96,VALLE PINARGOTE BAIRON LEONARDO,SI
97,COLLAGUAZO RODRIGO,SI
98,INTRIAGO MACIAS CARMEN ELENA,SI
106,VELA CHERONI MARIA SOLEDAD,SI
107,ARGUELLO TROYA BLANCA AZUCENA,SI
108,VELASCO ENRIQUEZ CARLOS ALBERTO,SI
111,VICUÑA MUÑOZ MARIA ALEJANDRA,SI
121,VILLACRESES PEÑA OCTAVIO XAVIER ENRIQUE,SI
122,VINTIMILLA JARRIN DIEGO ARMANDO,SI
123,VITERI GUALINGA CARLOS ELOY,SI
124,MERA RIVADENEIRA MARIA CECILIA,SI
126,ZAMBRANO CASTRO NORALMA ELIZABETH,SI
127,ZAMBRANO CHACHA ALBERTO ALEXANDER,SI
80,BUSTOS CHILIQUINGA ARCADIO,ABSTENCION
82,YANDUN POZO CASTULO RENE,ABSTENCION
83,ACACHO GONZALEZ PEPE LUIS,ABSTENCION
89,FIERRO OVIEDO PACO,ABSTENCION
91,ORELLANA MARQUINEZ MAGALI MARGOT,ABSTENCION
92,UMAJINGA GUAMAN CESAR,ABSTENCION
93,TIBAN GUALA LOURDES LICENIA,ABSTENCION
100,ALBAN GALLO MARINA ELIZABETH,ABSTENCION
101,AUQUILLA ORTEGA RAUL VICENTE,ABSTENCION
102,CHICAIZA TOAPANTA WILSON ALFONSO,ABSTENCION
105,AGUIRRE RODRIGUEZ FRANCISCO XAVIER,ABSTENCION
116,MORETA PANCHEZ MIGUEL ANGEL,ABSTENCION
117,PAEZ BENALCAZAR ANDRES TARQUINO,ABSTENCION
120,TORRES TORRES LUIS FERNANDO,ABSTENCION
131,CUCALON CAMACHO HENRY EDUARDO,ABSTENCION
133,TACLE GALARRAGA MOISES FERNANDO,ABSTENCION
134,SERRANO VITERI MERCEDES MARITZA,ABSTENCION
136,OÑATE LOMBEIBA WIMPER BOLIVAR,ABSTENCION
137,KRONFLE GOMEZ MARIA CRISTINA,ABSTENCION
