voto,curul,asambleista
AUSENTE,4,ARIAS FERNÁNDEZ VERÓNICA ELIZABETH
AUSENTE,5,ARIAS RAMÍREZ ALBERTO JESÚS
AUSENTE,9,BERGMANN REYNA CARLOS ALBERTO
AUSENTE,11,BUENDÍA HERDOÍZA MARÍA SOLEDAD
AUSENTE,14,DELGADO ORLANDO CÉSAR ANTONIO
AUSENTE,19,VALLEJO JARAMILLO NORMA MARLENE
AUSENTE,20,CEDEÑO ZAMBRANO JOHANNA ELIZABETH
AUSENTE,21,GREFA AVILEZ FLAVIO PATRICIO
AUSENTE,26,NÚÑEZ CRIOLLO JAIRO PATRICIO
AUSENTE,42,MENDOZA ARÉVALO DANIEL ISAAC
AUSENTE,48,PEÑA PACHECO XIMENA DEL ROCÍO
AUSENTE,67,VITERI GUALINGA CARLOS ELOY
AUSENTE,88,KRONFLE KOZHAYA HENRY FABIÁN
AUSENTE,92,CRUZ VACA JEANNINE DEL CISNE
AUSENTE,95,CADENA HUERTAS FRANCISCO JAVIER
AUSENTE,102,FLORES ARROYO JUAN FERNADO
AUSENTE,105,MOLINA CELI KARLA ELIZABETH
AUSENTE,108,DUCHI GUAMÁN MARÍA ENCARNACIÓN
AUSENTE,109,OLIVO PALLO JAIME FERNANDO
AUSENTE,110,ROHON HERVAS CÉSAR EDUARDO
AUSENTE,136,VILLAMAR JÁCOME PEDRO FABRICIO
SI,1,AGUIÑAGA VALLEJO PAOLA MARCELA
SI,2,JUCA SALAZAR MERCEDES DEL ROCÍO
SI,3,SERRANO SALGADO JOSÉ RICARDO
SI,6,YELA ACOSTA WERNER ANTONIO
SI,7,ARTEAGA MUÑOZ KARINA CECILIA
SI,8,BENAVIDES ZAMBRANO ZOILA TERESA
SI,10,BONILLA SALCEDO VIVIANA
SI,12,BUSTAMANTE MONTEROS RUBÉN ALEJANDRO
SI,13,SERRANO VALLEJO JORGE ERNESTO
SI,15,CALLE VERZOZI HERMUY
SI,16,CAMBALA MONTECE CARLOS ALBERTO
SI,17,CÁRDENAS ESPINOZA JUAN JORGE
SI,18,CARRIÓN CEVALLOS MARÍA JOSÉ
SI,22,SARZOSA MONTENEGRO JOHANNA MARCELA
SI,23,TORRES TORRES EURO IGNACIO
SI,24,COROZO AYOVÍ JORGE WILBER
SI,25,CUESTA RÍOS LIUBA ELISA
SI,27,RUIZ CEDEÑO ANA BELÉN
SI,28,DURÁN AGUILAR LILIANA ELIZABETH
SI,29,ESPÍN REYES EUGENIA SOFÍA
SI,30,ESPINOSA ANDRADE AUGUSTO XAVIER
SI,31,FLOR GIL BRENDA AZUCENA
SI,32,GARCÍA GAIBOR CARMEN MERCEDES
SI,33,GARCÍA POZO DIEGO OSWALDO
SI,34,MORENO CHIRIBOGA AMPARO DIANA
SI,35,GAVILÁNEZ CAMACHO FAFO HOLGUÍN
SI,36,GUEVARA VILLACRÉS VERÓNICA MARGARITA
SI,37,HOLGUÍN NARANJO MARCELA PRISCILA
SI,38,ASPIAZU INFANTE CARMEN MARJORIE
SI,39,DELGADO ORELLANA SUSANA DEL CARMEN
SI,40,QUINDIGALLE LICTAPUZON GUILLERMO ORLANDO
SI,41,MELO GARZÓN ESTEBAN ANDRÉS
SI,43,MUÑOZ LÓPEZ CHRISTIAN PABEL
SI,44,NARANJO ALVARADO PRISCILA AMAPOLA
SI,45,OCHOA MORANTE MANUEL ALFREDO
SI,46,ALONSO FERNÁNDEZ FÉLIX FREDY
SI,47,PALACIOS VELÁSQUEZ SONIA LUCRECIA
SI,49,PLAZA CASTILLO LENIN
SI,50,POMA HERRERA YOFRE MARTÍN
SI,51,PROAÑO CIFUENTES ROBERTH MAURICIO
SI,52,QUIJIJE DELGADO LUIS RAFAEL
SI,53,QUIÑONEZ OCAMPO JULIO CÉSAR
SI,54,RIVADENEIRA BURBANO GABRIELA ALEJANDRA
SI,55,RIVADENEIRA BUSTOS CARMEN MERCEDES
SI,56,SALAZAR CEDEÑO GUADALUPE DOLORES
SI,57,SALGADO ANDRADE SILVIA BETZABETH
SI,58,SAMANIEGO MAIGUA FRANKLIN OMAR
SI,59,SÁNCHEZ REYES MONTGOMERY
SI,60,ALEMÁN MARMOL MÓNICA ROCÍO
SI,61,PEÑA BERNAL JOAQUÍN ANTONIO
SI,62,TENEZACA LOPEZ MABEL MICHELL
SI,63,VELIN CORTÉS JUAN PABLO
SI,64,VERA FLORES WENDY VANESSA
SI,65,VERA RODRÍGUEZ CARLOS ALFREDO
SI,66,VELASTEGUI NARANJO OLGUER FABRICIO
SI,68,YAR ARAUJO JUAN CARLOS
SI,69,YUNDA MACHADO JORGE HOMERO
SI,70,ZAMBRANO ARTEAGA JOSE RICARDO
SI,71,ANDRADE MUÑOZ WILMA PIEDAD
SI,72,ASÁN WONSANG JOSÉ FRANCISCO
SI,73,AUQUILLA ORTEGA RAÚL VICENTE
SI,74,BERNAL BERNAL ESTEBAN REMIGIO
SI,75,CERDA ROSERO THALIA GENOVEVA
SI,76,ZAMBRANO CASTRO NORALMA ELIZABETH
SI,77,AZUERO RODAS ELISEO ALEXIS
SI,78,ORDOÑEZ ZAMBRANO SANDRA DEL ROCÍO
SI,79,AÑAZCO ROMERO DOLORES LETICIA
SI,80,CALLEJAS BARONA FERNANDO
SI,81,CAMPAIN BRAMBILLA RINA ASUNCIÓN
SI,82,CAMPOVERDE ROBLES EMILIO ABSALÓN
SI,83,CARRIÓN MORENO CÉSAR ATAULFO
SI,84,ZAMBRANO CHACHA ALBERTO ALEXANDER
SI,85,GONZÁLEZ VÁSCONEZ TERESITA XIMENA
SI,86,YANDÚN POZO CÁSTULO RENÉ
SI,87,HENRÍQUEZ JAIME PATRICIA IVONNE
SI,89,CASTANIER JARAMILLO XAVIER HOMERO
SI,90,LÓPEZ GÓMEZ DE LA TORRE MARÍA CRISTINA
SI,91,CRUZ PROAÑO LUDOVICO ISRAEL
SI,93,CUESTA ORELLANA MARÍA DE LOURDES
SI,94,ZAMBRANO VALLE EDUARDO MAURICIO
SI,96,PEÑA ONTANEDA ELIO GERMÁN
SI,97,MONTAÑO GUISAMANO MAYRA MIGDONIA
SI,98,
SI,99,REYES HIDALGO CRISTINA EUGENIA
SI,100,CURICHUMBI YUPANQUI PEDRO
SI,101,DONOSO CHIRIBOGA PATRICIO
SI,103,VERDEZOTO REINOSO ROSA ISABEL
SI,104,GENDE CALAZACÓN ANGEL MESÍAS
SI,106,ZAMBRANO VERA MARIANO
SI,107,CANDELL SOTO JAIME ENRIQUE JIMMY
SI,111,TACLE GARCÍA SAMIA
SI,112,TERÁN SALCEDO RAMÓN FORTUNATO
SI,113,TORRES TORRES LUIS FERNANDO
SI,114,LARREÁTEGUI FABARA MARÍA GABRIELA
SI,115,MENDOZA PALMA JOFFRE PATRICIO
SI,116,MINCHALA MURILLO RÓMULO MARCELO
SI,117,MONTAÑO VALENCIA MAE
SI,118,MORENO GUERRERO HENRY FREDY
SI,119,HIDALGO ESPINEL SANDRA VICTORIA CARMEN
SI,120,PACHALA POMA LUIS ALBERTO
SI,121,TELLO BENALCÁZAR RAÚL ESTUPIÑAN
SI,122,CUESTA CONCARI MARÍA MERCEDES
SI,123,PEÑAFIEL IZQUIERDO EDDY COLÓN
SI,124,PUANCHIR PAYASHÑA TITO PEDRO
SI,125,ALARCÓN GUILLÍN FREDY OSCAR
SI,126,SOLORZANO SARRIA CESAR FAUSTO
SI,127,POVEDA ALVARADO ERIKA SOPHIA
SI,128,MARÍN LAVAYEN DENNIS GUSTAVO
SI,129,ZAMBRANO ORTIZ MARÍA ROBERTA
SI,130,PALACIOS MUÑOZ JUAN SEBASTIÁN
SI,131,PAREDES TORRES WASHINGTON ARTURO
SI,132,ROMERO LOAYZA FRANCO SEGUNDO
SI,133,GARZÓN TABANGO CHRISTIAN ALFREDO
SI,134,SUQUILANDA VALDIVIESO BYRON VINICIO
SI,135,CEDEÑO LOOR LENIN PAÚL
SI,137,YÉPEZ MARTÍNEZ HÉCTOR JOSÉ
