curul,asambleista,voto
4,MACHUCA MOSCOSO LINDA MARICELA,AUSENTE
7,TORRES CEDEÑO KERLLY ANABEL,AUSENTE
11,RIVAS ALAVA ELIANA LISSET,AUSENTE
24,CAYAMBE TIPAN FAUSTO HERIBERTO,AUSENTE
30,DE LA CRUZ BERNARDO HERMAN ULISES,AUSENTE
41,GUAMAN CASTRO ALEX FRANCISCO,AUSENTE
47,MOSQUERA YANEZ ISABEL PIEDAD,AUSENTE
48,ISSA WAGNER NICOLAS JOSE,AUSENTE
56,MELO GARZON ESTEBAN ANDRES,AUSENTE
58,MUÑOZ AVENDAÑO ROSA ELVIRA,AUSENTE
63,BRITO MENDOZA MONICA CRISTINA,AUSENTE
65,PEÑA PACHECO XIMENA DEL ROCIO,AUSENTE
70,RIVERA LOPEZ JOSE GABRIEL,AUSENTE
71,RIVERO DOGUER ANGEL ARMANDO,AUSENTE
77,SAENZ DE VITERI LAUTARO ENRIQUE,AUSENTE
78,SALAZAR CEDEÑO GUADALUPE DOLORES,AUSENTE
90,GUALAN JAPA MILTON RODRIGO,AUSENTE
93,TIBAN GUALA LOURDES LICENIA,AUSENTE
99,PACHECO ORDOÑEZ BAYRON EDUARDO,AUSENTE
113,POSSO SALGADO LUIS ANTONIO,AUSENTE
117,PAEZ BENALCAZAR ANDRES TARQUINO,AUSENTE
131,CUCALON CAMACHO HENRY EDUARDO,AUSENTE
1,ABAD VELEZ RAUL,SI
2,ACERO LANCHIMBA ESTHELA LILIANA,SI
3,LANDAZURI OLMEDO LUDIS CLAUDINA,SI
5,AGUIRRE HIDALGO DORA ANDELA,SI
6,ALBAN TORRES MARIANA DEL ROCIO,SI
8,MUÑOZ VICUÑA MARIANGEL,SI
9,ANDINO REINOSO MAURO EDMUNDO,SI
10,VITERI LOPEZ CHRISTIAN HUMBERTO,SI
12,ARREGUI RUEDA MARCIA CECILIA,SI
13,MARQUEZ LOPEZ JOSE LENIN,SI
14,BERGMANN REYNA CARLOS ALBERTO,SI
15,BORJA PEREZ GALO,SI
16,RIVADENEIRA BURBANO GABRIELA ALEJANDRA,SI
17,BUSTAMANTE PONCE FERNANDO XAVIER,SI
18,CALDERON SALTOS RICHARD OSWALDO,SI
19,CASANOVA CEPEDA XAVIER IVAN,SI
20,CARRILLO BETTY,SI
21,CARRION MARIA JOSE,SI
22,CARVAJAL AGUIRRE MIGUEL ANGEL,SI
23,CASSINELLI CALI JUAN CARLOS,SI
25,CEDEÑO ZAMBRANO JOHANNA ELIZABETH,SI
26,CHAVEZ CANALES HOLGER EZEQUIEL,SI
27,CHICA AREVALO VINICIO VETHOWEN,SI
28,CORDOVA ENCALADA EDGAR EDUARDO,SI
29,CUESTA RIOS LIUBA ELISA,SI
31,ESTARELLAS SOLIS FRANCISCO JOSE,SI
32,DELGADO CHALA AGUSTIN JAVIER,SI
33,FAJARDO MOSQUERA LETTY VANESSA,SI
34,FALCONI LOQUI EVELYN PAMELA,SI
35,GAGLIARDO LOOR GASTON,SI
36,GALVAN GRACIA MARIA ESPERANZA,SI
37,LARREA VITERI LIDICE VANESSA,SI
38,GARZON RICAURTE WILLIAM ANTONIO,SI
39,GODOY ANDRADE GINA JAKELINE,SI
40,GONZALEZ SERRANO MIRYAM CATARINA,SI
42,GUAMANGATE ANTE LUIS GILBERTO,SI
43,GUDIÑO MENA ZOBEIDA GUISELA,SI
44,GUEVARA VILLACRES VERONICA MARGARITA,SI
45,GUZMAN OCHOA LILIANA MAURA,SI
46,GUTIERREZ MOSCOSO MARIA EUGENIA,SI
49,JEREZ PILLA BETTY MARICELA,SI
50,JUEZ JUEZ OMAR JUSEPH,SI
51,BAZURTO ROLDAN NANCIS CELESTE,SI
52,BUENDIA HERDOIZA MARIA SOLEDAD,SI
53,LARRIVA ALVARADO OSCAR OSWALDO,SI
54,LEDESMA ZAMORA OSCAR ALFONSO,SI
55,AGUIÑAGA VALLEJO PAOLA MARCELA,SI
57,TOBAR NUÑEZ RAUL IGNACIO,SI
59,ALVARADO CARRION ROSANA,SI
60,OCLES PADILLA ALEXANDRA,SI
61,CAZA TIPANTA HUGO RENE,SI
62,PADRON SAETEROS GLADYS PAULINA,SI
64,PEÑA CARRASCO DIANA LUCIA,SI
66,PEÑAFIEL MONTESDEOCA JUANA MARISOL,SI
67,PONCE LEON XIMENA MERCEDES,SI
68,PROAÑO CIFUENTES ROBERTH MAURICIO,SI
69,FARFAN APONTE RICHARD WILSON,SI
72,MEDINA MERA VICTOR CLEMENTE,SI
73,REINOSO LESCANO MARIA ELIZABETH,SI
75,ARIAS FERNANDEZ VERONICA ELIZABETH,SI
76,RODRIGUEZ DELGADO MARIA VERONICA,SI
79,ANDRADE VARELA JUPITER GOZOSO DE LA CRUZ,SI
81,MATIAS APOLINARIO RITA AZUCENA,SI
84,SANCHEZ ORDOÑEZ MONTGOMERY LUIS,SI
85,MOYA DUQUE HERMAN ANIBAL,SI
86,SERRANO REYES NELSON ALCIDES,SI
87,SOLANO MORENO ALEX FABIAN,SI
88,DIAZ COKA MARIA GABRIELA,SI
94,TERAN SARZOSA SEGUNDO FAUSTO,SI
95,VALAREZO ORDOÑEZ ROCIO DEL CARMEN,SI
96,VALLE PINARGOTE BAIRON LEONARDO,SI
97,COLLAGUAZO RODRIGO,SI
98,VELA CAIZAPANTA ANGEL RAMIRO,SI
106,VELA CHERONI MARIA SOLEDAD,SI
107,ARGUELLO TROYA BLANCA AZUCENA,SI
108,VELASCO ENRIQUEZ CARLOS ALBERTO,SI
109,VELEZ MARLENE MARGARITA,SI
110,VERDUGA CEDEÑO MARY,SI
111,VICUÑA MUÑOZ MARIA ALEJANDRA,SI
112,VILEMA FREIRE ANGEL RAMIRO,SI
121,VILLACRESES PEÑA OCTAVIO XAVIER ENRIQUE,SI
122,VINTIMILLA JARRIN DIEGO ARMANDO,SI
123,COELLO JARAMILLO DIANA ANGELINA,SI
124,ZAMBRANO ARTEAGA JOSE RICARDO,SI
125,ZAMBRANO CABANILLA EDUARDO ALFONSO,SI
126,ZAMBRANO CASTRO NORALMA ELIZABETH,SI
127,ZAMBRANO CHACHA ALBERTO ALEXANDER,SI
128,ZAPATA MANTILLA JOSE LEONIDAS,SI
129,URIBE LOPEZ FANNY ESTHER,SI
74,AGUILAR TORRES MANUEL RAMIRO,NO
136,VITERI JIMENEZ CYNTHIA,BLANCO
137,KRONFLE GOMEZ MARIA CRISTINA,BLANCO
80,CASTRO AJILA GLADYS LUCIA,ABSTENCION
82,YANDUN POZO CASTULO RENE,ABSTENCION
83,ACACHO GONZALEZ PEPE LUIS,ABSTENCION
89,FIERRO OVIEDO PACO,ABSTENCION
91,ORELLANA MARQUINEZ MAGALI MARGOT,ABSTENCION
92,UMAJINGA GUAMAN CESAR,ABSTENCION
100,GUTIERREZ BORBUA FAUSTO GILMAR,ABSTENCION
101,AUQUILLA ORTEGA RAUL VICENTE,ABSTENCION
102,CHICAIZA TOAPANTA WILSON ALFONSO,ABSTENCION
103,DONOSO CHIRIBOGA PATRICIO,ABSTENCION
104,MONCAYO CEVALLOS JOSE RICARDO,ABSTENCION
105,MACIAS HUERTA ANDREA,ABSTENCION
114,SOLORZANO SARRIA CESAR FAUSTO,ABSTENCION
115,MONTAÑO VALENCIA MAE,ABSTENCION
116,MORETA PANCHEZ MIGUEL ANGEL,ABSTENCION
118,SALGADO RIVADENEIRA DIEGO,ABSTENCION
119,CHICA ARTEAGA GUNTARD PAVEL,ABSTENCION
120,TORRES TORRES LUIS FERNANDO,ABSTENCION
130,TAPIA LOMBEYDA LUIS FERNANDO,ABSTENCION
132,REYES HIDALGO CRISTINA EUGENIA,ABSTENCION
133,TACLE GALARRAGA MOISES FERNANDO,ABSTENCION
134,ROMERO LOAYZA FRANCO SEGUNDO,ABSTENCION
135,TERAN SALCEDO RAMON FORTUNATO,ABSTENCION
