asambleista,curul,voto
ABAD VELEZ RAUL,1,AUSENTE
HAGO CELI FRANCISCO WAIKING,4,AUSENTE
MUÑOZ VICUÑA MARIANGEL,8,AUSENTE
VITERI LOPEZ CHRISTIAN HUMBERTO,10,AUSENTE
ARREGUI RUEDA MARCIA CECILIA,12,AUSENTE
DE LA CRUZ GASPAR ADRIANA MIOSOTI,31,AUSENTE
MOSQUERA YANEZ ISABEL PIEDAD,47,AUSENTE
PATIÑO AROCA RAUL LEONARDO,63,AUSENTE
PEÑA PACHECO XIMENA DEL ROCIO,65,AUSENTE
PEÑAFIEL MONTESDEOCA JUANA MARISOL,66,AUSENTE
PONCE LEON XIMENA MERCEDES,67,AUSENTE
RIVERO DOGUER ANGEL ARMANDO,71,AUSENTE
MEDINA MERA VICTOR CLEMENTE,72,AUSENTE
SANCHEZ ORDOÑEZ MONTGOMERY LUIS,84,AUSENTE
VELEZ MARLENE MARGARITA,109,AUSENTE
VICUÑA MUÑOZ MARIA ALEJANDRA,111,AUSENTE
MORETA PANCHEZ MIGUEL ANGEL,116,AUSENTE
CHICA PAVEL,119,AUSENTE
MORALES POZO LENIN ALBERTO,2,SI
AGUILAR PLACIDO ARMANDO,3,SI
AGUIRRE HIDALGO DORA ANDELA,5,SI
ALBAN TORRES MARIANA DEL ROCIO,6,SI
TORRES CEDEÑO KERLLY ANABEL,7,SI
ANDINO REINOSO MAURO EDMUNDO,9,SI
RIVAS ALAVA ELIANA LISSET,11,SI
MARQUEZ LOPEZ JOSE LENIN,13,SI
BERGMANN REYNA CARLOS ALBERTO,14,SI
BORJA PEREZ GALO,15,SI
RIVADENEIRA BURBANO GABRIELA ALEJANDRA,16,SI
BUSTAMANTE PONCE FERNANDO XAVIER,17,SI
CALDERON SALTOS RICHARD OSWALDO,18,SI
CALLE ANDRADE MARIA AUGUSTA,19,SI
CARRILLO BETTY,20,SI
CARRION MARIA JOSE,21,SI
CARVAJAL AGUIRRE MIGUEL ANGEL,22,SI
BRAVO RAMIREZ MARIA LORENA,23,SI
CONSTANTE NIETO MARIANA DE LAS MERCEDES,24,SI
CEDEÑO ZAMBRANO JOHANNA ELIZABETH,25,SI
CHAVEZ CANALES HOLGER EZEQUIEL,26,SI
CHICA AREVALO VINICIO VETHOWEN,27,SI
CORDOVA ENCALADA EDGAR EDUARDO,28,SI
CUESTA RIOS LIUBA ELISA,29,SI
DE LA CRUZ BERNARDO HERMAN ULISES,30,SI
PIÑAN CAJAS MARIA ALEGRIA,32,SI
FAJARDO MOSQUERA LETTY VANESSA,33,SI
FALCONI LOQUI EVELYN PAMELA,34,SI
MONTIEL ARREAGA ROSAISELA DE LAS MERCEDES,35,SI
GALVAN GRACIA MARIA ESPERANZA,36,SI
MENDOZA DANIEL ISAAC,37,SI
CALAZACON AGUAVIL MARIA ALBERTINA,38,SI
GODOY ANDRADE GINA JAKELINE,39,SI
GONZALEZ SERRANO MIRYAM CATARINA,40,SI
GUAMAN CASTRO ALEX FRANCISCO,41,SI
BOMBON LOPEZ BLANCA CECILIA,42,SI
JARAMILLO RODRIGUEZ VICTOR HUGO,43,SI
GUEVARA VILLACRES VERONICA MARGARITA,44,SI
RODAS MARCA CARLOS EDUARDO,45,SI
HERNANDEZ ENRIQUEZ VIRGILIO HUMBERTO,46,SI
CRUZ SALAZAR FRANCISCA GABRIELA,48,SI
JEREZ PILLA BETTY MARICELA,49,SI
JUEZ JUEZ OMAR JUSEPH,50,SI
ORTIZ GASPAR ESTHER FLAVIA,51,SI
BUENDIA HERDOIZA MARIA SOLEDAD,52,SI
JAIGUA ALVARADO CELIA MARIA,53,SI
LEDESMA ZAMORA OSCAR ALFONSO,54,SI
AGUIÑAGA VALLEJO PAOLA MARCELA,55,SI
MELO GARZON ESTEBAN ANDRES,56,SI
TOBAR NUÑEZ RAUL IGNACIO,57,SI
MUÑOZ AVENDAÑO ROSA ELVIRA,58,SI
ALVARADO CARRION ROSANA,59,SI
OCLES PADILLA ALEXANDRA,60,SI
PABON CARANQUI PAOLA VERENICE,61,SI
PADRON SAETEROS GLADYS PAULINA,62,SI
PEÑA CARRASCO DIANA LUCIA,64,SI
PROAÑO CIFUENTES ROBERTH MAURICIO,68,SI
FARFAN APONTE RICHARD WILSON,69,SI
RIVERA LOPEZ JOSE GABRIEL,70,SI
REINOSO LESCANO MARIA ELIZABETH,73,SI
ARIAS FERNANDEZ VERONICA ELIZABETH,75,SI
RODRIGUEZ DELGADO MARIA VERONICA,76,SI
GARCIA PLUAS BEATRIZ CANDELARIA,77,SI
SUBIA BARREIRO BOLIVAR STALIN,78,SI
ANDRADE SOLORZANO LUIS ALBERTO,79,SI
VILLAO PANCHANA RAUL ELIAS,81,SI
MOYA DUQUE HERMAN ANIBAL,85,SI
SERRANO REYES NELSON ALCIDES,86,SI
SOLANO MORENO ALEX FABIAN,87,SI
DIAZ COKA MARIA GABRIELA,88,SI
CAJAS ARCOS PAOLA DE LOS ANGELES,94,SI
IÑIGUEZ APOLO LENIN MAURICIO,95,SI
MEJIA PLUAS NILDA CECIBEL,96,SI
VASCONEZ ARTEAGA ANNY MARLLELY,97,SI
INTRIAGO MACIAS CARMEN ELENA,98,SI
PACHECO ORDOÑEZ BAYRON EDUARDO,99,SI
SOLORZANO MANUEL ANTONIO,106,SI
ARGUELLO TROYA BLANCA AZUCENA,107,SI
VELASCO ENRIQUEZ CARLOS ALBERTO,108,SI
VERDUGA CEDEÑO MARY,110,SI
ANDINO ROBALINO ANGELICA MARIA,112,SI
VILLACRESES PEÑA OCTAVIO XAVIER ENRIQUE,121,SI
VINTIMILLA JARRIN DIEGO ARMANDO,122,SI
VITERI GUALINGA CARLOS ELOY,123,SI
ZAMBRANO ARTEAGA JOSE RICARDO,124,SI
ZAMBRANO CABANILLA EDUARDO ALFONSO,125,SI
ZAMBRANO CASTRO NORALMA ELIZABETH,126,SI
ZAMBRANO CHACHA ALBERTO ALEXANDER,127,SI
ZAPATA MANTILLA JOSE LEONIDAS,128,SI
AGUAS SAN MIGUEL MILTON CAMILO,129,SI
AGUILAR TORRES MANUEL RAMIRO,74,NO
ACACHO GONZALEZ PEPE LUIS,83,NO
FIERRO OVIEDO PACO,89,NO
GUTIERREZ BORBUA FAUSTO GILMAR,100,NO
BUSTOS CHILIQUINGA ARCADIO,80,ABSTENCION
YANDUN POZO CASTULO RENE,82,ABSTENCION
GUALAN JAPA MILTON RODRIGO,90,ABSTENCION
ORELLANA MARQUINEZ MAGALI MARGOT,91,ABSTENCION
SALAZAR CHICAIZA ABRAHAN ELIO,92,ABSTENCION
TIBAN GUALA LOURDES LICENIA,93,ABSTENCION
AUQUILLA ORTEGA RAUL VICENTE,101,ABSTENCION
CHICAIZA TOAPANTA WILSON ALFONSO,102,ABSTENCION
DONOSO CHIRIBOGA PATRICIO,103,ABSTENCION
MONCAYO CEVALLOS JOSE RICARDO,104,ABSTENCION
BORJA MANCHENO VIVIANA ELVIRA,105,ABSTENCION
POSSO SALGADO LUIS ANTONIO,113,ABSTENCION
SOLORZANO SARRIA CESAR FAUSTO,114,ABSTENCION
MONTAÑO VALENCIA MAE,115,ABSTENCION
PAEZ BENALCAZAR ANDRES TARQUINO,117,ABSTENCION
SALGADO RIVADENEIRA DIEGO,118,ABSTENCION
TORRES COBO LUIS ESTEBAN,120,ABSTENCION
TAPIA LOMBEYDA LUIS FERNANDO,130,ABSTENCION
CUCALON CAMACHO HENRY EDUARDO,131,ABSTENCION
REYES HIDALGO CRISTINA EUGENIA,132,ABSTENCION
TACLE GALARRAGA MOISES FERNANDO,133,ABSTENCION
ROMERO LOAYZA FRANCO SEGUNDO,134,ABSTENCION
TERAN SALCEDO RAMON FORTUNATO,135,ABSTENCION
VITERI JIMENEZ CYNTHIA,136,ABSTENCION
KRONFLE GOMEZ MARIA CRISTINA,137,ABSTENCION
