curul,asambleista,voto
7,MONTENEGRO NUÑEZ CHRISTIAN SANTIAGO,AUSENTE
8,ORDOÑEZ ALMEIDA FAUSTO EFRAIN,AUSENTE
9,ANDINO REINOSO MAURO EDMUNDO,AUSENTE
10,VITERI LOPEZ CHRISTIAN HUMBERTO,AUSENTE
12,VILLAMAR CASAL JOSE LEONIDAS,AUSENTE
18,QUIMBIULCO BEDON LORENA GABRIELA,AUSENTE
20,CARRILLO BETTY,AUSENTE
22,CARVAJAL AGUIRRE MIGUEL ÁNGEL,AUSENTE
38,GARZÓN RICAURTE WILLIAM ANTONIO,AUSENTE
48,ISSA WAGNER NICOLAS JOSE,AUSENTE
49,JEREZ PILLA BETTY MARICELA,AUSENTE
58,MUÑOZ AVENDAÑO ROSA ELVIRA,AUSENTE
60,OCLES PADILLA ALEXANDRA,AUSENTE
61,CAZA TIPANTA HUGO RENE,AUSENTE
64,TORRES LARA JOSE EDUARDO,AUSENTE
68,PROAÑO CIFUENTES ROBERTH MAURICIO,AUSENTE
71,RIVERO DOGUER ANGEL ARMANDO,AUSENTE
75,ARIAS FERNÁNDEZ VERÓNICA ELIZABETH,AUSENTE
76,RODRIGUEZ DELGADO MARIA VERONICA,AUSENTE
77,SAENZ DE VITERI LAUTARO ENRIQUE,AUSENTE
79,ANDRADE VARELA JUPITER GOZOSO DE LA CRUZ,AUSENTE
84,SANCHEZ ORDOÑEZ MONTGOMERY LUIS,AUSENTE
86,ALEMÁN MARMOL MÓNICA ROCÍO,AUSENTE
87,DAHIK ASTUDILLO REYTA GIOMAR,AUSENTE
88,DIAZ COKA MARIA GABRIELA,AUSENTE
99,PACHECO ORDOÑEZ BAYRON EDUARDO,AUSENTE
100,GUTIERREZ BORBUA FAUSTO GILMAR,AUSENTE
101,AUQUILLA ORTEGA RAÚL VICENTE,AUSENTE
105,MOREIRA MACIAS GRACE HOLANDA,AUSENTE
109,VELIZ BRIONES JOSE FELIX,AUSENTE
113,POSSO SALGADO LUIS ANTONIO,AUSENTE
114,SOLORZANO SARRIA CESAR FAUSTO,AUSENTE
116,MORETA PANCHEZ MIGUEL ANGEL,AUSENTE
122,VINTIMILLA JARRIN DIEGO ARMANDO,AUSENTE
124,ZAMBRANO ARTEAGA JOSE RICARDO,AUSENTE
125,MORAN AMALIA,AUSENTE
128,SERRANO SEGURA GRACE MARISOL,AUSENTE
129,URIBE LOPEZ FANNY ESTHER,AUSENTE
130,TAPIA LOMBEYDA LUIS FERNANDO,AUSENTE
131,CUCALÓN CAMACHO HENRY EDUARDO,AUSENTE
137,KRONFLE GOMEZ MARIA CRISTINA,AUSENTE
1,ABAD VELEZ RAUL,SI
2,ACERO LANCHIMBA ESTHELA LILIANA,SI
3,AGUILAR PLACIDO ARMANDO,SI
4,GOMEZ WALFANDERY IRMA,SI
5,AGUIRRE HIDALGO DORA ANADELA,SI
6,ALBAN TORRES MARIANA DEL ROCIO,SI
11,RIVAS ALAVA ELIANA LISSET,SI
13,MARQUEZ LOPEZ JOSE LENIN,SI
14,BERGMANN REYNA CARLOS ALBERTO,SI
15,BORJA PEREZ GALO,SI
16,RIVADENEIRA BURBANO GABRIELA ALEJANDRA,SI
19,CALLE ANDRADE MARIA AUGUSTA,SI
21,CARRIÓN CEVALLOS MARÍA JOSÉ,SI
23,BRAVO RAMIREZ MARIA LORENA,SI
24,CONSTANTE NIETO MARIANA DE LAS MERCEDES,SI
25,CEDEÑO ZAMBRANO JOHANNA ELIZABETH,SI
26,CHAVEZ CANALES HOLGER EZEQUIEL,SI
27,CHICA AREVALO VINICIO VETHOWEN,SI
28,CORDOVA ENCALADA EDGAR EDUARDO,SI
29,CUESTA RÍOS LIUBA ELISA,SI
30,DE LA CRUZ BERNARDO HERMAN ULISES,SI
31,DE LA CRUZ GASPAR ADRIANA MIOSOTI,SI
32,DELGADO CHALA AGUSTIN JAVIER,SI
33,FAJARDO MOSQUERA LETTY VANESSA,SI
34,FALCONI LOQUI EVELYN PAMELA,SI
35,GAGLIARDO LOOR GASTON,SI
36,DE LA TORRE RAMIREZ PABLO ANTONIO,SI
37,MENDOZA ARÉVALO DANIEL ISAAC,SI
39,GODOY ANDRADE GINA JAKELINE,SI
40,GONZALEZ SERRANO MIRYAM CATARINA,SI
41,GUAMAN CASTRO ALEX FRANCISCO,SI
42,GUAMANGATE ANTE LUIS GILBERTO,SI
43,JARAMILLO RODRIGUEZ VICTOR HUGO,SI
44,GUEVARA VILLACRÉS VERÓNICA MARGARITA,SI
45,GUZMAN OCHOA LILIANA MAURA,SI
46,HERNANDEZ ENRIQUEZ VIRGILIO HUMBERTO,SI
47,MOSQUERA YANEZ ISABEL PIEDAD,SI
50,SILVA MALDONADO SOFIA IRENE,SI
51,ORTIZ GASPAR ESTHER FLAVIA,SI
52,REYES MACHUCA EFREN RODRIGO,SI
54,LEDESMA ZAMORA OSCAR ALFONSO,SI
55,AGUIÑAGA VALLEJO PAOLA MARCELA,SI
56,MELO GARZÓN ESTEBAN ANDRÉS,SI
57,TOBAR NUÑEZ RAUL IGNACIO,SI
59,ALVARADO CARRION ROSANA,SI
62,SANANGO AUCACAMA LUIS LORENZO,SI
63,BRITO MENDOZA MONICA CRISTINA,SI
65,PEÑA PACHECO XIMENA DEL ROCÍO,SI
66,PEÑAFIEL MONTESDEOCA JUANA MARISOL,SI
67,PONCE LEON XIMENA MERCEDES,SI
69,FARFAN APONTE RICHARD WILSON,SI
70,JIJON BUENDIA ITALIA LUISA,SI
72,MEDINA MERA VICTOR CLEMENTE,SI
73,REINOSO LESCANO MARIA ELIZABETH,SI
78,SUBIA BARREIRO BOLIVAR STALIN,SI
81,MATIAS APOLINARIO RITA AZUCENA,SI
85,MOYA DUQUE HERMAN ANIBAL,SI
94,TERAN SARZOSA SEGUNDO FAUSTO,SI
95,VALAREZO ORDOÑEZ ROCIO DEL CARMEN,SI
96,VALLE PINARGOTE BAIRON LEONARDO,SI
97,VASCONEZ ARTEAGA ANNY MARLLELY,SI
98,VELA CAIZAPANTA ANGEL RAMIRO,SI
106,VELA CHERONI MARIA SOLEDAD,SI
107,ARGUELLO TROYA BLANCA AZUCENA,SI
108,CHAMORRO HIDALGO YOLANDA JOSEFINA,SI
110,VERDUGA CEDEÑO MARY,SI
111,VICUÑA MUÑOZ MARIA ALEJANDRA,SI
121,VILLACRESES PEÑA OCTAVIO XAVIER ENRIQUE,SI
123,VITERI GUALINGA CARLOS ELOY,SI
126,ZAMBRANO CASTRO NORALMA ELIZABETH,SI
127,ZAMBRANO CHACHA ALBERTO ALEXANDER,SI
17,BUSTAMANTE PONCE FERNANDO XAVIER,NO
53,LARRIVA ALVARADO OSCAR OSWALDO,NO
74,GUZMAN SEGOVIA JOSE FRANCISCO,NO
80,BUSTOS CHILIQUINGA ARCADIO,NO
82,YANDÚN POZO CÁSTULO RENÉ,NO
83,ACACHO GONZALEZ PEPE LUIS,NO
89,FIERRO OVIEDO PACO,NO
90,GUALAN JAPA MILTON RODRIGO,NO
91,ORELLANA MARQUINEZ MAGALI MARGOT,NO
92,UMAJINGA GUAMAN CESAR,NO
93,TIBAN GUALA LOURDES LICENIA,NO
102,CHICAIZA TOAPANTA WILSON ALFONSO,NO
103,DONOSO CHIRIBOGA PATRICIO,NO
104,MONCAYO CEVALLOS JOSE RICARDO,NO
112,ANDINO ROBALINO ANGELICA MARIA,NO
115,MONTAÑO VALENCIA MAE,NO
117,LLANES SUAREZ HENRY MANUEL,NO
118,SALGADO RIVADENEIRA DIEGO,NO
119,CHICA ARTEAGA GUNTARD PAVEL,NO
120,TORRES TORRES LUIS FERNANDO,NO
132,REYES HIDALGO CRISTINA EUGENIA,NO
133,TACLE GALARRAGA MOISES FERNANDO,NO
134,ROMERO LOAYZA FRANCO SEGUNDO,NO
135,TERÁN SALCEDO RAMÓN FORTUNATO,NO
136,SERRANO VALLADARES SAADIN ALFREDO,NO
