asambleista,curul,voto
ABAD VELEZ RAUL,1,AUSENTE
ACERO LANCHIMBA ESTHELA LILIANA,2,AUSENTE
AGUILAR PLACIDO ARMANDO,3,AUSENTE
MUÑOZ VICUÑA MARIANGEL,8,AUSENTE
ANDINO REINOSO MAURO EDMUNDO,9,AUSENTE
ARIAS RAMIREZ ALBERTO JESUS,11,AUSENTE
CARRION MARIA JOSE,21,AUSENTE
CORDOVA ENCALADA EDGAR EDUARDO,28,AUSENTE
MONTIEL ARREAGA ROSAISELA DE LAS MERCEDES,35,AUSENTE
GONZALEZ SERRANO MIRYAM CATARINA,40,AUSENTE
GUAMAN CASTRO ALEX FRANCISCO,41,AUSENTE
BUENDIA HERDOIZA MARIA SOLEDAD,52,AUSENTE
MEDINA MERA VICTOR CLEMENTE,72,AUSENTE
ARIAS FERNANDEZ VERONICA ELIZABETH,75,AUSENTE
RODRIGUEZ DELGADO MARIA VERONICA,76,AUSENTE
SUBIA BARREIRO BOLIVAR STALIN,78,AUSENTE
MOYA DUQUE HERMAN ANIBAL,85,AUSENTE
ALEMAN MARMOL MONICA ROCIO,86,AUSENTE
PACHECO ORDOÑEZ BAYRON EDUARDO,99,AUSENTE
MONCAYO CEVALLOS JOSE RICARDO,104,AUSENTE
GARCIA CANO LUIGI FRANCISCO,105,AUSENTE
POSSO SALGADO LUIS ANTONIO,113,AUSENTE
PONCE RUBIO ELVIA AZUCENA,122,AUSENTE
ZAMBRANO CABANILLA EDUARDO ALFONSO,125,AUSENTE
VILLON POZO LUIS MARIANO,126,AUSENTE
OÑATE LOMBEIDA WIMPER BOLIVAR,136,AUSENTE
HAGO CELI FRANCISCO WAIKING,4,SI
AGUIRRE HIDALGO DORA ANADELA,5,SI
ALBAN TORRES MARIANA DEL ROCIO,6,SI
MONTENEGRO NUÑEZ CHRISTIAN SANTIAGO,7,SI
VITERI LOPEZ CHRISTIAN HUMBERTO,10,SI
ARREGUI RUEDA MARCIA CECILIA,12,SI
MARQUEZ LOPEZ JOSE LENIN,13,SI
BERGMANN REYNA CARLOS ALBERTO,14,SI
BORJA PEREZ GALO,15,SI
SOLORZANO AVILES FRANCISCO MARCELO,16,SI
BUSTAMANTE PONCE FERNANDO XAVIER,17,SI
CALDERON SALTOS RICHARD OSWALDO,18,SI
CALLE ANDRADE MARIA AUGUSTA,19,SI
CARRILLO BETTY,20,SI
CARVAJAL AGUIRRE MIGUEL ANGEL,22,SI
BRAVO RAMIREZ MARIA LORENA,23,SI
CAYAMBE TIPAN FAUSTO HERIBERTO,24,SI
CEDEÑO ZAMBRANO JOHANNA ELIZABETH,25,SI
SALAZAR PAUCAR MARGOD ELISAVED,26,SI
CHICA AREVALO VINICIO VETHOWEN,27,SI
MACIAS GARCIA PEDRO ROBERTO GEOVANNY,29,SI
DE LA CRUZ BERNARDO HERMAN ULISES,30,SI
DE LA CRUZ GASPAR ADRIANA MIOSOTI,31,SI
DELGADO CHALA AGUSTIN JAVIER,32,SI
FAJARDO MOSQUERA LETTY VANESSA,33,SI
FALCONI LOQUI EVELYN PAMELA,34,SI
BAZURTO ROLDAN NANCIS CELESTE,36,SI
MENDOZA DANIEL ISAAC,37,SI
GARZON RICAURTE WILLIAM ANTONIO,38,SI
MACAS JOSE LUIS,39,SI
GUAMANGATE ANTE LUIS GILBERTO,42,SI
GUDIÑO MENA ZOBEIDA GUISELA,43,SI
GUEVARA VILLACRES VERONICA MARGARITA,44,SI
GUZMAN OCHOA LILIANA MAURA,45,SI
GUTIERREZ MOSCOSO MARIA EUGENIA,46,SI
MOSQUERA YANEZ ISABEL PIEDAD,47,SI
ISSA WAGNER NICOLAS JOSE,48,SI
JEREZ PILLA BETTY MARICELA,49,SI
JUEZ JUEZ OMAR JUSEPH,50,SI
ORTIZ GASPAR ESTHER FLAVIA,51,SI
LARRIVA ALVARADO OSCAR OSWALDO,53,SI
LEDESMA ZAMORA OSCAR ALFONSO,54,SI
AGUIÑAGA VALLEJO PAOLA MARCELA,55,SI
MELO GARZON ESTEBAN ANDRES,56,SI
TOBAR NUÑEZ RAUL IGNACIO,57,SI
MUÑOZ AVENDAÑO ROSA ELVIRA,58,SI
ALVARADO CARRION ROSANA,59,SI
OCLES PADILLA ALEXANDRA,60,SI
CAZA TIPANTA HUGO RENE,61,SI
PADRON SAETEROS GLADYS PAULINA,62,SI
BRITO MENDOZA MONICA CRISTINA,63,SI
PEÑA CARRASCO DIANA LUCIA,64,SI
PEÑA PACHECO XIMENA DEL ROCIO,65,SI
QUINCHIGUANGO GISELA,66,SI
CAMPOVERDE CALVA SEGUNDO MODESTO,67,SI
PROAÑO CIFUENTES ROBERTH MAURICIO,68,SI
FARFAN APONTE RICHARD WILSON,69,SI
RIVERA LOPEZ JOSE GABRIEL,70,SI
RIVERO DOGUER ANGEL ARMANDO,71,SI
REINOSO LESCANO MARIA ELIZABETH,73,SI
SAENZ DE VITERI LAUTARO ENRIQUE,77,SI
ANDRADE VARELA JUPITER GOZOSO DE LA CRUZ,79,SI
BUSTOS CHILIQUINGA ARCADIO,80,SI
MATIAS APOLINARIO RITA AZUCENA,81,SI
YANDUN POZO CASTULO RENE,82,SI
ACACHO GONZALEZ PEPE LUIS,83,SI
SANCHEZ ORDOÑEZ MONTGOMERY LUIS,84,SI
DAHIK ASTUDILLO REYTA GIOMAR,87,SI
DIAZ COKA MARIA GABRIELA,88,SI
FIERRO OVIEDO PACO,89,SI
GUALAN JAPA MILTON RODRIGO,90,SI
ORELLANA MARQUINEZ MAGALI MARGOT,91,SI
UMAJINGA GUAMAN CESAR,92,SI
TIBAN GUALA LOURDES LICENIA,93,SI
TERAN SARZOSA SEGUNDO FAUSTO,94,SI
VALAREZO ORDOÑEZ ROCIO DEL CARMEN,95,SI
MEJIA PLUAS NILDA CECIBEL,96,SI
VASCONEZ ARTEAGA ANNY MARLLELY,97,SI
INTRIAGO MACIAS CARMEN ELENA,98,SI
ALBAN GALLO MARINA ELIZABETH,100,SI
AUQUILLA ORTEGA RAUL VICENTE,101,SI
CHICAIZA TOAPANTA WILSON ALFONSO,102,SI
DONOSO CHIRIBOGA PATRICIO,103,SI
VELA CHERONI MARIA SOLEDAD,106,SI
ARGUELLO TROYA BLANCA AZUCENA,107,SI
VELASCO ENRIQUEZ CARLOS ALBERTO,108,SI
VELIZ BRIONES JOSE FELIX,109,SI
OCHOA MORANTE MANUEL ALFREDO,110,SI
VICUÑA MUÑOZ MARIA ALEJANDRA,111,SI
VILEMA FREIRE ANGEL RAMIRO,112,SI
SOLORZANO SARRIA CESAR FAUSTO,114,SI
MONTAÑO VALENCIA MAE,115,SI
MORETA PANCHEZ MIGUEL ANGEL,116,SI
PAEZ BENALCAZAR ANDRES TARQUINO,117,SI
SALGADO RIVADENEIRA DIEGO,118,SI
CHICA ARTEAGA GUNTARD PAVEL,119,SI
TORRES TORRES LUIS FERNANDO,120,SI
VILLACRESES PEÑA OCTAVIO XAVIER ENRIQUE,121,SI
VITERI GUALINGA CARLOS ELOY,123,SI
MERA RIVADENEIRA MARIA CECILIA,124,SI
ZAMBRANO CHACHA ALBERTO ALEXANDER,127,SI
SERRANO SEGURA GRACE MARISOL,128,SI
URIBE LOPEZ FANNY ESTHER,129,SI
TAPIA LOMBEYDA LUIS FERNANDO,130,SI
CUCALON CAMACHO HENRY EDUARDO,131,SI
REYES HIDALGO CRISTINA EUGENIA,132,SI
TACLE GALARRAGA MOISES FERNANDO,133,SI
ROMERO LOAYZA FRANCO SEGUNDO,134,SI
YELA BURGOS DAYSE INES,135,SI
KRONFLE GOMEZ MARIA CRISTINA,137,SI
AGUILAR TORRES MANUEL RAMIRO,74,BLANCO
