asambleista,curul,voto
CRUZ SALAZAR FRANCISCA GABRIELA,23,AUSENTE
JARAMILLO RODRIGUEZ VICTOR HUGO,43,AUSENTE
MOSQUERA YANEZ ISABEL PIEDAD,47,AUSENTE
JAIGUA ALVARADO CELIA MARIA,53,AUSENTE
SAENZ DE VITERI LAUTARO ENRIQUE,77,AUSENTE
DIAZ COKA MARIA GABRIELA,88,AUSENTE
POSSO SALGADO LUIS ANTONIO,113,AUSENTE
COELLO JARAMILLO DIANA ANGELINA,123,AUSENTE
ZAMBRANO CABANILLA EDUARDO ALFONSO,125,AUSENTE
ZAPATA MANTILLA JOSE LEONIDAS,128,AUSENTE
ABAD VELEZ RAUL,1,SI
ACERO LANCHIMBA ESTHELA LILIANA,2,SI
LANDAZURI OLMEDO LUDIS CLAUDINA,3,SI
MACHUCA MOSCOSO LINDA MARICELA,4,SI
AGUIRRE HIDALGO DORA ANDELA,5,SI
ALBAN TORRES MARIANA DEL ROCIO,6,SI
MONTENEGRO NUÑEZ CHRISTIAN SANTIAGO,7,SI
MUÑOZ VICUÑA MARIANGEL,8,SI
ANDINO REINOSO MAURO EDMUNDO,9,SI
VITERI LOPEZ CHRISTIAN HUMBERTO,10,SI
ARIAS RAMIREZ ALBERTO JESUS,11,SI
ARREGUI RUEDA MARCIA CECILIA,12,SI
BENAVIDES ZAMBRANO ZOILA TERESA,13,SI
BERGMANN REYNA CARLOS ALBERTO,14,SI
BARRIGA ROCIO,15,SI
RIVADENEIRA BURBANO GABRIELA ALEJANDRA,16,SI
BUSTAMANTE PONCE FERNANDO XAVIER,17,SI
CALDERON SALTOS RICHARD OSWALDO,18,SI
CALLE ANDRADE MARIA AUGUSTA,19,SI
CARRILLO BETTY,20,SI
CARRION MARIA JOSE,21,SI
CARVAJAL AGUIRRE MIGUEL ANGEL,22,SI
CAYAMBE TIPAN FAUSTO HERIBERTO,24,SI
CEDEÑO ZAMBRANO JOHANNA ELIZABETH,25,SI
CHAVEZ CANALES HOLGER EZEQUIEL,26,SI
CHICA AREVALO VINICIO VETHOWEN,27,SI
CORDOVA ENCALADA EDGAR EDUARDO,28,SI
CUESTA RIOS LIUBA ELISA,29,SI
DE LA CRUZ BERNARDO HERMAN ULISES,30,SI
DE LA CRUZ GASPAR ADRIANA MIOSOTI,31,SI
DELGADO CHALA AGUSTIN JAVIER,32,SI
FAJARDO MOSQUERA LETTY VANESSA,33,SI
FALCONI LOQUI EVELYN PAMELA,34,SI
GAGLIARDO LOOR GASTON,35,SI
DE LA TORRE RAMIREZ PABLO ANTONIO,36,SI
MENDOZA DANIEL ISAAC,37,SI
GARZON RICAURTE WILLIAM ANTONIO,38,SI
GODOY ANDRADE GINA JAKELINE,39,SI
GONZALEZ SERRANO MIRYAM CATARINA,40,SI
GUAMAN CASTRO ALEX FRANCISCO,41,SI
GUAMANGATE ANTE LUIS GILBERTO,42,SI
GUEVARA VILLACRES VERONICA MARGARITA,44,SI
GUZMAN OCHOA LILIANA MAURA,45,SI
HERNANDEZ ENRIQUEZ VIRGILIO HUMBERTO,46,SI
ISSA WAGNER NICOLAS JOSE,48,SI
JEREZ PILLA BETTY MARICELA,49,SI
JUEZ JUEZ OMAR JUSEPH,50,SI
ORTIZ GASPAR ESTHER FLAVIA,51,SI
BUENDIA HERDOIZA MARIA SOLEDAD,52,SI
LEDESMA ZAMORA OSCAR ALFONSO,54,SI
AGUIÑAGA VALLEJO PAOLA MARCELA,55,SI
MELO GARZON ESTEBAN ANDRES,56,SI
TOBAR NUÑEZ RAUL IGNACIO,57,SI
MUÑOZ AVENDAÑO ROSA ELVIRA,58,SI
ALVARADO CARRION ROSANA,59,SI
OCLES PADILLA ALEXANDRA,60,SI
PABON CARANQUI PAOLA VERENICE,61,SI
PADRON SAETEROS GLADYS PAULINA,62,SI
PATIÑO AROCA RAUL LEONARDO,63,SI
TORRES LARA JOSE EDUARDO,64,SI
PEÑA PACHECO XIMENA DEL ROCIO,65,SI
PEÑAFIEL MONTESDEOCA JUANA MARISOL,66,SI
PONCE LEON XIMENA MERCEDES,67,SI
PROAÑO CIFUENTES ROBERTH MAURICIO,68,SI
FARFAN APONTE RICHARD WILSON,69,SI
RIVERA LOPEZ JOSE GABRIEL,70,SI
RIVERO DOGUER ANGEL ARMANDO,71,SI
MEDINA MERA VICTOR CLEMENTE,72,SI
REINOSO LESCANO MARIA ELIZABETH,73,SI
AGUILAR TORRES MANUEL RAMIRO,74,SI
ARIAS FERNANDEZ VERONICA ELIZABETH,75,SI
RODRIGUEZ DELGADO MARIA VERONICA,76,SI
SALAZAR CEDEÑO GUADALUPE DOLORES,78,SI
ARTEAGA ARTEAGA ZOBEIDA MELINA,79,SI
MATIAS APOLINARIO RITA AZUCENA,81,SI
YANDUN POZO CASTULO RENE,82,SI
SANCHEZ ORDOÑEZ MONTGOMERY LUIS,84,SI
MOYA DUQUE HERMAN ANIBAL,85,SI
SERRANO REYES NELSON ALCIDES,86,SI
SOLANO MORENO ALEX FABIAN,87,SI
TERAN SARZOSA SEGUNDO FAUSTO,94,SI
VALAREZO ORDOÑEZ ROCIO DEL CARMEN,95,SI
VALLE PINARGOTE BAIRON LEONARDO,96,SI
VASCONEZ ARTEAGA ANNY MARLLELY,97,SI
VELA CAIZAPANTA ANGEL RAMIRO,98,SI
PACHECO ORDOÑEZ BAYRON EDUARDO,99,SI
VELA CHERONI MARIA SOLEDAD,106,SI
ARGUELLO TROYA BLANCA AZUCENA,107,SI
VELASCO ENRIQUEZ CARLOS ALBERTO,108,SI
VELIZ BRIONES JOSE FELIX,109,SI
VERDUGA CEDEÑO MARY,110,SI
VICUÑA MUÑOZ MARIA ALEJANDRA,111,SI
ANDINO ROBALINO ANGELICA MARIA,112,SI
VILLACRESES PEÑA OCTAVIO XAVIER ENRIQUE,121,SI
VINTIMILLA JARRIN DIEGO ARMANDO,122,SI
ZAMBRANO ARTEAGA JOSE RICARDO,124,SI
ZAMBRANO CASTRO NORALMA ELIZABETH,126,SI
ZAMBRANO CHACHA ALBERTO ALEXANDER,127,SI
URIBE LOPEZ FANNY ESTHER,129,SI
BUSTOS CHILIQUINGA ARCADIO,80,NO
ACACHO GONZALEZ PEPE LUIS,83,NO
FIERRO OVIEDO PACO,89,NO
GUALAN JAPA MILTON RODRIGO,90,NO
ORELLANA MARQUINEZ MAGALI MARGOT,91,NO
TIBAN GUALA LOURDES LICENIA,93,NO
GUTIERREZ BORBUA FAUSTO GILMAR,100,NO
AUQUILLA ORTEGA RAUL VICENTE,101,NO
CHICAIZA TOAPANTA WILSON ALFONSO,102,NO
DONOSO CHIRIBOGA PATRICIO,103,NO
MONCAYO CEVALLOS JOSE RICARDO,104,NO
MACIAS HUERTA ANDREA,105,NO
SOLORZANO SARRIA CESAR FAUSTO,114,NO
MONTAÑO VALENCIA MAE,115,NO
MORETA PANCHEZ MIGUEL ANGEL,116,NO
LLANES SUAREZ HENRY MANUEL,117,NO
SALGADO RIVADENEIRA DIEGO,118,NO
CHICA ARTEAGA GUNTARD PAVEL,119,NO
TORRES TORRES LUIS FERNANDO,120,NO
TAPIA LOMBEYDA LUIS FERNANDO,130,NO
CUCALON CAMACHO HENRY EDUARDO,131,NO
REYES HIDALGO CRISTINA EUGENIA,132,NO
TACLE GALARRAGA MOISES FERNANDO,133,NO
ROMERO LOAYZA FRANCO SEGUNDO,134,NO
TERAN SALCEDO RAMON FORTUNATO,135,NO
VITERI JIMENEZ CYNTHIA,136,NO
KRONFLE GOMEZ MARIA CRISTINA,137,NO
SALAZAR CHICAIZA ABRAHAN ELIO,92,ABSTENCION
