69,asambleista,curul,total si,voto
,ALBORNOZ VINTIMILLA CLAUDIO ESTEBAN,2.0,,AUSENTE
,ARIAS FERNÁNDEZ VERÓNICA ELIZABETH,4.0,,AUSENTE
,ARREGUI RUEDA MARCIA CECILIA,6.0,,AUSENTE
,COLLAGUAZO RODRIGO,10.0,,AUSENTE
,CADENA VÉLEZ KARLA GABRIELA,14.0,,AUSENTE
,DURÁN AGUILAR LILIANA ELIZABETH,28.0,,AUSENTE
,ESPÍN REYES EUGENIA SOFÍA,29.0,,AUSENTE
,GAVILÁNEZ CAMACHO FAFO HOLGUÍN,35.0,,AUSENTE
,MELO GARZÓN ESTEBAN ANDRÉS,41.0,,AUSENTE
,NARANJO ALVARADO PRISCILA AMAPOLA,44.0,,AUSENTE
,PEÑA PACHECO XIMENA DEL ROCÍO,48.0,,AUSENTE
,RIVADENEIRA BUSTOS CARMEN MERCEDES,55.0,,AUSENTE
,SALAZAR CEDEÑO GUADALUPE DOLORES,56.0,,AUSENTE
,MALDONADO VERA MABEL MARCELA,63.0,,AUSENTE
,VERA FLORES WENDY VANESSA,64.0,,AUSENTE
,VITERI GUALINGA CARLOS ELOY,67.0,,AUSENTE
,ZAMBRANO ARTEAGA JOSE RICARDO,70.0,,AUSENTE
,BERNAL BERNAL ESTEBAN REMIGIO,74.0,,AUSENTE
,SINMALEZA SÁNCHEZ ÁNGEL RUPERTO,85.0,,AUSENTE
,CUESTA ORELLANA MARÍA DE LOURDES,93.0,,AUSENTE
,"PASSAILAIGUE MANOSALVAS DALLYANAMARIANELA",98.0,,AUSENTE
,GÓMEZ ALCÍVAR ROBERTO ANDRÉS,105.0,,AUSENTE
,SALTOS MOREIRA DIANA GABRIELA,115.0,,AUSENTE
,PALACIOS MUÑOZ JUAN SEBASTIÁN,130.0,,AUSENTE
,SUQUILANDA VALDIVIESO BYRON VINICIO,134.0,,AUSENTE
,HIDALGO JARAMILLO EDITH MARLENE,12.0,,SI
,CAMBALA MONTECE CARLOS ALBERTO,16.0,,SI
,CARRIÓN CEVALLOS MARÍA JOSÉ,18.0,,SI
,CERDA MIRANDA GABRIELA PAMELA,21.0,,SI
,CHÁVEZ BAJAÑA KHARLA DEL ROCÍO,23.0,,SI
,COROZO AYOVÍ JORGE WILBER,24.0,,SI
,MARÍN AGUIRRE ANA BELÉN,40.0,,SI
,MENDOZA ARÉVALO DANIEL ISAAC,42.0,,SI
,BUSTAMANTE GARCÍA JUAN FRANCISCO,47.0,,SI
,POMA HERRERA YOFRE MARTÍN,50.0,,SI
,SALGADO ANDRADE SILVIA BETZABETH,57.0,,SI
,SÁNCHEZ REYES MONTGOMERY,59.0,,SI
,YUNDA MACHADO JORGE HOMERO,69.0,,SI
,ANDRADE MUÑOZ WILMA PIEDAD,71.0,,SI
,ASÁN WONSANG JOSÉ FRANCISCO,72.0,,SI
,AUQUILLA ORTEGA RAÚL VICENTE,73.0,,SI
,BURBANO MONTENEGRO FÉLIX FERNANDO,75.0,,SI
,AZUERO RODAS ELISEO ALEXIS,77.0,,SI
,ORDOÑEZ ZAMBRANO SANDRA DEL ROCÍO,78.0,,SI
,AÑAZCO ROMERO DOLORES LETICIA,79.0,,SI
,SUÁREZ PROAÑO LUIS FERNANDO,80.0,,SI
,CAMPAIN BRAMBILLA RINA ASUNCIÓN,81.0,,SI
,CAMPOVERDE ROBLES EMILIO ABSALÓN,82.0,,SI
,CARRIÓN MORENO CÉSAR ATAULFO,83.0,,SI
,ZAMBRANO CHACHA ALBERTO ALEXANDER,84.0,,SI
,YANDÚN POZO CÁSTULO RENÉ,86.0,,SI
,HENRÍQUEZ JAIME PATRICIA IVONNE,87.0,,SI
,KRONFLE KOZHAYA HENRY FABIÁN,88.0,,SI
,ARIAS MANCHENO ANGELA GRACIELA,89.0,,SI
,CELI SANTOS GUILLERMO ALEJANDRO,90.0,,SI
,CRUZ PROAÑO LUDOVICO ISRAEL,91.0,,SI
,CRUZ VACA JEANNINE DEL CISNE,92.0,,SI
,CADENA HUERTAS FRANCISCO JAVIER,95.0,,SI
,PEÑA ONTANEDA ELIO GERMÁN,96.0,,SI
,MONTAÑO GUISAMANO MAYRA MIGDONIA,97.0,,SI
,OLLAGUE VALAREZO ZOILA PIEDAD,99.0,,SI
,CURICHUMBI YUPANQUI PEDRO,100.0,,SI
,DONOSO CHIRIBOGA PATRICIO,101.0,,SI
,CANCHIG NAVEDA CECILIA DEL ROCÍO,102.0,,SI
,GALARZA AÑAZCO ANA MERCEDES,103.0,,SI
,GENDE CALAZACÓN ANGEL MESÍAS,104.0,,SI
,CANDELL SOTO JAIME ENRIQUE JIMMY,107.0,,SI
,DUCHI GUAMÁN MARÍA ENCARNACIÓN,108.0,,SI
,OLIVO PALLO JAIME FERNANDO,109.0,,SI
,ROHON HERVAS CÉSAR EDUARDO,110.0,,SI
,POVEDA ALVARADO ERIKA SOPHIA,111.0,,SI
,TERÁN SALCEDO RAMÓN FORTUNATO,112.0,,SI
,TORRES TORRES LUIS FERNANDO,113.0,,SI
,LARREÁTEGUI FABARA MARÍA GABRIELA,114.0,,SI
,MINCHALA MURILLO RÓMULO MARCELO,116.0,,SI
,MONTAÑO VALENCIA MAE,117.0,,SI
,MORENO GUERRERO HENRY FREDY,118.0,,SI
,MUÑOZ ALARCÓN HÉCTOR PATRICIO,119.0,,SI
,PACHALA POMA LUIS ALBERTO,120.0,,SI
,TELLO BENALCÁZAR RAÚL ESTUPIÑAN,121.0,,SI
,GUILLÉN MENDOZA MARÍA ISABEL,122.0,,SI
,PEÑAFIEL IZQUIERDO EDDY COLÓN,123.0,,SI
,PUANCHIR PAYASHÑA TITO PEDRO,124.0,,SI
,ALARCÓN GUILLÍN FREDY OSCAR,125.0,,SI
,BOHÓRQUEZ PANTOJA VALERIA DEL CARMEN,126.0,,SI
,UGARTE GUZMÁN BLANCA ROSANA,127.0,,SI
,VINTIMILLA MOSCOSO PAOLA,128.0,,SI
,ZAMBRANO ORTIZ MARÍA ROBERTA,129.0,,SI
,PAREDES TORRES WASHINGTON ARTURO,131.0,,SI
,ROMERO LOAYZA FRANCO SEGUNDO,132.0,,SI
,SIMBAÑA VILLARREAL ABDÓN MARCELO,133.0,,SI
,VERA MENDOZA TANLLY JANELA,135.0,,SI
,ABRIL OLIVO ANA ISABEL,136.0,,SI
,YÉPEZ MARTÍNEZ HÉCTOR JOSÉ,137.0,,SI
,AGUIÑAGA VALLEJO PAOLA MARCELA,1.0,,ABSTENCION
,CEVALLOS GUEVARA LESLIE MARCELA,3.0,,ABSTENCION
,ARIAS RAMÍREZ ALBERTO JESÚS,5.0,,ABSTENCION
,ARTEAGA MUÑOZ KARINA CECILIA,7.0,,ABSTENCION
,BENAVIDES ZAMBRANO ZOILA TERESA,8.0,,ABSTENCION
,BERGMANN REYNA CARLOS ALBERTO,9.0,,ABSTENCION
,BUENDÍA HERDOÍZA MARÍA SOLEDAD,11.0,,ABSTENCION
,CABEZAS GUERRERO ELIZABETH ENRIQUETA,13.0,,ABSTENCION
,CALLE VERZOZI HERMUY,15.0,,ABSTENCION
,CÁRDENAS ESPINOZA JUAN JORGE,17.0,,ABSTENCION
,VALLEJO JARAMILLO NORMA MARLENE,19.0,,ABSTENCION
,TENORIO VALENCIA CALLETANO,20.0,,ABSTENCION
,CHALÁ CRUZ JOSÉ FRANKLIN,22.0,,ABSTENCION
,SUAREZ HUAYAMAVE CARLOS ALBERTO,25.0,,ABSTENCION
,CUESTA SANTANA ESTHER ADELINA,26.0,,ABSTENCION
,RUIZ CEDEÑO ANA BELÉN,27.0,,ABSTENCION
,ESPINOSA ANDRADE AUGUSTO XAVIER,30.0,,ABSTENCION
,FLOR GIL BRENDA AZUCENA,31.0,,ABSTENCION
,GARCÍA GAIBOR CARMEN MERCEDES,32.0,,ABSTENCION
,GARCÍA POZO DIEGO OSWALDO,33.0,,ABSTENCION
,GARZÓN RICAURTE WILLIAM ANTONIO,34.0,,ABSTENCION
,GUEVARA VILLACRÉS VERÓNICA MARGARITA,36.0,,ABSTENCION
,HOLGUÍN NARANJO MARCELA PRISCILA,37.0,,ABSTENCION
,LITARDO CAICEDO CÉSAR ERNESTO,38.0,,ABSTENCION
,LLORET VALDIVIESO JUAN CRISTÓBAL,39.0,,ABSTENCION
,MUÑOZ LÓPEZ CHRISTIAN PABEL,43.0,,ABSTENCION
,OCHOA MORANTE MANUEL ALFREDO,45.0,,ABSTENCION
,ORELLANA ROMÁN ROSA GINA,46.0,,ABSTENCION
,PLAZA CASTILLO LENIN,49.0,,ABSTENCION
,PROAÑO CIFUENTES ROBERTH MAURICIO,51.0,,ABSTENCION
,QUIJIJE DELGADO LUIS RAFAEL,52.0,,ABSTENCION
,RODRÍGUEZ CEDEÑO ROSA ELENA,53.0,,ABSTENCION
,RIVADENEIRA BURBANO GABRIELA ALEJANDRA,54.0,,ABSTENCION
,SAMANIEGO MAIGUA FRANKLIN OMAR,58.0,,ABSTENCION
,ALEMÁN MARMOL MÓNICA ROCÍO,60.0,,ABSTENCION
,SOLIZ CARRIÓN DORIS JOSEFINA,61.0,,ABSTENCION
,VALLE PINARGOTE BAIRON LEONARDO,62.0,,ABSTENCION
,VERA RODRÍGUEZ CARLOS ALFREDO,65.0,,ABSTENCION
,VILLALVA MIRANDA LIRA DE LA PAZ,66.0,,ABSTENCION
,YAR ARAUJO JUAN CARLOS,68.0,,ABSTENCION
,ZAMBRANO CASTRO NORALMA ELIZABETH,76.0,,ABSTENCION
,ZAMBRANO VALLE EDUARDO MAURICIO,94.0,,ABSTENCION
,ZAMBRANO VERA MARIANO,106.0,,ABSTENCION
