curul,asambleista,voto
1,GUAMAN MAYANCELA MARIA MERCEDES,AUSENTE
10,MONGE ESPINEL LUIS HUMBERTO,AUSENTE
12,ARREGUI RUEDA MARCIA CECILIA,AUSENTE
16,RIVADENEIRA BURBANO GABRIELA ALEJANDRA,AUSENTE
18,CALDERON SALTOS RICHARD OSWALDO,AUSENTE
20,CARRILLO BETTY,AUSENTE
37,LARREA VITERI LIDICE VANESSA,AUSENTE
38,GARZON RICAURTE WILLIAM ANTONIO,AUSENTE
43,GUDIÑO MENA ZOBEIDA GUISELA,AUSENTE
53,LARRIVA ALVARADO OSCAR OSWALDO,AUSENTE
60,QUIROZ VALLEJO HECTOR HUGO,AUSENTE
66,QUINCHIGUANGO GISELA,AUSENTE
76,RODRIGUEZ DELGADO MARIA VERONICA,AUSENTE
77,SAENZ DE VITERI LAUTARO ENRIQUE,AUSENTE
78,SUBIA BARREIRO BOLIVAR STALIN,AUSENTE
81,VILLAO PANCHANA RAUL ELIAS,AUSENTE
87,SOLANO MORENO ALEX FABIAN,AUSENTE
88,DIAZ COKA MARIA GABRIELA,AUSENTE
89,FIERRO OVIEDO PACO,AUSENTE
91,ORELLANA MARQUINEZ MAGALI MARGOT,AUSENTE
92,UMAGINGA GUAMAN CESAR,AUSENTE
93,TIBAN GUALA LOURDES LICENIA,AUSENTE
95,VALAREZO ORDOÑEZ ROCIO DEL CARMEN,AUSENTE
105,BUCARAM PULLEY ABDALA JAIME,AUSENTE
117,PAEZ BENALCAZAR ANDRES TARQUINO,AUSENTE
118,SALGADO RIVADENEIRA DIEGO,AUSENTE
124,ZAMBRANO ARTEAGA JOSE RICARDO,AUSENTE
130,MERA RODRIGUEZ MARIA PAULINA,AUSENTE
136,SERRANO VALLADARES SAADIN ALFREDO,AUSENTE
2,ACERO LANCHIMBA ESTHELA LILIANA,SI
3,AGUILAR PLACIDO ARMANDO,SI
4,MACHUCA MOSCOSO LINDA MARICELA,SI
5,AGUIRRE HIDALGO DORA ANDELA,SI
6,ALBAN TORRES MARIANA DEL ROCIO,SI
7,TORRES CEDEÑO KERLLY ANABEL,SI
8,MUÑOZ VICUÑA MARIANGEL,SI
9,ANDINO REINOSO MAURO EDMUNDO,SI
11,RIVAS ALAVA ELIANA LISSET,SI
13,MARQUEZ LOPEZ JOSE LENIN,SI
14,BERGMANN REYNA CARLOS ALBERTO,SI
15,BARRIGA ROCIO,SI
17,BUSTAMANTE PONCE FERNANDO XAVIER,SI
19,CALLE ANDRADE MARIA AUGUSTA,SI
21,CARRION MARIA JOSE,SI
22,CARVAJAL AGUIRRE MIGUEL ANGEL,SI
23,CASSINELLI CALI JUAN CARLOS,SI
24,CAYAMBE TIPAN FAUSTO HERIBERTO,SI
25,OLAYA LIDER,SI
26,SALAZAR PAUCAR MARGOD ELISAVED,SI
27,CHICA AREVALO VINICIO VETHOWEN,SI
28,CORDOVA ENCALADA EDGAR EDUARDO,SI
29,CUESTA RIOS LIUBA ELISA,SI
30,DE LA CRUZ BERNARDO HERMAN ULISES,SI
31,DE LA CRUZ GASPAR ADRIANA MIOSOTI,SI
32,DELGADO CHALA AGUSTIN JAVIER,SI
33,FAJARDO MOSQUERA LETTY VANESSA,SI
34,FALCONI LOQUI EVELYN PAMELA,SI
35,GAGLIARDO LOOR GASTON,SI
36,DE LA TORRE RAMIREZ PABLO ANTONIO,SI
39,GODOY ANDRADE GINA JAKELINE,SI
40,GONZALEZ SERRANO MIRYAM CATARINA,SI
41,GUAMAN CASTRO ALEX FRANCISCO,SI
42,GUAMANGATE ANTE LUIS GILBERTO,SI
44,GUEVARA VILLACRES VERONICA MARGARITA,SI
45,GUZMAN OCHOA LILIANA MAURA,SI
46,HERNANDEZ ENRIQUEZ VIRGILIO HUMBERTO,SI
47,MOSQUERA YANEZ ISABEL PIEDAD,SI
48,ISSA WAGNER NICOLAS JOSE,SI
49,CARRILLO CRESPO HUGO FERNANDO,SI
50,SILVA MALDONADO SOFIA IRENE,SI
51,ORTIZ GASPAR ESTHER FLAVIA,SI
52,BUENDIA HERDOIZA MARIA SOLEDAD,SI
54,LEDESMA ZAMORA OSCAR ALFONSO,SI
55,AGUIÑAGA VALLEJO PAOLA MARCELA,SI
56,MELO GARZON ESTEBAN ANDRES,SI
57,TOBAR NUÑEZ RAUL IGNACIO,SI
58,MUÑOZ AVENDAÑO ROSA ELVIRA,SI
59,ALVARADO CARRION ROSANA,SI
61,PABON CARANQUI PAOLA VERENICE,SI
62,PADRON SAETEROS GLADYS PAULINA,SI
63,PATIÑO AROCA RAUL LEONARDO,SI
64,PEÑA CARRASCO DIANA LUCIA,SI
65,PEÑA PACHECO XIMENA DEL ROCIO,SI
67,CAMPOVERDE CALVA SEGUNDO MODESTO,SI
68,PILLAJO TUQUERES JENNY ELIZABETH,SI
69,FARES GUAILLAS MARIA SEBASTIANA,SI
70,RIVERA LOPEZ JOSE GABRIEL,SI
71,RIVERO DOGUER ANGEL ARMANDO,SI
72,MEDINA MERA VICTOR CLEMENTE,SI
73,REINOSO LESCANO MARIA ELIZABETH,SI
74,AGUILAR TORRES MANUEL RAMIRO,SI
75,ARIAS FERNANDEZ VERONICA ELIZABETH,SI
79,CANTOS MENDOZA ALBA JANET,SI
84,SANCHEZ ORDOÑEZ MONTGOMERY LUIS,SI
85,MOYA DUQUE HERMAN ANIBAL,SI
86,SERRANO REYES NELSON ALCIDES,SI
94,TERAN SARZOSA SEGUNDO FAUSTO,SI
96,VALLE PINARGOTE BAIRON LEONARDO,SI
98,INTRIAGO MACIAS CARMEN ELENA,SI
99,PACHECO ORDOÑEZ BAYRON EDUARDO,SI
106,VELA CHERONI MARIA SOLEDAD,SI
107,ARGUELLO TROYA BLANCA AZUCENA,SI
108,VELASCO ENRIQUEZ CARLOS ALBERTO,SI
109,VELIZ BRIONES JOSE FELIX,SI
110,VERDUGA CEDEÑO MARY,SI
111,JONIAUX BLUM ENRIQUE ALEJANDRO,SI
112,VILEMA FREIRE ANGEL RAMIRO,SI
113,POSSO SALGADO LUIS ANTONIO,SI
121,VILLACRESES PEÑA OCTAVIO XAVIER ENRIQUE,SI
122,VINTIMILLA JARRIN DIEGO ARMANDO,SI
123,VITERI GUALINGA CARLOS ELOY,SI
125,ZAMBRANO CABANILLA EDUARDO ALFONSO,SI
127,ZAMBRANO CHACHA ALBERTO ALEXANDER,SI
128,SERRANO SEGURA GRACE MARISOL,SI
129,URIBE LOPEZ FANNY ESTHER,SI
80,CASTRO AJILA GLADYS LUCIA,NO
82,YANDUN POZO CASTULO RENE,NO
97,VASCONEZ ARTEAGA ANNY MARLLELY,NO
100,GUTIERREZ BORBUA FAUSTO GILMAR,NO
101,AUQUILLA ORTEGA RAUL VICENTE,NO
102,CHICAIZA TOAPANTA WILSON ALFONSO,NO
103,DONOSO CHIRIBOGA PATRICIO,NO
104,MONCAYO CEVALLOS JOSE RICARDO,NO
114,SOLORZANO SARRIA CESAR FAUSTO,NO
115,MONTAÑO VALENCIA MAE,NO
116,MORETA PANCHEZ MIGUEL ANGEL,NO
119,PUYOL CORTEZ JORGE LUIS,NO
126,ZAMBRANO CASTRO NORALMA ELIZABETH,NO
83,ACACHO GONZALEZ PEPE LUIS,ABSTENCION
90,GUALAN JAPA MILTON RODRIGO,ABSTENCION
120,TORRES TORRES LUIS FERNANDO,ABSTENCION
131,CUCALON CAMACHO HENRY EDUARDO,ABSTENCION
132,REYES HIDALGO CRISTINA EUGENIA,ABSTENCION
133,TACLE GALARRAGA MOISES FERNANDO,ABSTENCION
134,ROMERO LOAYZA FRANCO SEGUNDO,ABSTENCION
135,TERAN SALCEDO RAMON FORTUNATO,ABSTENCION
137,KRONFLE GOMEZ MARIA CRISTINA,ABSTENCION
