69,asambleista,curul,total si,voto
,AGUIÑAGA VALLEJO PAOLA MARCELA,1,,AUSENTE
,ALBORNOZ VINTIMILLA CLAUDIO ESTEBAN,2,,AUSENTE
,SERRANO SALGADO JOSÉ RICARDO,3,,AUSENTE
,ARIAS RAMÍREZ ALBERTO JESÚS,5,,AUSENTE
,ARREGUI RUEDA MARCIA CECILIA,6,,AUSENTE
,BENAVIDES ZAMBRANO ZOILA TERESA,8,,AUSENTE
,CAMBALA MONTECE CARLOS ALBERTO,16,,AUSENTE
,CÁRDENAS ESPINOZA JUAN JORGE,17,,AUSENTE
,CARRIÓN CEVALLOS MARÍA JOSÉ,18,,AUSENTE
,CUESTA RÍOS LIUBA ELISA,25,,AUSENTE
,DOUMET CHEDRAUI MICHEL ANDRÉS,27,,AUSENTE
,GARCÍA GAIBOR CARMEN MERCEDES,32,,AUSENTE
,GARCÍA POZO DIEGO OSWALDO,33,,AUSENTE
,GUEVARA VILLACRÉS VERÓNICA MARGARITA,36,,AUSENTE
,HOLGUÍN NARANJO MARCELA PRISCILA,37,,AUSENTE
,LITARDO CAICEDO CÉSAR ERNESTO,38,,AUSENTE
,LLORET VALDIVIESO JUAN CRISTÓBAL,39,,AUSENTE
,MARÍN AGUIRRE ANA BELÉN,40,,AUSENTE
,MELO GARZÓN ESTEBAN ANDRÉS,41,,AUSENTE
,COLAMARCO VERA PINUCCIA MAGALY,42,,AUSENTE
,MUÑOZ LÓPEZ CHRISTIAN PABEL,43,,AUSENTE
,NARANJO ALVARADO PRISCILA AMAPOLA,44,,AUSENTE
,PEÑA PACHECO XIMENA DEL ROCÍO,48,,AUSENTE
,POMA HERRERA YOFRE MARTÍN,50,,AUSENTE
,PROAÑO CIFUENTES ROBERTH MAURICIO,51,,AUSENTE
,RIVADENEIRA BURBANO GABRIELA ALEJANDRA,54,,AUSENTE
,RIVADENEIRA BUSTOS CARMEN MERCEDES,55,,AUSENTE
,PARRA VILLACIS JONATHAN EMANUEL,56,,AUSENTE
,SALGADO ANDRADE SILVIA BETZABETH,57,,AUSENTE
,SAMANIEGO MAIGUA FRANKLIN OMAR,58,,AUSENTE
,YAGUANA ECHEVERRÍA ANDREA ALEXANDRA,59,,AUSENTE
,MOLINA ONOFA LUIS FERNANDO,60,,AUSENTE
,VELIN CORTÉS JUAN PABLO,63,,AUSENTE
,VERA FLORES WENDY VANESSA,64,,AUSENTE
,VILLALVA MIRANDA LIRA DE LA PAZ,66,,AUSENTE
,VITERI GUALINGA CARLOS ELOY,67,,AUSENTE
,AUQUILLA ORTEGA RAÚL VICENTE,73,,AUSENTE
,CALLEJAS BARONA FERNANDO,80,,AUSENTE
,CAMPAIN BRAMBILLA RINA ASUNCIÓN,81,,AUSENTE
,CARRIÓN MORENO CÉSAR ATAULFO,83,,AUSENTE
,ZAMBRANO CHACHA ALBERTO ALEXANDER,84,,AUSENTE
,CRUZ VACA JEANNINE DEL CISNE,92,,AUSENTE
,ZAMBRANO VALLE EDUARDO MAURICIO,94,,AUSENTE
,,98,,AUSENTE
,GALARZA AÑAZCO ANA MERCEDES,103,,AUSENTE
,ZAMBRANO VERA MARIANO,106,,AUSENTE
,TAIANO BASANTE VICENTE GIOVANNY,111,,AUSENTE
,TERÁN SALCEDO RAMÓN FORTUNATO,112,,AUSENTE
,VERA CALDERÓN SILVIA LORENA,116,,AUSENTE
,TELLO BENALCÁZAR RAÚL ESTUPIÑAN,121,,AUSENTE
,ESTUPIÑÁN ORTIZ BORIS EFRÉN,129,,AUSENTE
,SUQUILANDA VALDIVIESO BYRON VINICIO,134,,AUSENTE
,VILLAMAR JÁCOME PEDRO FABRICIO,136,,AUSENTE
,YÉPEZ MARTÍNEZ HÉCTOR JOSÉ,137,,AUSENTE
,ARTEAGA MUÑOZ KARINA CECILIA,7,,SI
,BERGMANN REYNA CARLOS ALBERTO,9,,SI
,BONILLA SALCEDO VIVIANA,10,,SI
,BUSTAMANTE MONTEROS RUBÉN ALEJANDRO,12,,SI
,CABEZAS GUERRERO ELIZABETH ENRIQUETA,13,,SI
,TERAN SARZOSA SEGUNDO FAUSTO,19,,SI
,TENORIO VALENCIA CALLETANO,20,,SI
,CERDA MIRANDA GABRIELA PAMELA,21,,SI
,CHÁVEZ BAJAÑA KHARLA DEL ROCÍO,23,,SI
,COROZO AYOVÍ JORGE WILBER,24,,SI
,FLOR GIL BRENDA AZUCENA,31,,SI
,GARZÓN RICAURTE WILLIAM ANTONIO,34,,SI
,GAVILÁNEZ CAMACHO FAFO HOLGUÍN,35,,SI
,ORELLANA ROMÁN ROSA GINA,46,,SI
,BUSTAMANTE GARCÍA JUAN FRANCISCO,47,,SI
,PLAZA CASTILLO LENIN,49,,SI
,QUIJIJE DELGADO LUIS RAFAEL,52,,SI
,RODRÍGUEZ CEDEÑO ROSA ELENA,53,,SI
,VERA RODRÍGUEZ CARLOS ALFREDO,65,,SI
,YAR ARAUJO JUAN CARLOS,68,,SI
,ANDRADE MUÑOZ WILMA PIEDAD,71,,SI
,ZAMBRANO ALCÍVAR MAGDA XIOMARA,72,,SI
,ASTUDILLO LOOR LINA GLORIA,74,,SI
,BURBANO MONTENEGRO FÉLIX FERNANDO,75,,SI
,ZAMBRANO CASTRO NORALMA ELIZABETH,76,,SI
,AZUERO RODAS ELISEO ALEXIS,77,,SI
,CUCALÓN CAMACHO HENRY EDUARDO,78,,SI
,SERRANO VITERI MERCEDES MARITZA,79,,SI
,CAMPOVERDE ROBLES EMILIO ABSALÓN,82,,SI
,SINMALEZA SÁNCHEZ ÁNGEL RUPERTO,85,,SI
,YANDÚN POZO CÁSTULO RENÉ,86,,SI
,HENRÍQUEZ JAIME PATRICIA IVONNE,87,,SI
,KRONFLE KOZHAYA HENRY FABIÁN,88,,SI
,CASTANIER JARAMILLO XAVIER HOMERO,89,,SI
,CELI SANTOS GUILLERMO ALEJANDRO,90,,SI
,CRUZ PROAÑO LUDOVICO ISRAEL,91,,SI
,MEDINA RAMÍREZ JOSÉ ALFREDO,93,,SI
,CADENA HUERTAS FRANCISCO JAVIER,95,,SI
,PEÑA ONTANEDA ELIO GERMÁN,96,,SI
,CAMPOVERDE GONZÁLEZ RAÚL FREDDY BOLÍVAR,97,,SI
,REYES HIDALGO CRISTINA EUGENIA,99,,SI
,CURICHUMBI YUPANQUI PEDRO,100,,SI
,DONOSO CHIRIBOGA PATRICIO,101,,SI
,FLORES VÁSQUEZ FERNANDO PATRICIO,102,,SI
,GENDE CALAZACÓN ANGEL MESÍAS,104,,SI
,GÓMEZ ALCÍVAR ROBERTO ANDRÉS,105,,SI
,CANDELL SOTO JAIME ENRIQUE JIMMY,107,,SI
,DUCHI GUAMÁN MARÍA ENCARNACIÓN,108,,SI
,OLIVO PALLO JAIME FERNANDO,109,,SI
,ROHON HERVAS CÉSAR EDUARDO,110,,SI
,TORRES COBO LUIS ESTEBAN,113,,SI
,LARREÁTEGUI FABARA MARÍA GABRIELA,114,,SI
,SALTOS MOREIRA DIANA GABRIELA,115,,SI
,MONTAÑO VALENCIA MAE,117,,SI
,MORENO GUERRERO HENRY FREDY,118,,SI
,MUÑOZ ALARCÓN HÉCTOR PATRICIO,119,,SI
,PACHALA POMA LUIS ALBERTO,120,,SI
,CUESTA CONCARI MARÍA MERCEDES,122,,SI
,PEÑAFIEL IZQUIERDO EDDY COLÓN,123,,SI
,PUANCHIR PAYASHÑA TITO PEDRO,124,,SI
,ALARCÓN GUILLÍN FREDY OSCAR,125,,SI
,SOLORZANO SARRIA CESAR FAUSTO,126,,SI
,ALMEYDA JALIL VICENTE FERNANDO,127,,SI
,MARÍN LAVAYEN DENNIS GUSTAVO,128,,SI
,PALACIOS MUÑOZ JUAN SEBASTIÁN,130,,SI
,PAREDES TORRES WASHINGTON ARTURO,131,,SI
,ROMERO LOAYZA FRANCO SEGUNDO,132,,SI
,SIMBAÑA VILLARREAL ABDÓN MARCELO,133,,SI
,VERA MENDOZA TANLLY JANELA,135,,SI
,BUENDÍA HERDOÍZA MARÍA SOLEDAD,11,,NO
,CALLE VERZOZI HERMUY,15,,NO
,CHALÁ CRUZ JOSÉ FRANKLIN,22,,NO
,DURÁN AGUILAR LILIANA ELIZABETH,28,,NO
,ALEAGA SANTOS RONNY XAVIER,29,,NO
,ESPINOSA ANDRADE AUGUSTO XAVIER,30,,NO
,SOLIZ CARRIÓN DORIS JOSEFINA,61,,NO
,VALLE PINARGOTE BAIRON LEONARDO,62,,NO
,GUAMBA DÍAZ NANCY JEANNETH,69,,NO
,LOOR ALCÍVAR LEXI LIDUVINA,70,,NO
,ARIAS FERNÁNDEZ VERÓNICA ELIZABETH,4,,ABSTENCION
,CADENA VÉLEZ KARLA GABRIELA,14,,ABSTENCION
,CUESTA SANTANA ESTHER ADELINA,26,,ABSTENCION
,OCHOA MORANTE MANUEL ALFREDO,45,,ABSTENCION
