curul,asambleista,voto
3,SERRANO SALGADO JOSÉ RICARDO,AUSENTE
14,CADENA VÉLEZ KARLA GABRIELA,AUSENTE
23,CHÁVEZ BAJAÑA KHARLA DEL ROCÍO,AUSENTE
27,DOUMET CHEDRAUI MICHEL ANDRÉS,AUSENTE
28,DURÁN AGUILAR LILIANA ELIZABETH,AUSENTE
40,MARÍN AGUIRRE ANA BELÉN,AUSENTE
41,MELO GARZÓN ESTEBAN ANDRÉS,AUSENTE
54,RIVADENEIRA BURBANO GABRIELA ALEJANDRA,AUSENTE
55,RIVADENEIRA BUSTOS CARMEN MERCEDES,AUSENTE
58,SAMANIEGO MAIGUA FRANKLIN OMAR,AUSENTE
64,VERA FLORES WENDY VANESSA,AUSENTE
67,VITERI GUALINGA CARLOS ELOY,AUSENTE
68,YAR ARAUJO JUAN CARLOS,AUSENTE
69,YUNDA MACHADO JORGE HOMERO,AUSENTE
82,CAMPOVERDE ROBLES EMILIO ABSALÓN,AUSENTE
87,HENRÍQUEZ JAIME PATRICIA IVONNE,AUSENTE
101,DONOSO CHIRIBOGA PATRICIO,AUSENTE
104,GENDE CALAZACÓN ANGEL MESÍAS,AUSENTE
112,TERÁN SALCEDO RAMÓN FORTUNATO,AUSENTE
114,LARREÁTEGUI FABARA MARÍA GABRIELA,AUSENTE
115,SALTOS MOREIRA DIANA GABRIELA,AUSENTE
123,PEÑAFIEL IZQUIERDO EDDY COLÓN,AUSENTE
124,PUANCHIR PAYASHÑA TITO PEDRO,AUSENTE
126,SOLORZANO SARRIA CESAR FAUSTO,AUSENTE
131,PAREDES TORRES WASHINGTON ARTURO,AUSENTE
1,AGUIÑAGA VALLEJO PAOLA MARCELA,SI
2,ALBORNOZ VINTIMILLA CLAUDIO ESTEBAN,SI
4,ARIAS FERNÁNDEZ VERÓNICA ELIZABETH,SI
5,ARIAS RAMÍREZ ALBERTO JESÚS,SI
6,ARREGUI RUEDA MARCIA CECILIA,SI
7,ARTEAGA MUÑOZ KARINA CECILIA,SI
8,BENAVIDES ZAMBRANO ZOILA TERESA,SI
9,MORENO INTRIAGO MARIA LUISA,SI
10,BONILLA SALCEDO VIVIANA,SI
11,BUENDÍA HERDOÍZA MARÍA SOLEDAD,SI
12,BUSTAMANTE MONTEROS RUBÉN ALEJANDRO,SI
13,CABEZAS GUERRERO ELIZABETH ENRIQUETA,SI
15,CALLE VERZOZI HERMUY,SI
16,CAMBALA MONTECE CARLOS ALBERTO,SI
17,CÁRDENAS ESPINOZA JUAN JORGE,SI
18,CARRIÓN CEVALLOS MARÍA JOSÉ,SI
19,VALLEJO JARAMILLO NORMA MARLENE,SI
20,CEDEÑO ZAMBRANO JOHANNA ELIZABETH,SI
21,CERDA MIRANDA GABRIELA PAMELA,SI
22,CHALÁ CRUZ JOSÉ FRANKLIN,SI
24,COROZO AYOVÍ JORGE WILBER,SI
25,CUESTA RÍOS LIUBA ELISA,SI
26,CUESTA SANTANA ESTHER ADELINA,SI
29,ESPÍN REYES EUGENIA SOFÍA,SI
30,ESPINOSA ANDRADE AUGUSTO XAVIER,SI
31,FLOR GIL BRENDA AZUCENA,SI
32,GARCÍA GAIBOR CARMEN MERCEDES,SI
33,GARCÍA POZO DIEGO OSWALDO,SI
34,GARZÓN RICAURTE WILLIAM ANTONIO,SI
35,GAVILÁNEZ CAMACHO FAFO HOLGUÍN,SI
36,GUEVARA VILLACRÉS VERÓNICA MARGARITA,SI
37,HOLGUÍN NARANJO MARCELA PRISCILA,SI
38,LITARDO CAICEDO CÉSAR ERNESTO,SI
42,COLAMARCO VERA PINUCCIA MAGALY,SI
43,MUÑOZ LÓPEZ CHRISTIAN PABEL,SI
44,NARANJO ALVARADO PRISCILA AMAPOLA,SI
45,OCHOA MORANTE MANUEL ALFREDO,SI
46,ORELLANA ROMÁN ROSA GINA,SI
47,PALACIOS VELÁSQUEZ SONIA LUCRECIA,SI
48,PEÑA PACHECO XIMENA DEL ROCÍO,SI
49,PLAZA CASTILLO LENIN,SI
50,POMA HERRERA YOFRE MARTÍN,SI
51,PROAÑO CIFUENTES ROBERTH MAURICIO,SI
52,QUIJIJE DELGADO LUIS RAFAEL,SI
53,QUIÑONEZ OCAMPO JULIO CÉSAR,SI
56,SALAZAR CEDEÑO GUADALUPE DOLORES,SI
57,SALGADO ANDRADE SILVIA BETZABETH,SI
60,ALEMÁN MARMOL MÓNICA ROCÍO,SI
62,VALLE PINARGOTE BAIRON LEONARDO,SI
63,VELIN CORTÉS JUAN PABLO,SI
65,RODRÍGUEZ ZAMBRANO DIANE MARIE,SI
66,VILLALVA MIRANDA LIRA DE LA PAZ,SI
70,ZAMBRANO ARTEAGA JOSE RICARDO,SI
71,ANDRADE MUÑOZ WILMA PIEDAD,SI
72,ASÁN WONSANG JOSÉ FRANCISCO,SI
73,AUQUILLA ORTEGA RAÚL VICENTE,SI
74,ASTUDILLO LOOR LINA GLORIA,SI
75,BURBANO MONTENEGRO FÉLIX FERNANDO,SI
76,ZAMBRANO CASTRO NORALMA ELIZABETH,SI
77,AZUERO RODAS ELISEO ALEXIS,SI
78,CUCALÓN CAMACHO HENRY EDUARDO,SI
79,FALQUEZ BATALLAS PEDRO CARLOS,SI
80,CALLEJAS BARONA FERNANDO,SI
81,CAMPAIN BRAMBILLA RINA ASUNCIÓN,SI
83,CORONEL PÁEZ OSWALDO MARCELO,SI
84,VEGAY JIPA LUZ AIDA,SI
85,SINMALEZA SÁNCHEZ ÁNGEL RUPERTO,SI
86,YANDÚN POZO CÁSTULO RENÉ,SI
88,JARAMILLO ZURITA PAOLA MICHAEL,SI
89,CASTANIER JARAMILLO XAVIER HOMERO,SI
90,CELI SANTOS GUILLERMO ALEJANDRO,SI
91,CRUZ PROAÑO LUDOVICO ISRAEL,SI
92,CRUZ VACA JEANNINE DEL CISNE,SI
93,CUESTA ORELLANA MARÍA DE LOURDES,SI
94,ZAMBRANO VALLE EDUARDO MAURICIO,SI
95,CADENA HUERTAS FRANCISCO JAVIER,SI
96,PEÑA ONTANEDA ELIO GERMÁN,SI
97,MONTAÑO GUISAMANO MAYRA MIGDONIA,SI
98,"PASSAILAIGUE MANOSALVAS DALLYANAMARIANELA",SI
99,REYES HIDALGO CRISTINA EUGENIA,SI
100,CURICHUMBI YUPANQUI PEDRO,SI
102,FLORES VÁSQUEZ FERNANDO PATRICIO,SI
103,GALARZA AÑAZCO ANA MERCEDES,SI
105,GÓMEZ ALCÍVAR ROBERTO ANDRÉS,SI
106,MACÍAS ORTEGA WENDY ELENA MARISOL,SI
107,CAMPOS QUIÑONEZ LIDDA MERARI,SI
108,DUCHI GUAMÁN MARÍA ENCARNACIÓN,SI
109,OLIVO PALLO JAIME FERNANDO,SI
110,ROHON HERVAS CÉSAR EDUARDO,SI
111,TACLE GARCÍA SAMIA,SI
113,TORRES TORRES LUIS FERNANDO,SI
116,MINCHALA MURILLO RÓMULO MARCELO,SI
117,MONTAÑO VALENCIA MAE,SI
118,MORENO GUERRERO HENRY FREDY,SI
119,MUÑOZ ALARCÓN HÉCTOR PATRICIO,SI
120,ARREGUI SÁNCHEZ NORMA OFELIA,SI
121,TELLO BENALCÁZAR RAÚL ESTUPIÑAN,SI
122,CUESTA CONCARI MARÍA MERCEDES,SI
125,ALARCÓN GUILLÍN FREDY OSCAR,SI
127,CALDERÓN JARAMILLO ALDRIN YUBER,SI
128,VINTIMILLA MOSCOSO PAOLA,SI
129,ZAMBRANO ORTIZ MARÍA ROBERTA,SI
130,PALACIOS MUÑOZ JUAN SEBASTIÁN,SI
132,ROMERO LOAYZA FRANCO SEGUNDO,SI
133,SIMBAÑA VILLARREAL ABDÓN MARCELO,SI
134,SUQUILANDA VALDIVIESO BYRON VINICIO,SI
135,VERA MENDOZA TANLLY JANELA,SI
136,VILLAMAR JÁCOME PEDRO FABRICIO,SI
137,PADILLA SIERRA MAGGIE DOLORES,SI
39,LLORET VALDIVIESO JUAN CRISTÓBAL,ABSTENCION
59,SÁNCHEZ REYES MONTGOMERY,ABSTENCION
61,SOLIZ CARRIÓN DORIS JOSEFINA,ABSTENCION
