voto,curul,asambleista
AUSENTE,26,CUESTA SANTANA ESTHER ADELINA
AUSENTE,32,GARCÍA GAIBOR CARMEN MERCEDES
AUSENTE,36,GUEVARA VILLACRÉS VERÓNICA MARGARITA
AUSENTE,41,MELO GARZÓN ESTEBAN ANDRÉS
AUSENTE,60,ALEMÁN MARMOL MÓNICA ROCÍO
AUSENTE,66,VILLALVA MIRANDA LIRA DE LA PAZ
AUSENTE,67,VITERI GUALINGA CARLOS ELOY
AUSENTE,77,AZUERO RODAS ELISEO ALEXIS
AUSENTE,93,CUESTA ORELLANA MARÍA DE LOURDES
AUSENTE,122,GARCIA CANO LUIGI FRANCISCO
AUSENTE,136,VILLAMAR JÁCOME PEDRO FABRICIO
SI,2,ALBORNOZ VINTIMILLA CLAUDIO ESTEBAN
SI,3,SERRANO SALGADO JOSÉ RICARDO
SI,4,TORRES CASTILLO JACKSON GUILLERMO
SI,5,ARIAS RAMÍREZ ALBERTO JESÚS
SI,6,ARREGUI RUEDA MARCIA CECILIA
SI,7,ARTEAGA MUÑOZ KARINA CECILIA
SI,8,BENAVIDES ZAMBRANO ZOILA TERESA
SI,9,BERGMANN REYNA CARLOS ALBERTO
SI,10,COLLAGUAZO RODRIGO
SI,12,BUSTAMANTE MONTEROS RUBÉN ALEJANDRO
SI,13,CABEZAS GUERRERO ELIZABETH ENRIQUETA
SI,14,CADENA VÉLEZ KARLA GABRIELA
SI,16,CAMBALA MONTECE CARLOS ALBERTO
SI,18,CARRIÓN CEVALLOS MARÍA JOSÉ
SI,19,VALLEJO JARAMILLO NORMA MARLENE
SI,20,CEDEÑO ZAMBRANO JOHANNA ELIZABETH
SI,21,GREFA AVILEZ FLAVIO PATRICIO
SI,23,CHÁVEZ BAJAÑA KHARLA DEL ROCÍO
SI,24,COROZO AYOVÍ JORGE WILBER
SI,25,CUESTA RÍOS LIUBA ELISA
SI,27,DOUMET CHEDRAUI MICHEL ANDRÉS
SI,31,FLOR GIL BRENDA AZUCENA
SI,34,GARZÓN RICAURTE WILLIAM ANTONIO
SI,35,GAVILÁNEZ CAMACHO FAFO HOLGUÍN
SI,38,LITARDO CAICEDO CÉSAR ERNESTO
SI,40,MARÍN AGUIRRE ANA BELÉN
SI,42,MENDOZA ARÉVALO DANIEL ISAAC
SI,45,OCHOA MORANTE MANUEL ALFREDO
SI,46,ORELLANA ROMÁN ROSA GINA
SI,47,PALACIOS VELÁSQUEZ SONIA LUCRECIA
SI,48,PEÑA PACHECO XIMENA DEL ROCÍO
SI,49,PLAZA CASTILLO LENIN
SI,50,POMA HERRERA YOFRE MARTÍN
SI,53,QUIÑONEZ OCAMPO JULIO CÉSAR
SI,56,SALAZAR CEDEÑO GUADALUPE DOLORES
SI,57,SALGADO ANDRADE SILVIA BETZABETH
SI,59,SÁNCHEZ REYES MONTGOMERY
SI,63,VELIN CORTÉS JUAN PABLO
SI,65,VERA RODRÍGUEZ CARLOS ALFREDO
SI,68,BASTIDAS GUERRA BRENDA DANIELA
SI,69,YUNDA MACHADO JORGE HOMERO
SI,70,ZAMBRANO ARTEAGA JOSE RICARDO
SI,71,ANDRADE MUÑOZ WILMA PIEDAD
SI,72,ASÁN WONSANG JOSÉ FRANCISCO
SI,75,BURBANO MONTENEGRO FÉLIX FERNANDO
SI,76,ZAMBRANO CASTRO NORALMA ELIZABETH
SI,78,CUCALÓN CAMACHO HENRY EDUARDO
SI,79,FALQUEZ BATALLAS PEDRO CARLOS
SI,84,ZAMBRANO CHACHA ALBERTO ALEXANDER
SI,85,SINMALEZA SÁNCHEZ ÁNGEL RUPERTO
SI,86,YANDÚN POZO CÁSTULO RENÉ
SI,87,HENRÍQUEZ JAIME PATRICIA IVONNE
SI,88,KRONFLE KOZHAYA HENRY FABIÁN
SI,90,CELI SANTOS GUILLERMO ALEJANDRO
SI,91,CRUZ PROAÑO LUDOVICO ISRAEL
SI,95,CADENA HUERTAS FRANCISCO JAVIER
SI,96,PEÑA ONTANEDA ELIO GERMÁN
SI,97,MONTAÑO GUISAMANO MAYRA MIGDONIA
SI,98,
SI,99,REYES HIDALGO CRISTINA EUGENIA
SI,104,GENDE CALAZACÓN ANGEL MESÍAS
SI,106,ZAMBRANO VERA MARIANO
SI,107,CANDELL SOTO JAIME ENRIQUE JIMMY
SI,108,DUCHI GUAMÁN MARÍA ENCARNACIÓN
SI,109,OLIVO PALLO JAIME FERNANDO
SI,110,ROHON HERVAS CÉSAR EDUARDO
SI,111,TACLE GARCÍA SAMIA
SI,112,TERÁN SALCEDO RAMÓN FORTUNATO
SI,113,TORRES TORRES LUIS FERNANDO
SI,114,LARREÁTEGUI FABARA MARÍA GABRIELA
SI,115,MENDOZA PALMA JOFFRE PATRICIO
SI,119,MUÑOZ ALARCÓN HÉCTOR PATRICIO
SI,123,PEÑAFIEL IZQUIERDO EDDY COLÓN
SI,124,PUANCHIR PAYASHÑA TITO PEDRO
SI,125,ALARCÓN GUILLÍN FREDY OSCAR
SI,126,SOLORZANO SARRIA CESAR FAUSTO
SI,127,UGARTE GUZMÁN BLANCA ROSANA
SI,128,VINTIMILLA MOSCOSO PAOLA
SI,129,ZAMBRANO ORTIZ MARÍA ROBERTA
SI,130,PALACIOS MUÑOZ JUAN SEBASTIÁN
SI,131,PAREDES TORRES WASHINGTON ARTURO
SI,132,ROMERO LOAYZA FRANCO SEGUNDO
NO,1,AGUIÑAGA VALLEJO PAOLA MARCELA
NO,11,BUENDÍA HERDOÍZA MARÍA SOLEDAD
NO,15,CALLE VERZOZI HERMUY
NO,17,CÁRDENAS ESPINOZA JUAN JORGE
NO,22,CHALÁ CRUZ JOSÉ FRANKLIN
NO,28,DURÁN AGUILAR LILIANA ELIZABETH
NO,29,ESPÍN REYES EUGENIA SOFÍA
NO,30,CABEZAS CASTILLO JANETH PAOLA
NO,33,GARCÍA POZO DIEGO OSWALDO
NO,37,HOLGUÍN NARANJO MARCELA PRISCILA
NO,39,LLORET VALDIVIESO JUAN CRISTÓBAL
NO,43,MUÑOZ LÓPEZ CHRISTIAN PABEL
NO,44,NARANJO ALVARADO PRISCILA AMAPOLA
NO,54,RIVADENEIRA BURBANO GABRIELA ALEJANDRA
NO,55,RIVADENEIRA BUSTOS CARMEN MERCEDES
NO,58,SAMANIEGO MAIGUA FRANKLIN OMAR
NO,61,SOLIZ CARRIÓN DORIS JOSEFINA
NO,62,VALLE PINARGOTE BAIRON LEONARDO
NO,64,VERA FLORES WENDY VANESSA
NO,94,ZAMBRANO VALLE EDUARDO MAURICIO
ABSTENCION,51,PROAÑO CIFUENTES ROBERTH MAURICIO
ABSTENCION,52,QUIJIJE DELGADO LUIS RAFAEL
ABSTENCION,73,AUQUILLA ORTEGA RAÚL VICENTE
ABSTENCION,74,BERNAL BERNAL ESTEBAN REMIGIO
ABSTENCION,80,CALLEJAS BARONA FERNANDO
ABSTENCION,81,CAMPAIN BRAMBILLA RINA ASUNCIÓN
ABSTENCION,82,CAMPOVERDE ROBLES EMILIO ABSALÓN
ABSTENCION,83,CARRIÓN MORENO CÉSAR ATAULFO
ABSTENCION,89,CASTANIER JARAMILLO XAVIER HOMERO
ABSTENCION,92,ZÁRATE CASTRO JORGE EDUARDO
ABSTENCION,100,CURICHUMBI YUPANQUI PEDRO
ABSTENCION,101,DONOSO CHIRIBOGA PATRICIO
ABSTENCION,102,FLORES VÁSQUEZ FERNANDO PATRICIO
ABSTENCION,103,GALARZA AÑAZCO ANA MERCEDES
ABSTENCION,105,GÓMEZ ALCÍVAR ROBERTO ANDRÉS
ABSTENCION,116,MINCHALA MURILLO RÓMULO MARCELO
ABSTENCION,117,LOPEZ ANDRADE JOSE PATRICIO
ABSTENCION,118,MORENO GUERRERO HENRY FREDY
ABSTENCION,120,PACHALA POMA LUIS ALBERTO
ABSTENCION,121,TELLO BENALCÁZAR RAÚL ESTUPIÑAN
ABSTENCION,133,SIMBAÑA VILLARREAL ABDÓN MARCELO
ABSTENCION,134,SUQUILANDA VALDIVIESO BYRON VINICIO
ABSTENCION,135,VERA MENDOZA TANLLY JANELA
ABSTENCION,137,YÉPEZ MARTÍNEZ HÉCTOR JOSÉ
