curul,asambleista,voto
9,BERGMANN REYNA CARLOS ALBERTO,AUSENTE
11,BUENDÍA HERDOÍZA MARÍA SOLEDAD,AUSENTE
13,CABEZAS GUERRERO ELIZABETH ENRIQUETA,AUSENTE
14,CADENA VÉLEZ KARLA GABRIELA,AUSENTE
21,CERDA MIRANDA GABRIELA PAMELA,AUSENTE
25,CUESTA RÍOS LIUBA ELISA,AUSENTE
28,DURÁN AGUILAR LILIANA ELIZABETH,AUSENTE
30,ESPINOSA ANDRADE AUGUSTO XAVIER,AUSENTE
32,GARCÍA GAIBOR CARMEN MERCEDES,AUSENTE
37,HOLGUÍN NARANJO MARCELA PRISCILA,AUSENTE
39,LLORET VALDIVIESO JUAN CRISTÓBAL,AUSENTE
42,MENDOZA ARÉVALO DANIEL ISAAC,AUSENTE
51,PROAÑO CIFUENTES ROBERTH MAURICIO,AUSENTE
52,QUIJIJE DELGADO LUIS RAFAEL,AUSENTE
54,RIVADENEIRA BURBANO GABRIELA ALEJANDRA,AUSENTE
57,SALGADO ANDRADE SILVIA BETZABETH,AUSENTE
58,SAMANIEGO MAIGUA FRANKLIN OMAR,AUSENTE
67,VITERI GUALINGA CARLOS ELOY,AUSENTE
70,ZAMBRANO ARTEAGA JOSE RICARDO,AUSENTE
92,CRUZ VACA JEANNINE DEL CISNE,AUSENTE
94,ZAMBRANO VALLE EDUARDO MAURICIO,AUSENTE
113,TORRES TORRES LUIS FERNANDO,AUSENTE
129,ZAMBRANO ORTIZ MARÍA ROBERTA,AUSENTE
2,ALBORNOZ VINTIMILLA CLAUDIO ESTEBAN,SI
6,ARREGUI RUEDA MARCIA CECILIA,SI
7,ARTEAGA MUÑOZ KARINA CECILIA,SI
8,BENAVIDES ZAMBRANO ZOILA TERESA,SI
10,BONILLA SALCEDO VIVIANA,SI
12,BUSTAMANTE MONTEROS RUBÉN ALEJANDRO,SI
16,CAMBALA MONTECE CARLOS ALBERTO,SI
18,CARRIÓN CEVALLOS MARÍA JOSÉ,SI
19,VALLEJO JARAMILLO NORMA MARLENE,SI
20,CEDEÑO ZAMBRANO JOHANNA ELIZABETH,SI
23,CHÁVEZ BAJAÑA KHARLA DEL ROCÍO,SI
24,COROZO AYOVÍ JORGE WILBER,SI
27,DOUMET CHEDRAUI MICHEL ANDRÉS,SI
31,FLOR GIL BRENDA AZUCENA,SI
34,GARZÓN RICAURTE WILLIAM ANTONIO,SI
35,GAVILÁNEZ CAMACHO FAFO HOLGUÍN,SI
38,LITARDO CAICEDO CÉSAR ERNESTO,SI
40,MARÍN AGUIRRE ANA BELÉN,SI
45,OCHOA MORANTE MANUEL ALFREDO,SI
46,ORELLANA ROMÁN ROSA GINA,SI
47,PALACIOS VELÁSQUEZ SONIA LUCRECIA,SI
48,PEÑA PACHECO XIMENA DEL ROCÍO,SI
49,PLAZA CASTILLO LENIN,SI
50,POMA HERRERA YOFRE MARTÍN,SI
53,QUIÑONEZ OCAMPO JULIO CÉSAR,SI
55,COROZO VALENCIA WILMER JORVELIS,SI
56,SALAZAR CEDEÑO GUADALUPE DOLORES,SI
59,SÁNCHEZ REYES MONTGOMERY,SI
60,ALEMÁN MARMOL MÓNICA ROCÍO,SI
63,VELIN CORTÉS JUAN PABLO,SI
65,VERA RODRÍGUEZ CARLOS ALFREDO,SI
66,VILLALVA MIRANDA LIRA DE LA PAZ,SI
68,YAR ARAUJO JUAN CARLOS,SI
69,YUNDA MACHADO JORGE HOMERO,SI
71,ANDRADE MUÑOZ WILMA PIEDAD,SI
72,ASÁN WONSANG JOSÉ FRANCISCO,SI
73,AUQUILLA ORTEGA RAÚL VICENTE,SI
74,BERNAL BERNAL ESTEBAN REMIGIO,SI
75,BURBANO MONTENEGRO FÉLIX FERNANDO,SI
77,AZUERO RODAS ELISEO ALEXIS,SI
78,CUCALÓN CAMACHO HENRY EDUARDO,SI
79,FALQUEZ BATALLAS PEDRO CARLOS,SI
80,CALLEJAS BARONA FERNANDO,SI
81,CAMPAIN BRAMBILLA RINA ASUNCIÓN,SI
82,CAMPOVERDE ROBLES EMILIO ABSALÓN,SI
83,CARRIÓN MORENO CÉSAR ATAULFO,SI
84,ZAMBRANO CHACHA ALBERTO ALEXANDER,SI
85,SINMALEZA SÁNCHEZ ÁNGEL RUPERTO,SI
86,YANDÚN POZO CÁSTULO RENÉ,SI
87,HENRÍQUEZ JAIME PATRICIA IVONNE,SI
88,OLLAGUE VALAREZO ZOILA PIEDAD,SI
89,CASTANIER JARAMILLO XAVIER HOMERO,SI
90,CELI SANTOS GUILLERMO ALEJANDRO,SI
91,CRUZ PROAÑO LUDOVICO ISRAEL,SI
93,CUESTA ORELLANA MARÍA DE LOURDES,SI
95,CADENA HUERTAS FRANCISCO JAVIER,SI
96,PEÑA ONTANEDA ELIO GERMÁN,SI
97,CAMPOVERDE GONZÁLEZ RAÚL FREDDY BOLÍVAR,SI
98,"PASSAILAIGUE MANOSALVAS DALLYANAMARIANELA",SI
99,REYES HIDALGO CRISTINA EUGENIA,SI
100,CURICHUMBI YUPANQUI PEDRO,SI
101,DONOSO CHIRIBOGA PATRICIO,SI
102,FLORES VÁSQUEZ FERNANDO PATRICIO,SI
103,GALARZA AÑAZCO ANA MERCEDES,SI
104,GENDE CALAZACÓN ANGEL MESÍAS,SI
105,GÓMEZ ALCÍVAR ROBERTO ANDRÉS,SI
106,ZAMBRANO VERA MARIANO,SI
107,CANDELL SOTO JAIME ENRIQUE JIMMY,SI
108,DUCHI GUAMÁN MARÍA ENCARNACIÓN,SI
109,OLIVO PALLO JAIME FERNANDO,SI
110,ROHON HERVAS CÉSAR EDUARDO,SI
111,TAIANO BASANTE VICENTE GIOVANNY,SI
112,TERÁN SALCEDO RAMÓN FORTUNATO,SI
114,LARREÁTEGUI FABARA MARÍA GABRIELA,SI
115,CUADRO GASTEZZI DEYSI MARIA,SI
116,MINCHALA MURILLO RÓMULO MARCELO,SI
117,MONTAÑO VALENCIA MAE,SI
118,MORENO GUERRERO HENRY FREDY,SI
119,MUÑOZ ALARCÓN HÉCTOR PATRICIO,SI
120,PACHALA POMA LUIS ALBERTO,SI
121,TELLO BENALCÁZAR RAÚL ESTUPIÑAN,SI
122,GARCIA CANO LUIGI FRANCISCO,SI
123,BUSTAMANTE BRICEÑO YONY ESPERANZA,SI
124,PUANCHIR PAYASHÑA TITO PEDRO,SI
125,ALARCÓN GUILLÍN FREDY OSCAR,SI
126,SOLORZANO SARRIA CESAR FAUSTO,SI
127,ALMEYDA JALIL VICENTE FERNANDO,SI
128,VINTIMILLA MOSCOSO PAOLA,SI
130,PALACIOS MUÑOZ JUAN SEBASTIÁN,SI
131,PAREDES TORRES WASHINGTON ARTURO,SI
132,ROMERO LOAYZA FRANCO SEGUNDO,SI
133,SIMBAÑA VILLARREAL ABDÓN MARCELO,SI
134,SUQUILANDA VALDIVIESO BYRON VINICIO,SI
135,VERA MENDOZA TANLLY JANELA,SI
136,VILLAMAR JÁCOME PEDRO FABRICIO,SI
137,YÉPEZ MARTÍNEZ HÉCTOR JOSÉ,SI
1,AGUIÑAGA VALLEJO PAOLA MARCELA,ABSTENCION
3,SERRANO SALGADO JOSÉ RICARDO,ABSTENCION
4,ARIAS FERNÁNDEZ VERÓNICA ELIZABETH,ABSTENCION
5,OVIEDO ENDERICA DANIELA NATHALY,ABSTENCION
15,CALLE VERZOZI HERMUY,ABSTENCION
17,CÁRDENAS ESPINOZA JUAN JORGE,ABSTENCION
22,CHALÁ CRUZ JOSÉ FRANKLIN,ABSTENCION
26,CUESTA SANTANA ESTHER ADELINA,ABSTENCION
29,ESPÍN REYES EUGENIA SOFÍA,ABSTENCION
33,GARCÍA POZO DIEGO OSWALDO,ABSTENCION
36,GUEVARA VILLACRÉS VERÓNICA MARGARITA,ABSTENCION
41,MELO GARZÓN ESTEBAN ANDRÉS,ABSTENCION
43,PAREDES BENAVIDES LIDIA VICTORIA,ABSTENCION
44,NARANJO ALVARADO PRISCILA AMAPOLA,ABSTENCION
61,SOLIZ CARRIÓN DORIS JOSEFINA,ABSTENCION
62,TENEZACA LOPEZ MABEL MICHELL,ABSTENCION
64,VERA FLORES WENDY VANESSA,ABSTENCION
76,PALACIOS ALEJANDRO CESAR GUSTAVO,ABSTENCION
