curul,asambleista,voto
1,GUAMAN MAYANCELA MARIA MERCEDES,AUSENTE
10,MONGE ESPINEL LUIS HUMBERTO,AUSENTE
12,ARREGUI RUEDA MARCIA CECILIA,AUSENTE
14,BERGMANN REYNA CARLOS ALBERTO,AUSENTE
18,CALDERON SALTOS RICHARD OSWALDO,AUSENTE
26,CHAVEZ CANALES HOLGER EZEQUIEL,AUSENTE
37,LARREA VITERI LIDICE VANESSA,AUSENTE
40,GONZALEZ SERRANO MIRYAM CATARINA,AUSENTE
43,GUDIÑO MENA ZOBEIDA GUISELA,AUSENTE
60,QUIROZ VALLEJO HECTOR HUGO,AUSENTE
64,PEÑA CARRASCO DIANA LUCIA,AUSENTE
66,QUINCHIGUANGO GISELA,AUSENTE
76,RODRIGUEZ DELGADO MARIA VERONICA,AUSENTE
77,SAENZ DE VITERI LAUTARO ENRIQUE,AUSENTE
78,SUBIA BARREIRO BOLIVAR STALIN,AUSENTE
81,VILLAO PANCHANA RAUL ELIAS,AUSENTE
84,SANCHEZ ORDOÑEZ MONTGOMERY LUIS,AUSENTE
88,DIAZ COKA MARIA GABRIELA,AUSENTE
89,FIERRO OVIEDO PACO,AUSENTE
91,ORELLANA MARQUINEZ MAGALI MARGOT,AUSENTE
92,UMAGINGA GUAMAN CESAR,AUSENTE
93,TIBAN GUALA LOURDES LICENIA,AUSENTE
117,PAEZ BENALCAZAR ANDRES TARQUINO,AUSENTE
118,SALGADO RIVADENEIRA DIEGO,AUSENTE
124,ZAMBRANO ARTEAGA JOSE RICARDO,AUSENTE
126,ZAMBRANO CASTRO NORALMA ELIZABETH,AUSENTE
130,MERA RODRIGUEZ MARIA PAULINA,AUSENTE
136,SERRANO VALLADARES SAADIN ALFREDO,AUSENTE
2,ACERO LANCHIMBA ESTHELA LILIANA,SI
3,AGUILAR PLACIDO ARMANDO,SI
4,MACHUCA MOSCOSO LINDA MARICELA,SI
5,AGUIRRE HIDALGO DORA ANDELA,SI
6,ALBAN TORRES MARIANA DEL ROCIO,SI
7,TORRES CEDEÑO KERLLY ANABEL,SI
8,MUÑOZ VICUÑA MARIANGEL,SI
9,ANDINO REINOSO MAURO EDMUNDO,SI
11,RIVAS ALAVA ELIANA LISSET,SI
13,MARQUEZ LOPEZ JOSE LENIN,SI
15,BARRIGA ROCIO,SI
16,RIVADENEIRA BURBANO GABRIELA ALEJANDRA,SI
17,BUSTAMANTE PONCE FERNANDO XAVIER,SI
19,CALLE ANDRADE MARIA AUGUSTA,SI
20,CARRILLO BETTY,SI
21,CARRION MARIA JOSE,SI
22,CARVAJAL AGUIRRE MIGUEL ANGEL,SI
23,CASSINELLI CALI JUAN CARLOS,SI
24,CAYAMBE TIPAN FAUSTO HERIBERTO,SI
25,OLAYA LIDER,SI
27,CHICA AREVALO VINICIO VETHOWEN,SI
28,CORDOVA ENCALADA EDGAR EDUARDO,SI
29,CUESTA RIOS LIUBA ELISA,SI
30,DE LA CRUZ BERNARDO HERMAN ULISES,SI
31,DE LA CRUZ GASPAR ADRIANA MIOSOTI,SI
32,DELGADO CHALA AGUSTIN JAVIER,SI
33,FAJARDO MOSQUERA LETTY VANESSA,SI
34,FALCONI LOQUI EVELYN PAMELA,SI
35,GAGLIARDO LOOR GASTON,SI
36,DE LA TORRE RAMIREZ PABLO ANTONIO,SI
38,GARZON RICAURTE WILLIAM ANTONIO,SI
39,GODOY ANDRADE GINA JAKELINE,SI
41,GUAMAN CASTRO ALEX FRANCISCO,SI
42,GUAMANGATE ANTE LUIS GILBERTO,SI
44,GUEVARA VILLACRES VERONICA MARGARITA,SI
45,GUZMAN OCHOA LILIANA MAURA,SI
46,HERNANDEZ ENRIQUEZ VIRGILIO HUMBERTO,SI
47,MOSQUERA YANEZ ISABEL PIEDAD,SI
48,ISSA WAGNER NICOLAS JOSE,SI
49,CARRILLO CRESPO HUGO FERNANDO,SI
50,SILVA MALDONADO SOFIA IRENE,SI
51,ORTIZ GASPAR ESTHER FLAVIA,SI
52,BUENDIA HERDOIZA MARIA SOLEDAD,SI
53,LARRIVA ALVARADO OSCAR OSWALDO,SI
54,LEDESMA ZAMORA OSCAR ALFONSO,SI
55,AGUIÑAGA VALLEJO PAOLA MARCELA,SI
56,MELO GARZON ESTEBAN ANDRES,SI
57,TOBAR NUÑEZ RAUL IGNACIO,SI
58,MUÑOZ AVENDAÑO ROSA ELVIRA,SI
59,ALVARADO CARRION ROSANA,SI
61,PABON CARANQUI PAOLA VERENICE,SI
62,PADRON SAETEROS GLADYS PAULINA,SI
63,PATIÑO AROCA RAUL LEONARDO,SI
65,PEÑA PACHECO XIMENA DEL ROCIO,SI
67,CAMPOVERDE CALVA SEGUNDO MODESTO,SI
68,PILLAJO TUQUERES JENNY ELIZABETH,SI
69,FARES GUAILLAS MARIA SEBASTIANA,SI
70,RIVERA LOPEZ JOSE GABRIEL,SI
71,RIVERO DOGUER ANGEL ARMANDO,SI
72,MEDINA MERA VICTOR CLEMENTE,SI
73,REINOSO LESCANO MARIA ELIZABETH,SI
74,AGUILAR TORRES MANUEL RAMIRO,SI
75,ARIAS FERNANDEZ VERONICA ELIZABETH,SI
79,CANTOS MENDOZA ALBA JANET,SI
85,MOYA DUQUE HERMAN ANIBAL,SI
86,SERRANO REYES NELSON ALCIDES,SI
87,SOLANO MORENO ALEX FABIAN,SI
94,TERAN SARZOSA SEGUNDO FAUSTO,SI
95,VALAREZO ORDOÑEZ ROCIO DEL CARMEN,SI
96,VALLE PINARGOTE BAIRON LEONARDO,SI
98,INTRIAGO MACIAS CARMEN ELENA,SI
99,PACHECO ORDOÑEZ BAYRON EDUARDO,SI
106,VELA CHERONI MARIA SOLEDAD,SI
107,ARGUELLO TROYA BLANCA AZUCENA,SI
108,VELASCO ENRIQUEZ CARLOS ALBERTO,SI
109,VELIZ BRIONES JOSE FELIX,SI
110,VERDUGA CEDEÑO MARY,SI
111,JONIAUX BLUM ENRIQUE ALEJANDRO,SI
112,VILEMA FREIRE ANGEL RAMIRO,SI
113,POSSO SALGADO LUIS ANTONIO,SI
120,TORRES TORRES LUIS FERNANDO,SI
121,VILLACRESES PEÑA OCTAVIO XAVIER ENRIQUE,SI
122,VINTIMILLA JARRIN DIEGO ARMANDO,SI
123,VITERI GUALINGA CARLOS ELOY,SI
125,ZAMBRANO CABANILLA EDUARDO ALFONSO,SI
127,ZAMBRANO CHACHA ALBERTO ALEXANDER,SI
128,SERRANO SEGURA GRACE MARISOL,SI
129,URIBE LOPEZ FANNY ESTHER,SI
131,CUCALON CAMACHO HENRY EDUARDO,SI
132,REYES HIDALGO CRISTINA EUGENIA,SI
133,TACLE GALARRAGA MOISES FERNANDO,SI
134,ROMERO LOAYZA FRANCO SEGUNDO,SI
135,TERAN SALCEDO RAMON FORTUNATO,SI
137,KRONFLE GOMEZ MARIA CRISTINA,SI
82,YANDUN POZO CASTULO RENE,NO
83,ACACHO GONZALEZ PEPE LUIS,NO
97,VASCONEZ ARTEAGA ANNY MARLLELY,NO
105,BUCARAM PULLEY ABDALA JAIME,BLANCO
80,CASTRO AJILA GLADYS LUCIA,ABSTENCION
90,GUALAN JAPA MILTON RODRIGO,ABSTENCION
100,GUTIERREZ BORBUA FAUSTO GILMAR,ABSTENCION
101,AUQUILLA ORTEGA RAUL VICENTE,ABSTENCION
102,CHICAIZA TOAPANTA WILSON ALFONSO,ABSTENCION
103,DONOSO CHIRIBOGA PATRICIO,ABSTENCION
104,MONCAYO CEVALLOS JOSE RICARDO,ABSTENCION
114,SOLORZANO SARRIA CESAR FAUSTO,ABSTENCION
115,MONTAÑO VALENCIA MAE,ABSTENCION
116,MORETA PANCHEZ MIGUEL ANGEL,ABSTENCION
119,PUYOL CORTEZ JORGE LUIS,ABSTENCION
