curul,asambleista,voto
1,AGUIÑAGA VALLEJO PAOLA MARCELA,AUSENTE
2,ALBORNOZ VINTIMILLA CLAUDIO ESTEBAN,AUSENTE
11,BUENDÍA HERDOÍZA MARÍA SOLEDAD,AUSENTE
14,CADENA VÉLEZ KARLA GABRIELA,AUSENTE
22,CHALÁ CRUZ JOSÉ FRANKLIN,AUSENTE
36,GUEVARA VILLACRÉS VERÓNICA MARGARITA,AUSENTE
40,MARÍN AGUIRRE ANA BELÉN,AUSENTE
41,MELO GARZÓN ESTEBAN ANDRÉS,AUSENTE
47,PALACIOS VELÁSQUEZ SONIA LUCRECIA,AUSENTE
48,PEÑA PACHECO XIMENA DEL ROCÍO,AUSENTE
61,SOLIZ CARRIÓN DORIS JOSEFINA,AUSENTE
64,VERA FLORES WENDY VANESSA,AUSENTE
69,GUAMBA DÍAZ NANCY JEANNETH,AUSENTE
70,ZAMBRANO ARTEAGA JOSE RICARDO,AUSENTE
73,MALDONADO JARAMILLO MARÍA ISABEL,AUSENTE
79,FALQUEZ BATALLAS PEDRO CARLOS,AUSENTE
89,CASTANIER JARAMILLO XAVIER HOMERO,AUSENTE
92,CRUZ VACA JEANNINE DEL CISNE,AUSENTE
99,REYES HIDALGO CRISTINA EUGENIA,AUSENTE
104,LÓPEZ LAPO CARLOS VÍCTOR,AUSENTE
105,GÓMEZ ALCÍVAR ROBERTO ANDRÉS,AUSENTE
110,ROHON HERVAS CÉSAR EDUARDO,AUSENTE
116,VERA CALDERÓN SILVIA LORENA,AUSENTE
120,PACHALA POMA LUIS ALBERTO,AUSENTE
121,TELLO BENALCÁZAR RAÚL ESTUPIÑAN,AUSENTE
123,PEÑAFIEL IZQUIERDO EDDY COLÓN,AUSENTE
124,PUANCHIR PAYASHÑA TITO PEDRO,AUSENTE
131,PAREDES TORRES WASHINGTON ARTURO,AUSENTE
134,SUQUILANDA VALDIVIESO BYRON VINICIO,AUSENTE
136,VILLAMAR JÁCOME PEDRO FABRICIO,AUSENTE
3,SERRANO SALGADO JOSÉ RICARDO,SI
4,ARIAS FERNÁNDEZ VERÓNICA ELIZABETH,SI
5,ARIAS RAMÍREZ ALBERTO JESÚS,SI
6,YELA ACOSTA WERNER ANTONIO,SI
7,MONTESDEOCA PALACIOS JOSÉ DANIEL,SI
8,BENAVIDES ZAMBRANO ZOILA TERESA,SI
9,MORENO INTRIAGO MARIA LUISA,SI
10,BONILLA SALCEDO VIVIANA,SI
12,BUSTAMANTE MONTEROS RUBÉN ALEJANDRO,SI
13,CABEZAS GUERRERO ELIZABETH ENRIQUETA,SI
16,CAMBALA MONTECE CARLOS ALBERTO,SI
18,EGAS LEDESMA JOSÉ ANTONIO,SI
19,VALLEJO JARAMILLO NORMA MARLENE,SI
20,TENORIO VALENCIA CALLETANO,SI
21,CERDA MIRANDA GABRIELA PAMELA,SI
23,CHÁVEZ BAJAÑA KHARLA DEL ROCÍO,SI
24,COROZO AYOVÍ JORGE WILBER,SI
25,CUESTA RÍOS LIUBA ELISA,SI
27,DOUMET CHEDRAUI MICHEL ANDRÉS,SI
29,ESPÍN REYES EUGENIA SOFÍA,SI
31,FLOR GIL BRENDA AZUCENA,SI
34,GARZÓN RICAURTE WILLIAM ANTONIO,SI
35,GAVILÁNEZ CAMACHO FAFO HOLGUÍN,SI
37,HOLGUÍN NARANJO MARCELA PRISCILA,SI
38,LITARDO CAICEDO CÉSAR ERNESTO,SI
42,MENDOZA ARÉVALO DANIEL ISAAC,SI
44,NARANJO ALVARADO PRISCILA AMAPOLA,SI
45,OCHOA MORANTE MANUEL ALFREDO,SI
46,ORELLANA ROMÁN ROSA GINA,SI
49,PLAZA CASTILLO LENIN,SI
50,POMA HERRERA YOFRE MARTÍN,SI
51,PROAÑO CIFUENTES ROBERTH MAURICIO,SI
52,QUIJIJE DELGADO LUIS RAFAEL,SI
53,QUIÑONEZ OCAMPO JULIO CÉSAR,SI
55,RIVADENEIRA BUSTOS CARMEN MERCEDES,SI
56,SALAZAR CEDEÑO GUADALUPE DOLORES,SI
57,SALGADO ANDRADE SILVIA BETZABETH,SI
58,SAMANIEGO MAIGUA FRANKLIN OMAR,SI
59,SÁNCHEZ REYES MONTGOMERY,SI
60,ALEMÁN MARMOL MÓNICA ROCÍO,SI
62,VALLE PINARGOTE BAIRON LEONARDO,SI
63,VELIN CORTÉS JUAN PABLO,SI
65,VERA RODRÍGUEZ CARLOS ALFREDO,SI
66,VELASTEGUI NARANJO OLGUER FABRICIO,SI
68,YAR ARAUJO JUAN CARLOS,SI
71,ANDRADE MUÑOZ WILMA PIEDAD,SI
72,ASÁN WONSANG JOSÉ FRANCISCO,SI
74,BERNAL BERNAL ESTEBAN REMIGIO,SI
75,CERDA ROSERO THALIA GENOVEVA,SI
76,ZAMBRANO CASTRO NORALMA ELIZABETH,SI
77,AZUERO RODAS ELISEO ALEXIS,SI
78,ORDOÑEZ ZAMBRANO SANDRA DEL ROCÍO,SI
80,CALLEJAS BARONA FERNANDO,SI
81,CAMPAIN BRAMBILLA RINA ASUNCIÓN,SI
82,CAMPOVERDE ROBLES EMILIO ABSALÓN,SI
83,CARRIÓN MORENO CÉSAR ATAULFO,SI
84,ZAMBRANO CHACHA ALBERTO ALEXANDER,SI
85,GONZÁLEZ VÁSCONEZ TERESITA XIMENA,SI
86,YANDÚN POZO CÁSTULO RENÉ,SI
87,HENRÍQUEZ JAIME PATRICIA IVONNE,SI
88,OLLAGUE VALAREZO ZOILA PIEDAD,SI
90,CELI SANTOS GUILLERMO ALEJANDRO,SI
91,CRUZ PROAÑO LUDOVICO ISRAEL,SI
93,CUESTA ORELLANA MARÍA DE LOURDES,SI
95,CADENA HUERTAS FRANCISCO JAVIER,SI
96,PEÑA ONTANEDA ELIO GERMÁN,SI
97,MONTAÑO GUISAMANO MAYRA MIGDONIA,SI
98,"PASSAILAIGUE MANOSALVAS DALLYANAMARIANELA",SI
100,CURICHUMBI YUPANQUI PEDRO,SI
101,DONOSO CHIRIBOGA PATRICIO,SI
102,FLORES VÁSQUEZ FERNANDO PATRICIO,SI
103,GALARZA AÑAZCO ANA MERCEDES,SI
106,MACÍAS ORTEGA WENDY ELENA MARISOL,SI
107,CANDELL SOTO JAIME ENRIQUE JIMMY,SI
108,DUCHI GUAMÁN MARÍA ENCARNACIÓN,SI
109,ZAPATA GÓMEZ DALILA MONSERRATH,SI
111,TACLE GARCÍA SAMIA,SI
112,TERÁN SALCEDO RAMÓN FORTUNATO,SI
113,TORRES TORRES LUIS FERNANDO,SI
114,LARREÁTEGUI FABARA MARÍA GABRIELA,SI
115,CARBO AGUIRRE JONATHAN ALEXI,SI
117,MONTAÑO VALENCIA MAE,SI
118,VARGAS SÁNCHEZ GRETTY LEILA,SI
119,HIDALGO ESPINEL SANDRA VICTORIA CARMEN,SI
122,CUESTA CONCARI MARÍA MERCEDES,SI
125,ALARCÓN GUILLÍN FREDY OSCAR,SI
126,SOLORZANO SARRIA CESAR FAUSTO,SI
127,UGARTE GUZMÁN BLANCA ROSANA,SI
128,VINTIMILLA MOSCOSO PAOLA,SI
129,LEÓN ZAVALA MARCO ANTONIO,SI
130,PALACIOS MUÑOZ JUAN SEBASTIÁN,SI
132,ROMERO LOAYZA FRANCO SEGUNDO,SI
133,SIMBAÑA VILLARREAL ABDÓN MARCELO,SI
135,VERA MENDOZA TANLLY JANELA,SI
137,YÉPEZ MARTÍNEZ HÉCTOR JOSÉ,SI
15,CALLE VERZOZI HERMUY,ABSTENCION
17,CÁRDENAS ESPINOZA JUAN JORGE,ABSTENCION
26,CUESTA SANTANA ESTHER ADELINA,ABSTENCION
28,DURÁN AGUILAR LILIANA ELIZABETH,ABSTENCION
30,ESPINOSA ANDRADE AUGUSTO XAVIER,ABSTENCION
32,GARCÍA GAIBOR CARMEN MERCEDES,ABSTENCION
33,GARCÍA POZO DIEGO OSWALDO,ABSTENCION
39,LLORET VALDIVIESO JUAN CRISTÓBAL,ABSTENCION
43,PAREDES BENAVIDES LIDIA VICTORIA,ABSTENCION
54,RIVADENEIRA BURBANO GABRIELA ALEJANDRA,ABSTENCION
67,VITERI GUALINGA CARLOS ELOY,ABSTENCION
94,ZAMBRANO VALLE EDUARDO MAURICIO,ABSTENCION
