curul,asambleista,voto
8,MUÑOZ VICUÑA MARIANGEL,AUSENTE
10,VITERI LOPEZ CHRISTIAN HUMBERTO,AUSENTE
12,ARREGUI RUEDA MARCIA CECILIA,AUSENTE
39,GODOY ANDRADE GINA JAKELINE,AUSENTE
45,RODAS MARCA CARLOS EDUARDO,AUSENTE
48,ISSA WAGNER NICOLAS JOSE,AUSENTE
53,LARRIVA ALVARADO OSCAR OSWALDO,AUSENTE
59,CABRERA FAJARDO SEGUNDO CESAR,AUSENTE
67,CAMPOVERDE CALVA SEGUNDO MODESTO,AUSENTE
76,RODRIGUEZ DELGADO MARIA VERONICA,AUSENTE
80,BUSTOS CHILIQUINGA ARCADIO,AUSENTE
90,QUEZADA CARRION ANDREA MARIBEL,AUSENTE
92,UMAJINGA GUAMAN CESAR,AUSENTE
108,CHAMORRO HIDALGO YOLANDA JOSEFINA,AUSENTE
111,VICUÑA MUÑOZ MARIA ALEJANDRA,AUSENTE
119,CHICA ARTEAGA GUNTARD PAVEL,AUSENTE
131,CUCALON CAMACHO HENRY EDUARDO,AUSENTE
136,SERRANO VALLADARES SAADIN ALFREDO,AUSENTE
137,KRONFLE GOMEZ MARIA CRISTINA,AUSENTE
1,ABAD VELEZ RAUL,SI
2,ACERO LANCHIMBA ESTHELA LILIANA,SI
3,AGUILAR PLACIDO ARMANDO,SI
4,MACHUCA MOSCOSO LINDA MARICELA,SI
5,ORTIZ LARA LEONARDO,SI
6,ALBAN TORRES MARIANA DEL ROCIO,SI
7,MONTENEGRO NUÑEZ CHRISTIAN SANTIAGO,SI
9,ANDINO REINOSO MAURO EDMUNDO,SI
11,RIVAS ALAVA ELIANA LISSET,SI
13,BENAVIDES ZAMBRANO ZOILA TERESA,SI
14,BERGMANN REYNA CARLOS ALBERTO,SI
15,BORJA PEREZ GALO,SI
16,RIVADENEIRA BURBANO GABRIELA ALEJANDRA,SI
17,PAREDES BENAVIDES LIDIA VICTORIA,SI
18,CALDERON SALTOS RICHARD OSWALDO,SI
19,CALLE ANDRADE MARIA AUGUSTA,SI
20,CARRILLO BETTY,SI
21,CARRION MARIA JOSE,SI
22,CARVAJAL AGUIRRE MIGUEL ANGEL,SI
23,CASSINELLI CALI JUAN CARLOS,SI
24,CONSTANTE NIETO MARIANA DE LAS MERCEDES,SI
25,CEDEÑO ZAMBRANO JOHANNA ELIZABETH,SI
26,CHAVEZ CANALES HOLGER EZEQUIEL,SI
27,CHICA AREVALO VINICIO VETHOWEN,SI
28,CORDOVA ENCALADA EDGAR EDUARDO,SI
29,MACIAS GARCIA PEDRO ROBERTO GEOVANNY,SI
30,DE LA CRUZ BERNARDO HERMAN ULISES,SI
31,ESTARELLAS SOLIS FRANCISCO JOSE,SI
32,DELGADO CHALA AGUSTIN JAVIER,SI
33,FAJARDO MOSQUERA LETTY VANESSA,SI
34,FALCONI LOQUI EVELYN PAMELA,SI
35,GAGLIARDO LOOR GASTON,SI
36,DE LA TORRE RAMIREZ PABLO ANTONIO,SI
37,LARREA VITERI LIDICE VANESSA,SI
38,GARZON RICAURTE WILLIAM ANTONIO,SI
40,GONZALEZ SERRANO MIRYAM CATARINA,SI
41,GUAMAN CASTRO ALEX FRANCISCO,SI
42,GUAMANGATE ANTE LUIS GILBERTO,SI
43,GUDIÑO MENA ZOBEIDA GUISELA,SI
44,GUEVARA VILLACRES VERONICA MARGARITA,SI
46,GUTIERREZ MOSCOSO MARIA EUGENIA,SI
47,MOSQUERA YANEZ ISABEL PIEDAD,SI
49,JEREZ PILLA BETTY MARICELA,SI
50,ARANA COELLO YIMABEL MARIA,SI
51,BAZURTO ROLDAN NANCIS CELESTE,SI
52,BUENDIA HERDOIZA MARIA SOLEDAD,SI
54,LEDESMA ZAMORA OSCAR ALFONSO,SI
55,AGUIÑAGA VALLEJO PAOLA MARCELA,SI
56,MELO GARZON ESTEBAN ANDRES,SI
57,TOBAR NUÑEZ RAUL IGNACIO,SI
58,MUÑOZ AVENDAÑO ROSA ELVIRA,SI
60,OCLES PADILLA ALEXANDRA,SI
61,CAZA TIPANTA HUGO RENE,SI
62,PADRON SAETEROS GLADYS PAULINA,SI
63,BRITO MENDOZA MONICA CRISTINA,SI
64,TORRES LARA JOSE EDUARDO,SI
65,PEÑA PACHECO XIMENA DEL ROCIO,SI
66,PEÑAFIEL MONTESDEOCA JUANA MARISOL,SI
68,PROAÑO CIFUENTES ROBERTH MAURICIO,SI
69,FARFAN APONTE RICHARD WILSON,SI
70,RIVERA LOPEZ JOSE GABRIEL,SI
71,RIVERO DOGUER ANGEL ARMANDO,SI
72,MEDINA MERA VICTOR CLEMENTE,SI
73,REINOSO LESCANO MARIA ELIZABETH,SI
75,ARIAS FERNANDEZ VERONICA ELIZABETH,SI
77,GARCIA PLUAS BEATRIZ CANDELARIA,SI
78,SUBIA BARREIRO BOLIVAR STALIN,SI
81,MATIAS APOLINARIO RITA AZUCENA,SI
84,SANCHEZ ORDOÑEZ MONTGOMERY LUIS,SI
85,MOYA DUQUE HERMAN ANIBAL,SI
86,SERRANO REYES NELSON ALCIDES,SI
87,SOLANO MORENO ALEX FABIAN,SI
89,FIERRO OVIEDO PACO,SI
91,ORELLANA MARQUINEZ MAGALI MARGOT,SI
93,ESCALA ZAMBRANO JORGE ELIAS,SI
94,TERAN SARZOSA SEGUNDO FAUSTO,SI
95,VALAREZO ORDOÑEZ ROCIO DEL CARMEN,SI
96,MEJIA PLUAS NILDA CECIBEL,SI
97,VASCONEZ ARTEAGA ANNY MARLLELY,SI
98,VELA CAIZAPANTA ANGEL RAMIRO,SI
100,ALBAN GALLO MARINA ELIZABETH,SI
101,AUQUILLA ORTEGA RAUL VICENTE,SI
102,CHICAIZA TOAPANTA WILSON ALFONSO,SI
103,DONOSO CHIRIBOGA PATRICIO,SI
105,MOREIRA MACIAS GRACE HOLANDA,SI
106,VELA CHERONI MARIA SOLEDAD,SI
107,ARGUELLO TROYA BLANCA AZUCENA,SI
109,VELIZ BRIONES JOSE FELIX,SI
110,VERDUGA CEDEÑO MARY,SI
115,MONTAÑO VALENCIA MAE,SI
116,MORETA PANCHEZ MIGUEL ANGEL,SI
117,PAEZ BENALCAZAR ANDRES TARQUINO,SI
118,SALGADO RIVADENEIRA DIEGO,SI
120,TORRES TORRES LUIS FERNANDO,SI
121,ALEJANDRO MEDINA CRISTINA SORAYA,SI
122,PONCE RUBIO ELVIA AZUCENA,SI
123,VITERI GUALINGA CARLOS ELOY,SI
124,ZAMBRANO ARTEAGA JOSE RICARDO,SI
125,ZAMBRANO CABANILLA EDUARDO ALFONSO,SI
126,ZAMBRANO CASTRO NORALMA ELIZABETH,SI
127,ZAMBRANO CHACHA ALBERTO ALEXANDER,SI
128,SERRANO SEGURA GRACE MARISOL,SI
130,TAPIA LOMBEYDA LUIS FERNANDO,SI
132,REYES HIDALGO CRISTINA EUGENIA,SI
133,TACLE GALARRAGA MOISES FERNANDO,SI
134,ROMERO LOAYZA FRANCO SEGUNDO,SI
135,TERAN SALCEDO RAMON FORTUNATO,SI
74,AGUILAR TORRES MANUEL RAMIRO,NO
79,ANDRADE VARELA JUPITER GOZOSO DE LA CRUZ,NO
82,YANDUN POZO CASTULO RENE,NO
83,ACACHO GONZALEZ PEPE LUIS,NO
88,DIAZ COKA MARIA GABRIELA,NO
99,PACHECO ORDOÑEZ BAYRON EDUARDO,NO
112,VILEMA FREIRE ANGEL RAMIRO,NO
113,POSSO SALGADO LUIS ANTONIO,NO
114,SOLORZANO SARRIA CESAR FAUSTO,NO
129,URIBE LOPEZ FANNY ESTHER,NO
104,MONCAYO CEVALLOS JOSE RICARDO,ABSTENCION
