35,asambleista,curul,total ausente,voto
,ACERO LANCHIMBA ESTHELA LILIANA,2.0,,AUSENTE
,MONTENEGRO NUÑEZ CHRISTIAN SANTIAGO,7.0,,AUSENTE
,ORDOÑEZ ALMEIDA FAUSTO EFRAIN,8.0,,AUSENTE
,VITERI LOPEZ CHRISTIAN HUMBERTO,10.0,,AUSENTE
,VILLAMAR CASAL JOSE LEONIDAS,12.0,,AUSENTE
,BUSTAMANTE PONCE FERNANDO XAVIER,17.0,,AUSENTE
,QUIMBIULCO BEDON LORENA GABRIELA,18.0,,AUSENTE
,CARRILLO BETTY,20.0,,AUSENTE
,CARRIÓN CEVALLOS MARÍA JOSÉ,21.0,,AUSENTE
,CARVAJAL AGUIRRE MIGUEL ÁNGEL,22.0,,AUSENTE
,CUESTA RÍOS LIUBA ELISA,29.0,,AUSENTE
,FAJARDO MOSQUERA LETTY VANESSA,33.0,,AUSENTE
,GONZALEZ SERRANO MIRYAM CATARINA,40.0,,AUSENTE
,JARAMILLO RODRIGUEZ VICTOR HUGO,43.0,,AUSENTE
,ISSA WAGNER NICOLAS JOSE,48.0,,AUSENTE
,TOBAR NUÑEZ RAUL IGNACIO,57.0,,AUSENTE
,PEÑAFIEL MONTESDEOCA JUANA MARISOL,66.0,,AUSENTE
,RIVERO DOGUER ANGEL ARMANDO,71.0,,AUSENTE
,ARIAS FERNÁNDEZ VERÓNICA ELIZABETH,75.0,,AUSENTE
,SAENZ DE VITERI LAUTARO ENRIQUE,77.0,,AUSENTE
,FIERRO OVIEDO PACO,89.0,,AUSENTE
,VALAREZO ORDOÑEZ ROCIO DEL CARMEN,95.0,,AUSENTE
,VASCONEZ ARTEAGA ANNY MARLLELY,97.0,,AUSENTE
,PACHECO ORDOÑEZ BAYRON EDUARDO,99.0,,AUSENTE
,GUTIERREZ BORBUA FAUSTO GILMAR,100.0,,AUSENTE
,VICUÑA MUÑOZ MARIA ALEJANDRA,111.0,,AUSENTE
,POSSO SALGADO LUIS ANTONIO,113.0,,AUSENTE
,SOLORZANO SARRIA CESAR FAUSTO,114.0,,AUSENTE
,MORAN AMALIA,125.0,,AUSENTE
,ZAMBRANO CHACHA ALBERTO ALEXANDER,127.0,,AUSENTE
,SERRANO SEGURA GRACE MARISOL,128.0,,AUSENTE
,URIBE LOPEZ FANNY ESTHER,129.0,,AUSENTE
,TAPIA LOMBEYDA LUIS FERNANDO,130.0,,AUSENTE
,CUCALÓN CAMACHO HENRY EDUARDO,131.0,,AUSENTE
,KRONFLE GOMEZ MARIA CRISTINA,137.0,,AUSENTE
,ABAD VELEZ RAUL,1.0,,SI
,AGUILAR PLACIDO ARMANDO,3.0,,SI
,GOMEZ WALFANDERY IRMA,4.0,,SI
,AGUIRRE HIDALGO DORA ANADELA,5.0,,SI
,ALBAN TORRES MARIANA DEL ROCIO,6.0,,SI
,ANDINO REINOSO MAURO EDMUNDO,9.0,,SI
,RIVAS ALAVA ELIANA LISSET,11.0,,SI
,MARQUEZ LOPEZ JOSE LENIN,13.0,,SI
,BERGMANN REYNA CARLOS ALBERTO,14.0,,SI
,BORJA PEREZ GALO,15.0,,SI
,RIVADENEIRA BURBANO GABRIELA ALEJANDRA,16.0,,SI
,CALLE ANDRADE MARIA AUGUSTA,19.0,,SI
,BRAVO RAMIREZ MARIA LORENA,23.0,,SI
,CONSTANTE NIETO MARIANA DE LAS MERCEDES,24.0,,SI
,CEDEÑO ZAMBRANO JOHANNA ELIZABETH,25.0,,SI
,CHAVEZ CANALES HOLGER EZEQUIEL,26.0,,SI
,CHICA AREVALO VINICIO VETHOWEN,27.0,,SI
,CORDOVA ENCALADA EDGAR EDUARDO,28.0,,SI
,DE LA CRUZ BERNARDO HERMAN ULISES,30.0,,SI
,DE LA CRUZ GASPAR ADRIANA MIOSOTI,31.0,,SI
,DELGADO CHALA AGUSTIN JAVIER,32.0,,SI
,FALCONI LOQUI EVELYN PAMELA,34.0,,SI
,GAGLIARDO LOOR GASTON,35.0,,SI
,DE LA TORRE RAMIREZ PABLO ANTONIO,36.0,,SI
,MENDOZA ARÉVALO DANIEL ISAAC,37.0,,SI
,CALAZACON AGUAVIL MARIA ALBERTINA,38.0,,SI
,GODOY ANDRADE GINA JAKELINE,39.0,,SI
,GUAMAN CASTRO ALEX FRANCISCO,41.0,,SI
,GUAMANGATE ANTE LUIS GILBERTO,42.0,,SI
,GUEVARA VILLACRÉS VERÓNICA MARGARITA,44.0,,SI
,GUZMAN OCHOA LILIANA MAURA,45.0,,SI
,GUTIERREZ MOSCOSO MARIA EUGENIA,46.0,,SI
,MOSQUERA YANEZ ISABEL PIEDAD,47.0,,SI
,JEREZ PILLA BETTY MARICELA,49.0,,SI
,SILVA MALDONADO SOFIA IRENE,50.0,,SI
,ORTIZ GASPAR ESTHER FLAVIA,51.0,,SI
,REYES MACHUCA EFREN RODRIGO,52.0,,SI
,LARRIVA ALVARADO OSCAR OSWALDO,53.0,,SI
,LEDESMA ZAMORA OSCAR ALFONSO,54.0,,SI
,AGUIÑAGA VALLEJO PAOLA MARCELA,55.0,,SI
,MELO GARZÓN ESTEBAN ANDRÉS,56.0,,SI
,MUÑOZ AVENDAÑO ROSA ELVIRA,58.0,,SI
,ALVARADO CARRION ROSANA,59.0,,SI
,OCLES PADILLA ALEXANDRA,60.0,,SI
,CAZA TIPANTA HUGO RENE,61.0,,SI
,SANANGO AUCACAMA LUIS LORENZO,62.0,,SI
,BRITO MENDOZA MONICA CRISTINA,63.0,,SI
,TORRES LARA JOSE EDUARDO,64.0,,SI
,PEÑA PACHECO XIMENA DEL ROCÍO,65.0,,SI
,PONCE LEON XIMENA MERCEDES,67.0,,SI
,PROAÑO CIFUENTES ROBERTH MAURICIO,68.0,,SI
,FARFAN APONTE RICHARD WILSON,69.0,,SI
,JIJON BUENDIA ITALIA LUISA,70.0,,SI
,MEDINA MERA VICTOR CLEMENTE,72.0,,SI
,REINOSO LESCANO MARIA ELIZABETH,73.0,,SI
,GUZMAN SEGOVIA JOSE FRANCISCO,74.0,,SI
,RODRIGUEZ DELGADO MARIA VERONICA,76.0,,SI
,SALAZAR CEDEÑO GUADALUPE DOLORES,78.0,,SI
,ANDRADE VARELA JUPITER GOZOSO DE LA CRUZ,79.0,,SI
,BUSTOS CHILIQUINGA ARCADIO,80.0,,SI
,MATIAS APOLINARIO RITA AZUCENA,81.0,,SI
,YANDÚN POZO CÁSTULO RENÉ,82.0,,SI
,ACACHO GONZALEZ PEPE LUIS,83.0,,SI
,SANCHEZ ORDOÑEZ MONTGOMERY LUIS,84.0,,SI
,MOYA DUQUE HERMAN ANIBAL,85.0,,SI
,ALEMÁN MARMOL MÓNICA ROCÍO,86.0,,SI
,DAHIK ASTUDILLO REYTA GIOMAR,87.0,,SI
,GUALAN JAPA MILTON RODRIGO,90.0,,SI
,ORELLANA MARQUINEZ MAGALI MARGOT,91.0,,SI
,UMAJINGA GUAMAN CESAR,92.0,,SI
,TIBAN GUALA LOURDES LICENIA,93.0,,SI
,TERAN SARZOSA SEGUNDO FAUSTO,94.0,,SI
,VALLE PINARGOTE BAIRON LEONARDO,96.0,,SI
,VELA CAIZAPANTA ANGEL RAMIRO,98.0,,SI
,AUQUILLA ORTEGA RAÚL VICENTE,101.0,,SI
,CHICAIZA TOAPANTA WILSON ALFONSO,102.0,,SI
,DONOSO CHIRIBOGA PATRICIO,103.0,,SI
,MONCAYO CEVALLOS JOSE RICARDO,104.0,,SI
,MOREIRA MACIAS GRACE HOLANDA,105.0,,SI
,VELA CHERONI MARIA SOLEDAD,106.0,,SI
,ARGUELLO TROYA BLANCA AZUCENA,107.0,,SI
,CHAMORRO HIDALGO YOLANDA JOSEFINA,108.0,,SI
,VELIZ BRIONES JOSE FELIX,109.0,,SI
,VERDUGA CEDEÑO MARY,110.0,,SI
,ANDINO ROBALINO ANGELICA MARIA,112.0,,SI
,MONTAÑO VALENCIA MAE,115.0,,SI
,MORETA PANCHEZ MIGUEL ANGEL,116.0,,SI
,LLANES SUAREZ HENRY MANUEL,117.0,,SI
,SALGADO RIVADENEIRA DIEGO,118.0,,SI
,CHICA ARTEAGA GUNTARD PAVEL,119.0,,SI
,TORRES TORRES LUIS FERNANDO,120.0,,SI
,VILLACRESES PEÑA OCTAVIO XAVIER ENRIQUE,121.0,,SI
,VINTIMILLA JARRIN DIEGO ARMANDO,122.0,,SI
,VITERI GUALINGA CARLOS ELOY,123.0,,SI
,ZAMBRANO ARTEAGA JOSE RICARDO,124.0,,SI
,ZAMBRANO CASTRO NORALMA ELIZABETH,126.0,,SI
,DIAZ COKA MARIA GABRIELA,88.0,,ABSTENCION
,REYES HIDALGO CRISTINA EUGENIA,132.0,,ABSTENCION
,TACLE GALARRAGA MOISES FERNANDO,133.0,,ABSTENCION
,ROMERO LOAYZA FRANCO SEGUNDO,134.0,,ABSTENCION
,TERÁN SALCEDO RAMÓN FORTUNATO,135.0,,ABSTENCION
,SERRANO VALLADARES SAADIN ALFREDO,136.0,,ABSTENCION
