curul,asambleista,voto
9,BERGMANN REYNA CARLOS ALBERTO,AUSENTE
26,CUESTA SANTANA ESTHER ADELINA,AUSENTE
31,FLOR GIL BRENDA AZUCENA,AUSENTE
64,VERA FLORES WENDY VANESSA,AUSENTE
69,YUNDA MACHADO JORGE HOMERO,AUSENTE
81,CAMPAIN BRAMBILLA RINA ASUNCIÓN,AUSENTE
84,ZAMBRANO CHACHA ALBERTO ALEXANDER,AUSENTE
92,CRUZ VACA JEANNINE DEL CISNE,AUSENTE
98,"PASSAILAIGUE MANOSALVAS DALLYANAMARIANELA",AUSENTE
124,PUANCHIR PAYASHÑA TITO PEDRO,AUSENTE
134,SUQUILANDA VALDIVIESO BYRON VINICIO,AUSENTE
2,ALBORNOZ VINTIMILLA CLAUDIO ESTEBAN,SI
3,SERRANO SALGADO JOSÉ RICARDO,SI
5,ARIAS RAMÍREZ ALBERTO JESÚS,SI
6,YELA ACOSTA WERNER ANTONIO,SI
7,ARTEAGA MUÑOZ KARINA CECILIA,SI
8,BENAVIDES ZAMBRANO ZOILA TERESA,SI
10,QUISHPI VÉLEZ LUIS MANUEL,SI
12,BUSTAMANTE MONTEROS RUBÉN ALEJANDRO,SI
13,CABEZAS GUERRERO ELIZABETH ENRIQUETA,SI
14,CADENA VÉLEZ KARLA GABRIELA,SI
16,CAMBALA MONTECE CARLOS ALBERTO,SI
18,CARRIÓN CEVALLOS MARÍA JOSÉ,SI
19,VALLEJO JARAMILLO NORMA MARLENE,SI
20,TENORIO VALENCIA CALLETANO,SI
21,CERDA MIRANDA GABRIELA PAMELA,SI
23,CHÁVEZ BAJAÑA KHARLA DEL ROCÍO,SI
24,COROZO AYOVÍ JORGE WILBER,SI
25,SUAREZ HUAYAMAVE CARLOS ALBERTO,SI
27,DOUMET CHEDRAUI MICHEL ANDRÉS,SI
34,GARZÓN RICAURTE WILLIAM ANTONIO,SI
35,GAVILÁNEZ CAMACHO FAFO HOLGUÍN,SI
38,LITARDO CAICEDO CÉSAR ERNESTO,SI
40,MARÍN AGUIRRE ANA BELÉN,SI
42,MENDOZA ARÉVALO DANIEL ISAAC,SI
45,OCHOA MORANTE MANUEL ALFREDO,SI
46,ORELLANA ROMÁN ROSA GINA,SI
47,PALACIOS VELÁSQUEZ SONIA LUCRECIA,SI
48,PEÑA PACHECO XIMENA DEL ROCÍO,SI
49,PLAZA CASTILLO LENIN,SI
50,POMA HERRERA YOFRE MARTÍN,SI
56,SALAZAR CEDEÑO GUADALUPE DOLORES,SI
57,SALGADO ANDRADE SILVIA BETZABETH,SI
65,VERA RODRÍGUEZ CARLOS ALFREDO,SI
68,YAR ARAUJO JUAN CARLOS,SI
70,ZAMBRANO ARTEAGA JOSE RICARDO,SI
71,ANDRADE MUÑOZ WILMA PIEDAD,SI
72,ASÁN WONSANG JOSÉ FRANCISCO,SI
73,AUQUILLA ORTEGA RAÚL VICENTE,SI
75,BURBANO MONTENEGRO FÉLIX FERNANDO,SI
76,ZAMBRANO CASTRO NORALMA ELIZABETH,SI
78,CUCALÓN CAMACHO HENRY EDUARDO,SI
79,SERRANO VITERI MERCEDES MARITZA,SI
85,SINMALEZA SÁNCHEZ ÁNGEL RUPERTO,SI
87,HENRÍQUEZ JAIME PATRICIA IVONNE,SI
88,JARAMILLO ZURITA PAOLA MICHAEL,SI
89,CASTANIER JARAMILLO XAVIER HOMERO,SI
90,CELI SANTOS GUILLERMO ALEJANDRO,SI
95,CADENA HUERTAS FRANCISCO JAVIER,SI
97,MONTAÑO GUISAMANO MAYRA MIGDONIA,SI
99,REYES HIDALGO CRISTINA EUGENIA,SI
100,CURICHUMBI YUPANQUI PEDRO,SI
101,DONOSO CHIRIBOGA PATRICIO,SI
102,FLORES VÁSQUEZ FERNANDO PATRICIO,SI
103,GALARZA AÑAZCO ANA MERCEDES,SI
104,LÓPEZ LAPO CARLOS VÍCTOR,SI
105,SCIPPA DURÁN ARIANNA SANTINA,SI
106,MACÍAS ORTEGA WENDY ELENA MARISOL,SI
107,CANDELL SOTO JAIME ENRIQUE JIMMY,SI
109,OLIVO PALLO JAIME FERNANDO,SI
110,ROHON HERVAS CÉSAR EDUARDO,SI
111,TAIANO BASANTE VICENTE GIOVANNY,SI
112,TERÁN SALCEDO RAMÓN FORTUNATO,SI
113,TORRES TORRES LUIS FERNANDO,SI
114,LARREÁTEGUI FABARA MARÍA GABRIELA,SI
115,SALTOS MOREIRA DIANA GABRIELA,SI
116,MINCHALA MURILLO RÓMULO MARCELO,SI
117,MONTAÑO VALENCIA MAE,SI
118,MORENO GUERRERO HENRY FREDY,SI
119,MUÑOZ ALARCÓN HÉCTOR PATRICIO,SI
120,PACHALA POMA LUIS ALBERTO,SI
125,ALARCÓN GUILLÍN FREDY OSCAR,SI
126,SOLORZANO SARRIA CESAR FAUSTO,SI
127,POVEDA ALVARADO ERIKA SOPHIA,SI
128,VINTIMILLA MOSCOSO PAOLA,SI
129,ZAMBRANO ORTIZ MARÍA ROBERTA,SI
130,PALACIOS MUÑOZ JUAN SEBASTIÁN,SI
131,PAREDES TORRES WASHINGTON ARTURO,SI
132,ROMERO LOAYZA FRANCO SEGUNDO,SI
133,SIMBAÑA VILLARREAL ABDÓN MARCELO,SI
135,VERA MENDOZA TANLLY JANELA,SI
136,VILLAMAR JÁCOME PEDRO FABRICIO,SI
137,YÉPEZ MARTÍNEZ HÉCTOR JOSÉ,SI
1,AGUIÑAGA VALLEJO PAOLA MARCELA,NO
4,TORRES CASTILLO JACKSON GUILLERMO,NO
11,BUENDÍA HERDOÍZA MARÍA SOLEDAD,NO
15,CALLE VERZOZI HERMUY,NO
17,CÁRDENAS ESPINOZA JUAN JORGE,NO
22,CHALÁ CRUZ JOSÉ FRANKLIN,NO
28,DURÁN AGUILAR LILIANA ELIZABETH,NO
29,ESPÍN REYES EUGENIA SOFÍA,NO
30,ESPINOSA ANDRADE AUGUSTO XAVIER,NO
32,GARCÍA GAIBOR CARMEN MERCEDES,NO
33,GARCÍA POZO DIEGO OSWALDO,NO
36,GUEVARA VILLACRÉS VERÓNICA MARGARITA,NO
37,HOLGUÍN NARANJO MARCELA PRISCILA,NO
39,LLORET VALDIVIESO JUAN CRISTÓBAL,NO
41,MELO GARZÓN ESTEBAN ANDRÉS,NO
43,MUÑOZ LÓPEZ CHRISTIAN PABEL,NO
44,NARANJO ALVARADO PRISCILA AMAPOLA,NO
51,PROAÑO CIFUENTES ROBERTH MAURICIO,NO
52,QUIJIJE DELGADO LUIS RAFAEL,NO
53,RODRÍGUEZ CEDEÑO ROSA ELENA,NO
54,RIVADENEIRA BURBANO GABRIELA ALEJANDRA,NO
55,RIVADENEIRA BUSTOS CARMEN MERCEDES,NO
58,SAMANIEGO MAIGUA FRANKLIN OMAR,NO
59,SÁNCHEZ REYES MONTGOMERY,NO
60,MOLINA ONOFA LUIS FERNANDO,NO
62,VALLE PINARGOTE BAIRON LEONARDO,NO
66,VILLALVA MIRANDA LIRA DE LA PAZ,NO
67,VITERI GUALINGA CARLOS ELOY,NO
94,ZAMBRANO VALLE EDUARDO MAURICIO,NO
61,PEÑA BERNAL JOAQUÍN ANTONIO,ABSTENCION
63,VELIN CORTÉS JUAN PABLO,ABSTENCION
74,BERNAL BERNAL ESTEBAN REMIGIO,ABSTENCION
77,AZUERO RODAS ELISEO ALEXIS,ABSTENCION
80,CALLEJAS BARONA FERNANDO,ABSTENCION
82,CAMPOVERDE ROBLES EMILIO ABSALÓN,ABSTENCION
83,CARRIÓN MORENO CÉSAR ATAULFO,ABSTENCION
86,YANDÚN POZO CÁSTULO RENÉ,ABSTENCION
91,CRUZ PROAÑO LUDOVICO ISRAEL,ABSTENCION
93,CUESTA ORELLANA MARÍA DE LOURDES,ABSTENCION
96,PEÑA ONTANEDA ELIO GERMÁN,ABSTENCION
108,DUCHI GUAMÁN MARÍA ENCARNACIÓN,ABSTENCION
121,TELLO BENALCÁZAR RAÚL ESTUPIÑAN,ABSTENCION
122,CUESTA CONCARI MARÍA MERCEDES,ABSTENCION
123,BUSTAMANTE BRICEÑO YONY ESPERANZA,ABSTENCION
