curul,asambleista,voto
1,AGUIÑAGA VALLEJO PAOLA MARCELA,AUSENTE
3,CEVALLOS GUEVARA LESLIE MARCELA,AUSENTE
8,MARQUEZ LOPEZ JOSE LENIN,AUSENTE
9,MORENO INTRIAGO MARIA LUISA,AUSENTE
10,BONILLA SALCEDO VIVIANA,AUSENTE
15,CALLE VERZOZI HERMUY,AUSENTE
18,CARRIÓN CEVALLOS MARÍA JOSÉ,AUSENTE
30,ESPINOSA ANDRADE AUGUSTO XAVIER,AUSENTE
40,MARÍN AGUIRRE ANA BELÉN,AUSENTE
47,PALACIOS VELÁSQUEZ SONIA LUCRECIA,AUSENTE
48,PEÑA PACHECO XIMENA DEL ROCÍO,AUSENTE
53,RODRÍGUEZ CEDEÑO ROSA ELENA,AUSENTE
56,SALAZAR CEDEÑO GUADALUPE DOLORES,AUSENTE
63,VELIN CORTÉS JUAN PABLO,AUSENTE
68,YAR ARAUJO JUAN CARLOS,AUSENTE
69,GUAMBA DÍAZ NANCY JEANNETH,AUSENTE
70,ZAMBRANO ARTEAGA JOSE RICARDO,AUSENTE
75,BURBANO MONTENEGRO FÉLIX FERNANDO,AUSENTE
82,CAMPOVERDE ROBLES EMILIO ABSALÓN,AUSENTE
90,CELI SANTOS GUILLERMO ALEJANDRO,AUSENTE
94,ZAMBRANO VALLE EDUARDO MAURICIO,AUSENTE
95,CADENA HUERTAS FRANCISCO JAVIER,AUSENTE
113,TORRES TORRES LUIS FERNANDO,AUSENTE
119,MUÑOZ ALARCÓN HÉCTOR PATRICIO,AUSENTE
122,CUESTA CONCARI MARÍA MERCEDES,AUSENTE
127,UGARTE GUZMÁN BLANCA ROSANA,AUSENTE
4,ARIAS FERNÁNDEZ VERÓNICA ELIZABETH,SI
11,BUENDÍA HERDOÍZA MARÍA SOLEDAD,SI
12,HIDALGO JARAMILLO EDITH MARLENE,SI
14,DELGADO ORLANDO CÉSAR ANTONIO,SI
16,CAMBALA MONTECE CARLOS ALBERTO,SI
17,CÁRDENAS ESPINOZA JUAN JORGE,SI
22,CHALÁ CRUZ JOSÉ FRANKLIN,SI
24,COROZO AYOVÍ JORGE WILBER,SI
26,CUESTA SANTANA ESTHER ADELINA,SI
28,DURÁN AGUILAR LILIANA ELIZABETH,SI
29,ALEAGA SANTOS RONNY XAVIER,SI
32,GARCÍA GAIBOR CARMEN MERCEDES,SI
33,GARCÍA POZO DIEGO OSWALDO,SI
36,GUEVARA VILLACRÉS VERÓNICA MARGARITA,SI
37,HOLGUÍN NARANJO MARCELA PRISCILA,SI
39,LLORET VALDIVIESO JUAN CRISTÓBAL,SI
41,MELO GARZÓN ESTEBAN ANDRÉS,SI
43,MUÑOZ LÓPEZ CHRISTIAN PABEL,SI
44,NARANJO ALVARADO PRISCILA AMAPOLA,SI
46,ORELLANA ROMÁN ROSA GINA,SI
50,POMA HERRERA YOFRE MARTÍN,SI
51,PROAÑO CIFUENTES ROBERTH MAURICIO,SI
54,RIVADENEIRA BURBANO GABRIELA ALEJANDRA,SI
55,RIVADENEIRA BUSTOS CARMEN MERCEDES,SI
58,SAMANIEGO MAIGUA FRANKLIN OMAR,SI
60,MOLINA ONOFA LUIS FERNANDO,SI
61,SOLIZ CARRIÓN DORIS JOSEFINA,SI
62,VALLE PINARGOTE BAIRON LEONARDO,SI
64,VERA FLORES WENDY VANESSA,SI
66,VILLALVA MIRANDA LIRA DE LA PAZ,SI
67,VITERI GUALINGA CARLOS ELOY,SI
71,ANDRADE MUÑOZ WILMA PIEDAD,SI
72,ASÁN WONSANG JOSÉ FRANCISCO,SI
73,AUQUILLA ORTEGA RAÚL VICENTE,SI
74,BERNAL BERNAL ESTEBAN REMIGIO,SI
77,AZUERO RODAS ELISEO ALEXIS,SI
78,ORDOÑEZ ZAMBRANO SANDRA DEL ROCÍO,SI
79,FALQUEZ BATALLAS PEDRO CARLOS,SI
80,CALLEJAS BARONA FERNANDO,SI
81,VACA QUIÑONEZ SONIA MARÍA,SI
83,CARRIÓN MORENO CÉSAR ATAULFO,SI
85,SINMALEZA SÁNCHEZ ÁNGEL RUPERTO,SI
86,YANDÚN POZO CÁSTULO RENÉ,SI
87,HENRÍQUEZ JAIME PATRICIA IVONNE,SI
88,JARAMILLO ZURITA PAOLA MICHAEL,SI
89,CASTANIER JARAMILLO XAVIER HOMERO,SI
91,YUNGA NAULA SEGUNDO JULIÁN,SI
92,CRUZ VACA JEANNINE DEL CISNE,SI
93,CUESTA ORELLANA MARÍA DE LOURDES,SI
96,PEÑA ONTANEDA ELIO GERMÁN,SI
97,MONTAÑO GUISAMANO MAYRA MIGDONIA,SI
98,"PASSAILAIGUE MANOSALVAS DALLYANAMARIANELA",SI
99,REYES HIDALGO CRISTINA EUGENIA,SI
100,CURICHUMBI YUPANQUI PEDRO,SI
101,DONOSO CHIRIBOGA PATRICIO,SI
102,FLORES VÁSQUEZ FERNANDO PATRICIO,SI
103,GALARZA AÑAZCO ANA MERCEDES,SI
104,GENDE CALAZACÓN ANGEL MESÍAS,SI
105,MOLINA CELI KARLA ELIZABETH,SI
106,MACÍAS ORTEGA WENDY ELENA MARISOL,SI
107,CANDELL SOTO JAIME ENRIQUE JIMMY,SI
108,DUCHI GUAMÁN MARÍA ENCARNACIÓN,SI
109,OLIVO PALLO JAIME FERNANDO,SI
110,ROHON HERVAS CÉSAR EDUARDO,SI
111,TACLE GARCÍA SAMIA,SI
112,NUÑEZ MANSSUR LUIS ANTONIO,SI
114,LARREÁTEGUI FABARA MARÍA GABRIELA,SI
115,CUADRO GASTEZZI DEYSI MARIA,SI
116,VERA CALDERÓN SILVIA LORENA,SI
117,MONTAÑO VALENCIA MAE,SI
118,MORENO GUERRERO HENRY FREDY,SI
120,PACHALA POMA LUIS ALBERTO,SI
121,TELLO BENALCÁZAR RAÚL ESTUPIÑAN,SI
123,PEÑAFIEL IZQUIERDO EDDY COLÓN,SI
124,PUANCHIR PAYASHÑA TITO PEDRO,SI
125,ALARCÓN GUILLÍN FREDY OSCAR,SI
126,SOLORZANO SARRIA CESAR FAUSTO,SI
128,MARÍN LAVAYEN DENNIS GUSTAVO,SI
129,ZAMBRANO ORTIZ MARÍA ROBERTA,SI
130,PALACIOS MUÑOZ JUAN SEBASTIÁN,SI
131,PAREDES TORRES WASHINGTON ARTURO,SI
132,ROMERO LOAYZA FRANCO SEGUNDO,SI
133,SIMBAÑA VILLARREAL ABDÓN MARCELO,SI
134,SUQUILANDA VALDIVIESO BYRON VINICIO,SI
135,VERA MENDOZA TANLLY JANELA,SI
136,VILLAMAR JÁCOME PEDRO FABRICIO,SI
137,YÉPEZ MARTÍNEZ HÉCTOR JOSÉ,SI
2,ALBORNOZ VINTIMILLA CLAUDIO ESTEBAN,ABSTENCION
5,ARIAS RAMÍREZ ALBERTO JESÚS,ABSTENCION
6,SALINAS OCHOA CAMILO AURELIO,ABSTENCION
7,ARTEAGA MUÑOZ KARINA CECILIA,ABSTENCION
13,CABEZAS GUERRERO ELIZABETH ENRIQUETA,ABSTENCION
19,TERAN SARZOSA SEGUNDO FAUSTO,ABSTENCION
20,TENORIO VALENCIA CALLETANO,ABSTENCION
21,GREFA AVILEZ FLAVIO PATRICIO,ABSTENCION
23,TORRES TORRES EURO IGNACIO,ABSTENCION
25,CUESTA RÍOS LIUBA ELISA,ABSTENCION
27,DOUMET CHEDRAUI MICHEL ANDRÉS,ABSTENCION
31,FLOR GIL BRENDA AZUCENA,ABSTENCION
34,GARZÓN RICAURTE WILLIAM ANTONIO,ABSTENCION
35,FUENTES NARANJO PAULINA DEL CARMEN,ABSTENCION
38,LITARDO CAICEDO CÉSAR ERNESTO,ABSTENCION
42,MENDOZA ARÉVALO DANIEL ISAAC,ABSTENCION
45,ORDOÑEZ JARAMILLO DIANA MARINA,ABSTENCION
49,PLAZA CASTILLO LENIN,ABSTENCION
52,QUIJIJE DELGADO LUIS RAFAEL,ABSTENCION
57,SALGADO ANDRADE SILVIA BETZABETH,ABSTENCION
59,YAGUANA ECHEVERRÍA ANDREA ALEXANDRA,ABSTENCION
65,VERA RODRÍGUEZ CARLOS ALFREDO,ABSTENCION
76,ZAMBRANO CASTRO NORALMA ELIZABETH,ABSTENCION
84,ZAMBRANO CHACHA ALBERTO ALEXANDER,ABSTENCION
