curul,asambleista,voto
2,ALBORNOZ VINTIMILLA CLAUDIO ESTEBAN,AUSENTE
3,SERRANO SALGADO JOSÉ RICARDO,AUSENTE
4,ARIAS FERNÁNDEZ VERÓNICA ELIZABETH,AUSENTE
5,ARIAS RAMÍREZ ALBERTO JESÚS,AUSENTE
6,SALINAS OCHOA CAMILO AURELIO,AUSENTE
7,ARTEAGA MUÑOZ KARINA CECILIA,AUSENTE
9,BERGMANN REYNA CARLOS ALBERTO,AUSENTE
10,BONILLA SALCEDO VIVIANA,AUSENTE
12,BUSTAMANTE MONTEROS RUBÉN ALEJANDRO,AUSENTE
14,DELGADO ORLANDO CÉSAR ANTONIO,AUSENTE
18,CARRIÓN CEVALLOS MARÍA JOSÉ,AUSENTE
23,CHÁVEZ BAJAÑA KHARLA DEL ROCÍO,AUSENTE
25,CUESTA RÍOS LIUBA ELISA,AUSENTE
27,DOUMET CHEDRAUI MICHEL ANDRÉS,AUSENTE
28,DURÁN AGUILAR LILIANA ELIZABETH,AUSENTE
29,ALEAGA SANTOS RONNY XAVIER,AUSENTE
41,MELO GARZÓN ESTEBAN ANDRÉS,AUSENTE
42,MENDOZA ARÉVALO DANIEL ISAAC,AUSENTE
44,NARANJO ALVARADO PRISCILA AMAPOLA,AUSENTE
53,RODRÍGUEZ CEDEÑO ROSA ELENA,AUSENTE
54,RIVADENEIRA BURBANO GABRIELA ALEJANDRA,AUSENTE
56,SALAZAR CEDEÑO GUADALUPE DOLORES,AUSENTE
57,SALGADO ANDRADE SILVIA BETZABETH,AUSENTE
61,SOLIZ CARRIÓN DORIS JOSEFINA,AUSENTE
68,YAR ARAUJO JUAN CARLOS,AUSENTE
75,BURBANO MONTENEGRO FÉLIX FERNANDO,AUSENTE
77,AZUERO RODAS ELISEO ALEXIS,AUSENTE
81,CAMPAIN BRAMBILLA RINA ASUNCIÓN,AUSENTE
82,CAMPOVERDE ROBLES EMILIO ABSALÓN,AUSENTE
88,JARAMILLO ZURITA PAOLA MICHAEL,AUSENTE
89,CASTANIER JARAMILLO XAVIER HOMERO,AUSENTE
90,CELI SANTOS GUILLERMO ALEJANDRO,AUSENTE
91,CRUZ PROAÑO LUDOVICO ISRAEL,AUSENTE
99,REYES HIDALGO CRISTINA EUGENIA,AUSENTE
105,GÓMEZ ALCÍVAR ROBERTO ANDRÉS,AUSENTE
107,CANDELL SOTO JAIME ENRIQUE JIMMY,AUSENTE
108,DUCHI GUAMÁN MARÍA ENCARNACIÓN,AUSENTE
114,LARREÁTEGUI FABARA MARÍA GABRIELA,AUSENTE
119,HIDALGO ESPINEL SANDRA VICTORIA CARMEN,AUSENTE
121,TELLO BENALCÁZAR RAÚL ESTUPIÑAN,AUSENTE
122,CUESTA CONCARI MARÍA MERCEDES,AUSENTE
123,PEÑAFIEL IZQUIERDO EDDY COLÓN,AUSENTE
125,ALARCÓN GUILLÍN FREDY OSCAR,AUSENTE
126,SOLORZANO SARRIA CESAR FAUSTO,AUSENTE
127,ALMEYDA JALIL VICENTE FERNANDO,AUSENTE
129,ESTUPIÑÁN ORTIZ BORIS EFRÉN,AUSENTE
130,PALACIOS MUÑOZ JUAN SEBASTIÁN,AUSENTE
136,VILLAMAR JÁCOME PEDRO FABRICIO,AUSENTE
1,AGUIÑAGA VALLEJO PAOLA MARCELA,SI
8,BENAVIDES ZAMBRANO ZOILA TERESA,SI
11,BUENDÍA HERDOÍZA MARÍA SOLEDAD,SI
13,CABEZAS GUERRERO ELIZABETH ENRIQUETA,SI
15,CALLE VERZOZI HERMUY,SI
16,CAMBALA MONTECE CARLOS ALBERTO,SI
17,CÁRDENAS ESPINOZA JUAN JORGE,SI
19,TERÁN SARZOSA SEGUNDO FAUSTO,SI
20,TENORIO VALENCIA CALLETANO,SI
21,CERDA MIRANDA GABRIELA PAMELA,SI
22,CHALÁ CRUZ JOSÉ FRANKLIN,SI
24,COROZO AYOVÍ JORGE WILBER,SI
26,CUESTA SANTANA ESTHER ADELINA,SI
30,ESPINOSA ANDRADE AUGUSTO XAVIER,SI
31,FLOR GIL BRENDA AZUCENA,SI
32,GARCÍA GAIBOR CARMEN MERCEDES,SI
33,GARCÍA POZO DIEGO OSWALDO,SI
34,GARZÓN RICAURTE WILLIAM ANTONIO,SI
35,GAVILÁNEZ CAMACHO FAFO HOLGUÍN,SI
36,GUEVARA VILLACRÉS VERÓNICA MARGARITA,SI
37,HOLGUÍN NARANJO MARCELA PRISCILA,SI
38,LITARDO CAICEDO CÉSAR ERNESTO,SI
39,LLORET VALDIVIESO JUAN CRISTÓBAL,SI
40,MARÍN AGUIRRE ANA BELÉN,SI
43,MUÑOZ LÓPEZ CHRISTIAN PABEL,SI
45,OCHOA MORANTE MANUEL ALFREDO,SI
46,ORELLANA ROMÁN ROSA GINA,SI
47,BUSTAMANTE GARCÍA JUAN FRANCISCO,SI
48,PEÑA PACHECO XIMENA DEL ROCÍO,SI
49,PLAZA CASTILLO LENIN,SI
50,POMA HERRERA YOFRE MARTÍN,SI
51,PROAÑO CIFUENTES ROBERTH MAURICIO,SI
52,QUIJIJE DELGADO LUIS RAFAEL,SI
55,RIVADENEIRA BUSTOS CARMEN MERCEDES,SI
58,SAMANIEGO MAIGUA FRANKLIN OMAR,SI
59,YAGUANA ECHEVERRÍA ANDREA ALEXANDRA,SI
60,ALEMÁN MARMOL MÓNICA ROCÍO,SI
62,VALLE PINARGOTE BAIRON LEONARDO,SI
63,VELIN CORTÉS JUAN PABLO,SI
64,VERA FLORES WENDY VANESSA,SI
65,VERA RODRÍGUEZ CARLOS ALFREDO,SI
66,VILLALVA MIRANDA LIRA DE LA PAZ,SI
67,VITERI GUALINGA CARLOS ELOY,SI
69,GUAMBA DÍAZ NANCY JEANNETH,SI
70,LOOR ALCÍVAR LEXI LIDUVINA,SI
71,ANDRADE MUÑOZ WILMA PIEDAD,SI
72,ZAMBRANO ALCÍVAR MAGDA XIOMARA,SI
73,AUQUILLA ORTEGA RAÚL VICENTE,SI
74,ASTUDILLO LOOR LINA GLORIA,SI
76,ZAMBRANO CASTRO NORALMA ELIZABETH,SI
78,CUCALÓN CAMACHO HENRY EDUARDO,SI
79,INTRIAGO ZAMBRANO FAUSTO PATRICIO,SI
80,CALLEJAS BARONA FERNANDO,SI
83,CARRIÓN MORENO CÉSAR ATAULFO,SI
84,ZAMBRANO CHACHA ALBERTO ALEXANDER,SI
85,GONZÁLEZ VÁSCONEZ TERESITA XIMENA,SI
86,YANDÚN POZO CÁSTULO RENÉ,SI
87,HENRÍQUEZ JAIME PATRICIA IVONNE,SI
92,CRUZ VACA JEANNINE DEL CISNE,SI
93,CUESTA ORELLANA MARÍA DE LOURDES,SI
94,ZAMBRANO VALLE EDUARDO MAURICIO,SI
95,CADENA HUERTAS FRANCISCO JAVIER,SI
96,PEÑA ONTANEDA ELIO GERMÁN,SI
97,CAMPOVERDE GONZÁLEZ RAÚL FREDDY BOLÍVAR,SI
98,CALDERÓN CHANCAY DORIS DAISY,SI
100,CURICHUMBI YUPANQUI PEDRO,SI
101,DONOSO CHIRIBOGA PATRICIO,SI
102,SALAS SALAS MARÍA CECILIA,SI
103,VERDEZOTO REINOSO ROSA ISABEL,SI
104,GENDE CALAZACÓN ANGEL MESÍAS,SI
106,CEDEÑO ZAMBRANO FELISITA MONCERRATE,SI
109,OLIVO PALLO JAIME FERNANDO,SI
110,ROHON HERVAS CÉSAR EDUARDO,SI
111,TAIANO BASANTE VICENTE GIOVANNY,SI
112,MENDOZA MACÍAS MANUEL VIRGILIO,SI
113,TORRES COBO LUIS ESTEBAN,SI
115,SALTOS MOREIRA DIANA GABRIELA,SI
116,VERA CALDERÓN SILVIA LORENA,SI
117,MONTAÑO VALENCIA MAE,SI
118,MORENO GUERRERO HENRY FREDY,SI
120,PACHALA POMA LUIS ALBERTO,SI
124,PUANCHIR PAYASHÑA TITO PEDRO,SI
128,MARÍN LAVAYEN DENNIS GUSTAVO,SI
131,PAREDES TORRES WASHINGTON ARTURO,SI
132,ROMERO LOAYZA FRANCO SEGUNDO,SI
133,SIMBAÑA VILLARREAL ABDÓN MARCELO,SI
134,SUQUILANDA VALDIVIESO BYRON VINICIO,SI
135,VERA MENDOZA TANLLY JANELA,SI
137,PADILLA SIERRA MAGGIE DOLORES,SI
