voto,curul,asambleista
AUSENTE,3,SERRANO SALGADO JOSÉ RICARDO
AUSENTE,14,CADENA VÉLEZ KARLA GABRIELA
AUSENTE,32,GARCÍA GAIBOR CARMEN MERCEDES
AUSENTE,46,ORELLANA ROMÁN ROSA GINA
AUSENTE,52,QUIJIJE DELGADO LUIS RAFAEL
AUSENTE,59,YAGUANA ECHEVERRÍA ANDREA ALEXANDRA
AUSENTE,64,VERA FLORES WENDY VANESSA
AUSENTE,76,ZAMBRANO CASTRO NORALMA ELIZABETH
AUSENTE,101,DONOSO CHIRIBOGA PATRICIO
AUSENTE,105,GÓMEZ ALCÍVAR ROBERTO ANDRÉS
AUSENTE,115,SALTOS MOREIRA DIANA GABRIELA
AUSENTE,116,VERA CALDERÓN SILVIA LORENA
AUSENTE,124,PUANCHIR PAYASHÑA TITO PEDRO
AUSENTE,136,VILLAMAR JÁCOME PEDRO FABRICIO
SI,125,CARRILLO ALVERCA SANTOS ROMANELI
SI,133,SIMBAÑA VILLARREAL ABDÓN MARCELO
NO,1,AGUIÑAGA VALLEJO PAOLA MARCELA
NO,2,ALBORNOZ VINTIMILLA CLAUDIO ESTEBAN
NO,4,ARIAS FERNÁNDEZ VERÓNICA ELIZABETH
NO,5,ARIAS RAMÍREZ ALBERTO JESÚS
NO,6,ARREGUI RUEDA MARCIA CECILIA
NO,7,ARTEAGA MUÑOZ KARINA CECILIA
NO,8,MARQUEZ LOPEZ JOSE LENIN
NO,10,COLLAGUAZO RODRIGO
NO,11,CASANOVA CEPEDA XAVIER IVAN
NO,12,BUSTAMANTE MONTEROS RUBÉN ALEJANDRO
NO,13,SERRANO VALLEJO JORGE ERNESTO
NO,15,CALLE VERZOZI HERMUY
NO,16,CAMBALA MONTECE CARLOS ALBERTO
NO,17,CÁRDENAS ESPINOZA JUAN JORGE
NO,18,EGAS LEDESMA JOSÉ ANTONIO
NO,19,TERÁN SARZOSA SEGUNDO FAUSTO
NO,20,CEDEÑO ZAMBRANO JOHANNA ELIZABETH
NO,21,CERDA MIRANDA GABRIELA PAMELA
NO,22,CHALÁ CRUZ JOSÉ FRANKLIN
NO,23,CHÁVEZ BAJAÑA KHARLA DEL ROCÍO
NO,24,COROZO AYOVÍ JORGE WILBER
NO,25,CUESTA RÍOS LIUBA ELISA
NO,26,CUESTA SANTANA ESTHER ADELINA
NO,27,DOUMET CHEDRAUI MICHEL ANDRÉS
NO,28,DURÁN AGUILAR LILIANA ELIZABETH
NO,29,ALEAGA SANTOS RONNY XAVIER
NO,30,ESPINOSA ANDRADE AUGUSTO XAVIER
NO,31,FLOR GIL BRENDA AZUCENA
NO,33,GARCÍA POZO DIEGO OSWALDO
NO,34,GARZÓN RICAURTE WILLIAM ANTONIO
NO,35,GAVILÁNEZ CAMACHO FAFO HOLGUÍN
NO,36,GUEVARA VILLACRÉS VERÓNICA MARGARITA
NO,37,HOLGUÍN NARANJO MARCELA PRISCILA
NO,38,LITARDO CAICEDO CÉSAR ERNESTO
NO,39,LLORET VALDIVIESO JUAN CRISTÓBAL
NO,40,MARÍN AGUIRRE ANA BELÉN
NO,41,MELO GARZÓN ESTEBAN ANDRÉS
NO,42,COLAMARCO VERA PINUCCIA MAGALY
NO,43,MUÑOZ LÓPEZ CHRISTIAN PABEL
NO,44,NARANJO ALVARADO PRISCILA AMAPOLA
NO,45,OCHOA MORANTE MANUEL ALFREDO
NO,47,BUSTAMANTE GARCÍA JUAN FRANCISCO
NO,48,PEÑA PACHECO XIMENA DEL ROCÍO
NO,49,PLAZA CASTILLO LENIN
NO,50,ANDRADE VILLAPRADO NELLY LISSETH
NO,51,PROAÑO CIFUENTES ROBERTH MAURICIO
NO,53,QUIÑONEZ OCAMPO JULIO CÉSAR
NO,54,AGUALSACA GUAMAN JOSE CLEMENTE
NO,55,RIVADENEIRA BUSTOS CARMEN MERCEDES
NO,56,SALAZAR CEDEÑO GUADALUPE DOLORES
NO,57,MONCAYO ESPINOSA JOSÉ FRANCISCO
NO,58,SAMANIEGO MAIGUA FRANKLIN OMAR
NO,60,ALEMÁN MARMOL MÓNICA ROCÍO
NO,61,PEÑA BERNAL JOAQUÍN ANTONIO
NO,62,VALLE PINARGOTE BAIRON LEONARDO
NO,63,VELIN CORTÉS JUAN PABLO
NO,65,VERA RODRÍGUEZ CARLOS ALFREDO
NO,66,VILLALVA MIRANDA LIRA DE LA PAZ
NO,67,CHACTONG VELASCO MARTHA XIMENA
NO,68,YAR ARAUJO JUAN CARLOS
NO,69,GUAMBA DÍAZ NANCY JEANNETH
NO,70,LOOR ALCÍVAR LEXI LIDUVINA
NO,71,ANDRADE MUÑOZ WILMA PIEDAD
NO,72,ZAMBRANO ALCÍVAR MAGDA XIOMARA
NO,73,AUQUILLA ORTEGA RAÚL VICENTE
NO,74,ASTUDILLO LOOR LINA GLORIA
NO,75,BURBANO MONTENEGRO FÉLIX FERNANDO
NO,77,GUEVARA LOZADA FLERIDA YOVANA
NO,78,CUCALÓN CAMACHO HENRY EDUARDO
NO,79,SERRANO VITERI MERCEDES MARITZA
NO,80,CALLEJAS BARONA FERNANDO
NO,81,GALLARDO CHEME CARLOS DAVID
NO,82,CAMPOVERDE ROBLES EMILIO ABSALÓN
NO,83,CARRIÓN MORENO CÉSAR ATAULFO
NO,84,ZAMBRANO CHACHA ALBERTO ALEXANDER
NO,85,SINMALEZA SÁNCHEZ ÁNGEL RUPERTO
NO,86,YANDÚN POZO CÁSTULO RENÉ
NO,87,HENRÍQUEZ JAIME PATRICIA IVONNE
NO,88,LLANES SUAREZ HENRY MANUEL
NO,89,CASTANIER JARAMILLO XAVIER HOMERO
NO,90,CELI SANTOS GUILLERMO ALEJANDRO
NO,93,CUESTA ORELLANA MARÍA DE LOURDES
NO,94,ZAMBRANO VALLE EDUARDO MAURICIO
NO,95,CADENA HUERTAS FRANCISCO JAVIER
NO,96,SUQUILANDA LIMA CARMEN MARGARITA
NO,97,CAMPOVERDE GONZÁLEZ RAÚL FREDDY BOLÍVAR
NO,98,CALDERÓN CHANCAY DORIS DAISY
NO,99,GARAY CLAVIJO LOURDES SOLANDA
NO,100,CURICHUMBI YUPANQUI PEDRO
NO,102,FLORES VÁSQUEZ FERNANDO PATRICIO
NO,103,VERDEZOTO REINOSO ROSA ISABEL
NO,104,GENDE CALAZACÓN ANGEL MESÍAS
NO,107,CAMPOS QUIÑONEZ LIDDA MERARI
NO,108,DUCHI GUAMÁN MARÍA ENCARNACIÓN
NO,109,OLIVO PALLO JAIME FERNANDO
NO,110,ROHON HERVAS CÉSAR EDUARDO
NO,111,POVEDA ALVARADO ERIKA SOPHIA
NO,112,TERÁN SALCEDO RAMÓN FORTUNATO
NO,113,TORRES COBO LUIS ESTEBAN
NO,117,MONTAÑO VALENCIA MAE
NO,118,MORENO GUERRERO HENRY FREDY
NO,120,PACHALA POMA LUIS ALBERTO
NO,121,TELLO BENALCÁZAR RAÚL ESTUPIÑAN
NO,122,CUESTA CONCARI MARÍA MERCEDES
NO,123,PEÑAFIEL IZQUIERDO EDDY COLÓN
NO,126,SOLÓRZANO SARRIA CÉSAR FAUSTO
NO,127,LOOR ZAMBRANO QUINCHE CONSUELO
NO,128,OLLAGUE VALAREZO ZOILA PIEDAD
NO,129,ESTUPIÑÁN ORTIZ BORIS EFRÉN
NO,132,ROMERO LOAYZA FRANCO SEGUNDO
NO,134,SUQUILANDA VALDIVIESO BYRON VINICIO
NO,135,VERA MENDOZA TANLLY JANELA
ABSTENCION,9,BERGMANN REYNA CARLOS ALBERTO
ABSTENCION,91,CRUZ PROAÑO LUDOVICO ISRAEL
ABSTENCION,92,CRUZ VACA JEANNINE DEL CISNE
ABSTENCION,106,ZAMBRANO VERA MARIANO
ABSTENCION,114,LARREÁTEGUI FABARA MARÍA GABRIELA
ABSTENCION,119,MUÑOZ ALARCÓN HÉCTOR PATRICIO
ABSTENCION,130,PALACIOS MUÑOZ JUAN SEBASTIÁN
ABSTENCION,131,PAREDES TORRES WASHINGTON ARTURO
ABSTENCION,137,YÉPEZ MARTÍNEZ HÉCTOR JOSÉ
