asambleista,curul,voto
COLLAGUAZO RODRIGO,10,AUSENTE
CASANOVA CEPEDA XAVIER IVAN,11,AUSENTE
CEDEÑO ZAMBRANO JOHANNA ELIZABETH,20,AUSENTE
GARZÓN RICAURTE WILLIAM ANTONIO,34,AUSENTE
HOLGUÍN NARANJO MARCELA PRISCILA,37,AUSENTE
QUILOANGO TIPANLUISA SUSANA XIMENA,51,AUSENTE
PARRA VILLACIS JONATHAN EMANUEL,56,AUSENTE
VERA RODRÍGUEZ CARLOS ALFREDO,65,AUSENTE
AUQUILLA ORTEGA RAÚL VICENTE,73,AUSENTE
CAMPAIN BRAMBILLA RINA ASUNCIÓN,81,AUSENTE
CASTANIER JARAMILLO XAVIER HOMERO,89,AUSENTE
FLORES VÁSQUEZ FERNANDO PATRICIO,102,AUSENTE
PACHALA POMA LUIS ALBERTO,120,AUSENTE
CUESTA CONCARI MARÍA MERCEDES,122,AUSENTE
PAREDES TORRES WASHINGTON ARTURO,131,AUSENTE
AGUIÑAGA VALLEJO PAOLA MARCELA,1,SI
ALBORNOZ VINTIMILLA CLAUDIO ESTEBAN,2,SI
SERRANO SALGADO JOSÉ RICARDO,3,SI
ARIAS FERNÁNDEZ VERÓNICA ELIZABETH,4,SI
ARIAS RAMÍREZ ALBERTO JESÚS,5,SI
ARREGUI RUEDA MARCIA CECILIA,6,SI
ARTEAGA MUÑOZ KARINA CECILIA,7,SI
BENAVIDES ZAMBRANO ZOILA TERESA,8,SI
BERGMANN REYNA CARLOS ALBERTO,9,SI
BUSTAMANTE MONTEROS RUBÉN ALEJANDRO,12,SI
CABEZAS GUERRERO ELIZABETH ENRIQUETA,13,SI
CADENA VÉLEZ KARLA GABRIELA,14,SI
CALLE VERZOZI HERMUY,15,SI
CAMBALA MONTECE CARLOS ALBERTO,16,SI
CÁRDENAS ESPINOZA JUAN JORGE,17,SI
CARRIÓN CEVALLOS MARÍA JOSÉ,18,SI
VALLEJO JARAMILLO NORMA MARLENE,19,SI
CERDA MIRANDA GABRIELA PAMELA,21,SI
CHALÁ CRUZ JOSÉ FRANKLIN,22,SI
CHÁVEZ BAJAÑA KHARLA DEL ROCÍO,23,SI
COROZO AYOVÍ JORGE WILBER,24,SI
SUAREZ HUAYAMAVE CARLOS ALBERTO,25,SI
NÚÑEZ CRIOLLO JAIRO PATRICIO,26,SI
DOUMET CHEDRAUI MICHEL ANDRÉS,27,SI
MIÑO ESCOBAR JORGE EDUARDO,28,SI
ALEAGA SANTOS RONNY XAVIER,29,SI
ESPINOSA ANDRADE AUGUSTO XAVIER,30,SI
FLOR GIL BRENDA AZUCENA,31,SI
MONGE TIPÁN OSCAR VINICIO,32,SI
GARCÍA POZO DIEGO OSWALDO,33,SI
GAVILÁNEZ CAMACHO FAFO HOLGUÍN,35,SI
GÓMEZ LOZANO RICHARD GARIS,36,SI
LITARDO CAICEDO CÉSAR ERNESTO,38,SI
LLORET VALDIVIESO JUAN CRISTÓBAL,39,SI
MARÍN AGUIRRE ANA BELÉN,40,SI
MELO GARZÓN ESTEBAN ANDRÉS,41,SI
MENDOZA ARÉVALO DANIEL ISAAC,42,SI
MUÑOZ LÓPEZ CHRISTIAN PABEL,43,SI
NARANJO ALVARADO PRISCILA AMAPOLA,44,SI
OCHOA MORANTE MANUEL ALFREDO,45,SI
ALONSO FERNÁNDEZ FÉLIX FREDY,46,SI
PALACIOS VELÁSQUEZ SONIA LUCRECIA,47,SI
ORTEGA ALVAREZ CARLOS UREL,48,SI
PLAZA CASTILLO LENIN,49,SI
POMA HERRERA YOFRE MARTÍN,50,SI
QUIJIJE DELGADO LUIS RAFAEL,52,SI
QUIÑONEZ OCAMPO JULIO CÉSAR,53,SI
AGUALSACA GUAMAN JOSE CLEMENTE,54,SI
RIVADENEIRA BUSTOS CARMEN MERCEDES,55,SI
SALGADO ANDRADE SILVIA BETZABETH,57,SI
SAMANIEGO MAIGUA FRANKLIN OMAR,58,SI
SÁNCHEZ REYES MONTGOMERY,59,SI
ALEMÁN MARMOL MÓNICA ROCÍO,60,SI
SOLIZ CARRIÓN DORIS JOSEFINA,61,SI
VALLE PINARGOTE BAIRON LEONARDO,62,SI
VELIN CORTÉS JUAN PABLO,63,SI
VERA FLORES WENDY VANESSA,64,SI
VILLALVA MIRANDA LIRA DE LA PAZ,66,SI
VITERI GUALINGA CARLOS ELOY,67,SI
YAR ARAUJO JUAN CARLOS,68,SI
YUNDA MACHADO JORGE HOMERO,69,SI
ZAMBRANO ARTEAGA JOSE RICARDO,70,SI
ANDRADE MUÑOZ WILMA PIEDAD,71,SI
ASÁN WONSANG JOSÉ FRANCISCO,72,SI
BERNAL BERNAL ESTEBAN REMIGIO,74,SI
BURBANO MONTENEGRO FÉLIX FERNANDO,75,SI
ZAMBRANO CASTRO NORALMA ELIZABETH,76,SI
AZUERO RODAS ELISEO ALEXIS,77,SI
CUCALÓN CAMACHO HENRY EDUARDO,78,SI
AÑAZCO ROMERO DOLORES LETICIA,79,SI
CALLEJAS BARONA FERNANDO,80,SI
CAMPOVERDE ROBLES EMILIO ABSALÓN,82,SI
CARRIÓN MORENO CÉSAR ATAULFO,83,SI
ZAMBRANO CHACHA ALBERTO ALEXANDER,84,SI
SINMALEZA SÁNCHEZ ÁNGEL RUPERTO,85,SI
YANDÚN POZO CÁSTULO RENÉ,86,SI
HENRÍQUEZ JAIME PATRICIA IVONNE,87,SI
KRONFLE KOZHAYA HENRY FABIÁN,88,SI
CELI SANTOS GUILLERMO ALEJANDRO,90,SI
YUNGA NAULA SEGUNDO JULIÁN,91,SI
ZÁRATE CASTRO JORGE EDUARDO,92,SI
CUESTA ORELLANA MARÍA DE LOURDES,93,SI
ZAMBRANO VALLE EDUARDO MAURICIO,94,SI
CADENA HUERTAS FRANCISCO JAVIER,95,SI
PEÑA ONTANEDA ELIO GERMÁN,96,SI
MONTAÑO GUISAMANO MAYRA MIGDONIA,97,SI
,98,SI
REYES HIDALGO CRISTINA EUGENIA,99,SI
CURICHUMBI YUPANQUI PEDRO,100,SI
DONOSO CHIRIBOGA PATRICIO,101,SI
GALARZA AÑAZCO ANA MERCEDES,103,SI
GENDE CALAZACÓN ANGEL MESÍAS,104,SI
GÓMEZ ALCÍVAR ROBERTO ANDRÉS,105,SI
ZAMBRANO VERA MARIANO,106,SI
CANDELL SOTO JAIME ENRIQUE JIMMY,107,SI
OLIVO PALLO JAIME FERNANDO,109,SI
ROHON HERVAS CÉSAR EDUARDO,110,SI
TACLE GARCÍA SAMIA,111,SI
TERÁN SALCEDO RAMÓN FORTUNATO,112,SI
TORRES TORRES LUIS FERNANDO,113,SI
LARREÁTEGUI FABARA MARÍA GABRIELA,114,SI
MENDOZA PALMA JOFFRE PATRICIO,115,SI
MINCHALA MURILLO RÓMULO MARCELO,116,SI
MONTAÑO VALENCIA MAE,117,SI
MORENO GUERRERO HENRY FREDY,118,SI
MUÑOZ ALARCÓN HÉCTOR PATRICIO,119,SI
PUANCHIR PAYASHÑA TITO PEDRO,124,SI
ALARCÓN GUILLÍN FREDY OSCAR,125,SI
SOLORZANO SARRIA CESAR FAUSTO,126,SI
UGARTE GUZMÁN BLANCA ROSANA,127,SI
VINTIMILLA MOSCOSO PAOLA,128,SI
ZAMBRANO ORTIZ MARÍA ROBERTA,129,SI
PALACIOS MUÑOZ JUAN SEBASTIÁN,130,SI
ROMERO LOAYZA FRANCO SEGUNDO,132,SI
SIMBAÑA VILLARREAL ABDÓN MARCELO,133,SI
SUQUILANDA VALDIVIESO BYRON VINICIO,134,SI
VERA MENDOZA TANLLY JANELA,135,SI
VILLAMAR JÁCOME PEDRO FABRICIO,136,SI
YÉPEZ MARTÍNEZ HÉCTOR JOSÉ,137,SI
DUCHI GUAMÁN MARÍA ENCARNACIÓN,108,ABSTENCION
TELLO BENALCÁZAR RAÚL ESTUPIÑAN,121,ABSTENCION
PEÑAFIEL IZQUIERDO EDDY COLÓN,123,ABSTENCION
