asambleista,curul,voto
BENAVIDES ZAMBRANO ZOILA TERESA,8,AUSENTE
COLLAGUAZO RODRIGO,10,AUSENTE
BUENDÍA HERDOÍZA MARÍA SOLEDAD,11,AUSENTE
CÁRDENAS ESPINOZA JUAN JORGE,17,AUSENTE
COROZO AYOVÍ JORGE WILBER,24,AUSENTE
CUESTA RÍOS LIUBA ELISA,25,AUSENTE
ESPÍN REYES EUGENIA SOFÍA,29,AUSENTE
GUEVARA VILLACRÉS VERÓNICA MARGARITA,36,AUSENTE
VERA FLORES WENDY VANESSA,64,AUSENTE
ZAMBRANO ARTEAGA JOSE RICARDO,70,AUSENTE
BURBANO MONTENEGRO FÉLIX FERNANDO,75,AUSENTE
GENDE CALAZACÓN ANGEL MESÍAS,104,AUSENTE
OLIVO PALLO JAIME FERNANDO,109,AUSENTE
VILLAMAR JÁCOME PEDRO FABRICIO,136,AUSENTE
JUCA SALAZAR MERCEDES DEL ROCÍO,2,SI
ARTEAGA MUÑOZ KARINA CECILIA,7,SI
BERGMANN REYNA CARLOS ALBERTO,9,SI
BUSTAMANTE MONTEROS RUBÉN ALEJANDRO,12,SI
CABEZAS GUERRERO ELIZABETH ENRIQUETA,13,SI
CAMBALA MONTECE CARLOS ALBERTO,16,SI
CARRIÓN CEVALLOS MARÍA JOSÉ,18,SI
VALLEJO JARAMILLO NORMA MARLENE,19,SI
CEDEÑO ZAMBRANO JOHANNA ELIZABETH,20,SI
GREFA AVILEZ FLAVIO PATRICIO,21,SI
CHÁVEZ BAJAÑA KHARLA DEL ROCÍO,23,SI
FLOR GIL BRENDA AZUCENA,31,SI
GARZÓN RICAURTE WILLIAM ANTONIO,34,SI
GAVILÁNEZ CAMACHO FAFO HOLGUÍN,35,SI
MARÍN AGUIRRE ANA BELÉN,40,SI
MENDOZA ARÉVALO DANIEL ISAAC,42,SI
OCHOA MORANTE MANUEL ALFREDO,45,SI
ORELLANA ROMÁN ROSA GINA,46,SI
PALACIOS VELÁSQUEZ SONIA LUCRECIA,47,SI
PEÑA PACHECO XIMENA DEL ROCÍO,48,SI
PLAZA CASTILLO LENIN,49,SI
POMA HERRERA YOFRE MARTÍN,50,SI
SÁNCHEZ REYES MONTGOMERY,59,SI
MALDONADO VERA MABEL MARCELA,63,SI
VERA RODRÍGUEZ CARLOS ALFREDO,65,SI
YAR ARAUJO JUAN CARLOS,68,SI
YUNDA MACHADO JORGE HOMERO,69,SI
ANDRADE MUÑOZ WILMA PIEDAD,71,SI
ASÁN WONSANG JOSÉ FRANCISCO,72,SI
AUQUILLA ORTEGA RAÚL VICENTE,73,SI
BERNAL BERNAL ESTEBAN REMIGIO,74,SI
ZAMBRANO CASTRO NORALMA ELIZABETH,76,SI
AZUERO RODAS ELISEO ALEXIS,77,SI
CUCALÓN CAMACHO HENRY EDUARDO,78,SI
FALQUEZ BATALLAS PEDRO CARLOS,79,SI
CALLEJAS BARONA FERNANDO,80,SI
CAMPAIN BRAMBILLA RINA ASUNCIÓN,81,SI
CAMPOVERDE ROBLES EMILIO ABSALÓN,82,SI
CARRIÓN MORENO CÉSAR ATAULFO,83,SI
VEGAY JIPA LUZ AIDA,84,SI
SINMALEZA SÁNCHEZ ÁNGEL RUPERTO,85,SI
YANDÚN POZO CÁSTULO RENÉ,86,SI
HENRÍQUEZ JAIME PATRICIA IVONNE,87,SI
JARAMILLO ZURITA PAOLA MICHAEL,88,SI
CASTANIER JARAMILLO XAVIER HOMERO,89,SI
CELI SANTOS GUILLERMO ALEJANDRO,90,SI
CRUZ PROAÑO LUDOVICO ISRAEL,91,SI
ZÁRATE CASTRO JORGE EDUARDO,92,SI
MEDINA RAMÍREZ JOSÉ ALFREDO,93,SI
CADENA HUERTAS FRANCISCO JAVIER,95,SI
PEÑA ONTANEDA ELIO GERMÁN,96,SI
CAMPOVERDE GONZÁLEZ RAÚL FREDDY BOLÍVAR,97,SI
"PASSAILAIGUE MANOSALVAS DALLYANAMARIANELA",98,SI
REYES HIDALGO CRISTINA EUGENIA,99,SI
CURICHUMBI YUPANQUI PEDRO,100,SI
DONOSO CHIRIBOGA PATRICIO,101,SI
FLORES ARROYO JUAN FERNADO,102,SI
GALARZA AÑAZCO ANA MERCEDES,103,SI
GÓMEZ ALCÍVAR ROBERTO ANDRÉS,105,SI
MACÍAS ORTEGA WENDY ELENA MARISOL,106,SI
CANDELL SOTO JAIME ENRIQUE JIMMY,107,SI
DUCHI GUAMÁN MARÍA ENCARNACIÓN,108,SI
ROHON HERVAS CÉSAR EDUARDO,110,SI
TAIANO BASANTE VICENTE GIOVANNY,111,SI
TERÁN SALCEDO RAMÓN FORTUNATO,112,SI
TORRES TORRES LUIS FERNANDO,113,SI
LARREÁTEGUI FABARA MARÍA GABRIELA,114,SI
CARBO AGUIRRE JONATHAN ALEXI,115,SI
MINCHALA MURILLO RÓMULO MARCELO,116,SI
MONTAÑO VALENCIA MAE,117,SI
MORENO GUERRERO HENRY FREDY,118,SI
MUÑOZ ALARCÓN HÉCTOR PATRICIO,119,SI
PACHALA POMA LUIS ALBERTO,120,SI
TELLO BENALCÁZAR RAÚL ESTUPIÑAN,121,SI
CUESTA CONCARI MARÍA MERCEDES,122,SI
PEÑAFIEL IZQUIERDO EDDY COLÓN,123,SI
PUANCHIR PAYASHÑA TITO PEDRO,124,SI
ALARCÓN GUILLÍN FREDY OSCAR,125,SI
SOLORZANO SARRIA CESAR FAUSTO,126,SI
UGARTE GUZMÁN BLANCA ROSANA,127,SI
VINTIMILLA MOSCOSO PAOLA,128,SI
ZAMBRANO ORTIZ MARÍA ROBERTA,129,SI
PALACIOS MUÑOZ JUAN SEBASTIÁN,130,SI
PAREDES TORRES WASHINGTON ARTURO,131,SI
ROMERO LOAYZA FRANCO SEGUNDO,132,SI
SIMBAÑA VILLARREAL ABDÓN MARCELO,133,SI
SUQUILANDA VALDIVIESO BYRON VINICIO,134,SI
VERA MENDOZA TANLLY JANELA,135,SI
PADILLA SIERRA MAGGIE DOLORES,137,SI
VILLALVA MIRANDA LIRA DE LA PAZ,66,BLANCO
AGUIÑAGA VALLEJO PAOLA MARCELA,1,ABSTENCION
CEVALLOS GUEVARA LESLIE MARCELA,3,ABSTENCION
ARIAS FERNÁNDEZ VERÓNICA ELIZABETH,4,ABSTENCION
ARIAS RAMÍREZ ALBERTO JESÚS,5,ABSTENCION
ARREGUI RUEDA MARCIA CECILIA,6,ABSTENCION
CADENA VÉLEZ KARLA GABRIELA,14,ABSTENCION
CALLE VERZOZI HERMUY,15,ABSTENCION
CHALÁ CRUZ JOSÉ FRANKLIN,22,ABSTENCION
CUESTA SANTANA ESTHER ADELINA,26,ABSTENCION
RUIZ CEDEÑO ANA BELÉN,27,ABSTENCION
DURÁN AGUILAR LILIANA ELIZABETH,28,ABSTENCION
ESPINOSA ANDRADE AUGUSTO XAVIER,30,ABSTENCION
GARCÍA GAIBOR CARMEN MERCEDES,32,ABSTENCION
GARCÍA POZO DIEGO OSWALDO,33,ABSTENCION
HOLGUÍN NARANJO MARCELA PRISCILA,37,ABSTENCION
LITARDO CAICEDO CÉSAR ERNESTO,38,ABSTENCION
LLORET VALDIVIESO JUAN CRISTÓBAL,39,ABSTENCION
MELO GARZÓN ESTEBAN ANDRÉS,41,ABSTENCION
MUÑOZ LÓPEZ CHRISTIAN PABEL,43,ABSTENCION
NARANJO ALVARADO PRISCILA AMAPOLA,44,ABSTENCION
PROAÑO CIFUENTES ROBERTH MAURICIO,51,ABSTENCION
QUIJIJE DELGADO LUIS RAFAEL,52,ABSTENCION
QUIÑONEZ OCAMPO JULIO CÉSAR,53,ABSTENCION
RIVADENEIRA BURBANO GABRIELA ALEJANDRA,54,ABSTENCION
RIVADENEIRA BUSTOS CARMEN MERCEDES,55,ABSTENCION
PARRA VILLACIS JONATHAN EMANUEL,56,ABSTENCION
SALGADO ANDRADE SILVIA BETZABETH,57,ABSTENCION
SAMANIEGO MAIGUA FRANKLIN OMAR,58,ABSTENCION
ALEMÁN MARMOL MÓNICA ROCÍO,60,ABSTENCION
SOLIZ CARRIÓN DORIS JOSEFINA,61,ABSTENCION
VALLE PINARGOTE BAIRON LEONARDO,62,ABSTENCION
VITERI GUALINGA CARLOS ELOY,67,ABSTENCION
ZAMBRANO VALLE EDUARDO MAURICIO,94,ABSTENCION
