voto,curul,asambleista
AUSENTE,2,ALBORNOZ VINTIMILLA CLAUDIO ESTEBAN
AUSENTE,3,SERRANO SALGADO JOSÉ RICARDO
AUSENTE,5,ARIAS RAMÍREZ ALBERTO JESÚS
AUSENTE,7,ARTEAGA MUÑOZ KARINA CECILIA
AUSENTE,8,BENAVIDES ZAMBRANO ZOILA TERESA
AUSENTE,9,BERGMANN REYNA CARLOS ALBERTO
AUSENTE,11,BUENDÍA HERDOÍZA MARÍA SOLEDAD
AUSENTE,12,BUSTAMANTE MONTEROS RUBÉN ALEJANDRO
AUSENTE,13,CABEZAS GUERRERO ELIZABETH ENRIQUETA
AUSENTE,15,CALLE VERZOZI HERMUY
AUSENTE,18,CARRIÓN CEVALLOS MARÍA JOSÉ
AUSENTE,21,CERDA MIRANDA GABRIELA PAMELA
AUSENTE,23,CHÁVEZ BAJAÑA KHARLA DEL ROCÍO
AUSENTE,24,COROZO AYOVÍ JORGE WILBER
AUSENTE,27,DOUMET CHEDRAUI MICHEL ANDRÉS
AUSENTE,34,GARZÓN RICAURTE WILLIAM ANTONIO
AUSENTE,38,LITARDO CAICEDO CÉSAR ERNESTO
AUSENTE,41,MELO GARZÓN ESTEBAN ANDRÉS
AUSENTE,42,MENDOZA ARÉVALO DANIEL ISAAC
AUSENTE,45,OCHOA MORANTE MANUEL ALFREDO
AUSENTE,46,ORELLANA ROMÁN ROSA GINA
AUSENTE,48,PEÑA PACHECO XIMENA DEL ROCÍO
AUSENTE,49,PLAZA CASTILLO LENIN
AUSENTE,53,QUIÑONEZ OCAMPO JULIO CÉSAR
AUSENTE,56,SALAZAR CEDEÑO GUADALUPE DOLORES
AUSENTE,63,VELIN CORTÉS JUAN PABLO
AUSENTE,68,YAR ARAUJO JUAN CARLOS
AUSENTE,77,AZUERO RODAS ELISEO ALEXIS
AUSENTE,83,CARRIÓN MORENO CÉSAR ATAULFO
AUSENTE,89,CASTANIER JARAMILLO XAVIER HOMERO
AUSENTE,91,CRUZ PROAÑO LUDOVICO ISRAEL
AUSENTE,92,CRUZ VACA JEANNINE DEL CISNE
AUSENTE,101,DONOSO CHIRIBOGA PATRICIO
AUSENTE,106,ZAMBRANO VERA MARIANO
AUSENTE,108,DUCHI GUAMÁN MARÍA ENCARNACIÓN
AUSENTE,120,PACHALA POMA LUIS ALBERTO
AUSENTE,122,CUESTA CONCARI MARÍA MERCEDES
AUSENTE,137,YÉPEZ MARTÍNEZ HÉCTOR JOSÉ
SI,1,AGUIÑAGA VALLEJO PAOLA MARCELA
SI,4,ARIAS FERNÁNDEZ VERÓNICA ELIZABETH
SI,10,BONILLA SALCEDO VIVIANA
SI,14,CADENA VÉLEZ KARLA GABRIELA
SI,16,CAMBALA MONTECE CARLOS ALBERTO
SI,17,CÁRDENAS ESPINOZA JUAN JORGE
SI,22,CHALÁ CRUZ JOSÉ FRANKLIN
SI,26,CUESTA SANTANA ESTHER ADELINA
SI,28,DURÁN AGUILAR LILIANA ELIZABETH
SI,29,ALEAGA SANTOS RONNY XAVIER
SI,30,ESPINOSA ANDRADE AUGUSTO XAVIER
SI,32,GARCÍA GAIBOR CARMEN MERCEDES
SI,33,GARCÍA POZO DIEGO OSWALDO
SI,35,GAVILÁNEZ CAMACHO FAFO HOLGUÍN
SI,36,GUEVARA VILLACRÉS VERÓNICA MARGARITA
SI,37,HOLGUÍN NARANJO MARCELA PRISCILA
SI,39,LLORET VALDIVIESO JUAN CRISTÓBAL
SI,40,MARÍN AGUIRRE ANA BELÉN
SI,43,MUÑOZ LÓPEZ CHRISTIAN PABEL
SI,44,NARANJO ALVARADO PRISCILA AMAPOLA
SI,47,BUSTAMANTE GARCÍA JUAN FRANCISCO
SI,50,POMA HERRERA YOFRE MARTÍN
SI,51,PROAÑO CIFUENTES ROBERTH MAURICIO
SI,54,RIVADENEIRA BURBANO GABRIELA ALEJANDRA
SI,55,RIVADENEIRA BUSTOS CARMEN MERCEDES
SI,57,SALGADO ANDRADE SILVIA BETZABETH
SI,58,SAMANIEGO MAIGUA FRANKLIN OMAR
SI,59,YAGUANA ECHEVERRÍA ANDREA ALEXANDRA
SI,60,ALEMÁN MARMOL MÓNICA ROCÍO
SI,61,SOLIZ CARRIÓN DORIS JOSEFINA
SI,62,VALLE PINARGOTE BAIRON LEONARDO
SI,64,VERA FLORES WENDY VANESSA
SI,66,VILLALVA MIRANDA LIRA DE LA PAZ
SI,67,VITERI GUALINGA CARLOS ELOY
SI,69,GUAMBA DÍAZ NANCY JEANNETH
SI,70,LOOR ALCÍVAR LEXI LIDUVINA
SI,71,ANDRADE MUÑOZ WILMA PIEDAD
SI,72,ZAMBRANO ALCÍVAR MAGDA XIOMARA
SI,73,AUQUILLA ORTEGA RAÚL VICENTE
SI,74,ASTUDILLO LOOR LINA GLORIA
SI,78,CUCALÓN CAMACHO HENRY EDUARDO
SI,79,SERRANO VITERI MERCEDES MARITZA
SI,80,CALLEJAS BARONA FERNANDO
SI,81,CAMPAIN BRAMBILLA RINA ASUNCIÓN
SI,82,CAMPOVERDE ROBLES EMILIO ABSALÓN
SI,85,SINMALEZA SÁNCHEZ ÁNGEL RUPERTO
SI,86,YANDÚN POZO CÁSTULO RENÉ
SI,87,UGARTE HENRÍQUEZ JOSÉ FERNANDO
SI,88,KRONFLE KOZHAYA HENRY FABIÁN
SI,90,CELI SANTOS GUILLERMO ALEJANDRO
SI,93,CUESTA ORELLANA MARÍA DE LOURDES
SI,94,ZAMBRANO VALLE EDUARDO MAURICIO
SI,95,CADENA HUERTAS FRANCISCO JAVIER
SI,96,PEÑA ONTANEDA ELIO GERMÁN
SI,97,CAMPOVERDE GONZÁLEZ RAÚL FREDDY BOLÍVAR
SI,98,
SI,99,REYES HIDALGO CRISTINA EUGENIA
SI,100,CURICHUMBI YUPANQUI PEDRO
SI,102,FLORES VÁSQUEZ FERNANDO PATRICIO
SI,103,VERDEZOTO REINOSO ROSA ISABEL
SI,105,GÓMEZ ALCÍVAR ROBERTO ANDRÉS
SI,110,ROHON HERVAS CÉSAR EDUARDO
SI,111,TAIANO BASANTE VICENTE GIOVANNY
SI,112,MANOBANDA ALVAREZ JORGE ENRIQUE
SI,113,TORRES COBO LUIS ESTEBAN
SI,115,CUADRO GASTEZZI DEYSI MARIA
SI,116,VERA CALDERÓN SILVIA LORENA
SI,117,MONTAÑO VALENCIA MAE
SI,118,MORENO GUERRERO HENRY FREDY
SI,119,MUÑOZ ALARCÓN HÉCTOR PATRICIO
SI,121,TELLO BENALCÁZAR RAÚL ESTUPIÑAN
SI,125,ALARCÓN GUILLÍN FREDY OSCAR
SI,127,POVEDA ALVARADO ERIKA SOPHIA
SI,128,MARÍN LAVAYEN DENNIS GUSTAVO
SI,129,ESTUPIÑÁN ORTIZ BORIS EFRÉN
SI,130,PALACIOS MUÑOZ JUAN SEBASTIÁN
SI,131,PAREDES TORRES WASHINGTON ARTURO
SI,132,ROMERO LOAYZA FRANCO SEGUNDO
SI,133,SIMBAÑA VILLARREAL ABDÓN MARCELO
SI,134,SUQUILANDA VALDIVIESO BYRON VINICIO
SI,135,VERA MENDOZA TANLLY JANELA
SI,136,VILLAMAR JÁCOME PEDRO FABRICIO
NO,104,GENDE CALAZACÓN ANGEL MESÍAS
NO,109,OLIVO PALLO JAIME FERNANDO
ABSTENCION,6,ARREGUI RUEDA MARCIA CECILIA
ABSTENCION,19,TERÁN SARZOSA SEGUNDO FAUSTO
ABSTENCION,20,CEDEÑO ZAMBRANO JOHANNA ELIZABETH
ABSTENCION,25,CUESTA RÍOS LIUBA ELISA
ABSTENCION,31,FLOR GIL BRENDA AZUCENA
ABSTENCION,52,QUIJIJE DELGADO LUIS RAFAEL
ABSTENCION,65,VERA RODRÍGUEZ CARLOS ALFREDO
ABSTENCION,75,BURBANO MONTENEGRO FÉLIX FERNANDO
ABSTENCION,76,ZAMBRANO CASTRO NORALMA ELIZABETH
ABSTENCION,84,ZAMBRANO CHACHA ALBERTO ALEXANDER
ABSTENCION,107,CANDELL SOTO JAIME ENRIQUE JIMMY
ABSTENCION,114,LARREÁTEGUI FABARA MARÍA GABRIELA
ABSTENCION,123,PEÑAFIEL IZQUIERDO EDDY COLÓN
ABSTENCION,124,PUANCHIR PAYASHÑA TITO PEDRO
ABSTENCION,126,SOLORZANO SARRIA CESAR FAUSTO
