voto,curul,asambleista
AUSENTE,7,ARTEAGA MUÑOZ KARINA CECILIA
AUSENTE,8,BENAVIDES ZAMBRANO ZOILA TERESA
AUSENTE,21,CERDA MIRANDA GABRIELA PAMELA
AUSENTE,31,FLOR GIL BRENDA AZUCENA
AUSENTE,46,ORELLANA ROMÁN ROSA GINA
AUSENTE,47,PALACIOS VELÁSQUEZ SONIA LUCRECIA
AUSENTE,50,POMA HERRERA YOFRE MARTÍN
AUSENTE,52,QUIJIJE DELGADO LUIS RAFAEL
AUSENTE,63,VELIN CORTÉS JUAN PABLO
AUSENTE,64,VERA FLORES WENDY VANESSA
AUSENTE,70,ZAMBRANO ARTEAGA JOSE RICARDO
AUSENTE,81,CAMPAIN BRAMBILLA RINA ASUNCIÓN
AUSENTE,84,ZAMBRANO CHACHA ALBERTO ALEXANDER
AUSENTE,88,JARAMILLO ZURITA PAOLA MICHAEL
AUSENTE,120,PACHALA POMA LUIS ALBERTO
AUSENTE,124,PUANCHIR PAYASHÑA TITO PEDRO
SI,2,ALBORNOZ VINTIMILLA CLAUDIO ESTEBAN
SI,3,SERRANO SALGADO JOSÉ RICARDO
SI,5,ARIAS RAMÍREZ ALBERTO JESÚS
SI,6,ARREGUI RUEDA MARCIA CECILIA
SI,9,BERGMANN REYNA CARLOS ALBERTO
SI,10,COLLAGUAZO RODRIGO
SI,12,BUSTAMANTE MONTEROS RUBÉN ALEJANDRO
SI,13,CABEZAS GUERRERO ELIZABETH ENRIQUETA
SI,14,DELGADO ORLANDO CÉSAR ANTONIO
SI,16,CAMBALA MONTECE CARLOS ALBERTO
SI,18,CARRIÓN CEVALLOS MARÍA JOSÉ
SI,19,VALLEJO JARAMILLO NORMA MARLENE
SI,20,CEDEÑO ZAMBRANO JOHANNA ELIZABETH
SI,23,CHÁVEZ BAJAÑA KHARLA DEL ROCÍO
SI,24,COROZO AYOVÍ JORGE WILBER
SI,25,SUAREZ HUAYAMAVE CARLOS ALBERTO
SI,27,DOUMET CHEDRAUI MICHEL ANDRÉS
SI,34,GARZÓN RICAURTE WILLIAM ANTONIO
SI,35,FUENTES NARANJO PAULINA DEL CARMEN
SI,38,LITARDO CAICEDO CÉSAR ERNESTO
SI,40,MARÍN AGUIRRE ANA BELÉN
SI,42,MENDOZA ARÉVALO DANIEL ISAAC
SI,45,OCHOA MORANTE MANUEL ALFREDO
SI,48,PEÑA PACHECO XIMENA DEL ROCÍO
SI,49,PLAZA CASTILLO LENIN
SI,53,QUIÑONEZ OCAMPO JULIO CÉSAR
SI,56,SALAZAR CEDEÑO GUADALUPE DOLORES
SI,57,SALGADO ANDRADE SILVIA BETZABETH
SI,59,SÁNCHEZ REYES MONTGOMERY
SI,65,VERA RODRÍGUEZ CARLOS ALFREDO
SI,68,YAR ARAUJO JUAN CARLOS
SI,69,YUNDA MACHADO JORGE HOMERO
SI,71,ANDRADE MUÑOZ WILMA PIEDAD
SI,72,ASÁN WONSANG JOSÉ FRANCISCO
SI,73,AUQUILLA ORTEGA RAÚL VICENTE
SI,75,BURBANO MONTENEGRO FÉLIX FERNANDO
SI,76,ZAMBRANO CASTRO NORALMA ELIZABETH
SI,77,AZUERO RODAS ELISEO ALEXIS
SI,78,CUCALÓN CAMACHO HENRY EDUARDO
SI,79,AÑAZCO ROMERO DOLORES LETICIA
SI,82,CAMPOVERDE ROBLES EMILIO ABSALÓN
SI,83,CARRIÓN MORENO CÉSAR ATAULFO
SI,85,SINMALEZA SÁNCHEZ ÁNGEL RUPERTO
SI,86,YANDÚN POZO CÁSTULO RENÉ
SI,87,HENRÍQUEZ JAIME PATRICIA IVONNE
SI,89,CASTANIER JARAMILLO XAVIER HOMERO
SI,90,CELI SANTOS GUILLERMO ALEJANDRO
SI,91,YUNGA NAULA SEGUNDO JULIÁN
SI,92,ZÁRATE CASTRO JORGE EDUARDO
SI,95,CADENA HUERTAS FRANCISCO JAVIER
SI,96,PEÑA ONTANEDA ELIO GERMÁN
SI,97,CAMPOVERDE GONZÁLEZ RAÚL FREDDY BOLÍVAR
SI,98,
SI,99,NARVÁEZ MENDIETA DALTON RAFAEL
SI,100,CURICHUMBI YUPANQUI PEDRO
SI,101,DONOSO CHIRIBOGA PATRICIO
SI,104,GENDE CALAZACÓN ANGEL MESÍAS
SI,106,ZAMBRANO VERA MARIANO
SI,107,CANDELL SOTO JAIME ENRIQUE JIMMY
SI,108,DUCHI GUAMÁN MARÍA ENCARNACIÓN
SI,109,OLIVO PALLO JAIME FERNANDO
SI,110,ROHON HERVAS CÉSAR EDUARDO
SI,111,TACLE GARCÍA SAMIA
SI,112,TERÁN SALCEDO RAMÓN FORTUNATO
SI,113,TORRES TORRES LUIS FERNANDO
SI,114,LARREÁTEGUI FABARA MARÍA GABRIELA
SI,115,MENDOZA PALMA JOFFRE PATRICIO
SI,116,MINCHALA MURILLO RÓMULO MARCELO
SI,117,MONTAÑO VALENCIA MAE
SI,118,MORENO GUERRERO HENRY FREDY
SI,119,MUÑOZ ALARCÓN HÉCTOR PATRICIO
SI,122,CUESTA CONCARI MARÍA MERCEDES
SI,123,PEÑAFIEL IZQUIERDO EDDY COLÓN
SI,125,ALARCÓN GUILLÍN FREDY OSCAR
SI,126,SOLORZANO SARRIA CESAR FAUSTO
SI,127,POVEDA ALVARADO ERIKA SOPHIA
SI,128,VINTIMILLA MOSCOSO PAOLA
SI,129,ZAMBRANO ORTIZ MARÍA ROBERTA
SI,130,RODRÍGUEZ PÉREZ SORAYA MARIBEL
SI,131,PAREDES TORRES WASHINGTON ARTURO
SI,132,ROMERO LOAYZA FRANCO SEGUNDO
SI,133,SIMBAÑA VILLARREAL ABDÓN MARCELO
SI,134,SUQUILANDA VALDIVIESO BYRON VINICIO
SI,135,VERA MENDOZA TANLLY JANELA
NO,102,FLORES VÁSQUEZ FERNANDO PATRICIO
ABSTENCION,1,AGUIÑAGA VALLEJO PAOLA MARCELA
ABSTENCION,4,ARIAS FERNÁNDEZ VERÓNICA ELIZABETH
ABSTENCION,11,BUENDÍA HERDOÍZA MARÍA SOLEDAD
ABSTENCION,15,CALLE VERZOZI HERMUY
ABSTENCION,17,CÁRDENAS ESPINOZA JUAN JORGE
ABSTENCION,22,CHALÁ CRUZ JOSÉ FRANKLIN
ABSTENCION,26,CUESTA SANTANA ESTHER ADELINA
ABSTENCION,28,DURÁN AGUILAR LILIANA ELIZABETH
ABSTENCION,29,ESPÍN REYES EUGENIA SOFÍA
ABSTENCION,30,CABEZAS CASTILLO JANETH PAOLA
ABSTENCION,32,GARCÍA GAIBOR CARMEN MERCEDES
ABSTENCION,33,GARCÍA POZO DIEGO OSWALDO
ABSTENCION,36,GUEVARA VILLACRÉS VERÓNICA MARGARITA
ABSTENCION,37,HOLGUÍN NARANJO MARCELA PRISCILA
ABSTENCION,39,LLORET VALDIVIESO JUAN CRISTÓBAL
ABSTENCION,41,MELO GARZÓN ESTEBAN ANDRÉS
ABSTENCION,43,MUÑOZ LÓPEZ CHRISTIAN PABEL
ABSTENCION,44,NARANJO ALVARADO PRISCILA AMAPOLA
ABSTENCION,51,PROAÑO CIFUENTES ROBERTH MAURICIO
ABSTENCION,54,RIVADENEIRA BURBANO GABRIELA ALEJANDRA
ABSTENCION,55,RIVADENEIRA BUSTOS CARMEN MERCEDES
ABSTENCION,58,SAMANIEGO MAIGUA FRANKLIN OMAR
ABSTENCION,60,ALEMÁN MARMOL MÓNICA ROCÍO
ABSTENCION,61,SOLIZ CARRIÓN DORIS JOSEFINA
ABSTENCION,62,TENEZACA LOPEZ MABEL MICHELL
ABSTENCION,66,VILLALVA MIRANDA LIRA DE LA PAZ
ABSTENCION,67,VITERI GUALINGA CARLOS ELOY
ABSTENCION,74,BERNAL BERNAL ESTEBAN REMIGIO
ABSTENCION,80,CALLEJAS BARONA FERNANDO
ABSTENCION,93,CUESTA ORELLANA MARÍA DE LOURDES
ABSTENCION,94,ZAMBRANO VALLE EDUARDO MAURICIO
ABSTENCION,103,GALARZA AÑAZCO ANA MERCEDES
ABSTENCION,105,HIDALGO LEY CARMEN AMALIA
ABSTENCION,121,TELLO BENALCÁZAR RAÚL ESTUPIÑAN
ABSTENCION,136,VILLAMAR JÁCOME PEDRO FABRICIO
ABSTENCION,137,PADILLA SIERRA MAGGIE DOLORES
