curul,asambleista,voto
7,MONTENEGRO NUÑEZ CHRISTIAN SANTIAGO,AUSENTE
10,VITERI LOPEZ CHRISTIAN HUMBERTO,AUSENTE
11,ARIAS RAMIREZ ALBERTO JESUS,AUSENTE
16,SOLORZANO AVILES FRANCISCO MARCELO,AUSENTE
19,CASANOVA CEPEDA XAVIER IVAN,AUSENTE
22,CARVAJAL AGUIRRE MIGUEL ANGEL,AUSENTE
23,CRUZ SALAZAR FRANCISCA GABRIELA,AUSENTE
25,CEDEÑO ZAMBRANO JOHANNA ELIZABETH,AUSENTE
29,AGUALSACA GUAMAN JOSE CLEMENTE,AUSENTE
38,GARZON RICAURTE WILLIAM ANTONIO,AUSENTE
40,GONZALEZ SERRANO MIRYAM CATARINA,AUSENTE
43,JARAMILLO RODRIGUEZ VICTOR HUGO,AUSENTE
44,GUEVARA VILLACRES VERONICA MARGARITA,AUSENTE
47,MOSQUERA YANEZ ISABEL PIEDAD,AUSENTE
51,ORTIZ GASPAR ESTHER FLAVIA,AUSENTE
54,LEDESMA ZAMORA OSCAR ALFONSO,AUSENTE
55,AGUIÑAGA VALLEJO PAOLA MARCELA,AUSENTE
57,TOBAR NUÑEZ RAUL IGNACIO,AUSENTE
65,PEÑA PACHECO XIMENA DEL ROCIO,AUSENTE
68,PROAÑO CIFUENTES ROBERTH MAURICIO,AUSENTE
72,MEDINA MERA VICTOR CLEMENTE,AUSENTE
75,ARIAS FERNANDEZ VERONICA ELIZABETH,AUSENTE
77,SAENZ DE VITERI LAUTARO ENRIQUE,AUSENTE
79,ANDRADE VARELA JUPITER GOZOSO DE LA CRUZ,AUSENTE
85,MORAN AMALIA,AUSENTE
104,MONCAYO CEVALLOS JOSE RICARDO,AUSENTE
112,VILEMA FREIRE ANGEL RAMIRO,AUSENTE
114,SOLORZANO SARRIA CESAR FAUSTO,AUSENTE
122,VINTIMILLA JARRIN DIEGO ARMANDO,AUSENTE
124,ZAMBRANO ARTEAGA JOSE RICARDO,AUSENTE
126,VILLON POZO LUIS MARIANO,AUSENTE
127,ZAMBRANO CHACHA ALBERTO ALEXANDER,AUSENTE
129,URIBE LOPEZ FANNY ESTHER,AUSENTE
1,ABAD VELEZ RAUL,SI
3,AGUILAR PLACIDO ARMANDO,SI
4,HAGO CELI FRANCISCO WAIKING,SI
5,AGUIRRE HIDALGO DORA ANADELA,SI
6,ALBAN TORRES MARIANA DEL ROCIO,SI
8,MUÑOZ VICUÑA MARIANGEL,SI
9,ANDINO REINOSO MAURO EDMUNDO,SI
12,ARREGUI RUEDA MARCIA CECILIA,SI
13,BENAVIDES ZAMBRANO ZOILA TERESA,SI
14,BERGMANN REYNA CARLOS ALBERTO,SI
15,BORJA PEREZ GALO,SI
18,CALDERON SALTOS RICHARD OSWALDO,SI
20,CARRILLO BETTY,SI
21,CARRION MARIA JOSE,SI
24,CONSTANTE NIETO MARIANA DE LAS MERCEDES,SI
26,CHAVEZ CANALES HOLGER EZEQUIEL,SI
27,CHICA AREVALO VINICIO VETHOWEN,SI
28,CORDOVA ENCALADA EDGAR EDUARDO,SI
30,DE LA CRUZ BERNARDO HERMAN ULISES,SI
31,DE LA CRUZ GASPAR ADRIANA MIOSOTI,SI
32,DELGADO CHALA AGUSTIN JAVIER,SI
33,FAJARDO MOSQUERA LETTY VANESSA,SI
34,FALCONI LOQUI EVELYN PAMELA,SI
35,GAGLIARDO LOOR GASTON,SI
36,DE LA TORRE RAMIREZ PABLO ANTONIO,SI
37,MENDOZA DANIEL ISAAC,SI
39,GODOY ANDRADE GINA JAKELINE,SI
41,GUAMAN CASTRO ALEX FRANCISCO,SI
42,GUAMANGATE ANTE LUIS GILBERTO,SI
46,HERNANDEZ ENRIQUEZ VIRGILIO HUMBERTO,SI
48,ISSA WAGNER NICOLAS JOSE,SI
49,CARRILLO CRESPO HUGO FERNANDO,SI
50,JUEZ JUEZ OMAR JUSEPH,SI
59,ALVARADO CARRION ROSANA,SI
61,CAZA TIPANTA HUGO RENE,SI
62,PADRON SAETEROS GLADYS PAULINA,SI
63,BRITO MENDOZA MONICA CRISTINA,SI
64,GOMEZ IRMA,SI
66,PEÑAFIEL MONTESDEOCA JUANA MARISOL,SI
67,PONCE LEON XIMENA MERCEDES,SI
69,FARFAN APONTE RICHARD WILSON,SI
70,JIJON BUENDIA ITALIA LUISA,SI
71,RIVERO DOGUER ANGEL ARMANDO,SI
73,REINOSO LESCANO MARIA ELIZABETH,SI
78,SALAZAR CEDEÑO GUADALUPE DOLORES,SI
81,MATIAS APOLINARIO RITA AZUCENA,SI
84,SANCHEZ ORDOÑEZ MONTGOMERY LUIS,SI
86,ALEMAN MARMOL MONICA ROCIO,SI
87,DAHIK ASTUDILLO REYTA GIOMAR,SI
91,ORELLANA MARQUINEZ MAGALI MARGOT,SI
92,UMAJINGA GUAMAN CESAR,SI
93,TIBAN GUALA LOURDES LICENIA,SI
94,TERAN SARZOSA SEGUNDO FAUSTO,SI
95,VALAREZO ORDOÑEZ ROCIO DEL CARMEN,SI
96,MEJIA PLUAS NILDA CECIBEL,SI
97,VASCONEZ ARTEAGA ANNY MARLLELY,SI
98,INTRIAGO MACIAS CARMEN ELENA,SI
106,VELA CHERONI MARIA SOLEDAD,SI
107,ARGUELLO TROYA BLANCA AZUCENA,SI
108,VELASCO ENRIQUEZ CARLOS ALBERTO,SI
109,VELIZ BRIONES JOSE FELIX,SI
110,VERDUGA CEDEÑO MARY,SI
111,VICUÑA MUÑOZ MARIA ALEJANDRA,SI
121,VILLACRESES PEÑA OCTAVIO XAVIER ENRIQUE,SI
123,VITERI GUALINGA CARLOS ELOY,SI
125,ZAMBRANO CABANILLA EDUARDO ALFONSO,SI
128,SERRANO SEGURA GRACE MARISOL,SI
17,BUSTAMANTE PONCE FERNANDO XAVIER,NO
53,LARRIVA ALVARADO OSCAR OSWALDO,NO
74,GUZMAN SEGOVIA JOSE FRANCISCO,NO
80,BUSTOS CHILIQUINGA ARCADIO,NO
82,LANDAZURI CORDOVA SANDRA SUSANA,NO
83,ACACHO GONZALEZ PEPE LUIS,NO
89,FIERRO OVIEDO PACO,NO
100,GUTIERREZ BORBUA FAUSTO GILMAR,NO
101,LUDEÑA SOTOMAYOR CECILIA DEL CISNE,NO
102,CHICAIZA TOAPANTA WILSON ALFONSO,NO
103,DONOSO CHIRIBOGA PATRICIO,NO
105,MOREIRA MACIAS GRACE HOLANDA,NO
115,MONTAÑO VALENCIA MAE,NO
116,MORETA PANCHEZ MIGUEL ANGEL,NO
117,LLANES SUAREZ HENRY MANUEL,NO
118,PLAZA CRISTINA,NO
119,MEDINA TAMBACO EMILY JESUS,NO
120,TORRES TORRES LUIS FERNANDO,NO
130,TAPIA LOMBEYDA LUIS FERNANDO,NO
131,CUCALON CAMACHO HENRY EDUARDO,NO
132,REYES HIDALGO CRISTINA EUGENIA,NO
133,TACLE GALARRAGA MOISES FERNANDO,NO
134,ROMERO LOAYZA FRANCO SEGUNDO,NO
135,YELA BURGOS DAYSE INES,NO
136,SERRANO VALLADARES SAADIN ALFREDO,NO
137,KRONFLE GOMEZ MARIA CRISTINA,NO
45,GUZMAN OCHOA LILIANA MAURA,BLANCO
2,MORALES POZO LENIN ALBERTO,ABSTENCION
52,REYES MACHUCA EFREN RODRIGO,ABSTENCION
56,MELO GARZON ESTEBAN ANDRES,ABSTENCION
58,MUÑOZ AVENDAÑO ROSA ELVIRA,ABSTENCION
60,OCLES PADILLA ALEXANDRA,ABSTENCION
76,RODRIGUEZ DELGADO MARIA VERONICA,ABSTENCION
88,DIAZ COKA MARIA GABRIELA,ABSTENCION
90,GUALAN JAPA MILTON RODRIGO,ABSTENCION
99,PACHECO ORDOÑEZ BAYRON EDUARDO,ABSTENCION
113,POSSO SALGADO LUIS ANTONIO,ABSTENCION
