curul,asambleista,voto
2,ALBORNOZ VINTIMILLA CLAUDIO ESTEBAN,AUSENTE
3,SERRANO SALGADO JOSÉ RICARDO,AUSENTE
5,ARIAS RAMÍREZ ALBERTO JESÚS,AUSENTE
6,ARREGUI RUEDA MARCIA CECILIA,AUSENTE
9,BERGMANN REYNA CARLOS ALBERTO,AUSENTE
10,COLLAGUAZO RODRIGO,AUSENTE
13,CABEZAS GUERRERO ELIZABETH ENRIQUETA,AUSENTE
14,CADENA VÉLEZ KARLA GABRIELA,AUSENTE
15,CALLE VERZOZI HERMUY,AUSENTE
17,CÁRDENAS ESPINOZA JUAN JORGE,AUSENTE
19,TERÁN SARZOSA SEGUNDO FAUSTO,AUSENTE
21,CERDA MIRANDA GABRIELA PAMELA,AUSENTE
23,CHÁVEZ BAJAÑA KHARLA DEL ROCÍO,AUSENTE
24,COROZO AYOVÍ JORGE WILBER,AUSENTE
26,CUESTA SANTANA ESTHER ADELINA,AUSENTE
27,DOUMET CHEDRAUI MICHEL ANDRÉS,AUSENTE
28,DURÁN AGUILAR LILIANA ELIZABETH,AUSENTE
30,ESPINOSA ANDRADE AUGUSTO XAVIER,AUSENTE
31,FLOR GIL BRENDA AZUCENA,AUSENTE
35,GAVILÁNEZ CAMACHO FAFO HOLGUÍN,AUSENTE
36,GUEVARA VILLACRÉS VERÓNICA MARGARITA,AUSENTE
40,MARÍN AGUIRRE ANA BELÉN,AUSENTE
42,MENDOZA ARÉVALO DANIEL ISAAC,AUSENTE
44,NARANJO ALVARADO PRISCILA AMAPOLA,AUSENTE
46,ORELLANA ROMÁN ROSA GINA,AUSENTE
47,BUSTAMANTE GARCÍA JUAN FRANCISCO,AUSENTE
52,QUIJIJE DELGADO LUIS RAFAEL,AUSENTE
53,QUIÑONEZ OCAMPO JULIO CÉSAR,AUSENTE
56,SALAZAR CEDEÑO GUADALUPE DOLORES,AUSENTE
57,SALGADO ANDRADE SILVIA BETZABETH,AUSENTE
59,YAGUANA ECHEVERRÍA ANDREA ALEXANDRA,AUSENTE
64,VERA FLORES WENDY VANESSA,AUSENTE
65,VERA RODRÍGUEZ CARLOS ALFREDO,AUSENTE
67,CHACTONG VELASCO MARTHA XIMENA,AUSENTE
68,YAR ARAUJO JUAN CARLOS,AUSENTE
72,ZAMBRANO ALCÍVAR MAGDA XIOMARA,AUSENTE
75,BURBANO MONTENEGRO FÉLIX FERNANDO,AUSENTE
76,ZAMBRANO CASTRO NORALMA ELIZABETH,AUSENTE
83,CARRIÓN MORENO CÉSAR ATAULFO,AUSENTE
84,ZAMBRANO CHACHA ALBERTO ALEXANDER,AUSENTE
88,OLLAGUE VALAREZO ZOILA PIEDAD,AUSENTE
97,CAMPOVERDE GONZÁLEZ RAÚL FREDDY BOLÍVAR,AUSENTE
100,CURICHUMBI YUPANQUI PEDRO,AUSENTE
101,DONOSO CHIRIBOGA PATRICIO,AUSENTE
105,GÓMEZ ALCÍVAR ROBERTO ANDRÉS,AUSENTE
106,ZAMBRANO VERA MARIANO,AUSENTE
109,OLIVO PALLO JAIME FERNANDO,AUSENTE
112,NUÑEZ MANSSUR LUIS ANTONIO,AUSENTE
113,TORRES COBO LUIS ESTEBAN,AUSENTE
115,SALTOS MOREIRA DIANA GABRIELA,AUSENTE
116,VERA CALDERÓN SILVIA LORENA,AUSENTE
118,VARGAS SÁNCHEZ GRETTY LEILA,AUSENTE
132,ROMERO LOAYZA FRANCO SEGUNDO,AUSENTE
136,VILLAMAR JÁCOME PEDRO FABRICIO,AUSENTE
137,YÉPEZ MARTÍNEZ HÉCTOR JOSÉ,AUSENTE
1,AGUIÑAGA VALLEJO PAOLA MARCELA,SI
4,ARIAS FERNÁNDEZ VERÓNICA ELIZABETH,SI
7,ARTEAGA MUÑOZ KARINA CECILIA,SI
16,CAMBALA MONTECE CARLOS ALBERTO,SI
20,CEDEÑO ZAMBRANO JOHANNA ELIZABETH,SI
22,CHALÁ CRUZ JOSÉ FRANKLIN,SI
29,ALEAGA SANTOS RONNY XAVIER,SI
32,GARCÍA GAIBOR CARMEN MERCEDES,SI
33,GARCÍA POZO DIEGO OSWALDO,SI
37,HOLGUÍN NARANJO MARCELA PRISCILA,SI
38,LITARDO CAICEDO CÉSAR ERNESTO,SI
39,LLORET VALDIVIESO JUAN CRISTÓBAL,SI
41,MELO GARZÓN ESTEBAN ANDRÉS,SI
43,MUÑOZ LÓPEZ CHRISTIAN PABEL,SI
49,PLAZA CASTILLO LENIN,SI
50,ANDRADE VILLAPRADO NELLY LISSETH,SI
51,PROAÑO CIFUENTES ROBERTH MAURICIO,SI
54,AGUALSACA GUAMAN JOSE CLEMENTE,SI
55,RIVADENEIRA BUSTOS CARMEN MERCEDES,SI
58,SAMANIEGO MAIGUA FRANKLIN OMAR,SI
60,ALEMÁN MARMOL MÓNICA ROCÍO,SI
61,SOLIZ CARRIÓN DORIS JOSEFINA,SI
62,VALLE PINARGOTE BAIRON LEONARDO,SI
63,VELIN CORTÉS JUAN PABLO,SI
66,VILLALVA MIRANDA LIRA DE LA PAZ,SI
69,GUAMBA DÍAZ NANCY JEANNETH,SI
70,LOOR ALCÍVAR LEXI LIDUVINA,SI
73,AUQUILLA ORTEGA RAÚL VICENTE,SI
74,ASTUDILLO LOOR LINA GLORIA,SI
77,AZUERO RODAS ELISEO ALEXIS,SI
78,CUCALÓN CAMACHO HENRY EDUARDO,SI
80,CALLEJAS BARONA FERNANDO,SI
81,CAMPAIN BRAMBILLA RINA ASUNCIÓN,SI
82,CAMPOVERDE ROBLES EMILIO ABSALÓN,SI
87,UGARTE HENRÍQUEZ JOSÉ FERNANDO,SI
89,CASTANIER JARAMILLO XAVIER HOMERO,SI
90,CELI SANTOS GUILLERMO ALEJANDRO,SI
91,CRUZ PROAÑO LUDOVICO ISRAEL,SI
92,CRUZ VACA JEANNINE DEL CISNE,SI
93,CUESTA ORELLANA MARÍA DE LOURDES,SI
94,ZAMBRANO VALLE EDUARDO MAURICIO,SI
95,CADENA HUERTAS FRANCISCO JAVIER,SI
96,PEÑA ONTANEDA ELIO GERMÁN,SI
102,FLORES VÁSQUEZ FERNANDO PATRICIO,SI
103,VERDEZOTO REINOSO ROSA ISABEL,SI
104,GENDE CALAZACÓN ANGEL MESÍAS,SI
107,CANDELL SOTO JAIME ENRIQUE JIMMY,SI
108,DUCHI GUAMÁN MARÍA ENCARNACIÓN,SI
117,MONTAÑO VALENCIA MAE,SI
120,PACHALA POMA LUIS ALBERTO,SI
121,TELLO BENALCÁZAR RAÚL ESTUPIÑAN,SI
123,PEÑAFIEL IZQUIERDO EDDY COLÓN,SI
124,PUANCHIR PAYASHÑA TITO PEDRO,SI
125,ALARCÓN GUILLÍN FREDY OSCAR,SI
126,SOLÓRZANO SARRIA CÉSAR FAUSTO,SI
131,PAREDES TORRES WASHINGTON ARTURO,SI
133,SIMBAÑA VILLARREAL ABDÓN MARCELO,SI
134,SUQUILANDA VALDIVIESO BYRON VINICIO,SI
135,VERA MENDOZA TANLLY JANELA,SI
8,MARQUEZ LOPEZ JOSE LENIN,ABSTENCION
11,CASANOVA CEPEDA XAVIER IVAN,ABSTENCION
12,BUSTAMANTE MONTEROS RUBÉN ALEJANDRO,ABSTENCION
18,EGAS LEDESMA JOSÉ ANTONIO,ABSTENCION
25,CUESTA RÍOS LIUBA ELISA,ABSTENCION
34,GARZÓN RICAURTE WILLIAM ANTONIO,ABSTENCION
45,OCHOA MORANTE MANUEL ALFREDO,ABSTENCION
48,PEÑA PACHECO XIMENA DEL ROCÍO,ABSTENCION
71,ANDRADE MUÑOZ WILMA PIEDAD,ABSTENCION
79,SERRANO VITERI MERCEDES MARITZA,ABSTENCION
85,SINMALEZA SÁNCHEZ ÁNGEL RUPERTO,ABSTENCION
86,YANDÚN POZO CÁSTULO RENÉ,ABSTENCION
98,CALDERÓN CHANCAY DORIS DAISY,ABSTENCION
99,REYES HIDALGO CRISTINA EUGENIA,ABSTENCION
110,ROHON HERVAS CÉSAR EDUARDO,ABSTENCION
111,LOOR ZAMBRANO QUINCHE CONSUELO,ABSTENCION
114,LARREÁTEGUI FABARA MARÍA GABRIELA,ABSTENCION
119,MUÑOZ ALARCÓN HÉCTOR PATRICIO,ABSTENCION
122,CUESTA CONCARI MARÍA MERCEDES,ABSTENCION
127,ALMEYDA JALIL VICENTE FERNANDO,ABSTENCION
128,LLANES SUAREZ HENRY MANUEL,ABSTENCION
129,ESTUPIÑÁN ORTIZ BORIS EFRÉN,ABSTENCION
130,PALACIOS MUÑOZ JUAN SEBASTIÁN,ABSTENCION
