voto,curul,asambleista
AUSENTE,6,ARREGUI RUEDA MARCIA CECILIA
AUSENTE,7,MONTESDEOCA PALACIOS JOSÉ DANIEL
AUSENTE,10,BONILLA SALCEDO VIVIANA
AUSENTE,12,BUSTAMANTE MONTEROS RUBÉN ALEJANDRO
AUSENTE,14,CADENA VÉLEZ KARLA GABRIELA
AUSENTE,21,CERDA MIRANDA GABRIELA PAMELA
AUSENTE,26,CUESTA SANTANA ESTHER ADELINA
AUSENTE,41,MELO GARZÓN ESTEBAN ANDRÉS
AUSENTE,57,SALGADO ANDRADE SILVIA BETZABETH
AUSENTE,67,VITERI GUALINGA CARLOS ELOY
AUSENTE,70,ZAMBRANO ARTEAGA JOSE RICARDO
AUSENTE,73,MALDONADO JARAMILLO MARÍA ISABEL
AUSENTE,74,BERNAL BERNAL ESTEBAN REMIGIO
AUSENTE,81,CAMPAIN BRAMBILLA RINA ASUNCIÓN
AUSENTE,86,YANDÚN POZO CÁSTULO RENÉ
AUSENTE,88,JARAMILLO ZURITA PAOLA MICHAEL
AUSENTE,92,CRUZ VACA JEANNINE DEL CISNE
AUSENTE,102,FLORES VÁSQUEZ FERNANDO PATRICIO
AUSENTE,121,TELLO BENALCÁZAR RAÚL ESTUPIÑAN
AUSENTE,124,PUANCHIR PAYASHÑA TITO PEDRO
AUSENTE,129,ESTUPIÑÁN ORTIZ BORIS EFRÉN
AUSENTE,131,BECERRA HERNÁNDEZ JUAN CARLOS
AUSENTE,134,SUQUILANDA VALDIVIESO BYRON VINICIO
AUSENTE,136,VILLAMAR JÁCOME PEDRO FABRICIO
SI,1,AGUIÑAGA VALLEJO PAOLA MARCELA
SI,2,ALBORNOZ VINTIMILLA CLAUDIO ESTEBAN
SI,3,SERRANO SALGADO JOSÉ RICARDO
SI,4,ARIAS FERNÁNDEZ VERÓNICA ELIZABETH
SI,5,ARIAS RAMÍREZ ALBERTO JESÚS
SI,8,BENAVIDES ZAMBRANO ZOILA TERESA
SI,9,BERGMANN REYNA CARLOS ALBERTO
SI,11,BUENDÍA HERDOÍZA MARÍA SOLEDAD
SI,13,CABEZAS GUERRERO ELIZABETH ENRIQUETA
SI,15,CALLE VERZOZI HERMUY
SI,16,CAMBALA MONTECE CARLOS ALBERTO
SI,17,CÁRDENAS ESPINOZA JUAN JORGE
SI,18,CARRIÓN CEVALLOS MARÍA JOSÉ
SI,19,VALLEJO JARAMILLO NORMA MARLENE
SI,20,TENORIO VALENCIA CALLETANO
SI,22,CHALÁ CRUZ JOSÉ FRANKLIN
SI,23,CHÁVEZ BAJAÑA KHARLA DEL ROCÍO
SI,24,COROZO AYOVÍ JORGE WILBER
SI,25,CUESTA RÍOS LIUBA ELISA
SI,27,DOUMET CHEDRAUI MICHEL ANDRÉS
SI,28,DURÁN AGUILAR LILIANA ELIZABETH
SI,29,ALEAGA SANTOS RONNY XAVIER
SI,30,ESPINOSA ANDRADE AUGUSTO XAVIER
SI,31,FLOR GIL BRENDA AZUCENA
SI,32,GARCÍA GAIBOR CARMEN MERCEDES
SI,33,GARCÍA POZO DIEGO OSWALDO
SI,34,GARZÓN RICAURTE WILLIAM ANTONIO
SI,35,GAVILÁNEZ CAMACHO FAFO HOLGUÍN
SI,36,GUEVARA VILLACRÉS VERÓNICA MARGARITA
SI,37,HOLGUÍN NARANJO MARCELA PRISCILA
SI,38,LITARDO CAICEDO CÉSAR ERNESTO
SI,39,LLORET VALDIVIESO JUAN CRISTÓBAL
SI,40,MARÍN AGUIRRE ANA BELÉN
SI,42,MENDOZA ARÉVALO DANIEL ISAAC
SI,43,MUÑOZ LÓPEZ CHRISTIAN PABEL
SI,44,NARANJO ALVARADO PRISCILA AMAPOLA
SI,45,ORDOÑEZ JARAMILLO DIANA MARINA
SI,46,ORELLANA ROMÁN ROSA GINA
SI,47,PALACIOS VELÁSQUEZ SONIA LUCRECIA
SI,48,PEÑA PACHECO XIMENA DEL ROCÍO
SI,49,PLAZA CASTILLO LENIN
SI,50,POMA HERRERA YOFRE MARTÍN
SI,51,PROAÑO CIFUENTES ROBERTH MAURICIO
SI,52,TORRES CEDEÑO ELENA ANYELINE
SI,53,RODRÍGUEZ CEDEÑO ROSA ELENA
SI,54,RIVADENEIRA BURBANO GABRIELA ALEJANDRA
SI,55,RIVADENEIRA BUSTOS CARMEN MERCEDES
SI,56,SALAZAR CEDEÑO GUADALUPE DOLORES
SI,58,SAMANIEGO MAIGUA FRANKLIN OMAR
SI,59,SÁNCHEZ REYES MONTGOMERY
SI,60,ALEMÁN MARMOL MÓNICA ROCÍO
SI,61,SOLIZ CARRIÓN DORIS JOSEFINA
SI,62,VALLE PINARGOTE BAIRON LEONARDO
SI,63,VELIN CORTÉS JUAN PABLO
SI,64,VERA FLORES WENDY VANESSA
SI,65,VERA RODRÍGUEZ CARLOS ALFREDO
SI,66,VILLALVA MIRANDA LIRA DE LA PAZ
SI,68,YAR ARAUJO JUAN CARLOS
SI,69,YUNDA MACHADO JORGE HOMERO
SI,71,ANDRADE MUÑOZ WILMA PIEDAD
SI,72,ASÁN WONSANG JOSÉ FRANCISCO
SI,75,BURBANO MONTENEGRO FÉLIX FERNANDO
SI,76,ZAMBRANO CASTRO NORALMA ELIZABETH
SI,77,AZUERO RODAS ELISEO ALEXIS
SI,78,CUCALÓN CAMACHO HENRY EDUARDO
SI,79,AÑAZCO ROMERO DOLORES LETICIA
SI,80,CALLEJAS BARONA FERNANDO
SI,82,ORDOÑEZ QUEZADA ANDREINA SILVANA
SI,83,CARRIÓN MORENO CÉSAR ATAULFO
SI,84,ZAMBRANO CHACHA ALBERTO ALEXANDER
SI,85,SINMALEZA SÁNCHEZ ÁNGEL RUPERTO
SI,87,UGARTE HENRÍQUEZ JOSÉ FERNANDO
SI,89,CASTANIER JARAMILLO XAVIER HOMERO
SI,90,CELI SANTOS GUILLERMO ALEJANDRO
SI,91,CRUZ PROAÑO LUDOVICO ISRAEL
SI,93,CUESTA ORELLANA MARÍA DE LOURDES
SI,94,ZAMBRANO VALLE EDUARDO MAURICIO
SI,95,CADENA HUERTAS FRANCISCO JAVIER
SI,96,PEÑA ONTANEDA ELIO GERMÁN
SI,97,MONTAÑO GUISAMANO MAYRA MIGDONIA
SI,98,MUENTES ALVARADO PABLO ANDRES
SI,99,REYES HIDALGO CRISTINA EUGENIA
SI,100,CURICHUMBI YUPANQUI PEDRO
SI,101,DONOSO CHIRIBOGA PATRICIO
SI,103,GALARZA AÑAZCO ANA MERCEDES
SI,104,GENDE CALAZACÓN ANGEL MESÍAS
SI,105,GÓMEZ ALCÍVAR ROBERTO ANDRÉS
SI,106,MACÍAS ORTEGA WENDY ELENA MARISOL
SI,107,CANDELL SOTO JAIME ENRIQUE JIMMY
SI,108,DUCHI GUAMÁN MARÍA ENCARNACIÓN
SI,109,ZAPATA GÓMEZ DALILA MONSERRATH
SI,110,ROHON HERVAS CÉSAR EDUARDO
SI,111,TACLE GARCÍA SAMIA
SI,112,NUÑEZ MANSSUR LUIS ANTONIO
SI,113,TORRES TORRES LUIS FERNANDO
SI,114,LARREÁTEGUI FABARA MARÍA GABRIELA
SI,115,CARBO AGUIRRE JONATHAN ALEXI
SI,116,MINCHALA MURILLO RÓMULO MARCELO
SI,117,MONTAÑO VALENCIA MAE
SI,118,VARGAS SÁNCHEZ GRETTY LEILA
SI,119,HIDALGO ESPINEL SANDRA VICTORIA CARMEN
SI,120,PACHALA POMA LUIS ALBERTO
SI,122,GARCIA CANO LUIGI FRANCISCO
SI,123,PEÑAFIEL IZQUIERDO EDDY COLÓN
SI,125,ALARCÓN GUILLÍN FREDY OSCAR
SI,126,SOLORZANO SARRIA CESAR FAUSTO
SI,127,UGARTE GUZMÁN BLANCA ROSANA
SI,128,VINTIMILLA MOSCOSO PAOLA
SI,130,RODRÍGUEZ PÉREZ SORAYA MARIBEL
SI,132,ROMERO LOAYZA FRANCO SEGUNDO
SI,133,SIMBAÑA VILLARREAL ABDÓN MARCELO
SI,135,VERA MENDOZA TANLLY JANELA
SI,137,YÉPEZ MARTÍNEZ HÉCTOR JOSÉ
