101,asambleista,curul,total si,voto
,AGUIRRE HIDALGO DORA ANDELA,5,,AUSENTE
,VITERI LOPEZ CHRISTIAN HUMBERTO,10,,AUSENTE
,DE LA CRUZ GASPAR ADRIANA MIOSOTI,31,,AUSENTE
,MOSQUERA YANEZ ISABEL PIEDAD,47,,AUSENTE
,PEÑA CARRASCO DIANA LUCIA,64,,AUSENTE
,REYES HIDALGO CRISTINA EUGENIA,132,,AUSENTE
,KRONFLE GOMEZ MARIA CRISTINA,137,,AUSENTE
,ABAD VELEZ RAUL,1,,SI
,ACERO LANCHIMBA ESTHELA LILIANA,2,,SI
,AGUILAR PLACIDO ARMANDO,3,,SI
,MACHUCA MOSCOSO LINDA MARICELA,4,,SI
,ALBAN TORRES MARIANA DEL ROCIO,6,,SI
,TORRES CEDEÑO KERLLY ANABEL,7,,SI
,MUÑOZ VICUÑA MARIANGEL,8,,SI
,ANDINO REINOSO MAURO EDMUNDO,9,,SI
,ARIAS RAMIREZ ALBERTO JESUS,11,,SI
,VILLAMAR CASAL JOSE LEONIDAS,12,,SI
,BENAVIDES ZAMBRANO ZOILA TERESA,13,,SI
,BERGMANN REYNA CARLOS ALBERTO,14,,SI
,BORJA PEREZ GALO,15,,SI
,RIVADENEIRA BURBANO GABRIELA ALEJANDRA,16,,SI
,BUSTAMANTE PONCE FERNANDO XAVIER,17,,SI
,QUIMBIULCO BEDON LORENA GABRIELA,18,,SI
,CALLE ANDRADE MARIA AUGUSTA,19,,SI
,CARRILLO BETTY,20,,SI
,CARRION MARIA JOSE,21,,SI
,CARVAJAL AGUIRRE MIGUEL ANGEL,22,,SI
,CASSINELLI CALI JUAN CARLOS,23,,SI
,CAYAMBE TIPAN FAUSTO HERIBERTO,24,,SI
,OLAYA LIDER,25,,SI
,CHAVEZ CANALES HOLGER EZEQUIEL,26,,SI
,DELGADO GUTIERREZ ALEXANDRA ISABEL,27,,SI
,CORDOVA ENCALADA EDGAR EDUARDO,28,,SI
,CUESTA RIOS LIUBA ELISA,29,,SI
,DE LA CRUZ BERNARDO HERMAN ULISES,30,,SI
,DELGADO CHALA AGUSTIN JAVIER,32,,SI
,FAJARDO MOSQUERA LETTY VANESSA,33,,SI
,FALCONI LOQUI EVELYN PAMELA,34,,SI
,GAGLIARDO LOOR GASTON,35,,SI
,GALVAN GRACIA MARIA ESPERANZA,36,,SI
,LARREA VITERI LIDICE VANESSA,37,,SI
,GARZON RICAURTE WILLIAM ANTONIO,38,,SI
,GODOY ANDRADE GINA JAKELINE,39,,SI
,GONZALEZ SERRANO MIRYAM CATARINA,40,,SI
,GUAMAN CASTRO ALEX FRANCISCO,41,,SI
,GUAMANGATE ANTE LUIS GILBERTO,42,,SI
,GUDIÑO MENA ZOBEIDA GUISELA,43,,SI
,GUEVARA VILLACRES VERONICA MARGARITA,44,,SI
,RODAS MARCA CARLOS EDUARDO,45,,SI
,GUTIERREZ MOSCOSO MARIA EUGENIA,46,,SI
,ISSA WAGNER NICOLAS JOSE,48,,SI
,JEREZ PILLA BETTY MARICELA,49,,SI
,JUEZ JUEZ OMAR JUSEPH,50,,SI
,ORTIZ GASPAR ESTHER FLAVIA,51,,SI
,BUENDIA HERDOIZA MARIA SOLEDAD,52,,SI
,JAIGUA ALVARADO CELIA MARIA,53,,SI
,LEDESMA ZAMORA OSCAR ALFONSO,54,,SI
,AGUIÑAGA VALLEJO PAOLA MARCELA,55,,SI
,MELO GARZON ESTEBAN ANDRES,56,,SI
,TOBAR NUÑEZ RAUL IGNACIO,57,,SI
,MUÑOZ AVENDAÑO ROSA ELVIRA,58,,SI
,ALVARADO CARRION ROSANA,59,,SI
,OCLES PADILLA ALEXANDRA,60,,SI
,PABON CARANQUI PAOLA VERENICE,61,,SI
,PADRON SAETEROS GLADYS PAULINA,62,,SI
,BRITO MENDOZA MONICA CRISTINA,63,,SI
,PEÑA PACHECO XIMENA DEL ROCIO,65,,SI
,PEÑAFIEL MONTESDEOCA JUANA MARISOL,66,,SI
,PONCE LEON XIMENA MERCEDES,67,,SI
,PROAÑO CIFUENTES ROBERTH MAURICIO,68,,SI
,FARFAN APONTE RICHARD WILSON,69,,SI
,RIVERA LOPEZ JOSE GABRIEL,70,,SI
,RIVERO DOGUER ANGEL ARMANDO,71,,SI
,MEDINA MERA VICTOR CLEMENTE,72,,SI
,REINOSO LESCANO MARIA ELIZABETH,73,,SI
,ARIAS FERNANDEZ VERONICA ELIZABETH,75,,SI
,RODRIGUEZ DELGADO MARIA VERONICA,76,,SI
,SAENZ DE VITERI LAUTARO ENRIQUE,77,,SI
,SUBIA BARREIRO BOLIVAR STALIN,78,,SI
,HURTADO BRAVO WASHINGTON OMAR,79,,SI
,VILLAO PANCHANA RAUL ELIAS,81,,SI
,SANCHEZ ORDOÑEZ MONTGOMERY LUIS,84,,SI
,MOYA DUQUE HERMAN ANIBAL,85,,SI
,SERRANO REYES NELSON ALCIDES,86,,SI
,SOLANO MORENO ALEX FABIAN,87,,SI
,DIAZ COKA MARIA GABRIELA,88,,SI
,TERAN SARZOSA SEGUNDO FAUSTO,94,,SI
,VALAREZO ORDOÑEZ ROCIO DEL CARMEN,95,,SI
,VALLE PINARGOTE BAIRON LEONARDO,96,,SI
,VASCONEZ ARTEAGA ANNY MARLLELY,97,,SI
,VELA CAIZAPANTA ANGEL RAMIRO,98,,SI
,PACHECO ORDOÑEZ BAYRON EDUARDO,99,,SI
,VELA CHERONI MARIA SOLEDAD,106,,SI
,ARGUELLO TROYA BLANCA AZUCENA,107,,SI
,VELASCO ENRIQUEZ CARLOS ALBERTO,108,,SI
,VELIZ BRIONES JOSE FELIX,109,,SI
,VERDUGA CEDEÑO MARY,110,,SI
,VICUÑA MUÑOZ MARIA ALEJANDRA,111,,SI
,VILEMA FREIRE ANGEL RAMIRO,112,,SI
,VILLACRESES PEÑA OCTAVIO XAVIER ENRIQUE,121,,SI
,VINTIMILLA JARRIN DIEGO ARMANDO,122,,SI
,VITERI GUALINGA CARLOS ELOY,123,,SI
,ZAMBRANO ARTEAGA JOSE RICARDO,124,,SI
,ZAMBRANO CABANILLA EDUARDO ALFONSO,125,,SI
,ZAMBRANO CASTRO NORALMA ELIZABETH,126,,SI
,OBANDO MORALES SANTA FELICITA,127,,SI
,ZAPATA MANTILLA JOSE LEONIDAS,128,,SI
,URIBE LOPEZ FANNY ESTHER,129,,SI
,AGUILAR TORRES MANUEL RAMIRO,74,,NO
,CASTRO AJILA GLADYS LUCIA,80,,NO
,YANDUN POZO CASTULO RENE,82,,NO
,ACACHO GONZALEZ PEPE LUIS,83,,NO
,FIERRO OVIEDO PACO,89,,NO
,JIMENEZ CABRERA JOSE CLEVER,90,,NO
,ORELLANA MARQUINEZ MAGALI MARGOT,91,,NO
,UMAGINGA GUAMAN CESAR,92,,NO
,TIBAN GUALA LOURDES LICENIA,93,,NO
,ALBAN GALLO MARINA ELIZABETH,100,,NO
,AUQUILLA ORTEGA RAUL VICENTE,101,,NO
,CHICAIZA TOAPANTA WILSON ALFONSO,102,,NO
,DONOSO CHIRIBOGA PATRICIO,103,,NO
,MONCAYO CEVALLOS JOSE RICARDO,104,,NO
,GARCIA CANO LUIGI FRANCISCO,105,,NO
,SOLORZANO SARRIA CESAR FAUSTO,114,,NO
,MONTAÑO VALENCIA MAE,115,,NO
,MORETA PANCHEZ MIGUEL ANGEL,116,,NO
,PAEZ BENALCAZAR ANDRES TARQUINO,117,,NO
,SALGADO RIVADENEIRA DIEGO,118,,NO
,MEDINA TAMBACO EMILY JESUS,119,,NO
,TORRES TORRES LUIS FERNANDO,120,,NO
,MERA RODRIGUEZ MARIA PAULINA,130,,NO
,CUCALON CAMACHO HENRY EDUARDO,131,,NO
,TACLE GALARRAGA MOISES FERNANDO,133,,NO
,ROMERO LOAYZA FRANCO SEGUNDO,134,,NO
,TERAN SALCEDO RAMON FORTUNATO,135,,NO
,VITERI JIMENEZ CYNTHIA,136,,NO
,POSSO SALGADO LUIS ANTONIO,113,,ABSTENCION
